Link,post_title,post_content,featured_image,Date-Publish,post_category,post_tag
https://www.zdnet.com/article/i-switched-to-this-300-motorola-phone-for-two-weeks-and-was-pleasantly-surprised/,I switched to this $300 Motorola phone for two weeks and was pleasantly surprised,"The Moto G Power 5G is a budget-friendly phone that offers impressive features and performance. With a 5,000mAh battery, it can last up to two days on a single charge, making it perfect for users who are constantly on the go. The phone also boasts a large display and a sleek design, with a lovely vegan leather back panel that adds a touch of elegance.

One of the standout features of the Moto G Power 5G is its user interface. Motorola has created a stock-like experience that is reminiscent of Google's Pixel phones. The interface is clean and intuitive, with handy gestures and system enhancements that make it easy to navigate and use the phone. For example, you can twist the phone to launch the camera, make chopping motions to toggle the flashlight, and pick up the phone to silence the ringer. These gestures add convenience and efficiency to the user experience.

In terms of design, the Moto G Power 5G features a fingerprint sensor built into the side power button, which is a clever and convenient placement. The phone is made with plastic, but this helps keep it lightweight at just 201 grams. The Pale Lilac color variant, along with the vegan leather back, gives the phone a premium look and feel that belies its affordable price tag.

The 6.7-inch LCD display of the Moto G Power 5G is a standout feature. It offers a rare 120Hz refresh rate and an 85% screen-to-body ratio, which results in smooth and immersive visuals. With a resolution of 391 ppi, the display is crisp and vibrant, making it ideal for media consumption. The phone also has stereo speakers that deliver decent audio quality, and there is even a 3.5mm audio port for those who prefer wired listening.

In terms of performance, the Moto G Power 5G is powered by a MediaTek Dimensity 7020 processor, which is not as powerful as flagship processors but still delivers decent performance. The phone comes with 8GB of RAM and 128GB of internal storage, which can be expanded further with a microSD card. While there may be some occasional stuttering and lag when navigating between apps and games, Motorola's custom camera software makes up for it by providing excellent photo quality and creative features.

One of the highlights of the Moto G Power 5G is its massive 5,000mAh battery, which is capable of lasting up to two full days with heavy usage. This is impressive considering the phone's price range. Motorola also includes a fast 30W TurboPower charger in the box, allowing for quick charging. What's more, the Moto G Power 5G supports wireless charging, which is a rare feature in phones at this price point.

In conclusion, the Moto G Power 5G is a standout phone in its price range. Motorola has managed to pack in impressive features and performance without compromising on affordability. With its large display, sleek design, long-lasting battery, and user-friendly interface, the Moto G Power 5G is a strong contender for anyone looking for a budget-friendly smartphone that doesn't skimp on features. Whether you're a first-time smartphone user or simply in need of a reliable and affordable device, the Moto G Power 5G is definitely worth considering.",https://www.zdnet.com/a/img/resize/32aa07ddf6226336c47ed03b859ff3c4e46a8471/2024/03/24/63400535-0c15-459c-aca0-c0cc32986912/moto-g-power-5g-20245.jpg?auto=webp&fit=crop&height=675&width=1200,2024-03-24 00:00:00,Innovation,Innovation
https://techcrunch.com/2024/03/25/spotify-courses-learning/,Spotify tests video courses to teach everything from music production to Excel,"Spotify, the popular music streaming platform, is expanding its offerings to include e-learning courses. In partnership with third parties like the BBC and Skillshare, Spotify is testing the waters with freemium video courses in the U.K. The courses cover a wide range of subjects, from music production to learning Excel. They are accessible on Spotify's website and mobile app, and prices range from £20 to £80 for a complete course. The goal of this launch is to gauge demand and optimize the offering before potential expansion.

Spotify's foray into education comes as no surprise, considering the booming online learning market, estimated to be worth over $315 billion by 2023. While there are already numerous online learning sites available, Spotify's approach is focused on one-directional, on-demand video content. Currently, the courses primarily consist of videos, with some offering supplementary materials. However, there are no interactive elements or gamification at this time.

Spotify has partnered with Skillshare, PLAYvirtuoso, BBC Maestro, and Thinkific for its initial courses. The company plans to curate the courses based on user preferences and interests. By leveraging the data it collects from its podcasting business, Spotify can identify popular podcasts and recommend related paid courses. This cross-promotion strategy aims to boost engagement and revenue.

The decision to launch e-learning in the U.K. is strategic for Spotify. The country is a significant market for the platform, and its users are highly engaged. By diversifying its business and expanding into education, Spotify aims to improve profitability and margins. While the company has faced financial challenges in the past, it sees potential in the online learning and professional development space.

It's worth noting that third-party publishers own the videos and license them to Spotify. Revenue from course sales will be shared among the creators, publishers, and Spotify. The exact revenue share breakdown has not been disclosed, and it remains unclear whether existing premium subscribers will receive any discounts or benefits.

Overall, Spotify's move into e-learning aligns with its strategy to broaden its offerings and capitalize on user data. By leveraging its podcasting business and recommending relevant courses, Spotify aims to create a symbiotic relationship between its various content categories. As the company continues to diversify and explore new revenue streams, education presents an opportunity for growth and expansion.","https://techcrunch.com/wp-content/uploads/2024/03/Courses-on-Spotify-PR-Image-6-2.png?resize=1200,683",2024-03-25 08:59:18,Innovation,Innovation
