Link,post_title,post_content,featured_image,Date-Publish,post_category,post_tag
https://www.forbes.com/sites/technology/article/moba-games/,Top Multiplayer Online Battle Arena (MOBA) Games,"MOBAs, or multiplayer online battle arena games, have become incredibly popular over the past 15 years. Starting as a modification of a popular strategy game, the genre has evolved into standalone games that compete to be the best in the world. While many challengers have fallen by the wayside, the top MOBAs continue to attract millions of players every month. However, finding the best MOBA for you can still be a challenge if you don't know where to look.

So, what exactly is a multiplayer online battle arena game? A MOBA is an online game where two teams, usually consisting of five players each, battle against each other strategically to destroy the opponent's base using unique player-controlled characters. These games are typically played on PC or mobile devices and are known for their difficult-to-master gameplay.

The MOBA genre originated as a mod for Warcraft III, a popular strategy game with a thriving modding scene. The first MOBA, Defense of the Ancients (DotA), quickly gained popularity and became a major game in its own right. The team behind DotA eventually left to create their own MOBA, League of Legends, which was an instant hit. Valve, the developers of the Steam gaming platform, also got involved by hiring members of the original DotA team to create Dota 2, a competitor to League of Legends. This sparked a period where every major publisher attempted to create their own MOBA, but most failed to gain traction.

Over the years, hundreds of MOBAs have been released on various platforms. The top MOBA games today are the ones that have stood the test of time and have a large and loyal player base. These games have something unique to offer or have managed to capture an audience that continues to support them for years. Two of the biggest MOBAs, Dota 2 and League of Legends, have been around for over a decade and continue to innovate in a genre filled with copycats. These games have received critical acclaim and are considered the best of the best.

Dota 2, the direct sequel to the original DotA mod, has retained the spirit of its predecessor while becoming more accessible to a wider range of players. It has been one of the most popular games on Steam for over 10 years and continues to push the genre forward. While technically released in 2013, Dota 2 was available in beta form in 2011. Developed by Valve with the involvement of Ice Frog, the lead developer of the original DotA mod, Dota 2 has undergone significant changes over the years. These include map changes, new playable characters, and regular balance updates. Despite these changes, the core gameplay remains the same: two teams of five players battling across a three-lane map to destroy the enemy's Ancient and claim victory.

Dota 2 is known for its complexity. Compared to other MOBAs, it offers more variables in each match and has mechanics that take thousands of hours to master. Even experienced players admit that there are aspects of the game they still don't fully understand. If other MOBAs have become too easy for you, Dota 2 presents the ultimate challenge. The game is also free to play, with optional microtransactions for cosmetic items being the only form of payment.

League of Legends, on the other hand, is the biggest MOBA in the world, with over 100 million monthly active players. Its success has had a profound impact on the industry, inspiring numerous companies to create their own League of Legends clones. However, it is the original game that has stood the test of time. Developed by Riot Games, a company founded by a group of developers from the original DotA mod, League of Legends aimed to simplify some of the more complex aspects of DotA and make it more accessible for newcomers. The result is a slightly less complex version of the MOBA format, with the basic three-lane map and teams of five fighting to destroy the enemy's base. While it removed some of the less crucial complexities, it still offers a deep and engaging gameplay experience.

In conclusion, MOBAs have become a global phenomenon, offering unique gameplay experiences and attracting millions of players worldwide. While many MOBAs have come and gone, the top games in the genre continue to thrive and innovate. Dota 2 and League of Legends, in particular, have proven themselves as the best of the best, with dedicated fan bases and critical acclaim. Whether you're a seasoned player or new to the genre, these games offer challenging and rewarding experiences that are sure to keep you engaged for years to come.",https://imageio.forbes.com/specials-images/imageserve/65fb05c9fa323af23f667c73/0x0.jpg?format=jpg&height=900&width=1600&fit=bounds,2024-03-24 14:00:00,Innovation,Innovation
