Link,Title,Text,Image,Date Publish
https://www.forbes.com/sites/brianmazique/2024/01/03/madden-24-continues-to-divide-users-with-its-approach-to-legends/,Madden 24 Continues To Divide Users With Its Approach To Legends,"Quarterback Michael Vick #7 (Photo by George Gojkovich/Getty Images) Getty Images
Can't we all just get along?
Better yet, couldn't EA make things less prickly between MUT players and franchise mode folks?
Madden players are divided into three main categories.
There are some sub-categories within these profiles, but they're mostly hardcore Ultimate Team players, online head-to-head players, and diehard franchise mode users.
You'll probably never convert strictly MUT players to franchise mode, and it's an equally challenging flip vice versa. That said, some elements within the game cross over–besides the core gameplay.
The most significant piece and point of contention is the inclusion of legends.
EA has a pretty healthy and attractive list of legends incorporated in MUT, but unfortunately, none of those legends are available for offline use or in rosters for franchise mode players.
Roster makers often make historic rosters with their versions of legends like Deion Sanders, Joe Montana, Randy Moss, and Michael Vick (the most recent legend dangled in front of users on the main menu only to be kept exclusively in MUT).
Still, those user creations aren't quite as cool as the ones that are scanned or expertly crafted by EA's art team.
How close can roster makers come to creating realistic-looking versions of these legends?
Based on the limited number of template faces available and with no way to sculpt a created player's face, you're limited to simply trying to find a guy with the right skin complexion.
Why would EA not follow 2K and Sony San Diego Studio's lead and allow every legend that appears in their respective collector modes to be available for offline use?
In NBA 2K, every legend in MyTeam is on an All-Time or classic team roster. In MLB The Show, each legend in Diamond Dynasty is on one of the fictional legends' teams or in the free agent pool.
Perhaps even more inexplicable, EA’s NHL franchise has the legends from HUT available in their base game.
Madden is the only major American sports video game franchise that locks its legends in its collector mode. The only logical reason for this exclusivity is rooted in a philosophy that suggests making the legends available in the base game would devalue them in MUT.
Essentially, EA seems to believe that keeping Vick and other legends exclusive to MUT will entice players into playing the collector mode–even if they would rather play franchise.
I hope this isn't the thought process, as tying a consumer's hands has never been my favorite approach. It's also a significant overreaction.
I've played thousands of hours of collector modes in sports games, and the most influential concept in these modes is power.
Users want the most powerful cards; by powerful, I mean the ones that give them the best chance to win online games against other users.
Whether they are legends or not, those cards are the most significant factor in grinding, pack purchases, and microtransaction spending.
Keeping legends away from the base game isn't positively impacting the bottom line. MUT users who crave power will still go hard for a good Vick card, even if he's available to offline franchise mode users.
If there is some gating, it would make more sense for offline users to be able to unlock legends within MUT for use in the base game. Ideally, users could have the option to unlock the legends through gameplay or via purchase.
With this system, wouldn't everyone get what they want? Wouldn't EA still monetize the legends they've paid to sign?
Wouldn't MUT users still have the greatest players in NFL history available as rewards? And wouldn't franchise users have an extra piece to add to their virtual football experience?
It makes too much sense not to be a thing at some point.","https://imageio.forbes.com/specials-images/imageserve/6594ff08667811318aadf052/0x0.jpg?format=jpg&crop=1863,1048,x0,y110,safe&height=900&width=1600&fit=bounds",2024-01-03 01:38:30
https://www.forbes.com/sites/ewanspence/2024/01/02/samsung-galaxy-s24-galaxy-unpacked-launch-event-new-galaxy-s24-release/,Samsung Confirms Galaxy S24 Unpacked Event,"Samsung’s YouTube channel has roared to life as it confirms the next Galaxy Unpacked event. The highly anticipated event will occur at the SAP Centre in San Jose, CA, at 10 am Pacific on January 17th. And we have a hint on the South Korean company’s focus.
Samsung Galaxy Unpacked invitation (early 2024). Samsung Pressroom
Curiously, the focus of the teaser is not on the widely expected Galaxy S24, S24+ or S24 Ultra smartphones, although Samsung has confirmed that the Galaxy S Series will be part of the event. Instead, the focus is on Galaxy AI. Samsung has previously announced Samsung Gauss, an AI platform with three key modules; ""Gauss Language for understanding human language and crafting natural responses, Gauss Code assists software development for code descriptions and creating test cases, and Gauss Image allows the creation of and the modification of images.""
No doubt, Gauss will be one of the tools that will help deliver on the promise that “Galaxy AI is coming.""
The Galaxy S handsets are a key part of the proposition, with the press release noting that “[Samsung will] unveil the latest premium Galaxy innovations, providing an all-new mobile experience powered by AI. ""
The new handsets will be powered by Samsung's latest Exynos 2400 chipset or a tweaked Qualcomm Snapdragon 8 Gen 3 tailored for the Galaxy S24 platform, depending on the territory. The Samsung community will be looking to see if the Exynos handsets can finally match the performance and efficiency of the Qualcomm-powered option. Both chipsets are tailored towards optimizing AI and ML routines running solely on a device or working alongside cloud-based services.
The Galaxy S24 Ultra is also expected to launch with a new S-Pen stylus and feature a titanium chassis to increase durability while reducing the overall weight of the flagship.
Now read about the potential pre-order offers Samsung will announce alongside the new Galaxy S handsets...",https://imageio.forbes.com/specials-images/imageserve/6594b7785ea14d27e08b46bb/0x0.jpg?format=jpg&height=900&width=1600&fit=bounds,2024-01-02 20:25:53
https://www.forbes.com/sites/stevemcdowell/2024/01/02/halcyons-latest-funding-shows-robust-cybersecurity-growth/,Halcyon’s Latest Funding Shows Robust Cybersecurity Growth,"Ransomware NAND Research
Halcyon, an emerging player in the cybersecurity anti-ransomware sector, recently marked a significant milestone in its growth trajectory, securing an additional $40 million in a Series B funding round. This recent infusion of capital brings the company's total funding to an impressive $84 million, following a $44 million Series A round last April.
I spoke with Jon Miller, the company’s co-founder and CEO, shortly after news of Halcyon’s funding round became public. He took me behind the scenes, describing how Halcyon differentiates in a hyper-competitive and growing market.
Halcyon’s Unique Approach to Ransomware Protection
Halcyon has carved a niche in anti-ransomware solutions and services with offerings tailored to combat the increasing threat of ransomware attacks, which have become a significant concern for businesses and institutions worldwide.
While the company offers a suite of tools that provide a comprehensive defense mechanism against ransomware threats, it takes a high-touch bespoke approach to helping its customers navigate the threat landscape.
As Mr. Miller told me, Halcyon brings a “unique set of services” to the anti-ransomware market. The company’s services team consults with enterprises to ensure that those customers are prepared to protect themselves, but also be able to quickly recover from has become an almost certain attack.
Halcyon is famous for its ability to help customers quickly recover from an attack, usually within twenty-four hours. The secret to such a rapid recovery lay in Halcyon’s proprietary “recovery engine,” which allows for data recovery even without the ransomware’s encryption key.
Halcyon delivers tools that provide anti-tamper protections, aimed at preventing unauthorized access and alterations to data; anti-data exfiltration software, which helps safeguard sensitive information from being stolen or leaked; and key material capture capabilities, a unique feature that aids in securing critical data encryption keys.
Halcyon's integration of advanced AI models into its security infrastructure is another key differentiator for the company. Halcyon’s models are trained to detect, disrupt, and counter ransomware attacks, offering a proactive and dynamic line of defense. This AI-driven approach allows Halcyon's solutions to continually adapt to new and evolving cyber threats, ensuring that its protection remains effective against the latest ransomware tactics.
Moreover, Halcyon's platform is designed to be autonomous and able to update its detection and prevention algorithms in real time. This aspect is crucial in the fast-paced digital environment where cyber threats evolve rapidly, and traditional, manual update processes often need to be faster to be effective.
The company's focus on ransomware, a particularly pernicious and growing cyberattack, demonstrates a deep understanding of the current cybersecurity landscape and its specific challenges.
Analyst’s Take
Halcyon's emergence in the cybersecurity landscape represents a significant development in the battle against ransomware, a growing threat in our increasingly digital world. The company stands out for its specialized focus on anti-ransomware solutions, allowing Halcyon to develop advanced tools that prevent attacks and offer unique capabilities like device decryption post-attack.
Financially, Halcyon's fundraising achievements, including its recent $40 million Series B funding round, signal strong market confidence in its approach and potential. This funding, totaling $84 million to date, speaks to investors' belief in Halcyon's innovative strategies and ability to fill a crucial gap in the cybersecurity market.
Moreover, the company's growing client base, which includes over 100 enterprise-level brands and several state-level school districts, reflects the effectiveness of its solutions and the broad applicability of its products across various sectors. Its client diversity underscores the universal challenge of ransomware and positions Halcyon as a versatile and critical player in this domain.
The company operates in a crowded market, filled with well-funded and capable competitors such as CrowdStrike, SentinelOne, and Microsoft; this is market where its often difficult to demonstrate differentiation. The challenge for Halcyon will be in maintaining its specialized focus, including its unique services offerings, while adapting to the constantly changing nature of cyber threats and the evolving needs of its clients.
Halcyon’s approach, and continued success, reveal a company that’s navigating a complex and competitive market with a nice balance of focus and execution. In the face of an ever-increasing and sophisticated threat landscape, Halcyon's uniquely focused approach to ransomware and its technological advancements and strategic expansion marks it as a company to watch in the cybersecurity arena.
Disclosure: Steve McDowell is an industry analyst, and NAND Research an industry analyst firm, that engages in, or has engaged in, research, analysis, and advisory services with many technology companies, which may include those mentioned in this article. Mr. McDowell does not hold any equity positions with any company mentioned in this article.",https://imageio.forbes.com/specials-images/imageserve/6594afd5ff7c89349551bcfe/0x0.jpg?format=jpg&height=900&width=1600&fit=bounds,2024-01-02 20:02:47
https://www.forbes.com/sites/johnarcher/2024/01/02/lg-reveals-2024-oled-tv-range/,LG Reveals 2024 OLED TV Range,"There are few if any AV-related announcements each year more eagerly anticipated than LG’s annual revelation of its new OLED TV range. So I’m pleased to say that day has come early this year, ahead of the start of the 2024 CES in Las Vegas next week. And while LG’s new OLED range perhaps looks set to be more of an iterative improvement over 2023 rather than the revolutionary leap we got with last year’s G3 series, there’s still lots of exciting-sounding stuff for serious AV fans to look forward to.
Given the leap forward for WRGB technology last year’s LG G3 models gave us with their use of of Micro Lens Array technology (as part of what LG calls its Brightness Booster Max technology, to reflect the fact that the MLA hardware is just a part of what makes LG’s premium OLED picture quality tick), let’s look first at LG’s new G4 range.
LG's new G4 series will build on the Brightness Booster Max technology introduced on last year's G3 ... [+] range with an ultra-powerful new processor. There's a new matching soundbar for the G4s, too. Photo: LG
The main picture improvement here is set to come from a new processor that LG claims is so big a leap over its predecessor that they’ve named it Alpha 11 AI instead of the Alpha 10 engine we’d expected to follow from 2023’s Alpha 9 processor. If you want some numbers to go with the Alpha 11 AI hype, LG claims the new chip will offer four times the AI performance of its predecessor, 1.7x the graphics performance, and 1.3x the general processing power - all partnered with 2.5GB of RAM.
The biggest single bit of news regarding Alpha 11 is that LG’s AI Picture Pro deep learning-powered image enhancement system can now work across all sources, including those connected to the TV via HDMI, rather than only working with broadcasts and some streaming services as it did before.
The new AI Picture Pro system carries the latest versions of the genre and scene analysis, AI Super Resolution, Noise Reduction and OLED Dynamic Tone Mapping Pro engine features (the latter of which breaks the image into thousands of analysis blocks to make its tone mapping more effective) we’ve seen in AI Picture Pro before. But Alpha 11 also introduces two potentially key new AI Picture Pro features: Object Enhancing By Visual Perception, and AI Director Processing.
The Object Enhancing By Visual Perception feature is claimed to analyze each and every pixel in the picture to better detect and more effective treat different objects in an image to help make it in more life-like (so key objects gain more emphasis, for instance). The AI Director Processing attempts to apply to whatever you’re watching the colour theory (where colour is used to enhance emotions) used during content mastering and grading to give images more power.
These two new features might sound problematic for AV purists who would rather their TV just show as accurately as possible the images it’s receiving. However, given the power and extent of the AI deep learning that’s behind these features, I suspect they’re probably going to be worth at least experimenting with, even for die-hard cinephiles.
The Alpha 11 processor introduces a couple of potentially critical new elements to the G4’s AI Sound Pro system, too: A virtual 11.1.2-channel upmixer that can even be applied to stereo sources, and a new Voice Remastering system that’s able to use AI to extract voices from audio mixes so that their clarity can be enhanced without affecting the rest of the mix. These new features join previous AI Sound Pro features of Adaptive Sound Control (which optimizes sound playback in real time based on analysis of the content), AI Acoustic Tuning to optimise the sound for your room set up, and a Dynamic Sound Booster for making the sound more dynamic and powerful.
LG's flagship OLED range for 2024 will be the wireless M4s. Photo: LG
While it’s not clear if LG has implemented any significant improvements to the hardware side of the Micro Lens Array system that helped the G3s deliver such a game-changing increase in brightness last year, LG does state that its latest Brightness Booster Max technology, which also incorporates a light boosting algorithm along with the better ‘light control architecture’, will make the G4s even brighter than the G3s. It’s not absolutely clear by how much; LG just states that the G4s will be up to 70% brighter than ‘conventional’ (which is to say, basic entry level models such as LG’sB series) OLED screens.
One other great bit of progress for the G4 range finds the Brightness Booster Max system extending to the 83-inch model; it’s no longer restricted to the 55, 65 and 77-inch sizes in the range. The only G4 model that won’t benefit from Brightness Booster Max technology is the new king-sized 97 incher.
Gamers have a new feature to look forward to, meanwhile, in the shape of support for 144Hz games if you have a PC capable of delivering such refresh rates. LG claims that this feature makes its new ‘Evo’ OLED models (which include new C4 and M4 models as well as the G4s) the first TVs to officially support both Nvidia G-Sync and 144Hz. They also support AMD FreeSync, of course.
The M4 models mentioned back there will actually represent LG’s flagship OLED TVs for 2024. As anyone familiar with the M3 TVs LG introduced relatively late on in 2023 might expect, the new M4 range will continue to be built around LG’s Zero Connect system, where an external connection box sends pictures up to 4K/144Hz HDR (making them the first TVs to do this without compression) wirelessly to their gorgeously minimalistic partner OLED screens. The M4s will improve on their M3 predecessors by sporting the latest Alpha 11 AI processor, and again all screen sizes bar the 97-inch one will benefit from Brightness Booster Max technology.
The M4 and G4 screens will both feature so-called ‘One Wall Designs’ ideally suited to wall mounting, and five-year warranties as a sign of LG’s confidence in their longevity.
One other new feature exclusive to LG’s M4 and G4 OLED screens will be a new 4-screen multi-view system unlocked by the power of the Alpha 11 processor. This lets you divide the screen into four smaller screens showing different sources, with the power of the new processor increasing the range of source combinations you can set up (including live TV, HDMI, YouTube, CAM, Browser, Miracast, Spotify and Airplay) and improving the interface you use for selecting your Multiview sources.
The new C4 range
Rounding out LG’s so-called evo range of premium OLED panels will be the C4 range. As with the C series in 2023’s LG OLED range, the C4s won’t benefit from the full Brightness Booster Max technology, with some C4 screen sizes instead falling back to regular Brightness Booster technology. This reflects a specific combination of a slightly improved version of the Alpha 9 processor deployed on last year’s C3 models, and LG ‘evo’ panels that deliver more brightness than the basic OLED panels used in LG’s entry-level OLED range without getting the extra brightness boost made possible by MLA technology. Again, LG suggests there should be a small brightness enhancement for the C4s over the C3s, but can’t provide any exact figures for this.
As with previous years, the 42 and 48-inch C4s won’t get the Brightness Booster technology - though LG does confirm that they will definitely be brighter than their 2023 counterparts.
The C4s lose the 5 year warranty of the G4 and M4 series, drop the multiview support to two screens from four, and switch away from a One Wall design to an Ultra Slim Design. They do, though, retain both the 144Hz gaming and far-field voice control (where you can talk to the TV without needing to press a button on your remote handset) features delivered by the M4s and G4s.
The LG C4 range in 2024 will be available in 42, 48, 55, 65, 77 and 83-inch screen sizes.
Wrapping up LG’s OLED offering for 2024 will be the entry-level B4 series. Available in 77, 65, 55 and 48-inch screen sizes, these models top out at 120Hz support rather than 144Hz, and step down to a new Alpha 8 AI 4K processor, which LG rather vaguely describes as ‘inherited’ from last year’s Alpha 9 AI 4K system.
There’s no far-field voice recognition on the B4s either, and they lose all of the Brightness Booster technologies available from the C4 up, meaning they’ll be significantly less bright than their siblings. They do, though, still get the Dolby Vision and Dolby Atmos support enjoyed by all of LG’s more premium 2024 models, as well as the latest much-improved webOS platform including the two-screen Multiview system carried by the C4s.
LG has yet to provide launch date or pricing information for its 2024 OLED range, but rest assured I’ll bring you this information on my Forbes channel as soon as LG reveals it.
—
Related Reading
LG Unveils Its 2024 QNED LCD TV Range - Including New Mini LED Models
LG Announces New 4K Lifestyle Laser Projector With Ultra-Portable Design And WebOS Smarts
LG Unveils Its 2024 Soundbar Range, Including New 15-Channel Flagship",https://imageio.forbes.com/specials-images/imageserve/6594b0c1b0a4ee92159accbe/0x0.jpg?format=jpg&height=900&width=1600&fit=bounds,2024-01-02 20:00:46
https://www.forbes.com/sites/ewanspence/2024/01/02/samsung-galaxy-s24-ultra-price-special-offer-launch-preorder-new-galaxy-s24-release/,Samsung Makes Surprise Free Offer To Every Galaxy S24 User,"Updated January 2: article originally posted January 1
When Samsung launches the three new Galaxy S24 smartphones later this month, there will be exciting free offers for those who pre-order one of its flagship phones.
Galaxy S23, Galaxy Watch 5, and Galaxy Buds (Photo by Joan Cros/NurPhoto via Getty Images) NurPhoto via Getty Images
Samsung is widely expected to host a Galaxy Unpacked event on January 17th, where the Galaxy S24, Galaxy S24+ and Galaxy S24 Ultra will be launched. The handsets should go on general sale in key territories before the end of the month, but there will be a pre-order window with several free offers to encourage sales.
Update: Tuesday, January 2. Samsung has now announced the next Galaxy Unpacked event, where it will launch the Galaxy S24, S24+ and S24 Ultra. As well as confirming the time of 10 am Pacific on January 17th at the SAP Center in San Jose, CA, Samsung announced a special offer for those reserving a handset ahead of the launch… a pre-order on a pre-order, if you will.
Echoing a similar offer from the Galaxy Z Fold 5 and Z Flip 5 launch, customers who reserve a handset between the 2nd and 16th of January will receive a $50 credit towards purchasing a handset from the S24 range.
There are no details on the pre-order offers yet; these will probably become clear during the launch event, but recent reports suggest two options will return to entice consumers to the new Galaxy flagships.
The Samsung Experience Store on Oxford Street in London (Photo by Olly Curtis/Future via Getty ... [+] Images) Future via Getty Images
The first is “double your storage,” which will allow consumers to step up to the next model’s storage at no extra cost—if you buy the 128 GB model of the Galaxy S24 you’ll receive the 256 GB model right through the range to those buying the 512 GB model of the Galaxy S24 Ultra receiving the 1TB model. You can view it as a double your memory or a discount on the models with more storage; either way, it's an enticing option for those on a budget.
Then you have the bonus accessories. Samsung is expected to offer every Galaxy S24 buyer a discount on the Galaxy Buds Fan Edition wireless buds and Galaxy Watch smartwatches. The latest Buds FE were launched late last year alongside the Galaxy S23 FE smartphone, offering active noise cancellation and a transparency mode for $99. The Galaxy Watch 6 was launched in the summer of 2023 with improved battery life, slimmer bezels, and WearOS 4 for $299.
It remains to be seen which peripherals will be offered with which phones and how much discount will be offered. For comparison, Google offered a free set of Pixel Buds Pro for those pre-ordering the Pixel 8 smartphone and a free Pixel Watch 2 for those pre-ordering the Pixel 8 Pro.
Finally, you have the exclusive models available only through Samsung’s website.
Samsung will have a wide range of colors across the S24 portfolio, but some will only be available through the website. Those looking for the highest specced Galaxy S24 Ultra must order through Samsung’s website if, as expected, the 1 TB storage option will only be available online.
Recent leaks on the potential European pricing suggest that the Galaxy S24 and S24+ will be marginally cheaper than equivalent S23 models. At the same time, the Galaxy S24 Ultra will be more expensive than last year’s Galaxy S23 Ultra.
Now read about the three key features that will drive sales of the Galaxy S24 family...","https://imageio.forbes.com/specials-images/imageserve/659300f714eba79a0feffef8/0x0.jpg?format=jpg&crop=3626,2040,x221,y122,safe&height=900&width=1600&fit=bounds",2024-01-02 19:49:06
