Link,Title,Text,Image,Date Publish
https://techxplore.com/news/2023-10-ai-defeat-champion-street-fighter.html,Researchers train AI with reinforcement learning to defeat champion Street Fighter players,"This article has been reviewed according to Science X's editorial process and policies . Editors have highlighted the following attributes while ensuring the content's credibility:
Graphic of the neural network (left) and snapshot of the video game (right). Credit: SUTD
Researchers from the Singapore University of Technology and Design (SUTD) have successfully applied reinforcement learning to a video game problem. The research team created a new complicated movement design software based on an approach that has proven effective in board games like Chess and Go. In a single testing, the movements from the new approach appeared to be superior to those of top human players.
These findings could possibly impact robotics and automation, ushering in a new era of movement design. The team's article in Advanced Intelligence Systems is titled ""A Phase-Change Memristive Reinforcement Learning for Rapidly Outperforming Champion Street Fighter Players.""
""Our findings demonstrate that reinforcement learning can do more than just master simple board games. The program excelled in creating more complex movements when trained to address long-standing challenges in movement science,"" said principal investigator Desmond Loke, Associate Professor, SUTD.
""If this method is applied to the right research problems,"" he says, ""it could accelerate progress in a variety of scientific fields.""
The study marks a watershed moment in the use of artificial intelligence to advance movement science studies. The possible applications are numerous, ranging from the development of more autonomous automobiles to new collaborative robots and aerial drones.
Reinforcement learning is a kind of machine learning in which a computer program learns to make decisions by experimenting with various actions and getting feedback. For example, the algorithm can learn to play chess by testing millions of possible moves that result in success or defeat on the board. The program is intended to help algorithms learn from their experiences and improve their decision-making skills over time.
The research team provided the computer with millions of initial motions to create a reinforcement learning program for movement design. The program then made several tries at improving each move randomly towards a specific objective. The computer tweaks character movement or adjusts its strategy until it learns how to make moves that overcome the built-in AI. Human-level performance in Street Fighter game using phase-change memory reinforcement learning. Credit: SUTD
Associate Prof Loke added ""Our approach is unique because we use reinforcement learning to solve the problem of creating movements that outperforms those of top human players. This was simply not possible using prior approaches, and it has the potential to transform the types of moves we can create.""
As part of their research, the scientists create motions to compete with various in-built AIs. They confirmed that the moves could overcome different in-built AI opponents.
""Not only is this approach effective, but it is also energy efficient."" The phase-change memory-based system, for example, was able to make motions with a hardware energy consumption of about 26 fJ, which is 141 times less than that of existing GPU systems. ""Its potential for making ultra-low-hardware-energy movements has yet to be fully explored,"" stated Associate Prof Loke.
The team focused on creating new motions capable of defeating top human players in a short amount of time. This required the use of decay-based algorithms to create the motions.
Algorithm testing revealed that new AI-designed motions were effective. The researchers noted numerous good qualities as a measure of how successful the design system had become, such as reasonable game etiquette, management of inaccurate information, ability to attain specific game states, and the short times used to defeat opponents.
In other words, the program exhibited exceptional physical and mental qualities. This is referred to as effective movement design. For example, motions were more successful at overcoming opponents because the decayed-based technique used for training neural networks takes fewer training steps than conventional decay methods.
The researchers envision a future in which this strategy will allow them and others to build movements, skills, and other actions that were not before possible.
""The more effective the technology becomes, the more potential applications it opens up, including the continued progression of competitive tasks that computers can facilitate for the best players, such as in Poker, Starcraft, and Jeopardy,"" Associate Prof Loke said. ""We may also see high-level realistic competition for training professional players, discovering new tactics, and making video games more interesting.""
SUTD researchers Shao-Xiang Go and Yu Jiang also contributed to the study.
More information: Shao-Xiang Go et al, A Phase‐Change Memristive Reinforcement Learning for Rapidly Outperforming Champion Street‐Fighter Players, Advanced Intelligent Systems (2023). DOI: 10.1002/aisy.202300335",https://scx2.b-cdn.net/gfx/news/2023/sutd-researchers-train.jpg,2023-10-05 12:32:04
https://techxplore.com/news/2023-10-green-hydrogen-economic-viability-co-production.html,Green hydrogen could reach economic viability through the co-production of valuable chemicals,"This article has been reviewed according to Science X's editorial process and policies . Editors have highlighted the following attributes while ensuring the content's credibility:
Illustration of the solar-powered coupled photoelectrochemical and hydrogenation unit. The coupled device uses sunlight to generate hydrogen and consumes some of the generated hydrogen in situ to hydrogenate biomass-derived feedstock using a homogeneous catalyst. The remaining hydrogen can then be used for energy storage, transport, building and industrial applications. The hydrogenated products are valuable chemicals in high demand by the chemical and pharmaceutical industries. The fraction of the hydrogen used for the hydrogenation reaction can be adapted to demand by regulating the supply of biomass feedstock and the catalyst concentrations accordingly. By switching between ""Feedstock A + Catalyst A"" and ""Feedstock B + Catalyst B"", different hydrogenation products can be produced in the same PEC plant. Credit: Hassan Tahini, ScienceBrush Design / published in https://doi.org/10.1038/s41467-023-41742-4
It already works: there are several approaches to using solar energy to split water and produce hydrogen. Unfortunately, this ""green"" hydrogen has so far been more expensive than ""gray"" hydrogen from natural gas.
A study by the Helmholtz-Zentrum Berlin (HZB) and the Technical University of Berlin now shows how green hydrogen from sunlight can become profitable: part of the hydrogen is used to upgrade raw biomass-derived chemicals into high-value chemicals for industry. This co-production concept is very flexible; the same plant can be used to produce different by-products as required.
We need to move away from fossil fuels as soon as possible in order to limit global warming. In the energy system of the future, green hydrogen will therefore play an important role in energy storage and as a renewable feedstock for the production of chemicals and materials for a wide range of applications.
At present, hydrogen is mainly produced from fossil natural gas (gray hydrogen). Green hydrogen, on the other hand, is produced via electrolysis of water using renewable energy. One promising approach is to use photoelectrochemical (PEC) devices to produce hydrogen using solar energy. However, hydrogen from PEC plants is much more expensive than hydrogen from (fossil) methane.
Full control over reactions
A team led by Fatwa Abdi (at HZB until mid-2023, now at City University in Hong Kong) and Reinhard Schomäcker (UniSysCat, TU Berlin) has now investigated how the balance changes when some of the hydrogen produced in a PEC device reacts with itaconic acid (IA) to form methylsuccinic acid (MSA), all within the same device.
The starting material, itaconic acid, comes from biomass and is fed in. Methylsuccinic acid is a high priced compound and needed by the chemical and pharmaceutical industries.
In the study, the team describes how to control the chemical reactions in the PEC device by varying the process parameters and the concentration of the homogenous rhodium-based catalyst, which is water-soluble and already active at room temperature. In this way, different proportions of hydrogen could be used for the hydrogenation of itaconic acid, selectively increasing or decreasing the production of methylsuccinic acid.
Plant becomes profitable from 11 percent hydrogen for MSA
With a realistic overall PEC plant efficiency of 10 percent and taking into account primary costs as well as operation, maintenance and decommissioning, pure hydrogen production remains too expensive compared to production from fossil gas. This is true even if the lifetime of the PEC plant is assumed to be 40 years.
This balance changes if the PEC reaction is coupled with the hydrogenation process. Even if only 11 percent of the hydrogen produced is converted to MSA, the cost of hydrogen drops to 1.5 € per kilogram, which is already at the same level as for hydrogen from methane steam reforming. And this is true even for a PEC plant lifetime of only 5 years.
As the market price of MSA is significantly higher than that of hydrogen, more MSA increases the profitability. In the experiment, between 11 and up to 60 percent of the hydrogen could be selectively used to produce MSA.
In addition, a previous study has shown that co-production of MSA also reduces the so-called energy payback time, i.e. the time it takes for the plant to recover the energy that its production has consumed.
The PEC plant can also be used to produce other co-products by simply changing the feedstock and the (soluble) catalyst: for example, acetone could be hydrogenated to isopropanol. ""This is another major advantage of our concept of co-production. We have found a promising way to make solar hydrogen production economically viable,"" says Fatwa Abdi.
The work is published in the journal Nature Communications.
More information: Keisuke Obata et al, Solar-driven upgrading of biomass by coupled hydrogenation using in situ (photo)electrochemically generated H2, Nature Communications (2023). DOI: 10.1038/s41467-023-41742-4 Journal information: Nature Communications",https://scx2.b-cdn.net/gfx/news/hires/2023/green-hydrogen-could-r.jpg,2023-10-05 10:54:03
https://techxplore.com/news/2023-10-superconducting-niobium-waveguide-high-precision-communications.html,Superconducting niobium waveguide achieves high-precision communications for B5G/6G networks,"This article has been reviewed according to Science X's editorial process and policies . Editors have highlighted the following attributes while ensuring the content's credibility:
Researchers fabricated 20mm length waveguides made of the superconducting metal niobium (right). It shows improved conductivity compared with normal metal materials such as a gold-plated tellurium copper (middle) and aluminum alloy (left), and can transmit radio waves that are necessary for B5G/6G communications. Credit: Taku Nakajima
A team of researchers has made a breakthrough discovery in the world of Beyond 5G/6G (B5G/6G) signal transmission. Taku Nakajima and Kazuji Suzuki of Nagoya University in Japan, along with their collaborators, created a waveguide made of niobium that speeds up the transition of B5G/6G signals. The researchers published their findings in the Journal of Physics: Conference Series.
The frequency of data waves has continued to increase as B5G/6G technologies have been introduced. Although the currently used metal transmission lines can handle B5G/6G, research has focused on superconducting metals, such as niobium, that have lower transmission loss and can handle higher frequencies.
Nakajima and his collaborators evaluated the use of niobium in a waveguide, a three-dimensional transmission line consisting of a metal tube that guides and confines waves along a specific path, minimizing losses due to radiation and absorption. However, working with the metal proved to be difficult as it was susceptible to deformation and damage during fabrication and handling.
""Fabricating a physical model of a waveguide was very difficult. At first, it was not possible to process it with any precision at all,"" Nakajima said. The result of their first cutting caused a milling burr, an unwanted projection of the metal. ""We tried to search for the best cutting tool and cutting parameters and eventually found that diamond-like carbon-coated tools were the best. This trial-and-error process took several months.""
Using their method, the researchers fabricated rectangular waveguides that can transmit radio waves in the 100 GHz band that are necessary for B5G/6G communications. They compared the conductivity of their niobium waveguide with that of common non-superconducting waveguide materials: a gold-plated tellurium copper and aluminum alloy.
They tested both at room temperature and at low temperatures because the characteristics of superconducting metals change with cooling, entering what is called the superconducting state, which is characterized by low electrical resistance.
""As expected, we found that the conductivity improves as the temperature of the metal decreases, resulting in reduced losses in the circuit,"" said Nakajima.
""Using electromagnetic field simulations, we calculated the conductivity and transmission loss of each metal. The conductivity of niobium in the superconducting state was 1,000 to 10,000 times higher than that of the aluminum alloy. Furthermore, the transmission loss of niobium in the superconducting state was calculated to be several tenths that of other metals. These two factors contribute to the creation of a high-quality, high-precision communication environment.""
The results of this study have important implications for uses of their technology for B5G/6G communications. According to Nakajima, ""By applying the results of this research, an unprecedented ultra-sensitive receiving system can be realized in radio telescope receivers for astronomical observations, where waveguide circuits are already widely used, and in environmental measurement equipment for the earth's atmosphere.""
""This will open up new fields of scientific observation using high-frequency radio waves, such as the observation of very distant galaxies in the early universe, which emit only very weak radio waves, or the monitoring of changes in trace atmospheric constituents in the Earth's upper atmosphere.""
In addition to Nakajima and Suzuki from the Institute for Space-Earth Environmental Research (ISEE) at Nagoya University, the collaborators included researchers from the National Astronomical Observatory of Japan, Kawashima Manufacturing Co., and the National Institute of Information and Communications Technology.
More information: Taku Nakajima et al, Propagation in Superconducting Niobium Rectangular Waveguide in the 100 GHz band, Journal of Physics: Conference Series (2023). DOI: 10.1088/1742-6596/2545/1/012021",https://scx2.b-cdn.net/gfx/news/hires/2023/superconducting-niobiu.jpg,2023-10-05 10:34:57
https://techxplore.com/news/2023-10-tricky-tangles-robots-vine-like-vegetation.html,Tricky tangles: Robots learn to navigate vine-like vegetation,"This article has been reviewed according to Science X's editorial process and policies . Editors have highlighted the following attributes while ensuring the content's credibility:
Credit: Carnegie Mellon University Mechanical Engineering
Robots are often found in very controlled, indoor environments because, unlike in a natural environment, there are no tripping hazards to overcome. However, in order to perform important tasks like environmental monitoring or search and rescue, robots must be able to navigate through branches and vines without getting tied up.
""When you take robots outdoors, the entire problem of interacting with the environment becomes exponentially more difficult because you have to be more deliberate in everything that you do,"" said David Ologan, a master's student studying mechanical engineering. ""Your system has to be robust enough to handle any unforeseen circumstances or obstructions that you might encounter. It's interesting to tackle that problem that hasn't necessarily been solved yet.""
The research team, led by Aaron Johnson, an associate professor of mechanical engineering, used a quadrupedal-robot to produce a reactive walking strategy. Alternatives like wheeled robots can become stuck in vines or cause damage to the environment.
""Real-world obstacles might be stiff like a rock or soft like a vine, and we want robots to have strategies that prevent tripping on either,"" said Justin Yim, an engineering professor at the University of Illinois Urbana-Champaign and collaborator on the project.
The research demonstrates a ""momentum-based observer for proprioceptive joint torque estimation suited to classify contacts on a robot's limb as entanglements."" That is, it monitors the motion of its legs to see if any are getting stuck on something and not making progress.
""Legged robots can select footholds and step over things as opposed to just driving over everything,"" Ologan said. ""The problem with this is with every step, you have to reason about your footholds. The system is incredibly delicate. If you bump into a step, your whole robot can fall over, so we need methods to respond to external contact."" Credit: Carnegie Mellon Unviersity, College of Engineering
The environment also affects the efficiency and performance of robots, Ologan explains.
""The potential for legged robots in outdoor, vegetation-based environments is interesting to see,"" he said. ""If you live in a city, a wheeled platform is probably a better option because the infrastructure is already set up. There is a trade-off between being able to do more complex actions and being efficient with your movements.""
The ability for four-legged robots to walk through vegetation can be used in multiple fields and applications, Ologan said. Quadrupeds are now used to survey oil rigs, and improving their capabilities can also aid in rescue missions.
The team tested multiple iterations of Charlie's–the robot's–walking pattern. They found that having the robot reactively retract its legs was the best option in getting it to navigate and untangle itself from obstacles. Other methods, such as high-stepping and a knees-forward approach were not nearly as effective. Through this testing, the team was able to preset a simple leg reaction motion to disentangle from any detected entanglements. This technology to help robots untangle themselves can also be integrated into other robots without having to modify their existing hardware.
""This whole reaction strategy is just one part of a multi-step process,"" Ologan said.
This research will be presented at the 2023 IEEE/RSJ International Conference on Intelligent Robots and Systems (IROS 2023).",https://scx2.b-cdn.net/gfx/news/2023/tricky-tangles-robots.jpg,2023-10-05 11:39:24
https://www.reuters.com/innovation/article/tech-antitrust-google-branch/google-stopped-samsung-from-expanding-search-app-offering-ex-executive-idUSKBN3151Y7,Google stopped Samsung from expanding search app offering - ex-executive,"FILE PHOTO: The logo of Google is seen at the Viva Technology conference dedicated to innovation and startups at Porte de Versailles exhibition center in Paris, France, June 14, 2023. REUTERS/Gonzalo Fuentes/File Photo
WASHINGTON (Reuters) - A former executive at Samsung Electronics’ venture capital arm who proposed that mobile app developer Branch Metrics’ software offering be expanded in Samsung smartphones faced pushback due to pressure from Google, he said on Thursday in a landmark antitrust trial against the Alphabet unit.
Patrick Chang, who worked at Samsung Next to invest in innovative companies, had urged the parent company to expand the offerings of Branch, which can search within apps, to its Android smartphones.
Branch Metrics founder and former CEO Alexander Austin testified in late September that his company eliminated some of its software’s functions to fend off Google’s complaints as it sought to make deals with wireless carriers and smartphone makers. Branch had to ensure that its searches remained within apps and never linked to the web, Austin noted.
Chang testified that Samsung also faced pushback from wireless carries, like AT&T, which sell Android phones.
Google is accused of paying $10 billion a year based on revenue share agreements to smartphone makers like Samsung Electronics, wireless carriers and others who agree to make its software the default and maintain its monopoly in search.
In its questioning, the Justice Department showed an August 2020 email by Samsung executive David Eun, who complained that “Google is clearly buying its way to squelch competitors.”
Under cross examination by an attorney for Google, Chang was asked about another possible explanation for Samsung’s disinterest in Branch, which is that the software was clunky and few users clicked on links that Branch offered.
Chang testified during the fourth week of a more than two-month trial in which the U.S. Justice Department is seeking to show that Google abused its monopoly of search and some search advertising. Google has said that its business practices were legal.
(This story has been corrected to say Google was accused of stopping the expansion of Branch Metrics software offering on smartphones, not blocking the installation, in the headline and paragraph 1)",https://s1.reutersmedia.net/resources/r/?m=02&d=20231005&t=2&i=1646818796&w=1200&r=LYNXMPEJ940X2,2023-10-05 22:22:02
