Link,post_title,post_content,featured_image,Date-Publish,post_category,post_tag
https://www.forbes.com/sites/energyinnovation/2024/03/24/epa-didnt-ban-gas-cars-it-cut-air-pollution-so-we-can-breathe-easier/,EPA Didn’t Ban Gas Cars. It Cut Air Pollution So We Can Breathe Easier.,"On red air days, when pollution levels spike, the metallic taste of contaminated air lingers in our noses and lungs. It's a stark reminder of the toxic air we breathe, prompting caution for vulnerable groups like the elderly, children, pregnant women, and those with respiratory ailments.

The primary culprit behind this pervasive air pollution? Internal combustion engines powered by gasoline or diesel. These engines are major contributors to the dirty emissions that pollute our atmosphere. With over two-thirds of Americans relying on personal vehicles for daily transportation, it's no surprise that the transportation sector is the largest source of greenhouse gas emissions in the United States. Light-duty vehicles alone are responsible for nearly 60% of this pollution.

To combat this pressing issue, we must tackle tailpipe emissions from vehicles. The good news is that we have a powerful solution at our disposal: tailpipe emissions standards. Recently, the U.S. Environmental Protection Agency took a significant step by introducing new multi-pollutant regulations for light-duty and smaller medium-duty vehicles. These rules aim to limit the harmful emissions that compromise our air quality and contribute to climate change. Automakers are now required to embrace cutting-edge clean technologies to ensure that new vehicles are cleaner than ever before.

Every individual should have the opportunity to choose a clean car for their next vehicle. Those who prioritize reducing pollution deserve the option to drive electric vehicles.

Despite the benefits of cleaner air, some entities are not as enthusiastic about these new standards. Corporations that profit from selling polluting vehicles and fossil fuels view these regulations as a hindrance. They argue that these standards impede consumer choice and infringe on American freedoms.

In reality, these updated pollution limits are long overdue and will have widespread benefits. They will enhance air quality, particularly benefiting the 36% of the U.S. population affected by air pollution. People living in areas with unhealthy air quality face various respiratory issues, with children's lung development particularly at risk. Moreover, individuals from marginalized communities are disproportionately impacted by air pollution.

It's crucial to debunk the misinformation spread by profit-driven corporations. They have launched campaigns to mislead the public, framing the standards as a ban on gas vehicles. However, the truth is that the EPA's standards are technology-neutral, performance-based, and grounded in scientific research.

The Clean Air Act, enacted in 1970, empowers the EPA to establish air quality standards to safeguard public health and regulate emissions from vehicles. Over the years, these standards have driven innovation in engine and emission control technologies, leading to significant reductions in harmful pollutants. Prior to the Clean Air Act, cities like New York and Los Angeles grappled with severe air pollution, posing serious health risks to residents.

As we reflect on the progress made in combatting air pollution, it's evident that stringent emissions standards play a vital role in safeguarding public health and the environment. By embracing cleaner technologies and advocating for sustainable transportation options, we can create a healthier future for all. Let's continue to support initiatives that prioritize clean air and empower individuals to make environmentally conscious choices.",https://imageio.forbes.com/specials-images/imageserve/65fe401fc35aefb76700b52e/0x0.jpg?format=jpg&height=900&width=1600&fit=bounds,2024-03-24 07:45:00,Innovation,Innovation
https://www.forbes.com/sites/anuradhavaranasi/2024/03/24/which-adhd-medications-could-lower-risk-of-suicide--hospitalization/,Which ADHD Medications Could Lower Risk Of Suicide & Hospitalization?,"ADHD medications are associated with a lower risk of suicidal behavior and psychiatric hospitalizations, according to a new study. The research, which included over 200,000 individuals with ADHD, found that those who were prescribed ADHD stimulant medications had a decreased risk of attempting suicide or dying by suicide. Additionally, the use of ADHD medications was linked to fewer psychiatric hospitalizations.

The study, conducted by researchers at the Karolinska Institute in Stockholm, Sweden, focused on four ADHD medications: amphetamine, lisdexamphetamine, dexamphetamine, and methylphenidate. The researchers found that these medications were associated with a decreased risk of being hospitalized due to psychiatric co-morbidities. However, a decreased risk of suicidal behavior was only observed with the use of lisdexamphetamine, dexamphetamine, and methylphenidate.

Previous studies have shown that individuals with ADHD are more likely to have psychiatric co-morbidities compared to those without ADHD. Conditions such as major depressive disorder, panic disorder, substance abuse, generalized anxiety disorder, agoraphobia, obsessive-compulsive disorder, PTSD, and psychotic symptoms are commonly seen in individuals with ADHD. The prevalence of psychiatric co-morbidity among those with ADHD was found to be 52%, while it was only 7% among individuals without ADHD. The presence of psychiatric co-morbidities also increased the risk of mortality, particularly when substance use disorder was involved.

The researchers noted that while atomoxetine, an ADHD medication, was not linked to a lower risk of psychiatric hospitalizations or suicidal behavior, it was associated with fewer hospitalizations for non-psychiatric co-morbidities. They emphasized the need for further investigation into the long-term effectiveness and safety of ADHD medications, as they have been found to have both beneficial psychiatric outcomes and possible adverse outcomes.

For this study, the researchers analyzed data from 221,714 individuals between the ages of 16 to 65 years old who had received an ADHD diagnosis in Sweden between 2006 and 2021. The study participants' healthcare data, including inpatient and outpatient records, were collected from the Swedish National Patient Register. The researchers also obtained data from the Prescribed Drug Register to track the purchase of prescribed ADHD medications. Methylphenidate was the most commonly used medication, followed by lisdexamphetamine and atomoxetine.

During the 15-year follow-up period, it was found that 56% of the study participants had a psychiatric co-morbidity, with anxiety, depression, bipolar disorder, and stress-related disorders being the most common. Approximately 26% of the participants had been hospitalized due to a psychiatric co-morbidity. Interestingly, the effectiveness of the medications varied based on age and gender. Lisdexamphetamine was associated with a decreased risk of psychiatric hospitalizations among adolescents, young adults, and adults aged 30 and older, while methylphenidate appeared to be less effective among older adults. Atomoxetine was linked to a decreased risk of hospitalization among women but not men.

The researchers acknowledged concerns about the long-term use of stimulant medications, such as increased blood pressure and heart rate, which could potentially increase the risk of cardiovascular diseases. Additionally, there are concerns about the risk of seizures and the possibility of psychosis or mania. However, overall, the study found that the use of ADHD medications had a beneficial effect on psychiatric outcomes and a decreased risk of non-psychiatric hospitalizations.

The findings of this study provide valuable insights into the effectiveness and safety of ADHD medications. While further research is needed to fully understand the long-term effects, this study highlights the potential benefits of these medications in reducing the risk of suicidal behavior and psychiatric hospitalizations among individuals with ADHD.

Reference:
Taipale, H., Mittendorfer-Rutz, E., Alexanderson, K., Lichtenstein, P., & Larsson, H. (2024). Association of Attention-Deficit/Hyperactivity Disorder Medication Use With Risk of Psychiatric Hospitalization in Adolescents and Adults. JAMA Network Open, 7(3), e418. doi:10.1001/jamanetworkopen.2024.418",https://imageio.forbes.com/specials-images/imageserve/63c28dbb82c31b7412c92cf2/0x0.jpg?format=jpg&height=900&width=1600&fit=bounds,2024-03-24 04:09:46,Innovation,Innovation
