Link,post_title,post_content,featured_image,Date-Publish,post_category,post_tag
https://www.forbes.com/sites/karlfreund/2024/03/25/cerebras-update-the-wafer-scale-engine-3-is-a-door-opener/,Cerebras Update: The Wafer Scale Engine 3 Is A Door Opener,"Cerebras recently hosted an AI Day event that garnered a lot of attention. Despite the simultaneous occurrence of GTC, the event was packed with attendees. Cerebras Systems, a startup that stands out for its success in training AI, unveiled the third generation of its Wafer-Scale Engines (WSE-3) at the event. This powerful chip surpasses racks of GPUs in terms of performance and comes with a partnership with Qualcomm to offer custom training and collaborate with Edge AI leader in Go-To-Market efforts. The event featured numerous images from Cerebras, which effectively conveyed the company's message. In this article, we will delve into the highlights of the AI Day event, while also discussing the challenges faced by this ambitious startup.

The Cerebras CS-3 and Galaxy Clusters
The CS-3, along with the WSE-3, represents the third generation of wafer-scale engines. This engineering marvel aims to simplify scaling, rather than being compared to a single GPU chip. Cerebras questions the need for cutting up a wafer of chips, packaging each one with HBM, placing them on a board, connecting them to CPUs with a fabric, and then tying them all back together with networking chips and cables. This complex process often requires extensive programming to distribute the workload and create a supercomputer. Cerebras, on the other hand, proposes a more efficient solution.

Andrew Feldman, CEO and co-founder of Cerebras, expressed his pride in introducing the third generation of their wafer-scale AI chip. WSE-3 is purpose-built for the latest AI work, including mixture of experts and 24 trillion parameter models. In terms of transistor count, GPUs are projected to match WSE-3's capabilities in approximately six years. Cerebras calculated that WSE-3 is 57 times larger than Nvidia's H100, with 52 times more cores, 800 times more memory on chip, 7,000 times more memory bandwidth, and over 3,700 times more fabric bandwidth. These impressive statistics serve as the foundation for its outstanding performance.

The WSE Magic
However, the true magic of the WSE lies in its ability to treat a large cluster as a single instance, eliminating the need for extensive distributed computing coding effort. By streaming the weights of massive models instead of storing them on-chip, Cerebras' MemoryX and SwarmX interconnect can integrate up to 2048 CS-2 servers into a theoretical cluster. While creating such a monster would cost around $5 billion, Cerebras offers this as an option for those with the necessary resources.

This approach also addresses a major challenge in building trillion-parameter models. OpenAI's GPT-4 required the contribution of 240 individuals, with 35 engineers solely dedicated to solving the distributed computing problem. Cerebras not only reduces this problem but eliminates it entirely.

The Unified Interface
Cerebras' software stack presents a unified interface to the AI Supercomputer, regardless of its size. The company claims this interface provides real business value, enabling quick model deployment with only 5% of the resources required by other AI platforms. This advantage gives Cerebras a strong competitive edge.

Cerebras' Expansion Plans
Cerebras recently announced its progress in building the third of nine planned supercomputers worldwide. The Galaxy 3, based on CS-3, is currently under construction. By the end of 2024, Cerebras aims to complete the remaining six supercomputers.

More on the WSE-3
The WSE-3 is not just a shrink of its predecessor, but also introduces new SIMD engines for 8 and 16-bit numerics, as well as new non-linear functions (activations). These enhancements result in twice the performance per core compared to the WSE-2.

Unlimited Scalability
From both a hardware and software perspective, the CS-3 is designed for massive scalability. Cerebras has built a highly scalable system that can meet the needs of organizations willing to invest the required capital.

Conclusions and Challenges for Cerebras
Cerebras stands out as a truly different alternative to Nvidia. Unlike other options that may only offer a slight improvement, Cerebras presents a completely distinct approach. It is not just another ASIC that resembles a cheaper GPU, nor is it a traditional GPU. Cerebras faces challenges as it strives to revolutionize the AI industry, but it has already proven its ability to make significant strides.

In conclusion, Cerebras' AI Day event showcased the impressive capabilities of the CS-3 and WSE-3. The company's innovative approach to wafer-scale engines and its unified software interface offer unique advantages in the AI field. While challenges lie ahead, Cerebras has positioned itself as a formidable player in the industry. With its continued dedication to pushing boundaries, Cerebras is set to make a lasting impact on the future of AI.",https://imageio.forbes.com/specials-images/imageserve/660199b20a6fbc5033ee1cdf/0x0.jpg?format=jpg&height=900&width=1600&fit=bounds,2024-03-25 15:16:13,Innovation,Innovation
https://www.forbes.com/sites/jamiecartereurope/2024/03/25/total-eclipse-of-the-chatbot-why-not-to-ask-chatgpt-about-aprils-rare-event/,Total Eclipse Of The Chatbot: Why Not To Ask ChatGPT About April’s Rare Event,"The world of AI chatbots may have its limitations, and when it comes to total solar eclipses, it seems that even the most popular ones fall short. Take ChatGPT, for example. When asked about the next total solar eclipse, it provided some rather odd and inaccurate responses. But fear not, there are other AI models out there that can provide more reliable information.

So, when is the next total solar eclipse? According to ChatGPT, it happened on December 14, 2020, in South America. However, that information is outdated and irrelevant. The correct answer is April 8, 2024, and it will be visible from parts of North America, including Mexico, the United States, and Canada. Phew, that's a relief!

Curiosity got the best of me, and I decided to test ChatGPT's knowledge further. I asked about the next total solar eclipse after April 8, 2024, and it replied with an odd response, suggesting that it will occur on August 23, 2044. While there will indeed be a total solar eclipse on that date, it is not the next one. The real next one is on August 12, 2026, in Greenland, Iceland, and Spain. In fact, between April 8, 2024, and August 23, 2044, there will be a staggering 13 total solar eclipses. It seems that ChatGPT may have a bias towards events happening in the contiguous United States.

To further test its accuracy, I asked about the next total solar eclipse after August 23, 2044. ChatGPT confidently claimed that it would happen on March 20, 2053. However, that is not true at all. The actual next one after August 23, 2044, will be on August 12, 2045, and it is arguably dubbed the ""Greatest American Eclipse"" of all. While there is an eclipse set for March 20, 2053, it is not a total solar eclipse.

It is clear that ChatGPT is inconsistent, biased towards events in the U.S., and often completely wrong when it comes to solar eclipses. However, there is another AI model called Gemini (formerly known as Bard) developed by Google, which seems to provide more accurate and reliable information. When asked about the next total solar eclipse, Gemini responds with confidence, stating that it will occur on April 8, 2024, visible across parts of North America. It even goes the extra mile to inform me that I will be able to see it where I live. Impressive!

It's disappointing to discover that AI chatbots like ChatGPT are not reliable sources of information for celestial events that have been meticulously calculated for thousands of years into the future. However, we can still rely on other sources for accurate and up-to-date information on total solar eclipses.

If you're an eclipse chaser seeking the very latest on total solar eclipses, including travel and lodging options, I recommend checking reputable sources and staying updated through reliable articles. And with that, I wish you clear skies and wide eyes for your future eclipse adventures.","https://imageio.forbes.com/specials-images/imageserve/66016f04433add21d5071fb4/0x0.jpg?format=jpg&crop=2004,1128,x10,y411,safe&height=900&width=1600&fit=bounds",2024-03-25 13:00:51,Innovation,Innovation
https://techcrunch.com/2024/03/24/techcrunch-mobility-the-wheels-are-starting-to-come-off-the-fisker-ev-bus/,TechCrunch Mobility: The wheels are starting to come off the Fisker EV bus,"Welcome to TechCrunch Mobility, your go-to source for all things transportation. In this week's edition, we'll be covering a range of topics, from the latest regulations affecting automakers to exciting partnerships and investments in the industry. So let's dive in!

First, let's talk about the recent developments on Capitol Hill. The Biden Administration has proposed two new standards through the Department of Energy (DOE) and the Environmental Protection Agency (EPA) that will have significant implications for U.S. automakers and consumers alike. While these regulations have been adjusted to accommodate the concerns of the automotive industry, car dealers, and unions, they still impose stricter standards than before.

The DOE has introduced a ""petroleum equivalency factor"" that assigns a score to electric vehicles (EVs) under the government's corporate average fuel economy (CAFE) standards. The initial proposal could have made it challenging for automakers to meet these standards, resulting in hefty fines. However, the revised version is more lenient. On the other hand, the EPA has released tailpipe standards for 2027 to 2032 model year vehicles, imposing more rigorous requirements on automakers. Nevertheless, they offer flexibility in meeting the rules through various powertrain options, making them technology-agnostic. These standards are also less stringent than the original proposal, which aimed for 67% of all U.S. passenger vehicle sales to be EVs by 2032.

While these changes may not have a significant impact on EV startups like Rivian, Tesla, and Lucid, they do pose challenges for legacy automakers. These companies are investing billions in developing and selling EVs while still relying on profits from internal combustion engine vehicles. In this context, plug-in hybrids might emerge as the winners.

Now, let's move on to some exciting news in the industry. One of the highlights this week is Uber's first investment in an Africa-founded startup. Moove, a mobility fintech company based in Africa, raised $100 million in a Series B funding round led by Uber. Moove provides vehicle financing to ride-hailing and delivery app drivers and is valued at $750 million. This investment aligns with Uber's commitment to achieving a fully zero-emission fleet by 2040, as Moove has made electric vehicles a central part of its business strategy.

In other news, Clevon, a company specializing in autonomous delivery technology, has managed to secure funding and is in the process of finalizing a merger agreement with an American electric vehicle company. This development comes after rumors of the company's struggle to find new investments and potential shutdown. While some cost reductions are necessary, Clevon remains operational and expects the merger to be completed by the first half of June.

Additionally, a Bay Area startup called Amber has raised $3.18 million in a seed round for its aftermarket Tesla extended warranty product. This funding round was co-led by Era and Primer Sazze, with participation from other investors. Another notable development is the electric boat maker Candela raising $25 million in funding, led by Groupe Beneteau, to support its innovative products.

These are just a few of the exciting updates from the world of transportation this week. Stay tuned for more news and insights in future editions of TechCrunch Mobility.

That's it for this week's edition of TechCrunch Mobility. We hope you found these updates informative and engaging. Stay tuned for more exciting news and insights in the world of transportation.","https://techcrunch.com/wp-content/uploads/2024/03/GettyImages-1363022906.jpg?resize=1200,730",2024-03-24 19:00:33,Innovation,Innovation
https://www.forbes.com/sites/bobinglis/2024/03/25/avoiding-the-judgment-of-history/,Avoiding The Judgment Of History,"Art Laffer, a well-known economist and former advisor to President Ronald Reagan, recently had a meeting with former President Trump to discuss the possibility of replacing Jerome Powell as Chairman of the Federal Reserve Board. Interestingly, Laffer has been supportive of a revenue-neutral carbon tax as an effective market-based solution to combat climate change. This meeting took place at the same time when the U.S. House of Representatives passed a non-binding resolution condemning a carbon tax, despite it being considered the most powerful means of addressing climate change.

It is worth noting that a carbon tax can be designed in a way that it does not result in an expansion of the government. By pairing it with a reduction in an existing tax, it can be made revenue-neutral. Additionally, it can be made border-adjustable by applying the tax to imports from countries that have not implemented their own pollution taxes.

The irony lies in the fact that while the House passed the never-never-ever-ever carbon tax resolution, discussions were underway about potentially appointing Art Laffer or Kevin Hassett as replacements for Jerome Powell. Both Laffer and Hassett have advocated for a carbon tax coupled with a dollar-for-dollar reduction in existing taxes as a solution to climate change. They are members of the Pigou Club, a group founded by Greg Mankiw, a Harvard economist who served as Chairman of the Council of Economic Advisers under President George W. Bush.

Arthur Cecil Pigou, the English economist who lived from 1877 to 1959, is known for suggesting that we should tax the things we want less of and untax the things we want more of. In this case, taxing carbon pollution while reducing taxes on payroll income could be a viable solution. This approach would address the concern of a carbon tax disproportionately affecting low-wage workers. Moreover, it would also strengthen Social Security by expanding its tax base.

It is evident that the drafters of the never-never-ever-ever carbon tax resolution lack awareness of existing World Trade Organization rules that allow for the application of a carbon tax on imports from countries without their own carbon tax. This is known as a border adjustment. Other countries would likely follow suit and impose carbon pollution fees in their own jurisdictions to avoid losing revenue to the United States. Consequently, the true cost of burning fossil fuels would be reflected in the prices of products. This would incentivize the production of greener and cleaner alternatives, making them more affordable compared to dirty products.

Arthur Cecil Pigou would be proud of this approach, as he argued that negative externalities, such as costs imposed on society by firms and individuals, create market distortions that hinder innovation. By holding polluters accountable through taxation, we can encourage the development of cleaner technologies and processes. This perspective aligns with the views of Dr. Milton Friedman, an economic advisor to President Reagan, who suggested taxing polluters during an appearance on the Phil Donahue Show in the 1980s.

It is important to recognize that both Republicans and Democrats have a responsibility to prioritize policy over politics when it comes to addressing climate change. While some Democrats also voted in favor of the never-never-ever-ever carbon tax resolution, it is encouraging that it was non-binding, allowing for corrections to be made. It is never too late for redemption and to rectify the mistakes of the past.",https://imageio.forbes.com/specials-images/imageserve/6601d28de733bba2fcac676c/0x0.jpg?format=jpg&height=900&width=1600&fit=bounds,2024-03-25 15:47:48,Innovation,Innovation
https://www.forbes.com/sites/lesliekatz/2024/03/25/heres-proof-that-spiders-pretend-to-be-ants/,Here’s Fossilized Proof That Spiders Pretend To Be Ants,"In the world of nature, survival often depends on being able to avoid predators. And some creatures have developed incredibly creative strategies to stay alive. Take spiders, for example. These eight-legged arthropods have found a way to disguise themselves as ants in order to avoid being eaten by larger spiders, wasps, and birds.

But why ants? Well, ants are known for their aggressive defense mechanisms. They have a strong bite and can inject venom, making them unappetizing to other arthropods on the hunt for a meal. Additionally, ants can call in reinforcements from their nestmates, making them a formidable opponent. On the other hand, spiders lack chemical defenses and are solitary creatures, which makes them vulnerable to predation. By mimicking ants, spiders are more likely to go unnoticed and avoid becoming a meal themselves.

Recently, paleobiologist George Poinar Jr., a professor emeritus in the department of integrative biology at Oregon State University, made an exciting discovery. He described a new species of ant-mimicking spider that was found trapped in fossilized resin, also known as amber. This spider, preserved intact except for the tips of its legs, offers a rare glimpse into the past and sheds light on the adaptive behaviors of these fascinating creatures.

The study, published in the journal Historical Biology, reveals that ant-mimicking spiders can be found all over the world. However, they have managed to evade both fossil researchers and predators. This makes the discovery of this fossilized spider even more remarkable.

Sticky tree resin, when it hardens and fossilizes, becomes amber. This process often traps organisms, preserving them for millions of years. Poinar, who is no stranger to studying amber-preserved insects and other life forms, obtained the resin containing the spider from Medellin, Colombia. The copal block, a less mature form of amber, could not be age-tested using conventional methods without risking damage to the spider inside. Copal can be as old as 3 million years.

While the exact timeframe of when this spider attempted to masquerade as an ant remains unknown, the copal sample provides a unique fossilized record of this intriguing adaptive behavior.

Mimicry is a common strategy used by various creatures in nature to evade predators. Some animals change their colors to blend into their surroundings. But for spiders, which have eight legs and no antennae, mimicking ants is quite a challenge. Ant-mimicking spiders must reposition their front legs to resemble antennae. However, this is just one aspect of their transformation.

Spiders have their abdomen and cephalothorax closely attached, while ants have these body parts separated by a narrow segment called the petiole. Ant-mimicking spiders must modify many structures to closely resemble ants. Poinar suggests that this morphing process involves spider mutation, adaptation, and natural selection. However, he also believes that there might be some level of reasoning and intelligence involved, as spiders often model their body changes after specific ants in their environment.

While ant-mimicking spiders have certainly earned their place as nature's contortionists, their skills come at a cost. Other studies have shown that these elaborate disguises can impair the spiders' hunting abilities.

In conclusion, the discovery of a fossilized ant-mimicking spider provides valuable insights into the adaptive behaviors of these fascinating creatures. By disguising themselves as ants, spiders can avoid becoming prey for larger predators. While this strategy comes with its own disadvantages, such as reduced hunting abilities, it is a remarkable example of nature's ingenuity. The study conducted by Poinar adds to our understanding of mimicry and the complex interactions between different species in the natural world.","https://imageio.forbes.com/specials-images/imageserve/6601d75147f6aaf277e73ba1/0x0.jpg?format=jpg&crop=527,297,x0,y132,safe&height=900&width=1600&fit=bounds",2024-03-25 15:28:10,Innovation,Innovation
https://techcrunch.com/2024/03/25/ticktock-5-days-left-to-nest-your-early-bird-savings-for-tc-early-stage/,Ticktock: 5 days left to nest your early-bird savings for TC Early Stage,"Startup visionaries, time is running out! The clock is ticking, and there are only 5 days remaining to take advantage of the early-bird savings for TechCrunch Early Stage 2024. This is an opportunity you don't want to miss. So, make sure to secure your ticket now and save big before it's too late. Remember, the savings end on Friday, March 29 at 11:59pm PT.

Now, let's give you a glimpse of what awaits you at TechCrunch Early Stage. Get ready to dive into some enlightening sessions that will provide you with valuable insights and guidance on your startup journey.

First up, we have ""Selecting the Right Accelerator or Incubator"" with Emily Knight, president of the Engine Accelerator. In this session, you will learn about the vital support structures that incubators and accelerators offer to early-stage startups. Discover tailored programs designed to assist founders transitioning from academia and national labs. This will ensure a seamless navigation through post-formation challenges.

Next, we have ""How to Find Product-Market Fit When You Need It Most"" with Jess Lee, partner at Sequoia. This session will take you on a quest to find the perfect product-market fit. Jess Lee, a seasoned partner at Sequoia, will share her insights gained from building and scaling popular products. Additionally, she will provide her expertise in investing in companies like yours, who are in search of the ideal fit.

Lastly, we have ""How to Build an MVP and Navigate the Startup-Industrial Complex"" with James Currier, general partner at NFX. This session will explore the art of crafting the perfect minimum viable product (MVP). James Currier from NFX will guide you through the process, offering valuable insights into striking the right balance between meeting user needs and avoiding the allure of excessive features and polish in the startup-industrial complex.

These sessions are just a taste of what you can expect at TechCrunch Early Stage 2024. There's so much more to discover and learn. So, don't miss out! Secure your early-bird ticket today and position yourself for startup success.

And if you're interested in sponsoring or exhibiting at TechCrunch Early Stage 2024, reach out to our sponsorship sales team by completing the form available on our website.

Time is ticking, so don't wait any longer. Get your ticket now and embark on a journey towards startup success. We can't wait to see you at TechCrunch Early Stage 2024!",https://techcrunch.com/wp-content/uploads/2024/02/5DaysLeft_EarlyStage24_1200x628.png?w=1200,2024-03-25 13:00:22,Innovation,Innovation
