Link,Title,Text,Image,Date Publish
https://techcrunch.com/2024/01/02/lego-fortnite-interview-saxs-persson/,Why Fortnite is getting into cozy gaming,"Why Fortnite is getting into cozy gaming With Lego Fortnite, Epic Games is building out a gaming multiverse with a little something for everyone
When it comes to figuring out a formula for a hit game that keeps players coming back year after year, Saxs Persson would know. Now at Epic Games overseeing the Fortnite ecosystem, Persson previously spent 12 years at Mojang building Minecraft into the stratospheric success it is today.
Persson hopped over to Epic in 2022 to work on the Fortnite maker’s roadmap, shepherding Lego Fortnite from a press release last year into a polished, ambitious standalone experience designed to draw new audiences to Fortnite’s free-to-play world.
We spoke with Persson about Epic’s grand plans for Lego Fortnite and its two other new games, Rocket Racing and Fortnite Festival. Knowing Fortnite’s penchant for maximalism and a steady drip feed of fresh content, the trio of games is only just getting started — but here’s a glimpse of where they’re going.
Questions and answers have been edited for brevity and clarity.
TechCrunch: With the three new games, and particularly Lego Fortnite, is the goal to broaden Fortnite’s appeal to new kinds of players?
Persson: Battle Royale has been extraordinarily popular. And from a Battle Royale perspective we understand our players quite well. We’ve done our very best for the last six years to always make a game that feels fresh, evolves, never stands still, constantly updates and sets us apart from the competition by not taking itself too seriously. That’s always been the goal of Battle Royale.
The next ring that developed from that was when we put out Fortnite Creative and subsequently when we launched UEFN [Unreal Editor for Fortnite] in March this year – that is very much realizing that Fortnite players want to play more games, not just Battle Royale. And the more content they have, and the better content they have and the more varied content they have, the happier they are.
So if your only goal is to say, if you came to Fortnite, we would like you to consider all these different options, and to stay as long as you want to because we hope you’re going to have fun.
Our creators have done a phenomenal job of broadening, already, who plays Fortnite. Battle Royale is really important – it’s like an anchor tenant, whatever you want to call it. But if you asked players like ‘what do you play in a week,’ I think the average island played in the week is about seven, seven different islands. And they’re varied in style, aesthetics, genre… We ask our creators what they would like to create. If they want to create it, we bet there’s going to be players that want to play it. That’s been the strategy up until this far.
…In order for us to make really good tools, we have to use them ourselves. And we know that in order for us to really extend deep tools and new genres, our best bet is that we need to make some first party content that really stretches what Unreal Engine can do. And then take those tools and turn them over to creators and say now you have these capabilities.
So with that in mind, the three games we announced, Lego Fortnite, Rocket Racing, and [Fortnite] Festival all have different goals of extending the toolset in a particular direction, but also attracting new players to say ‘oh I guess Fortnite is not just Battle Royale. Really, we just need to get them over the hump of installing 54 gigabytes… and once you’re there, there should be a lot for you to do.
A test of turns. If you can make it here, you can make it anywhere. pic.twitter.com/X2mgqfv9YL — Rocket Racing (@RocketRacing) December 4, 2023
What do those sets of tools look like and what can people build with them?
“[With] Lego Fortnite… we’ve worked a lot on [procedural generation], we’ve worked a lot on different styles – like adding the Lego styles so you can both play as Fortnite style and as a minifig, as Lego style. And down the line we fully expect creators are gonna have access to that too.
The procedural world is really fascinating. Again, like we’ve always operated on a very static play playing field, but Lego is pioneering a whole lot of procedural tools that hopefully we can extend to creators, and a much bigger island – like we’re 20 times bigger than a Battle Royale island. So it is a massive island that we’re still working to expand. That again should benefit creators.
Rocket Racing is adding credible racing mechanics to our creators and track design editors and that sort of thing. So the game is important because it comes from Rocket League, and it’s an excellent game. And we really believe in that game. The secondary effect is creators get great vehicle tools.
And finally [Fortnite] Festival. A ton of effort has gone into music generation tools and music editing tools and music making tools and gameplay with music. And a lot of those devices, as we call them, have already been extended to creators.
So that’s the goal. Music attracts a new audience. Racing attracts a new audience. Lego attracts a new audience. Even though we know it appeals to current Fortnite players, it’s certainly going to appeal to audiences that are not interested in Battle Royale.
Get the band back together, you haven’t played with them since last year 😜 pic.twitter.com/OoKh69wcI5 — Fortnite Festival (@FNFestival) January 1, 2024
What about expanding Fortnite to younger players, is that part of the objective here?
We had introduced separately from LEGO but in collaboration with Lego a new ratings paradigm in Fortnite, where every piece of content is rated. That streamlines really nicely with our parental controls.It feels like if you’re a parent when you let your kid come into Fortnite, you don’t have to just slam the door wide open… you can still have at a granular level control over what your kids play.
And you can see what. So yeah, like, Lego is an E10 game, so mechanically, that opens a new audience. But I think underneath that, again, is there’s a whole suite of new features, just to be able to rate islands on an individual level. And just to really focus on like, how do we make a great experience for all ages that is age appropriate and safe?
Lego Fortnite seems to smartly dip into some genres and gameplay loops that people already love in other games. Animal Crossing, Minecraft and Valheim all come to mind, but there are quite a few.
I think all games should be inspired by something. What do we all enjoy? We really enjoy Zelda, really enjoy Minecraft, really enjoy Animal Crossing, Stardew Valley. All four of them are absolutely, in and of themselves, excellent examples of games that just have just have stood the test of time. That really, really resonate emotionally with people and we would love to add to that genre and be part of that genre.
I don’t think we’re anything in particular. Like we have aspects of Animal Crossing and a social sim… as it turns out, there’s nothing as cute as building a building with minifigs that all have jobs, and they all want to be part of your village and can [help out] with the harvest and go on adventures with you. The social sim design is very much focused on realizing the Lego fantasy, but it does feel like it has the cozy gamer aspect of it for sure, of homesteading and building and village building and investing in your people.
In a procedurally generated survival game — when you play something like Valheim or Minecraft — you have a big moment when you first open the map. It’s exciting, and you don’t know what’s around you and how dangerous it is. Lego Fortnite has that same feeling.
I think a key part of what Fortnite is is ‘what’s around the next corner?’ When we started working on procedural, procedurally generating these landscapes, there was just a lot of just wandering and just making these amazing looking things and then adding like more and more and more into it and sort of doing a true crossover between Lego and Fortnite and trying to find like what is it that would satisfy Lego players and would satisfy Fortnite players – really feeling like we understand these two IPs. And the landscape is littered with that.
I think the internal model was that Fortnite is the canvas and Lego is the paint. Basically anything you touch becomes Lego as you play, and the more you play, the more Lego-ized you make the world. I really liked that idea of landing on a Fortnite planet mysteriously transformed into a Lego figure and then, like making that into a survival sandbox — a true sandbox where anything can happen.
I love that genre is I really think it speaks to all of us, like in a very simple way that you get to set your own stakes and really the job is to not die. But everything else like thriving is completely up to you.
People who don’t follow Fortnite and don’t know about its user-generated content probably still think it’s just a zany battle royale game where 100 people fight to the death. How do you get the word out that hey, Fortnite is an ecosystem filled with lots of different things, now including these three major games we developed?
There’s nothing like YouTube videos showing the shenanigans of Lego Fortnite or your favorite streamer spending time in it. Because we think it has enormous storytelling potential for YouTubers and for and for Twitch streamers. It’s a sandbox that is made for you to essentially tell stories.
It is very much what has made Minecraft very, very successful. It is what you make it, meaning the more creative you are the better your videos and we really, really feel like the streaming community and YouTube is gonna help us tell that story for us.
Now it’s on to updates. If there is one thing Epic knows and the Fortnite team knows it’s players want content, they want updates and that is very much what the team is focused on.
All of us agreed that the best chance we have of retelling the story of Fortnite is to go overboard with content. And really show like, when Epic puts his mind to it, we have done our groundwork and we believe that Fortnite is the place that you would want to be and to spend time in, no matter what age you are, no matter what you’re interested in. There should be content that will resonate with you.","https://techcrunch.com/wp-content/uploads/2024/01/SHARE_20240103_0124041.jpeg?resize=1200,675",2024-01-03 01:44:57
https://techcrunch.com/2024/01/02/short-term-rental-provider-frontdesk-lays-off-entire-staff-on-the-verge-of-shutting-down/,"Short-term rental provider Frontdesk lays off entire staff, on the verge of shutting down","Another proptech startup has run into trouble.
Frontdesk, a startup that managed more than 1,000 furnished apartments across the United States, laid off its entire 200-person workforce Tuesday after attempts to raise more capital failed, TechCrunch exclusively learned from sources familiar with internal happenings at the company. The mass layoff comes just seven months after the Milwaukee, Wisconsin-based startup acquired smaller rival Zencity.
The layoffs, which included full-time, part-time workers and contractors, occurred Tuesday afternoon during “a two-minute Google Meet call,” according to one employee who was among those attending the virtual meeting.
During that call, Frontdesk CEO Jesse DePinto told employees that Frontdesk would be filing for a state receivership, an alternative to bankruptcy, according to the sources.
The company has not responded to a request for comment. When calling the number on the company’s website, a recording says: “Currently, Frontdesk is unavailable. If you have a reservation, please seek alternative accommodations and expect to be contacted within the next two weeks.” TechCrunch will update the article if the company responds.
Frontdesk, which was founded in 2017, had raised about $26 million from investors such as JetBlue Ventures, Veritas Investments and Sand Hill Angels, according to Crunchbase.
Frontdesk went out for a bridge round, attempting to sell investors on a new plan of doing full building management, sources told TechCrunch. That tactic didn’t work out and the company couldn’t keep operating. Frontdesk was apparently still optimistic about its ability to raise more capital; the startup had posted on LinkedIn openings for several jobs, including a chief of staff role, just two months ago.
The startup’s business model, which is leasing apartments at market rental rates and furnishing them for short-term rentals in more than 30 markets, has struggled largely due to the upfront costs involved, associated capital expenditures and variables in demand and rates, one of the sources said. Others in the space have also had challenges, including Stay Alfred, Domio, Lyric, Zeus Living, The Guild and WanderJaunt.","https://techcrunch.com/wp-content/uploads/2021/02/GettyImages-1188673335.jpg?resize=1200,776",2024-01-03 01:00:56
https://techcrunch.com/2024/01/02/former-anthemis-partner-soft-launches-new-fintech-focused-venture-firm/,Former Anthemis partner soft-launches new fintech-focused venture firm,"Ruth Foxe Blader has left her role as partner at Anthemis Group after nearly seven years to start her own venture firm, Foxe Capital, TechCrunch learned exclusively today.
Blader is joined by former Anthemis investment associate Kyle Perez. Sophie Winwood is serving as an operating partner. Winwood previously co-founded WVC:E, an organization that pledges to promote “inclusion, empowerment and integration of VC globally,” with Blader.
Over the years, Blader says she has led investments in more than 50 fintech startups, including Lemonade, Branch, Elevate, Flock, Mesh and Amplify.
A desire to invest independently was the main driver behind Blader’s decision to leave London-based Anthemis, Blader told TechCrunch in an interview. The investor says she got a taste of what that was like after she and Winwood started WVC:E in April 2022.
Foxe Capital will continue investing on behalf of Anthemis, serving as a sub advisor for the firm, and essentially managing the vehicle she was hired to run in 2017. When all that capital has been deployed — Blader projects that it will stop writing checks into startups this year out of the Anthemis funds — Foxe Capital will focus on fundraising. Meanwhile, Foxe Capital is being compensated for continuing to run the fund on behalf of Anthemis, according to Blader.
Anthemis continues to have an economic interest in that vehicle but does not own any part of the management company and will only have a continued economic interest in Foxe Capital if it chooses to be an LP when the firm fundraises in the future, according to Blader.
An Anthemis spokesperson confirmed the move, sharing via email: “Ruth wanted to be an independent manager. Anthemis proudly backs her. She will continue to support us as an investor across her current Anthemis funds.”
While Blader travels back and forth currently between France and New York (Blader has been living in Europe/New York for 15 years), Foxe Capital is based in New York City. Its investments will be global, with the U.S. as its home market.
“We have the most familiarity [outside of the U.S.] with Europe but have also done investments in India, Cameroon and LatAm,” she told TechCrunch. “We’ll be looking to invest opportunistically globally.”
Restructuring and a failed SPAC
Anthemis has had its share of upheaval — and turnover — in recent times.
Last April, TechCrunch broke the news that Anthemis Group had completed a restructuring that resulted in its letting go of 16 employees, or about 28% of its staff.
A spokesperson for London-based Anthemis at the time said the move was an effort “to better reflect current market conditions and to set up the business for future growth” against its “strategic priorities.”
Also, last May, TechCrunch reported that Anthemis Group was trying to raise $200 million for a third fund. It had been in the market since 2022 and had only secured commitments of just $36.4 million. The firm separately had to scrap plans to raise a SPAC in late April.
In the past 18 months, Anthemis also saw a couple of portfolio companies stumble. In November 2022, controversy surrounding the sudden stepping down of three of Pipe’s co-founders, including its CEO, raised eyebrows. And in 2023, LGBTQ+-focused digital bank Daylight was slammed with a lawsuit by three former employees “alleging age and wage discrimination, whistleblower retaliation, and fraud.” The startup shut down later in the year.
The firm’s 2023 restructuring was not the first time it saw a management shakeup. Anthemis also made headlines in 2018 when its then-CEO and co-founder Nadeem Shaikh resigned after reportedly being the target of a sexual harassment complaint by a female employee.
Blader is not the first fintech-focused investor to venture out on her own in recent times.
Early last year, Peter Ackerson departed fintech-focused Fin Capital to co-found a new firm, Audere Capital. It is still unclear as to whether Ackerson left voluntarily or was forced to leave. A source with familiarity of internal happenings at Fin Capital alleged there was tension between Ackerson and managing partner and founder Logan Allin around portfolio company alternative financing startup Pipe — an investment into which Ackerson led and on whose board he sat. Audere has invested in five startups, according to PitchBook — only one of which is focused on financial services.
Want more fintech news in your inbox? Sign up for The Interchange here.",https://techcrunch.com/wp-content/uploads/2024/01/Ruth-Foxe-Blader.jpg?w=1024,2024-01-02 23:37:59
https://techcrunch.com/2024/01/02/samsungs-galaxy-s24-line-set-for-january-17-debut/,Samsung’s Galaxy S24 lineup set for January 17 debut,"Samsung’s mobile division ditched the big show unveils a while back. Gone, too, it seems, are the days when the company would save its first big phone news of the year for the weeks leading up to Mobile World Congress.
The latest Unpacked event is set for January 17 — a week and change after the close of CES. If past is precedent (as it almost invariably is), we’ll be getting our first official look at Samsung’s new mobile flagship, the Galaxy S24.
Last year’s event, held at the beginning of February, ushered in three key versions of the S23, along with a handful of Galaxy Book laptops. This being Samsung, the handset leaks have been ongoing for a couple of months now.
Renders of the S24, S24+ and the S24 Ultra don’t stray too far from their predecessors. Those devices are expected to sport 6.2-, 6.7- and 6.8-inch displays, respectively. The S24 and S24+ look to be sporting a trio of rear-facing cameras, while the Ultra bumps it up to a quartet, including the 200-megapixel sensor.
The Ultra also maintains much of the DNA the device inherited from the Galaxy Note line, including square edges and S Pen functionality. The ultra-premium model is also believed to be getting a titanium option, much like the iPhone 15 Pro Max before it.
In spite of apparently being among the first to be powered by Qualcomm’s more powerful and power-efficient Snapdragon 8 Gen 3 chip, leaked price sheets point at a lower price point in Europe, which could be good news for potential buyers everywhere.
This time out, the event is being held in the South Bay. It kicks off at 10 a.m. PT and will be available to stream here. If you want to reserve the device sight unseen up to January 16, Samsung will toss in a $50 “reserve credit” on preorders.","https://techcrunch.com/wp-content/uploads/2023/02/CMC_6058.jpg?resize=1200,800",2024-01-02 23:00:02
https://techcrunch.com/2024/01/02/tech-for-palestine-launches-to-provide-tools-and-projects-to-help-advocate-for-palestinians/,Tech for Palestine launches to provide tools to help support Palestinians,"More than 40 founders, investors, engineers and others in the tech industry are today announcing a coalition called Tech for Palestine to build open source projects, tools and data to help others in the industry advocate for the Palestinian people.
The launch of the group comes during a tense time in the region. Hamas’s October 7th attack on Israel led to the deaths of more than 1,100 individuals. The war in the Gaza Strip that followed has seen the displacement of millions of Palestinians and tens of thousands of deaths.
The Israel-Hamas war has proved divisive to the tech industry. Israel, home to a well-known technology and startup market, has seen strong support from tech individuals and institutions. In contrast, calls for ceasefires and speaking in support of Palestine have caused some to lose their jobs.
Paul Biggar, the founder of Tech for Palestine, hopes to raise more awareness of the war in Gaza, fight for a permanent ceasefire and provide ways for those who are afraid to speak publicly in support of Palestine to still offer support. It is one of the first tech initiatives to take a public stance supporting Palestine and could represent a turning point in the venture industry’s posture regarding the Israel-Hamas conflict as more people seek to speak out in favor of a ceasefire.
Biggar, the founder of the company CircleCI — last valued at $1.7 billion — formed the coalition after writing a viral blog post that criticized the lack of support the tech industry has shown Palestinians. He said that after he wrote his blog post, thousands of people reached out to him with words of support, many of them afraid to speak up themselves for fear of potential career impacts.
Among them, he said, were “dozens of people not only speaking up but who had started projects to change the industry to ensure that people speaking up for Palestine could be heard. Dozens of others were volunteering to help,” Biggar added. “I started connecting these folks together, and the [Tech for Palestine] community came together very quickly.”
The platform, still in its early days, will feature projects run by small groups and serve as a place to share resources and advice, something many pro-Palestinian tech workers are already doing privately. It has already secured names like Idris Mokhtarzada, founder of the unicorn Truebill, to help build out the platform. So far, it has created a badge for engineers to use on GitHub that calls for a ceasefire and created HTML snippets for people to use on their websites to put up a support ceasefire banner.
Biggar said there are plans to eventually work more with Palestinian organizations and help Palestinian startups with mentorship and cloud credits. TechCrunch previously reported that the war has destroyed much of Palestine’s burgeoning tech industry.
Arfah Farooq, founder of Muslamic Makers, said the last three months have changed everyone in many ways. At the same time, there has been a togetherness and activism that she has never seen before. “I’ve seen firsthand people come together to work for Palestine with nothing but their laptops from across the globe,” she said.
She decided to work with Tech for Palestine after reading Biggar’s viral blog post and has already started to share resources on how to support Palestine. “Due to the siege, we can’t go to Gaza and help on the ground, but we help regardless of where we are in the world,” Farooq said.
One engineer, who asked to remain anonymous, decided to join the coalition because this person felt suffocated at work. This person has agreed to work as an engineer and product manager to help build resources for Tech for Palestine, saying, “I hope this initiative will spark a significant shift and give people their voices back.”
A former tech brand marketer, who is also scared to speak out publicly for fear it will impact a new job search, also told TechCrunch about feeling happy to have a way to get involved with the cause.
“This period has been incredibly isolating to Arabs, Muslims and other people of color in VC and tech,” she said. “Tech for Palestine is a necessary initiative. When we are seeing mobilization around the world and the U.S. in the numbers of hundreds of thousands calling for peace and [the] humanization of the Palestinians, the tech community can no longer be silent.”
The Tech for Palestine initiative comes as the death toll among Palestinians continues to rise. In recent weeks, U.S. officials have reportedly prodded Israel to do more to protect civilians in Gaza even as they have called U.S. support for Israeli security unshakable.
Biggar hopes, at the very least, that this new coalition will augur a larger shift in people speaking up.
“The narrative has only just turned,” he said. “We are working to enable many more who feel silenced to speak out, we are only getting started.”","https://techcrunch.com/wp-content/uploads/2024/01/GettyImages-1367359752.jpg?resize=1200,800",2024-01-02 21:15:40
