Link,post_title,post_content,featured_image,Date-Publish,post_category,post_tag
https://www.forbes.com/sites/energyinnovation/2024/03/24/epa-didnt-ban-gas-cars-it-cut-air-pollution-so-we-can-breathe-easier/,EPA Didn’t Ban Gas Cars. It Cut Air Pollution So We Can Breathe Easier.,"Every person who has experienced a red air day knows the unpleasant taste and sensation of air pollution. It leaves a metallic sting in your nose and lungs, making it difficult to breathe. On these days, when pollution levels reach unhealthy levels, people are advised to stay indoors and avoid outdoor activities. This is especially important for vulnerable populations such as the elderly, children, pregnant women, and those with respiratory illnesses.

But have you ever wondered what the main cause of toxic air is in most places? The answer lies in the internal combustion engines that power our vehicles. Whether fueled by gas or diesel, these engines emit dirty pollution that not only harms our health but also contributes to climate change. Shockingly, more than two-thirds of Americans rely on personal automobiles for their day-to-day travel. As a result, transportation has become the largest source of greenhouse gas emissions in the United States. Light-duty vehicles alone account for nearly 60% of the pollution in this sector.

If we want to tackle our pervasive air pollution problem, we must focus on reducing tailpipe pollution from vehicles. The good news is that we have a proven tool that can make our cars cleaner and help us all breathe easier: tailpipe emissions standards. These standards require automakers to adopt the latest clean technologies, ensuring that new vehicles are cleaner than ever before.

Just last week, the U.S. Environmental Protection Agency (EPA) took a significant step by adopting new multi-pollutant rules for light-duty and smaller medium-duty vehicles. These rules limit tailpipe pollution that poisons the air we breathe and accelerates climate change. By implementing these updated standards, automakers are compelled to embrace clean technologies, making our vehicles more environmentally friendly.

It is essential that everyone, regardless of where they live, has the choice to make their next car a clean car. Those who care about reducing pollution deserve the option to drive electric vehicles. Electric cars produce zero tailpipe emissions, offering a sustainable and clean transportation solution.

However, there are powerful forces that do not want to see these positive changes in our vehicle emissions standards. Corporations that profit from selling vehicles that pollute our air and petroleum companies that rely on fossil fuels view these standards as a threat. They argue that these regulations limit American freedoms and consumer choice. But the truth is that these updated pollution limits are long overdue and will benefit all Americans by cleaning the air we breathe and providing consumers with more sustainable options.

Consider the American Fuel & Petrochemical Manufacturers' recent launch of a ""major seven-figure issue campaign."" Their campaign targets critical states and aims to inform Americans about the Biden administration's efforts to ban new gas, diesel, and flex fuel vehicles from the U.S. market. This is a prime example of how profit-driven corporate polluters actively manipulate the American public to believe that these standards are unwarranted. They spread disinformation, falsely claiming that these rules are a ban on gas cars.

In reality, the EPA does not have the authority to ban technologies or modes of transportation. The agency's standards are technology-neutral, performance-based, and grounded in scientific research. The Clean Air Act, signed into law in 1970, empowers the EPA to establish National Ambient Air Quality Standards to protect public health and welfare. It also directs the agency to regulate emissions from vehicles and engines and adapt the standards over time.

The earliest standards for light-duty vehicles required a 90% reduction in emissions from hydrocarbons, nitrogen oxides, and carbon monoxide. These standards drove the development of new engine and emission control technologies, such as the catalytic converter, and led to the switch to unleaded fuel. Before the Clean Air Act, our cities were choked with air pollution so thick that breathing in places like New York City was as harmful as smoking two packs of cigarettes per day. Los Angeles, in particular, suffered from unhealthy levels of air pollution for more than 200 days a year.

It is clear that we have come a long way in improving air quality, but there is still work to be done. We cannot allow profit-driven interests to derail our progress and harm our health and the environment. It is crucial for individuals to understand the truth behind these updated standards and support efforts to reduce tailpipe pollution. By doing so, we can create a cleaner and healthier future for ourselves and future generations.

In conclusion, the adoption of new tailpipe emissions standards by the EPA is a significant step towards reducing air pollution and combating climate change. These standards compel automakers to embrace clean technologies, making our vehicles cleaner than ever before. It is important for everyone to have the choice to make their next car a clean car, and electric vehicles offer a sustainable solution. We must not be swayed by disinformation campaigns from profit-driven interests. These updated pollution limits are long overdue and will benefit all Americans by cleaning the air we breathe and providing consumers with more sustainable options. Let us support efforts to reduce tailpipe pollution and create a cleaner and healthier future for ourselves and future generations.",https://imageio.forbes.com/specials-images/imageserve/65fe401fc35aefb76700b52e/0x0.jpg?format=jpg&height=900&width=1600&fit=bounds,2024-03-24 07:45:00,Innovation,Innovation
https://www.forbes.com/sites/anuradhavaranasi/2024/03/24/which-adhd-medications-could-lower-risk-of-suicide--hospitalization/,These ADHD Medications Could Lower Risk Of Suicide & Hospitalization,"Illustration of the ADHD process, attention deficit disorder with or without hyperactivity. The cerebral areas located in the frontal lobe, responsible for attention, organizational skills, and emotional responses, are abnormally active or have a specific anatomy. There is also an imbalance in levels of some chemical messengers in the brain, such as dopamine and noradrenaline.

A recent study involving 221,714 individuals with ADHD revealed that those prescribed ADHD stimulant medications had a lower risk of suicide attempts and psychiatric hospitalizations. Heidi Taipale and her team at Karolinska Institute in Stockholm found that specific ADHD medications like amphetamine, lisdexamphetamine, dexamphetamine, and methylphenidate were associated with decreased psychiatric hospitalizations.

While lisdexamphetamine, dexamphetamine, and methylphenidate were linked to a reduced risk of suicidal behavior, atomoxetine showed a correlation with fewer hospitalizations for non-psychiatric co-morbidities. Psychiatric co-morbidities, including major depressive disorder, panic disorder, substance abuse, and others, were prevalent among individuals with ADHD, increasing the risk of mortality, especially when combined with substance use disorder.

The study highlighted the positive impact of ADHD medications, particularly stimulants, on improving functioning and quality of life. However, the long-term effectiveness and safety of these pharmacotherapies require further investigation due to potential adverse outcomes like psychosis or cardiovascular diseases.

Analyzing data from the Swedish National Patient Register and Prescribed Drug Register, the researchers tracked medication use and hospitalization rates among ADHD-diagnosed individuals aged 16 to 65 over a 15-year period. Methylphenidate, lisdexamphetamine, and atomoxetine were the most commonly prescribed medications, with varying effectiveness across different age groups and genders.

The findings, published in JAMA Network Open, underscored the overall beneficial effects of ADHD medications on psychiatric outcomes while noting potential concerns about long-term stimulant use. Future research should continue to explore the relationship between ADHD pharmacotherapies and both positive and negative health outcomes to optimize treatment strategies for individuals with ADHD.",https://imageio.forbes.com/specials-images/imageserve/63c28dbb82c31b7412c92cf2/0x0.jpg?format=jpg&height=900&width=1600&fit=bounds,2024-03-24 04:09:46,Innovation,Innovation
https://www.forbes.com/sites/marksparrow/2024/03/24/lofrees-misty-mechanical-keyboard-is-a-wonderfully-frosted-confection/,Lofree’s Misty Mechanical Keyboard Is A Wonderfully Frosted Confection,"The LoFree Misty mechanical keyboard offers a unique and delightful typing experience with its frosted casing and keycaps. This 68-key layout includes a full row of function keys that can also serve as multimedia keys, along with modifier keys for Windows and macOS. The frosted keycaps allow the white RGB backlighting to shine through, making it visually appealing and suitable for those with visual impairments.

In addition to its smart design, the LoFree Misty features hot-swappable mechanical switches and a Poron Silencing layer that ensures a silent and solid typing experience. The pre-lubed Kailh Jellyfish switches provide ultra-smooth and quiet key presses, making it ideal for quiet environments. The keyboard also features UV-coated keycaps for longevity and resistance to fingerprints and fading.

The Misty keyboard offers flexibility with both Bluetooth connectivity and a USB Type-C cable option. It can be paired with up to three Bluetooth devices and supports N-Key Rollover for fast typists. The keyboard is compatible with various operating systems, including Windows, macOS, iOS, Android, and Chrome.

Overall, the LoFree Misty 1% is a beautiful and functional keyboard that combines aesthetics with functionality. It is recommended for those looking for a unique typing experience and is particularly suitable for older individuals with visual impairments. The keyboard is available for purchase on the LoFree website for $239 / £187.65.

For more information, visit lofree.co.","https://imageio.forbes.com/specials-images/imageserve/65f71772feb922c91162e919/0x0.jpg?format=jpg&crop=1097,723,x103,y177,safe&height=900&width=1600&fit=bounds",2024-03-24 06:00:00,Innovation,Innovation
