Link,post_title,post_content,featured_image,Date-Publish,post_category,post_tag
https://www.forbes.com/sites/jamiecartereurope/2024/03/24/when-to-see-a-great-un-american-eclipse---from-iceland-to-australia/,When To See A ‘Great Un-American Eclipse’ - From Spain To Australia,"On Monday, April 8th, North America will witness a total solar eclipse, marking a significant event in the celestial world. In 2017, approximately 12 million Americans experienced totality during a solar eclipse, and on April 8th, 2024, another 31 million will have the opportunity to do so.

While the next total solar eclipse in the United States will not occur until 2033 in Alaska, there are ways to experience this rare phenomenon before then. During a total solar eclipse, only a small portion of the Earth's surface is covered by the moon's shadow, creating a moment of sudden darkness during the day, accompanied by rapid cooling, eerie light, strange animal behavior, and a chance to witness the sun's corona.

To experience totality, one must be in the right place at the right time, often requiring travel to various locations around the world. Here is a list of upcoming total solar eclipses and where to go to witness them:

1. Greenland, Iceland, and Northern Spain Eclipse: August 12, 2026
This eclipse will provide a two-minute totality, making Iceland an ideal destination to observe the event. The western tip of the Snæfellsnes Peninsula and Reykjavik, the capital city, offer excellent viewing spots. Northern Spain is another popular option, although the eclipse will occur dangerously close to sunset, resulting in the sun being very low in the sky.

2. North African Eclipse: August 2, 2027
With a totality lasting over six minutes, this eclipse is the longest of the century. The path of totality crosses southern Spain and much of North Africa, but Luxor in Egypt, known for its historical sites such as the Valley of the Kings and Karnak, stands out as the prime location to witness this remarkable event.

3. Australia and New Zealand Eclipse: July 22, 2028
Sydney Harbour in Australia will provide an unforgettable viewing experience with three minutes and 44 seconds of totality. However, if you prefer a guaranteed clear sky, exploring the Australian Outback is highly recommended. Queenstown in New Zealand will also witness totality close to sunset.

4. Southern Africa and South Australia Eclipse: November 25, 2030
Southern Africa offers a great destination for a two-minute totality experience, followed by a game drive in Namibia and Botswana. South Australia will witness the eclipse approximately one hour before sunset. Which continent appeals to you?

5. Pacific Ocean Eclipse: November 14, 2031
Embark on a long and solitary cruise from Hawaii to witness this hybrid solar eclipse. The spectacle will transition from a ""ring of fire"" annular solar eclipse to a total solar eclipse southeast of Hawaii, and then back again.

6. Alaska and Siberia Eclipse: March 30, 2033
This eclipse will provide a two-minute totality from Alaska, offering the opportunity to see the Northern Lights. While clear skies may be unlikely during the Great Bering Strait eclipse, exploring remote Alaskan towns like Barrow/Utqiagvik, Prudhoe Bay/Sagavanirktok, and Kotzebue is an added bonus. If luck is on your side, the northern lights may make an appearance during totality.

7. Central Africa and Asia Eclipse: March 20, 2034
Marking the first ""equinox eclipse"" since 2015, this event will bring four minutes and nine seconds of totality to Central Africa and South Asia. Southeastern Egypt is a recommended destination, attracting numerous eclipse chasers. The UNESCO World Heritage Site of Persopolis in Iran is another option. The path of totality will pass through Nigeria, Cameroon, Chad, Sudan, Egypt, Saudi Arabia, Iran, Kuwait, Afghanistan, Pakistan, India, and Nepal.

8. China, North Korea, and Japan Eclipse: September 2, 2035
Beijing, China, and Tokyo, Japan, will be the prime locations to witness this East Asian eclipse. Just north of Beijing and Pyongyang in North Korea, totality will last for almost two minutes. A trip just north of Tokyo will provide an additional 30 seconds of totality.

9. Australia and New Zealand Eclipse: July 13, 2037
During this mid-winter eclipse, locations such as Geraldton, Uluru (Ayers Rock), Byron Bay, the Gold Coast, and the remote Lord Howe Island in Australia will be covered by the moon's shadow for up to three minutes and 58 seconds. The North Island of New Zealand, including the Ngauruhoe volcano (Mount Doom in The Lord of the Rings films) in Tongariro National Park and coastal Napier in Hawke's Bay, will also witness totality.

10. Australia and New Zealand Eclipse: December 26, 2038
If you have any remaining air miles from previous eclipse events, this mid-summer eclipse will primarily occur over the remote Australian Outback. However, the path of totality will pass just north of both Australia and New Zealand, allowing for a unique viewing experience.

These upcoming total solar eclipses provide incredible opportunities to witness a natural wonder. Start planning your travels now to ensure you don't miss out on these once-in-a-lifetime experiences. Remember, being in the right place at the right time is key to witnessing totality and all its mesmerizing effects.",https://imageio.forbes.com/specials-images/imageserve/6596ce996dfc8e3f5f161c42/0x0.jpg?format=jpg&height=900&width=1600&fit=bounds,2024-03-24 13:00:00,Innovation,Innovation
