Link,post_title,post_content,featured_image,Date-Publish,post_category,post_tag
https://techxplore.com/news/2024-03-vulnerability-virtual-reality.html,Vulnerability in virtual reality systems identified,"Virtual reality (VR) systems have opened up a whole new world of possibilities, allowing users to immerse themselves in a virtual environment that seems almost real. However, a team of computer scientists from the University of Chicago has recently discovered a potential vulnerability in these VR systems that could put users at risk.

The team has identified a way for hackers to insert what they call an ""inception layer"" between a user's VR Home Screen and their VR User/Server. This means that users may unknowingly interact with a simulated VR app created by the attacker, rather than the app they intended to use. The researchers have outlined their findings in a paper published on the arXiv preprint server.

Imagine a scenario where a hacker adds an app to a user's VR headset that tricks them into revealing sensitive information. This is exactly what the research team envisioned. The app would create a layer of reality between the user and the virtual world they see through their VR device. Drawing inspiration from the movie ""Inception,"" where characters have altered realities downloaded into their brains, the researchers called this layer the ""inception layer.""

The potential consequences of this vulnerability are alarming. The app could record sensitive information, such as passcodes entered into a virtual ATM, or intercept and alter financial transactions, routing the difference to the hacker's bank account. Moreover, it could manipulate the VR world by adding characters that appear to be friends or family, using this deception to gain trust and access to secrets. Essentially, the app could monitor and manipulate gestures, voice interactions, browsing activity, and social or business interactions within the VR environment.

To demonstrate the feasibility of this attack, the research team conducted an experiment. They enlisted 28 volunteers who played a game using a demonstration VR headset. The researchers then downloaded an app onto the devices, simulating a hacking scenario. Only 10 of the volunteers noticed a slight flickering during the download and activation process, and just one of them questioned whether something nefarious was happening.

Upon discovering this vulnerability, the research team promptly informed Meta, the company behind the Meta Quest VR system used in the experiment. Meta acknowledged the findings and expressed their intention to investigate and address the issue if confirmed. The researchers also believe that similar vulnerabilities may exist in other VR systems and apps that attempt to insert themselves between users and their VR devices.

This discovery highlights the importance of addressing potential security threats in VR systems. As the popularity and widespread use of VR continues to grow, it is essential to ensure that users are protected from potential attacks. By addressing these vulnerabilities, we can ensure that VR remains a safe and enjoyable experience for all users.

In conclusion, the team of computer scientists from the University of Chicago has uncovered a potential vulnerability in VR systems, which they refer to as ""inception attacks."" These attacks involve the insertion of an inception layer between a user's VR Home Screen and their VR User/Server. This layer can be used by hackers to record sensitive information, manipulate transactions, and deceive users within the VR environment. The research team has alerted Meta, the makers of the Meta Quest VR system, about their findings, and they plan to investigate and address the issue. It is crucial for the VR industry as a whole to be aware of potential vulnerabilities and take steps to protect users from such attacks.",https://scx2.b-cdn.net/gfx/news/2024/vulnerability-in-virtu.jpg,2024-03-25 10:20:02,Innovation,Innovation
https://www.zdnet.com/education/professional-development/want-to-be-a-devops-engineer-heres-the-good-the-bad-and-the-ugly/,"Want to be a DevOps engineer? Here's the good, the bad, and the ugly","DevOps engineering is a highly sought-after job in today's economy. However, to excel in this role, one must possess both technical expertise and business acumen. Furthermore, continuous learning is essential for staying relevant in this rapidly evolving field.

The demand for DevOps engineers, who are responsible for automating and coordinating software development processes across cloud and on-premises environments, is skyrocketing. As a result, these professionals earn lucrative salaries, with the average annual salary in the US reaching approximately $134,000.

While being a DevOps engineer comes with its fair share of challenges, it also offers numerous rewards. According to Brad Morgan, an experienced DevOps engineer, having a strong understanding of Linux is crucial. Linux serves as the foundation for most DevOps roles, so it is important to be familiar with its basics, terminal commands, and the overall functionality of the operating system.

In addition to Linux, another essential skill for DevOps engineers is bash scripting, which is used to automate Linux commands. Bash scripting is widely employed in the DevOps world, particularly in building pipelines. Therefore, mastering this skill is highly beneficial.

Cloud skills are also vital for DevOps engineers. Familiarizing oneself with a major cloud provider like AWS, Google Cloud, or Microsoft Azure can open up numerous opportunities. Instead of trying to learn multiple cloud platforms simultaneously, it is advisable to focus on mastering one at a time. This approach allows for a deeper understanding and easier transition to other platforms in the future.

Becoming a DevOps engineer does not require formal education. Self-learning is often the best path to pursue a career in this field. DevOps engineers must have a passion for learning and constantly challenging themselves to keep up with the ever-evolving landscape of tools, frameworks, and technologies.

Homebrew Henry, another seasoned DevOps engineer, emphasizes the importance of continuous learning in this field. DevOps engineers must dedicate their free time to studying new concepts and technologies. The DevOps ecosystem is vast and constantly changing, so staying updated is crucial.

Even as one gains experience, learning never stops. The introduction of AI tools like ChatGPT and the rapid pace of development mean that DevOps engineering today will not be the same as it was a few years ago. Embracing this constant evolution is one of the aspects that DevOps engineers find most exciting about their job.

Infrastructure management is a significant part of a DevOps engineer's responsibilities. Those who enjoy managing infrastructure thrive in this role. Setting up, configuring, and maintaining cloud infrastructure, including servers, databases, networks, and security, is a daily task. This aspect of the job can be both challenging and rewarding for individuals who find excitement in it. However, if one's passion lies more in software engineering, the infrastructure management aspect may not provide the same level of fulfillment.

It is worth noting that transitioning between software engineering and DevOps is possible. Many professionals have successfully made this switch, so individuals should not feel limited to one path.

Lastly, it is essential to consider the business side of DevOps. Unrealistic expectations from management can often be a challenge. Businesses may believe that hiring a few DevOps engineers will magically solve all their problems. However, this is not the reality. DevOps is a complex discipline that requires time, effort, and collaboration across the organization to achieve success.

In conclusion, DevOps engineering is a highly rewarding career that requires a combination of technical expertise, continuous learning, and a passion for collaboration. By mastering essential skills such as Linux, bash scripting, and cloud technologies, and by embracing the challenges and opportunities that come with infrastructure management, individuals can thrive in this fast-paced field. Continuous learning and adaptability are key to staying ahead in the ever-evolving world of DevOps.",https://www.zdnet.com/a/img/resize/e4d3d8d263eb00323161fcf2566ad35a3fe52282/2024/03/25/1b8b924e-2629-43c2-b416-1b990e262786/gettyimages-1319039490.jpg?auto=webp&fit=crop&height=675&width=1200,2024-03-25 00:00:00,Innovation,Innovation
https://www.forbes.com/sites/joemckendrick/2024/03/26/can-ai-amplify-esprit-de-corps/,Can AI Amplify Esprit De Corps?,"Can AI Bring Us Together?

In the world of sports, data-driven decision-making has become a standard practice. However, this approach has leveled the playing field, as every team now relies on data for recruiting and strategy. So, what can set a team apart from the rest? Back in the 1980s, Dr. Peter Senge conducted a study on the Los Angeles Lakers, one of the most successful basketball teams of the previous decade. He found that the key to their success was a shared vision and alignment among team members. Fast-forward to today, and experts are exploring the idea of using artificial intelligence (AI) to create a common vision and bring teams closer together.

AI has the potential to be a unifying force for teams, but this aspect hasn't received much attention. It is a soft benefit that is difficult to quantify. However, AI can be used to achieve greater alignment and understanding between team members, even if they are not physically in the same location. Dr. Tomas Chamorro-Premuzic, chief innovation officer at ManpowerGroup, refers to this as ""artificial emotional intelligence"" (AEI). AEI involves computers trying to understand human emotions and thoughts, a foundational aspect of human emotional intelligence.

One way AI can enhance team collaboration is by helping team members understand each other's feelings and motivations. Natural language processing can analyze the language used by team members to estimate their morale, engagement, and enthusiasm. This information can be valuable for managers to better understand their team members. Additionally, AI can analyze body language during video meetings to give team members a sense of how others are feeling. Think of it as a ""Shazam for the soul.""

However, AI is still in its early stages when it comes to bringing teams into alignment. Currently, AI applications are more focused on enhancing individual productivity within a team rather than fostering collaboration. Yingqi Wang, CEO and founder of ONES, a project management software provider, compares today's AI usage to ""shadow IT."" AI can assist with time-consuming tasks like notetaking and transcription, or it can provide real-time translation. As AI becomes more widely adopted and reliable, it has the potential to reshape how teams approach tasks and break down barriers to collaboration and communication.

While AI can be a helpful tool, humans should not over-rely on it. Over-automation can diminish human touch and spontaneous collaboration, which are essential for team cohesion. It is crucial to maintain strong people skills and continue to communicate with each other, even as AI becomes more integrated into our workflows. Additionally, over-reliance on data-driven creativity can stifle true innovation, leading to formulaic content or recommended next steps. As AI evolves, it is important to explore its impact on team dynamics and ensure that it enhances collaboration rather than hinders it.

In conclusion, AI has the potential to bring teams together by creating a shared vision and improving understanding between team members. However, AI is still in its early stages when it comes to fostering collaboration. As AI continues to develop, it is important to strike a balance between leveraging its capabilities and maintaining human connection within teams. By doing so, teams can harness the power of AI while preserving the unique qualities that make us human.",https://imageio.forbes.com/specials-images/imageserve/66025c981748a83933081202/0x0.jpg?format=jpg&height=900&width=1600&fit=bounds,2024-03-26 01:28:39,Innovation,Innovation
https://techcrunch.com/2024/03/25/techcrunch-minute-why-the-company-behind-trumps-truth-social-joined-the-growing-ipo-trend/,Watch: Why the company behind Trump's Truth Social joined the growing IPO trend,"Last week, the Reddit and Astera Labs IPOs made headlines and captured the attention of the media. These two tech IPOs not only priced well but also traded with great enthusiasm. This is significant considering the scarcity of technology offerings in recent times. The occurrence of two large, multibillion-dollar IPOs in the same week was a much-needed victory for private-market tech companies, providing a sense of relief for many.

However, amidst all the buzz surrounding these IPOs, there was another offering that shouldn't be overlooked: Trump Media and Technology Group, the company responsible for Truth Social. While there were some back-and-forth negotiations, it eventually merged with its chosen SPAC and commenced trading. TechCrunch has provided more details on this development.

Financially, Trump Media and Technology Group faces an uphill battle. Nevertheless, the fact that we witnessed two major debuts last week, along with another public-market transaction, suggests that the IPO window is reopening. This is certainly good news for companies looking to go public and investors eager to explore new opportunities in the tech sector.

The resurgence of the IPO market brings hope and excitement to both entrepreneurs and investors alike. It signifies the revitalization of the tech industry and a renewed interest in supporting innovative companies. The successful pricing and trading of these IPOs indicate a positive reception from the market, showcasing the potential for substantial growth and profitability.

The return of the IPO window also suggests a renewed confidence in the economy and investment climate. It reflects a belief that the market is ready to embrace and support new ventures, particularly in the technology sector. This is a promising sign for entrepreneurs seeking funding and an opportunity to bring their ideas to fruition.

Moreover, the reopening of the IPO window provides a platform for investors to diversify their portfolios and explore new investment opportunities. With the tech sector playing a crucial role in driving innovation and economic growth, the resurgence of technology offerings presents a chance for investors to participate in the success of groundbreaking companies.

As the IPO market gains momentum, it is important to recognize the potential challenges and risks that lie ahead. While the recent success of IPOs is encouraging, it does not guarantee future outcomes. Companies going public must navigate various hurdles, including market volatility, regulatory compliance, and investor scrutiny. It is crucial for these companies to have a solid business model, a clear growth strategy, and a strong management team to weather the challenges that come with being a publicly traded company.

In conclusion, the resurgence of the IPO market, as demonstrated by the recent success of the Reddit and Astera Labs IPOs, along with the emergence of Trump Media and Technology Group, signals a positive shift in the tech industry. This renewed interest in tech offerings provides an opportunity for companies to access capital, fuel growth, and accelerate innovation. As the IPO window reopens, both entrepreneurs and investors can look forward to a thriving market that fosters economic growth and supports the development of groundbreaking technologies.","https://techcrunch.com/wp-content/uploads/2024/03/TechCrunch-Minute-Site-Truth-Social.png?resize=1200,675",2024-03-25 16:00:10,Innovation,Innovation
https://www.forbes.com/sites/christianmiller/2024/03/25/getting-more-impatient-when-the-end-is-in-sight-taylor-swifts-new-album-covid-vaccines-and-the-2020-presidential-election/,Getting More Impatient When the End Is in Sight,"Taylor Swift's highly anticipated new album, The Tortured Poets Department, is just around the corner, and fans are eagerly awaiting its release. But as the big day approaches, emotions are running high. Are you feeling more impatient? Or maybe your impatience has remained constant? Perhaps you're even starting to feel a sense of relief as the wait comes to an end.

A recent study conducted by Annabelle Roberts at the University of Texas and Ayelet Fishbach at the University of Chicago sheds light on this phenomenon. They found that people tend to become more impatient as the end of a wait draws near, not necessarily because of the time and energy they've already invested, but because they long for closure.

In one of their studies, the researchers focused on the COVID-19 pandemic and the release of vaccines in the U.S. They surveyed 161 participants at three different time points: after the successful Pfizer trial announcement, in November and December 2020, and in March 2021. Participants were asked to rate their level of impatience to get a coronavirus vaccine and for the pandemic to end. Interestingly, while impatience for the vaccine increased over time, impatience for the pandemic to end remained relatively stable. This suggests that the proximity to the end of the wait was the driving factor behind the increased impatience.

Another study conducted by Roberts and Fishbach looked at the 2020 U.S. presidential race between Joe Biden and Donald Trump. They surveyed 215 participants in the days leading up to Election Day, November 3rd, and included an extra day in their data set since the results were not settled until November 4th. The findings showed that impatience grew as the election drew nearer, regardless of whether participants supported Biden or Trump. Again, this supports the idea that people crave closure.

The researchers also explored impatience in everyday scenarios, such as waiting for a bus, receiving a package, tracking a delivery truck, or encountering a traffic delay. In each case, impatience increased as the remaining time decreased. It wasn't the total wait time that mattered; it was the time left until the desired event or outcome.

These findings have practical implications. For instance, those responsible for managing situations, such as government officials, nurses, or customer service representatives, should inform people about delays early on and provide overestimated wait times rather than underestimate them. Additionally, individuals can plan ahead for anticipated events to help cope with the surge in impatience. Engaging in activities like reading or listening to podcasts can distract from the impatience and make the wait more bearable.

So, for all the Swifties eagerly awaiting Taylor Swift's new album, prepare for your impatience to intensify as the release date, April 19th, draws near. But take heart, because soon you'll have the closure you've been longing for.","https://imageio.forbes.com/specials-images/imageserve/65f253e5f8f81a9d16371132/0x0.jpg?format=jpg&crop=1350,759,x0,y0,safe&height=900&width=1600&fit=bounds",2024-03-25 20:53:11,Innovation,Innovation
https://techcrunch.com/2024/03/25/large-language-models-can-help-home-robots-recover-from-errors-without-human-help/,Large language models can help home robots recover from errors without human help,"Home robots have struggled to gain widespread popularity due to various factors such as pricing, practicality, form factor, and mapping. But even when these issues are addressed, there is still the challenge of dealing with inevitable mistakes. This problem is not exclusive to home robots; even on an industrial level, companies face difficulties in addressing mistakes. However, unlike big companies, consumers cannot be expected to learn programming or hire someone to help them every time an issue arises. This is where large language models (LLMs) can be useful in the robotics space, as demonstrated by recent research from MIT.

A study, which will be presented at the International Conference on Learning Representations (ICLR) in May, aims to bring ""common sense"" into the process of correcting mistakes. The researchers at MIT explain that robots are excellent mimics, but without being programmed to handle unexpected situations, they struggle to adapt and continue their tasks. Traditionally, when a robot encounters an issue, it exhausts its pre-programmed options before requiring human intervention. This becomes particularly challenging in unstructured environments like homes, where even small changes can disrupt a robot's functioning.

Imitation learning, which involves learning to perform tasks through observation, is popular in the field of home robotics. However, it often fails to account for the countless small environmental variations that can interfere with regular operation. As a result, the system needs to start from scratch. The new research addresses this problem by breaking demonstrations into smaller subsets instead of treating them as continuous actions.

This is where LLMs come into play, eliminating the need for manual labeling and assignment of subactions by the programmer. LLMs can provide instructions for each step of a task in natural language. The researchers wanted to connect the continuous demonstrations performed by humans with the steps described by LLMs so that a robot would automatically know its progress in a task and be able to replan and recover on its own.

The study features a demonstration in which a robot is trained to scoop marbles and pour them into an empty bowl. While this may seem like a simple task for humans, it involves a combination of various small tasks for robots. The LLMs can list and label these subtasks. During the demonstrations, the researchers purposely sabotaged the activity by bumping the robot off course and knocking marbles out of its spoon. However, instead of starting from scratch, the system was able to self-correct the small tasks.

""With our method, when the robot is making mistakes, we don’t need to ask humans to program or give extra demonstrations of how to recover from failures,"" explains grad student Tsun-Hsuan Wang.

This research presents a compelling approach to preventing robots from losing their marbles. By utilizing large language models and breaking tasks into smaller subsets, robots can better handle mistakes and continue their tasks without human intervention. This advancement in robotics has the potential to improve the functionality and reliability of home robots, making them more practical and user-friendly for consumers.",https://techcrunch.com/wp-content/uploads/2024/03/CommonSense-01-press_0.jpg?w=900,2024-03-25 20:01:06,Innovation,Innovation
