Link,Title,Text,Image,Date Publish
https://www.forbes.com/sites/jamiecartereurope/2024/03/23/explained-the-difference-between-a-solar-eclipse-and-a-lunar-eclipse/,Explained: The Difference Between A Solar Eclipse And A Lunar Eclipse,"

Have you ever wondered about the difference between a solar eclipse and a lunar eclipse? Well, in the next few weeks, we'll have the chance to witness both of these incredible celestial events. On Monday, March 25, there will be a lunar eclipse, followed by a solar eclipse on Monday, April 8. Although they may seem similar, these two phenomena are actually quite different, but they are both caused by the same alignment of celestial bodies.

Let's start with the lunar eclipse. This occurs when Earth's shadow is projected onto the moon. It can only happen during a full moon when Earth is positioned between the sun and the moon, creating a shadow in space. However, lunar eclipses are quite rare because the moon rarely passes through Earth's shadow. So, when it does happen, it's quite a spectacle.

On the other hand, a solar eclipse happens when the moon blocks the sun's light and casts a shadow on Earth. This can only occur during a new moon when the moon is positioned between the sun and Earth, projecting its shadow onto our planet. Similar to lunar eclipses, solar eclipses are also quite rare because the moon's orbit and the Earth's orbit around the sun are not perfectly aligned. So, when we do get to witness a solar eclipse, it's truly a remarkable event.

Now, you might be wondering what causes these fascinating celestial phenomena. Well, let's break it down. A total lunar eclipse occurs when there is a perfect alignment of the sun, Earth, and moon. Earth has two shadows—the outer penumbral shadow and the dark central umbral shadow. When a full moon drifts into Earth's umbral shadow, it is no longer directly illuminated by the sun. Instead, the only light reaching the moon's surface is sunlight refracted by Earth's atmosphere. This creates a mesmerizing effect, turning the moon a pinkish-red color—a ""Blood Moon."" If you were standing on the moon during a lunar eclipse, you would be bathed in this pinkish-red light and witness a partial or total solar eclipse.

On March 25, we will experience a penumbral lunar eclipse, where the full ""Worm Moon"" will pass through Earth's penumbra, creating a subtle shadowy effect.

Now, let's move on to a total solar eclipse. This phenomenon occurs when there is a perfect alignment of the sun, moon, and Earth, along with a celestial fluke. Just like the new moon has two shadows—the outer penumbral shadow and the dark central umbral shadow—the moon's umbra is projected onto Earth when it perfectly blocks the sun. This can only happen because the moon is about 400 times smaller than the sun but also 400 times closer to Earth. It's a unique coincidence that allows us to witness a total eclipse of the sun.

During a total solar eclipse, the moon's shadow moves across Earth's surface as it orbits from west to east. This happens to be the same direction that Earth rotates, which slows down the movement of the moon's shadow. As a result, an umbral shadow—a path of totality—is created, where lucky observers can witness something truly incredible. Imagine standing on the moon during a total solar eclipse and seeing the moon's shadow crossing Earth.

On April 8, we will have the opportunity to witness a total solar eclipse. The new ""Pink Moon"" will block the sun perfectly, projecting an umbral shadow over North America. It's an event that shouldn't be missed!

You may be wondering why lunar and solar eclipses are so rare. Well, it's because the moon's orbit around Earth is tilted about 5 degrees with respect to the sun's path through the sky. This means that the moon's path intersects the sun's path twice in each orbit, but for an eclipse to occur, the moon must be in its new or full phase. This scenario only happens twice a year, creating two ""eclipse seasons"" when solar and lunar eclipses are more likely. However, most solar eclipses are either partial or annular (""ring of fire""), while most lunar eclipses are penumbral or partial.

Looking ahead, let's take a peek at the upcoming lunar and solar eclipses in 2024 and 2025. In 2024, we can expect two eclipse seasons starting on March 25 and September 17. The first will bring a penumbral lunar eclipse visible in North America, followed by a total solar eclipse that will also be visible in North America. Later in the year, on September 17, there will be a partial lunar eclipse visible in North America, followed by an annular solar eclipse visible in the Pacific Ocean and South America on October 2.

Moving on to 2025, there will be two eclipse seasons starting on March 13 and September 7. In March, we can look forward to a total lunar eclipse visible in North America, followed by a partial solar eclipse visible in Canada and northern Europe on March 29. In September, there will be another total lunar eclipse visible in Asia, and later in the month, a partial solar eclipse visible in Antarctica on September 21.

So, mark your calendars and get ready for these spectacular celestial events. Whether it's a lunar eclipse or a solar eclipse, witnessing these rare occurrences is a truly awe-inspiring experience. Remember to stay updated for the latest information on the upcoming total solar eclipse on April 8. Clear skies and wide eyes!

",https://imageio.forbes.com/specials-images/imageserve/65f6b43702078076f68d7fcf/0x0.jpg?format=jpg&height=900&width=1600&fit=bounds,2024-03-23 19:00:00
