Link,post_title,post_content,featured_image,Date-Publish,post_category,post_tag
https://techxplore.com/news/2024-03-quantum-algorithm-high-quality-solutions.html,Novel quantum algorithm proposed for high-quality solutions to combinatorial optimization problems,"Combinatorial optimization problems (COPs) are complex problems that require finding the optimal solution in various fields such as logistics, supply chain management, machine learning, material design, and drug discovery. These problems are computationally intensive when solved using classical computers, which has led to increased interest in solving COPs using quantum computers.

Quantum computers utilize the quantum property of superposition, allowing specialized qubits to exist in multiple states simultaneously. This property enables quantum computers to quickly solve large problems. However, when COPs involve constraints, conventional quantum algorithms like adiabatic quantum annealing struggle to find near-optimal solutions within the operating time of quantum computers.

Recent advancements in quantum technology have introduced devices like quantum annealers and gate-type quantum devices, which provide suitable platforms for solving COPs. However, these devices are susceptible to noise, limiting their applicability to quantum algorithms with low computational costs.

To overcome this challenge, Assistant Professor Tatsuhiko Shirai and Professor Nozomu Togawa from Waseda University in Japan have developed a post-processing variationally scheduled quantum algorithm (pVSQA). Their study, published in the IEEE Transactions on Quantum Engineering, combines variational scheduling with a post-processing method to transform infeasible solutions into feasible ones, achieving near-optimal solutions for constrained COPs on both quantum annealers and gate-based quantum computers.

The pVSQA algorithm begins by using a quantum device to generate a variational quantum state through quantum computation. This state is then used to create a probability distribution function that includes all feasible and infeasible solutions within the constraints of the COP. The post-processing method is then applied to convert the infeasible solutions into feasible ones, resulting in a probability distribution with only feasible solutions. A classical computer is utilized to calculate the energy expectation value of the cost function using this new probability distribution. This calculation is repeated to obtain a near-optimal solution.

The performance of the pVSQA algorithm was evaluated using both a simulator and real quantum devices, including a quantum annealer and a gate-type quantum device. The experiments demonstrated that pVSQA achieves near-optimal performance within a specified time on the simulator and outperforms conventional quantum algorithms without post-processing on real quantum devices.

The development of this algorithm is crucial for addressing complex real-world problems in various domains. It holds promise for achieving long-term social transformations, such as realizing a carbon-neutral society to combat climate change and attaining sustainable development goals to address issues like increased energy demand and food shortage.

In conclusion, this study represents a significant advancement in using quantum computers to solve COPs. Its findings have the potential to revolutionize problem-solving across multiple fields and contribute to solving pressing global challenges.",https://scx2.b-cdn.net/gfx/news/2024/novel-quantum-algorith.jpg,2024-03-25 12:50:38,Innovation,Innovation
https://techcrunch.com/2024/03/25/techcrunch-minute-why-the-company-behind-trumps-truth-social-joined-the-growing-ipo-trend/,Watch: Why the company behind Trump's Truth Social joined the growing IPO trend,"Last week, the tech world was buzzing with the highly anticipated IPOs of Reddit and Astera Labs. These two offerings garnered significant attention and for good reason - they were successful in terms of pricing and trading performance. This was a welcome development after a period of minimal tech offerings, and it brought a sense of relief to private-market tech companies.

However, amidst all the excitement surrounding these IPOs, there was another offering that also had a tech angle to it - Trump Media and Technology Group, the company behind Truth Social. TechCrunch has provided more details on this, but in essence, after much deliberation, the company merged with its chosen SPAC and commenced trading.

Financially, Truth Social may face challenges in the future, but the fact that we witnessed two major debuts last week, along with another public-market transaction, indicates that the IPO window is indeed open once again. This is a positive sign for the tech industry, as it signifies renewed investor interest and confidence in the market.

With the resurgence of IPO activity, tech companies can now consider going public as a viable option for raising capital and expanding their businesses. This is especially significant for startups and private-market tech firms that have been eagerly waiting for an opportunity to tap into the public market.

The successful IPOs of Reddit and Astera Labs serve as a testament to the strong demand for tech stocks and the overall health of the market. These offerings not only provided a boost to the companies involved but also generated excitement among investors and industry observers. The fact that both offerings were able to price well and trade with enthusiasm indicates that there is still a hunger for innovative and promising tech companies.

As we look ahead, it will be interesting to see how the IPO landscape evolves and whether this trend of increased activity will continue. The success of the recent IPOs suggests that there is an appetite for technology offerings, and this could potentially encourage more companies to explore the public market route.

In conclusion, the recent IPOs of Reddit and Astera Labs, along with the emergence of Truth Social through a SPAC merger, have reignited the IPO window for tech companies. This is a positive development for the industry and demonstrates the resilience and attractiveness of tech stocks. With renewed investor interest and confidence, tech firms now have a viable avenue for growth and expansion. The future of the IPO market looks promising, and we can expect to see more exciting offerings in the coming months.","https://techcrunch.com/wp-content/uploads/2024/03/TechCrunch-Minute-Site-Truth-Social.png?resize=1200,675",2024-03-25 16:00:10,Innovation,Innovation
https://www.zdnet.com/article/saving-hours-of-work-with-ai-how-chatgpt-became-my-virtual-assistant-for-a-data-project/,Saving hours of work with AI: How ChatGPT became my virtual assistant for a data project,"Generative artificial intelligence (AI) has been making headlines lately, and one popular tool in this field is ChatGPT. While it has received a lot of attention, it's important to remember that ChatGPT is simply a tool, albeit a powerful one. In this article, I will share a project where ChatGPT saved me a significant amount of time, and hopefully inspire you to consider using it for your own projects.

The project at hand involves writing an article about the computer gear available on Temu for under $100. I was tasked with finding the products, their prices, and staying within the budget. This is a task that would typically be assigned to a human assistant, but I decided to give ChatGPT a try.

Phase 1: Gathering the links
To begin, I collected all the links from Temu and pasted them into a Notion page. Notion allows you to create bookmark blocks that include product names along with the links. Once I had selected all the blocks, I copied and pasted them into a text editor.

Phase 2: Identifying the data
Each block of data contains three key elements. The product name is enclosed in braces, the base URL is enclosed in parentheses, and there is a question mark separating the main URL from additional tracking data. I only needed the main URL, so I highlighted these sections for ChatGPT to process.

Phase 3: Teaching ChatGPT to recognize the data
I provided ChatGPT with a prompt to accept the data and await further instructions. Then, I pasted the information from the text editor into ChatGPT. At this point, ChatGPT knew to wait for more details.

The crucial step was instructing ChatGPT to extract the titles and links while disregarding the rest of the data. By providing a clear prompt, I was able to test if ChatGPT understood the assignment.

Phase 4: Cleaning up Temu's titles
Temu's product titles were quite lengthy and complex. To simplify them, I asked ChatGPT to create cleaner versions that were concise and to the point. For example, instead of ""10 Inch LCD Writing Tablet, Electronis Memo With Leather Protective Case, Electronic Drawing Board For Digital Handwriting Pad Doodle Board, Gifts For"", I wanted ""LCD writing tablet with case"".

By reminding ChatGPT of the previous steps and its understanding of the data, I was able to efficiently clean up the titles without any manual cutting and pasting. ChatGPT completed the task in under a minute.

In conclusion, ChatGPT proved to be a valuable tool in this project. It saved me a significant amount of time and effort by quickly processing the data and cleaning up the titles. While it may not be suitable for every project, it's worth exploring how ChatGPT can assist you in your own endeavors.",https://www.zdnet.com/a/img/resize/70d8814af33b190ff84b8faa5f9bafe13d3586e2/2024/03/25/7d1cb1ff-3bb7-4972-a6cd-33d04da76bc1/cover.jpg?auto=webp&fit=crop&height=675&width=1200,2024-03-25 00:00:00,Innovation,Innovation
https://techcrunch.com/2024/03/24/techcrunch-mobility-the-wheels-are-starting-to-come-off-the-fisker-ev-bus/,TechCrunch Mobility: The wheels are starting to come off the Fisker EV bus,"Welcome to TechCrunch Mobility, your go-to source for all things transportation. In this week's newsletter, we'll be discussing some recent developments in the automotive industry, as well as exciting investments and startups in the mobility space.

First, let's talk about the new proposed standards from the Biden Administration. The Department of Energy (DOE) and the Environmental Protection Agency (EPA) have released regulations that will impact U.S. automakers and consumers. While these regulations have been softened to accommodate the automotive industry, they still impose stricter standards than before.

The DOE has introduced a ""petroleum equivalency factor"" that rates electric vehicles (EVs) under the government's corporate average fuel economy (CAFE) standards. The original proposal would have made it challenging for automakers to meet these standards, resulting in substantial fines. The EPA, on the other hand, has set tailpipe standards for 2027 to 2032 model year cars and light-duty trucks. These standards require automakers to meet certain requirements but allow flexibility in choosing powertrain options.

What does this mean for EV startups? Well, companies like Rivian, Tesla, and Lucid, which already meet the clean car standards, won't be affected much. However, legacy automakers that are investing heavily in EVs while still making profits from internal combustion engines may face challenges. Plug-in hybrids could be a winner in this scenario.

Now, let's move on to some exciting news in the industry. Moove, an African mobility fintech company, recently raised $100 million in a Series B funding round led by Uber. This is Uber's first investment in an Africa-founded startup, and it shows their commitment to the region. Moove offers vehicle financing to ride-hailing and delivery app drivers, aligning with Uber's goal of a fully zero-emission fleet by 2040.

Another interesting development is the partnership between Rivian and Tesla. While details are scarce, this collaboration could potentially bring together two leading EV companies and create innovative solutions for the industry.

In the startup world, we have Clevon, a company specializing in autonomous delivery technology. Despite some financial challenges, Clevon is still operational and has entered into an exclusivity agreement for a merger with an American electric vehicle company. This deal is expected to be completed by the first half of June.

Lastly, we have Amber, a Bay Area startup that recently launched an aftermarket Tesla extended warranty product. They raised $3.18 million in a seed round, which will help them expand their offerings and provide peace of mind to Tesla owners.

These are just a few highlights from the world of mobility. Stay tuned for more updates and exciting news in the coming weeks. Subscribe to TechCrunch Mobility to receive our newsletter directly in your inbox.","https://techcrunch.com/wp-content/uploads/2024/03/GettyImages-1363022906.jpg?resize=1200,730",2024-03-24 19:00:33,Innovation,Innovation
https://www.zdnet.com/article/five-linux-file-and-folder-management-commands-you-need-to-know/,Five Linux file and folder management commands you need to know,"Linux: 5 Essential Commands for File and Folder Management

Linux is a powerful operating system with a wide range of commands at your disposal. From basic file and folder management to more advanced tasks, knowing the right commands can make your Linux experience more efficient and productive. In this article, we will explore five essential commands that every Linux user should know for working with files and folders.

1. mkdir - Create a New Directory

The ""mkdir"" command is used to create a new directory, also known as a folder. With just a simple command, you can create a new directory within your current working directory. For example, to create a directory named ""TEST"" in your home directory, you can use the command:

mkdir ~/TEST

But what if you want to create a nested directory structure, such as ""TEST/project1,"" and the parent directory ""TEST"" doesn't exist yet? No worries! You can use the ""-p"" option to create the parent directory if it doesn't already exist. Here's an example:

mkdir -p ~/TEST/project1

This command will create the ""TEST"" directory and then create the ""project1"" directory inside it.

2. less - View File Contents

The ""less"" command allows you to view the contents of a file without opening a text editor. It displays the file one page at a time, enabling you to scroll through it and view it line by line. This is particularly useful when you want to quickly check the contents of a file without the need to edit it.

To use the ""less"" command, simply specify the file you want to view. For example, to view the contents of the ""/etc/samba/smb.conf"" file, you can run:

less /etc/samba/smb.conf

With ""less,"" you can easily navigate through the file using your keyboard's arrow keys or other specified navigation commands.

3. cat - Concatenate Files

The ""cat"" command is used to concatenate files and display their contents in the terminal. It is a versatile command that can be used for various purposes, such as viewing the contents of a file or appending the content of one file to another.

To display the contents of a file using ""cat,"" simply specify the file as an argument. For example, to view the contents of the ""/etc/fstab"" file, you can run:

cat /etc/fstab

Additionally, you can use ""cat"" to append the content of one file to another. Let's say you have two files, ""file1.txt"" and ""file2.txt,"" located in the ""TEST/project1"" directory. To append the content of ""file1.txt"" to the end of ""file2.txt,"" you can use the following command:

cat TEST/project1/file1.txt >> TEST/project1/file2.txt

This command will append the content of ""file1.txt"" to the end of ""file2.txt.""

4. touch - Create Empty Files

The ""touch"" command is a simple yet handy command for creating empty files. Although its primary purpose is to change file timestamps, it is commonly used to create new files quickly.

To create an empty file using ""touch,"" simply specify the desired filename as an argument. For example, to create a file named ""filename,"" you can run:

touch filename

You can also use ""touch"" to add content to the new file or append more content to an existing file. For instance, to add the text ""New Content"" to the newly created file, you can use the following command:

echo ""New Content"" > filename

To append more content to the file, you can use the "">>"" operator. For example:

echo ""More Content"" >> filename

The "">"" operator overwrites the file's content, while "">>"" appends the new text to the end of the file.

5. pwd - Print the Current Working Directory

When navigating through the Linux filesystem hierarchy using the ""cd"" command, it can sometimes be helpful to know your current location. The ""pwd"" command allows you to print the name of the current working directory.

To use ""pwd,"" simply enter the command in your terminal, and it will display the full path of your current directory. For example, if your current directory is ""/var/www/html/site1,"" running the command ""pwd"" will output ""/var/www/html/site1.""

While you may not need to use ""pwd"" frequently, it can be invaluable when you need to verify your current location within the filesystem.

Conclusion

Understanding and utilizing basic commands is essential for efficient file and folder management on Linux. In this article, we explored five essential commands: ""mkdir"" for creating directories, ""less"" for viewing file contents, ""cat"" for concatenating files, ""touch"" for creating empty files, and ""pwd"" for printing the current working directory.

By mastering these commands, you'll have a solid foundation for working with files and folders on Linux. Combine them with the previous five commands we discussed in another article, and you'll be well-equipped to navigate and manage your Linux system effectively.

So go ahead, dive into the world of Linux commands, and unlock the true potential of your operating system!",https://www.zdnet.com/a/img/resize/73a6f654a7f5dd5cfc8e3389ab98f6a3dc1aafce/2024/03/25/49237a5b-9c57-4f0a-b810-21a85165bfeb/5penguinsflyinggettyimages-520459992.jpg?auto=webp&fit=crop&height=675&width=1200,2024-03-25 00:00:00,Innovation,Innovation
https://venturebeat.com/ai/pure-storage-nvidia-partner-to-democratize-ai-with-new-infrastructure-solutions/,"Pure Storage, Nvidia partner to democratize AI with new infrastructure solutions","Join us in Boston on March 27 for an exclusive event focused on data integrity and networking with leaders in the Gen AI enterprise. This is a great opportunity to gain insights and engage in conversations surrounding this important topic. Request an invite to secure your spot.

Pure Storage, a renowned provider of advanced data storage technology and services, recently unveiled a suite of new AI infrastructure solutions and validated reference architectures in collaboration with Nvidia at the GTC conference. These offerings are aimed at empowering enterprises with the necessary tools to effectively manage high-performance data and compute requirements for successful AI deployments.

Miroslav Klivansky, the Global Practice Leader for AI and Analytics at Pure Storage, recently sat down with VentureBeat to discuss the strengthened partnership between Pure Storage and Nvidia and its potential impact on the adoption of artificial intelligence by enterprises. This partnership comes at a critical time when businesses across various industries are increasingly embracing AI to drive innovation, optimize operations, and gain a competitive edge. However, many AI deployments are currently scattered across fragmented data environments, which can impede the full realization of AI's potential. Pure Storage and Nvidia are determined to address this challenge head-on.

Klivansky highlighted the long-standing partnership between Pure Storage and Nvidia, stating, ""In 2018, in collaboration with Nvidia, we launched AIRI, the first AI-ready infrastructure reference architecture. This architecture was purpose-built to enable organizations to achieve better utilization and uptime, and ultimately scale their AI investments without complexity. Since then, Pure Storage has been among the first enterprise data storage vendors to become Nvidia DGX BasePOD certified.""

The collaboration between Pure Storage and Nvidia is an ongoing and collaborative effort that aims to support enterprise AI deployments. Pure Storage, as a leader in AI, along with Nvidia, is equipping global customers with proven solutions to address their high-performance data and compute requirements. These solutions enable faster model training and inference, greater operational efficiency, and lower total cost and energy requirements.

One of the key solutions unveiled at the GTC conference was the Retrieval Augmented Generation (RAG) Pipeline for AI Inference. This solution combines Nvidia GPUs for compute with Pure Storage's all-flash enterprise storage. By leveraging Pure Storage's data storage infrastructure, customers can enhance standard large language models (LLMs) with custom corporate data. This enhancement provides greater relevance, accuracy, and currency to chatbots, all while avoiding the significant investment required to build custom large language models.

Pure Storage also achieved Nvidia OVX Server Storage certification, which is a significant milestone announced at the GTC conference. This certification offers customers flexible storage reference architectures that have been validated against key benchmarks. These architectures provide a robust infrastructure foundation for cost and performance-optimized AI hardware and software solutions.

With the Nvidia OVX Server Storage validation, Pure Storage can now offer enterprise customers and channel partners flexible storage reference architectures. These architectures have been validated against key benchmarks, ensuring a strong foundation for cost and performance-optimized AI hardware and software solutions. The OVX computing platforms are powered by Nvidia L40s GPUs, which means that customers now have the freedom to choose from a range of validated reference architectures from Pure Storage, with greater compute GPU platform options and availability.

Klivansky emphasized the unique advantages of Pure Storage's solution, stating, ""What sets Pure's solution apart from competitors is our data storage platform, which is optimized for AI workloads. Pure's FlashBlade//S offers leading performance, operational efficiency, energy and cost savings, and a reliable, future-proof storage foundation that can adapt to changing AI data requirements.""

In addition to the broader AI infrastructure solutions, Pure Storage and Nvidia are also focusing on developing vertical-specific AI applications. The first of these applications is a Financial RAG using FinGPT, which has been designed specifically for the finance industry. The finance industry presents numerous AI use cases for large enterprises, and Pure Storage and Nvidia are committed to addressing the unique needs of this sector.

The collaboration between Pure Storage and Nvidia represents a significant milestone in the advancement of AI infrastructure solutions. By providing enterprises with proven frameworks and solutions, this partnership is empowering businesses to unlock the full potential of artificial intelligence. The future of AI deployment looks promising, thanks to the innovative offerings from Pure Storage and Nvidia.",https://venturebeat.com/wp-content/uploads/2024/03/ps_evergreen_post_5-1.png?w=1200&strip=all,2024-03-25 19:40:23,Innovation,Innovation
