Link,post_title,post_content,featured_image,Date-Publish,post_category,post_tag
https://techcrunch.com/2024/03/25/fisker-nissan-deal-dead-funding-bankruptcy/,"Fisker loses potential Nissan deal, putting rescue funds at risk","The negotiations between Fisker and a major automaker have come to an end, putting the company's near-term rescue funding effort at risk. Fisker announced in a regulatory filing that the automaker terminated the negotiations on March 22, but did not provide a reason for the decision. The negotiations were a closing condition for a potential $150 million convertible note, and Fisker will now be seeking a waiver from the unnamed investor to proceed with the funding. This news had a significant impact on Fisker's stock, causing a 28% drop and leading to a trading halt.

This latest development adds to the growing concerns surrounding Fisker, particularly with regards to the sales performance of its Ocean SUV. The company has struggled to meet its own sales targets and has encountered various quality problems with the cars that have been delivered. Internal documents suggest that Fisker has faced difficulties in addressing these issues.

To compound matters, Fisker recently laid off 15% of its workforce and reported having only $121 million in its bank account. The company has suspended production and warned investors that it will not survive without a fresh injection of cash within the next year. While Fisker has held talks with other automakers, including Mazda, it appears that only Nissan was still considering a potential collaboration.

In response to the termination of negotiations with Nissan, Fisker has stated that it is exploring other options for a strategic partnership. These alternatives include potential restructurings in or out of court, capital market transactions, debt refinancings, equity issuances, asset sales, and other strategic measures. Fisker is determined to find a solution that will ensure its survival and future success.

It is clear that Fisker is currently facing significant challenges. However, the company remains determined to find a way forward and is actively exploring various options. With its focus on electric vehicles, Fisker has the potential to make a significant impact in the automotive industry. The coming months will be crucial for the company as it seeks to secure the necessary funding and partnerships to continue its operations and achieve its goals.","https://techcrunch.com/wp-content/uploads/2024/03/GettyImages-1236611991.jpg?resize=1200,759",2024-03-25 13:52:11,Innovation,Innovation
https://www.forbes.com/sites/traversmark/2024/03/25/a-psychologist-explores-3-silver-linings-of-parentification-of-kids/,A Psychologist Explores 3 Silver Linings Of ‘Parentified’ Kids,"A child that grows up too quickly can flourish in unexpected ways. Meet Emma, a 16-year-old girl who finds herself taking on the role of caregiver for her younger brothers due to her parents' long working hours. Not only does she have to manage household chores and responsibilities, but she is also dragged into her parents' arguments about finances. This experience is known as ""parentification,"" where children are burdened with caregiving responsibilities beyond their developmental stage.

Parentification often arises from disturbed family dynamics, working parents, or illness within the family. It can have negative consequences, such as distress and a loss of childhood innocence. However, there are potential benefits for parentified children in supportive environments. A study conducted in 2023 revealed that fairness, appreciation, validation, positive relationships with parents, and community support can lead to positive outcomes for these children.

Let's explore three positive outcomes that parentified children can experience in a supportive environment.

1. A Wide and Strong Social Circle
Despite the overwhelming responsibilities they face, parentified children can still cultivate healthy relationships with their parents. African American youth, for example, have been found to improve their relationships with their parents by meeting the emotional needs of the family. The support network surrounding these children plays a significant role in fostering positive relationships. Siblings of children with autism spectrum disorder, for instance, experienced improved relationships when consistent social support was available. Strengthened bonds between siblings facilitate empathy, understanding, acceptance, emotional connections, and a propensity for social support.

2. Extraordinary Resilience and Sense of Responsibility
Parentified children develop resilience as they navigate challenges typically reserved for adults. College students who have experienced parentification have been found to score high on resilience. They learn adaptability and composure under pressure. In addition, assuming adult roles prematurely equips them with a heightened sense of responsibility. They become adept at managing household tasks, caring for siblings, and providing emotional support to family members. Despite the challenges, they emerge with a deep understanding of accountability and a strong work ethic, which can serve as a foundation for future success.

3. Elevated Self-Esteem and Self-Efficacy
Parentification can contribute to a positive self-view as children successfully perform parental responsibilities. Research shows that parentified children exhibit higher levels of self-esteem when they perceive the benefits of parentification and have positive relationships with their siblings. These benefits include deriving enjoyment from their role, feeling appreciated, and sensing that their family functions effectively as a team. Receiving gratitude from family members boosts their confidence and sense of worth. Furthermore, children build their self-esteem through identification with their assigned role, carrying out their responsibilities, and experiencing self-approval. In a supportive family environment, children willingly embrace their roles to maintain attachments with their busy parents. The identification and subsequent benefits gained from parentification can be seen as an adaptive defense mechanism.

In conclusion, while parentification may impose burdens on children, it can also lead to unexpected positive outcomes in supportive environments. Parentified children can develop strong social circles, extraordinary resilience, a sense of responsibility, elevated self-esteem, and self-efficacy. It is crucial for families and communities to recognize and support these children, ensuring their well-being and allowing them to thrive.","https://imageio.forbes.com/specials-images/imageserve/6601106cc11f7d8efb9a0826/0x0.jpg?format=jpg&crop=1483,695,x0,y169,safe&height=900&width=1600&fit=bounds",2024-03-25 14:26:02,Innovation,Innovation
https://techcrunch.com/2024/03/25/spotify-throws-its-hat-in-the-edtech-ring/,Spotify throws its hat in the edtech ring,"Welcome back to Equity, the podcast that delves into the business side of startups, where we delve into the numbers and intricacies behind the headlines. In today's episode, we have a lot of ground to cover. Global stocks are experiencing a decline, but the crypto market is showing some promising gains. One of the major news stories in the startup world is the departure of Stability AI's CEO. The company's revenue growth and burn rate have been topics of discussion, making this leadership change significant.

Moving on to the EU, several U.S.-based tech companies are now under investigation due to the implementation of the new Digital Markets Act. It raises questions about whether tech giants will be able to establish a more productive relationship with the bloc.

Speaking of Europe, Spotify is making another foray into non-musical endeavors, and I have a few thoughts on that. We also discuss some news from China regarding their plans to adopt the Vision Pro next and their efforts to replace Intel and AMD chips in state computers. Lastly, we explore a report on how beverage startups are vying for market share against industry giants Coca-Cola and Pepsi.

For those interested in episode transcripts and more, you can visit Equity's Simplecast website. Remember, new episodes of Equity are released every Monday, Wednesday, and Friday at 7 a.m. PT. Be sure to subscribe to us on popular podcast platforms such as Apple Podcasts, Overcast, and Spotify. Additionally, TechCrunch offers an excellent crypto-focused show that features interviews with founders and more.

With so much happening in the startup world, it's important to stay informed. Tune in to Equity for insightful discussions and analysis on the latest developments.","https://techcrunch.com/wp-content/uploads/2024/02/GettyImages-1783835425-crop.jpg?resize=1200,675",2024-03-25 14:22:20,Innovation,Innovation
https://www.zdnet.com/article/what-is-ai-heres-everything-you-need-to-know-about-artificial-intelligence/,What is AI? Everything to know about artificial intelligence,"'ZDNET Recommends': What exactly does it mean?

When you come across the phrase 'ZDNET Recommends', you may wonder what it entails. Allow me to clarify its meaning for you.

At ZDNET, our recommendations are not made haphazardly. We pride ourselves on conducting extensive testing, research, and comparison shopping before providing any recommendations. We invest numerous hours in gathering data from reliable sources such as vendor and retailer listings, as well as other relevant and independent review sites. Additionally, we dive into customer reviews to understand what truly matters to individuals who have already purchased and utilized the products and services we are assessing.

It is important to note that when you click through from our site to a retailer and proceed to make a purchase, we may earn affiliate commissions. Rest assured, this does not impact the content we cover, how we cover it, or the price you pay. Neither ZDNET nor the author receive compensation for these independent reviews. We maintain a strict adherence to guidelines that ensure our editorial content remains unbiased and uninfluenced by advertisers.

At ZDNET, our editorial team acts as your advocate. We aim to provide you, our esteemed reader, with the most accurate information and the most knowledgeable advice. Our primary goal is to assist you in making informed and intelligent buying decisions, not only regarding tech gear but also a wide range of products and services. To ensure the highest standards are met, our editors meticulously review and fact-check every article we publish. If we happen to make an error or present misleading information, rest assured that we will promptly correct or clarify the article. We value accuracy and transparency in our content.

We also welcome your assistance in maintaining the integrity of our content. If you spot any inaccuracies in our articles, we kindly request that you report them to us using the form provided. Your feedback is invaluable in helping us uphold our commitment to excellence.

At ZDNET, our mission is to empower you, the reader, with the information necessary to make well-informed purchasing decisions. We strive to be your trusted source for reliable and unbiased recommendations. Rest assured that each and every piece of content we produce is carefully crafted to meet the highest standards of accuracy and integrity.

Thank you for choosing ZDNET as your go-to resource for expert advice and recommendations. We are here to serve you and look forward to continuing our journey together.",https://www.zdnet.com/a/img/resize/55a40497249ba30536e06678ecd61b31986788bb/2023/04/12/532c92c3-6621-46a2-86d9-b022809c4a12/how-to-use-chatgpt.jpg?auto=webp&fit=crop&height=675&width=1200,2024-03-25 08:03:00,Innovation,Innovation
https://www.zdnet.com/article/upgrade-to-windows-11-pro-for-just-25-right-now/,Upgrade to Windows 11 Pro for just $25 right now,"'ZDNET Recommends': What exactly does it mean?

When it comes to making informed purchasing decisions in the world of technology and beyond, ZDNET has got you covered. Our team of experts invests countless hours in testing, researching, and comparing products and services to provide you with reliable recommendations. But what exactly does it mean when we say 'ZDNET Recommends'?

To ensure that our recommendations are as accurate and trustworthy as possible, we gather data from a variety of reliable sources. This includes analyzing vendor and retailer listings, as well as consulting other relevant and independent review sites. Additionally, we dive into the realm of customer reviews to gain insights from real people who have already experienced and utilized the very products and services we are evaluating.

Now, you may be wondering, how does ZDNET benefit from these recommendations? It's a fair question. We are proud to disclose that when you click through from our site to a retailer and make a purchase, we may earn affiliate commissions. These commissions help support our work and allow us to continue providing you with valuable content. However, it is important to note that this does not impact the coverage of our reviews, nor does it affect the price you pay. Rest assured that our editorial content remains completely unbiased and uninfluenced by advertisers.

At ZDNET, our primary focus is you, our reader. We strive to deliver the most accurate information and the most knowledgeable advice to empower you in making smarter buying decisions. Our dedicated editorial team meticulously reviews and fact-checks every article to ensure that our content meets the highest standards. We take great pride in maintaining the integrity of our work, and if we do make an error or publish misleading information, we are committed to correcting or clarifying the article accordingly.

We also value your input and engagement. If you happen to come across any inaccuracies or mistakes in our content, we encourage you to report them through our dedicated form. Your feedback is invaluable to us, and we appreciate your assistance in upholding the quality and accuracy of our articles.

In conclusion, when you see 'ZDNET Recommends,' you can trust that it represents a thorough and unbiased evaluation of products and services. Our goal is to equip you with the knowledge needed to make informed decisions in the ever-evolving world of technology and beyond. We thank you for your continued support and look forward to being your trusted source for recommendations.",https://www.zdnet.com/a/img/resize/210bc66f7f72578d128c268bf78cbcf817209402/2023/10/03/e02665e0-f9de-434f-99f7-45a3cde856fa/windowspro-stack-social.jpg?auto=webp&fit=crop&height=675&width=1200,2024-03-25 10:30:00,Innovation,Innovation
https://techcrunch.com/2024/03/25/dma-first-formal-probes/,"Apple, Google and Meta face first formal investigations under EU's DMA","The European Union has recently announced a series of investigations on Big Tech companies under the Digital Markets Act (DMA). Alphabet/Google, Apple, and Meta are the first to face formal non-compliance investigations under the EU's new competition rulebook.

Alphabet/Google's rules on steering in Google Play and its approach to self-preferencing in search results are under scrutiny. The EU is also investigating Apple's rules on steering in the App Store and the design of choice screens for alternatives to its Safari web browser. Additionally, Meta's ""pay or consent"" model will be examined by the Commission.

A total of five investigations were announced on Monday, less than three weeks after the compliance deadline for these companies. The three gatekeepers, designated under the pan-EU market power and contestability regulation, are facing formal investigations to determine whether they are breaching the rulebook, as suspected by the Commission. Violations of the DMA can result in fines of up to 10% of global annual turnover, or even 20% for repeat offenses.

The EU has up to 12 months to conclude the investigations, with a preliminary report expected within six months. However, the duration of the probes may vary from these guidelines.

This enforcement action by the EU comes as antitrust scrutiny on these three US firms continues to increase domestically as well.

Criticism has emerged regarding the companies' DMA compliance plans, suggesting that they do not comply with the new EU law. Google has been accused of attempting to bypass the regulation's ban on self-preferencing by introducing new rich features in search results that unfairly compete with rivals. Apple's use of notifications warning users about risks outside its walled garden has been criticized as ""scare screens"" by developers. Meta's ""pay or be tracked"" tactic has been condemned as exploitative abuse by privacy and consumer rights groups.

The Commission has expressed concerns about Alphabet and Apple's measures relating to their obligations pertaining to app stores. The DMA requires gatekeepers to allow app developers to ""steer"" consumers to offers outside their app stores, free of charge. The Commission is concerned that the steering measures implemented by Alphabet and Apple may not be fully compliant, as they impose various restrictions and limitations. For example, developers may face constraints on their ability to freely communicate, promote offers, and directly conclude contracts.

Regarding Google's self-preferencing, the EU investigation will focus on Google's vertical search services, such as Google Shopping, Google Flights, and Google Hotels, and the impact they have on similar rival services. The Commission is concerned that Alphabet's measures to comply with the DMA may not ensure fair and non-discriminatory treatment of third-party services featured on Google's search results page, as required by the DMA.

The EU will also examine Apple's compliance with user choice obligations on iOS, including the ability to easily uninstall apps, change default settings, and select alternative default services such as browsers or search engines. The Commission is concerned that Apple's measures, including the design of the web browser choice screen, may be preventing users from exercising their choice of services within the Apple ecosystem.

Regarding Meta, the EU proceedings will investigate whether its ""pay or consent"" model for EU users complies with the DMA. This portion of the regulation requires gatekeepers to obtain consent from users when combining or cross-using their personal data across different core platform services. The Commission is concerned that Meta's binary choice model may not provide a real alternative if users do not consent, thus failing to prevent the accumulation of personal data by gatekeepers.

During a press conference, Thierry Breton, the EU's internal market commissioner, emphasized that the DMA requires gatekeepers to offer a free, non-preferential choice to users.

In conclusion, the European Union has launched investigations on Alphabet/Google, Apple, and Meta under the DMA to determine if they are breaching the rulebook. These investigations will assess various aspects of their operations, including steering, self-preferencing, user choice obligations, and personal data usage. The EU aims to ensure fair competition and protect user rights within the digital markets.","https://techcrunch.com/wp-content/uploads/2022/05/GettyImages-1031626648.jpg?resize=1200,799",2024-03-25 12:10:10,Innovation,Innovation
https://techcrunch.com/2024/03/25/london-regtech-gss-raises-47m-to-help-banks-screen-for-global-sanctions/,London regtech GSS raises $47M to help banks screen for global sanctions,"Global Screening Services (GSS), a London-based regulatory compliance platform, has recently secured $47 million in funding. The increase in economic sanctions, particularly from the United States, has created a demand for services that help financial institutions meet their global sanctions obligations.

GSS was initially incubated within consulting firm AlixPartner, where its co-founder and CEO, Tom Scampion, previously served as the head of financial crime for Deloitte’s EMEA arm. In 2021, GSS became a standalone entity, raising a significant amount of funding from prominent investors such as Mitsubishi UFJ Financial Group (MUFG) and the Commonwealth Bank of Australia (CBA), along with support from Cynosure Group and AlixPartner.

Financial institutions often find themselves at the forefront of sanctions enforcement, given their role in managing the flow of money worldwide. However, determining the parties involved in financial transactions can be challenging. In recent years, major banks like Standard Chartered and BNP Paribas have faced substantial fines for breaching sanctions and lacking adequate money-laundering controls.

As a result, investors have shown increasing interest in regulatory compliance businesses. Companies like Droit and SteelEye have also secured significant funding to support their efforts in this field.

GSS offers a sanctions-screening platform that enables banks and other financial institutions to comply with regulations. By inputting transaction data into GSS's cloud-based platform, institutions can receive alerts if any matches are found against a standardized set of sanctions lists from around the world. GSS also enriches these lists with additional data points, including dates of birth, International Maritime Organization (IMO) numbers for ships, and data from the financial transfer systems of sanctioned countries.

Furthermore, GSS provides enhanced screening lists that include companies partially owned by entities that have been sanctioned by organizations such as OFAC, the EU, or the U.K.

With the recent funding, GSS is now transitioning from the development phase to becoming fully operational. The company is preparing to go live with its first customers, offering them a reliable and efficient solution for meeting their global sanctions obligations.

In conclusion, GSS's successful funding round highlights the increasing importance of regulatory compliance in the face of rising economic sanctions. As financial institutions seek to navigate complex international regulations, platforms like GSS provide essential tools to ensure compliance and mitigate the risks associated with sanctions violations. With its innovative approach and substantial financial backing, GSS is poised to make a significant impact in the industry as it moves forward with its operational plans.","https://techcrunch.com/wp-content/uploads/2024/03/GettyImages-1770041999-e1711386339681.jpg?resize=1200,677",2024-03-25 18:36:37,Innovation,Innovation
