Link,post_title,post_content,featured_image,Date-Publish,post_category,post_tag
https://www.zdnet.com/article/five-linux-file-and-folder-management-commands-you-need-to-know/,Five Linux file and folder management commands you need to know,"Linux is a versatile operating system with a wide range of commands that users can utilize for various tasks. While there are over 1,000 basic commands, this number significantly increases when you migrate to the desktop environment. For instance, on Pop!_OS, there are 1,615 commands in /usr/bin and 609 in /usr/sbin, totaling more than 2,000 commands to choose from.

However, throughout your experience with Linux, you will likely only use a small percentage of these commands. This is particularly true when it comes to file and folder management, as the number of commands required for these tasks is relatively limited.

In a previous article, I listed the essential five Linux commands for file and folder management that every user should learn. These commands are an excellent starting point for beginners. However, there are additional commands that can further enhance your Linux skills. In this article, I will introduce you to the next five Linux commands that you should learn.

1. mkdir
The mkdir command allows you to create a new directory, also known as a ""folder."" To use this command, simply type ""mkdir"" followed by the name of the folder you wish to create. For example, if you want to create a folder named ""FOLDER,"" the command would be:
mkdir FOLDER

This command will create a new folder within the directory you are currently working in. Suppose you are in the ""~/Documents"" directory and want to create a folder named ""TEST"" in the root of your home directory. In that case, you can run the following command:
mkdir ~/TEST

But what if you want to create ""~/TEST/project1"" but haven't created the ""TEST"" folder yet? In such cases, you can use the ""-p"" option to create nested directories. For example:
mkdir -p ~/TEST/project1

This command will first create the ""TEST"" folder and then create the ""project1"" folder inside it.

2. less
The less command is used to view the contents of a file. It is particularly useful when you want to view large files without overwhelming your terminal. To use this command, simply type ""less"" followed by the path to the file you want to view. For example, if you want to view the contents of ""/etc/samba/smb.conf,"" the command would be:
less /etc/samba/smb.conf

What sets less apart is that it displays the file one page at a time, allowing you to scroll through it and view it line by line. This feature is beneficial when you only need to view the file and don't require any editing.

3. cat
The cat command is used for concatenating files and displaying their contents in the terminal. Unlike less, you cannot scroll through the output of cat unless your terminal window supports it. To view the contents of a file using cat, simply type ""cat"" followed by the path to the file. For example, to view the contents of ""/etc/fstab,"" you can use the following command:
cat /etc/fstab

Additionally, cat is useful for appending the content of one file to another. Suppose you have two files, ""file1.txt"" and ""file2.txt,"" located in ""TEST/project1."" If you want to append the content of ""file1.txt"" to the end of ""file2.txt,"" you can use the following command:
cat TEST/project1/file1.txt >> TEST/project1/file2.txt

This command will append the content of ""file1.txt"" to the end of ""file2.txt.""

4. touch
The touch command is simple yet essential. It allows you to create an empty file. To create a file using touch, simply type ""touch"" followed by the desired filename. For example:
touch filename

Although touch's primary purpose is to change file timestamps, most users employ it to create empty files. Here's an example of how it works:
1. Create an empty file: touch ~/test
2. Add content to the new file: echo ""New Content"" > ~/test
3. Append more content to the file: echo ""More Content"" >> ~/test

It's important to note the difference between the "">"" and "">>"" operators. The "">"" operator overwrites the content in the file, while "">>"" appends the new text to the end of the file.

5. pwd
While the cd command allows you to navigate the Linux filesystem hierarchy, there may come a time when you need to know your current directory, and the terminal does not provide any clues. This is where the pwd command comes in handy. Pwd stands for ""print working directory"" and displays the name of the current working directory. For example, if you are in ""/var/www/html/site1"" and you issue the command ""pwd,"" you will see ""/var/www/html/site1"" printed out. Although you may not need to use pwd frequently, it is a helpful command to determine your current location when necessary.

By familiarizing yourself with these five additional Linux commands, you will have a solid foundation for efficient file and folder management. Combine these commands with the previous five I mentioned in my previous article, and you will be well-equipped to navigate the Linux environment.

In conclusion, Linux offers a vast array of commands, and while it can be overwhelming, learning a few essential commands can significantly enhance your productivity. Whether you need to create directories, view file contents, concatenate files, create empty files, or determine your current directory, these commands will serve as valuable tools in your Linux journey. So, embrace the power of Linux and master these commands to unlock its full potential.",https://www.zdnet.com/a/img/resize/73a6f654a7f5dd5cfc8e3389ab98f6a3dc1aafce/2024/03/25/49237a5b-9c57-4f0a-b810-21a85165bfeb/5penguinsflyinggettyimages-520459992.jpg?auto=webp&fit=crop&height=675&width=1200,2024-03-25 00:00:00,Innovation,Innovation
https://techcrunch.com/2024/03/25/lucid-motors-1-billion-saudi-arabia-gravity-suv/,Lucid Motors raises another $1 billion from Saudi Arabia as it searches for luxury EV buyers,"Lucid Motors, the luxury electric sedan manufacturer, is securing an additional $1 billion in funding from its largest financial supporter, Saudi Arabia. The investment will help alleviate the high costs associated with the production and sale of its vehicles.

According to a regulatory filing made on Monday, Ayar Third Investment, an affiliate of Saudi Arabia's Public Investment Fund, has agreed to purchase $1 billion worth of Lucid's stock, increasing the Kingdom's current ownership stake of approximately 60%.

This recent funding comes shortly after Lucid informed investors that it intends to manufacture approximately 9,000 of its Air electric vehicles this year, a slight increase from the previous year's output. Despite generating a loss of $2.8 billion in 2023, the company ended the year with nearly $1.4 billion in cash and equivalents.

Lucid has faced challenges in finding buyers for its expensive Air sedan and has responded by reducing prices multiple times in recent months to stimulate sales. Additionally, the company plans to commence production of its electric Gravity SUV by the end of this year.

The announcement of this investment follows CEO Peter Rawlinson's cautionary statement to the Financial Times less than three weeks ago. Rawlinson expressed his wariness about relying too heavily on Saudi Arabia for continuous financial support, emphasizing the need for prudence. He stated, ""If I adopt a mindset that there is bottomless wealth from PIF, that is very dangerous, that is something I will never do, I respect them far too much for that.""

With the new investment from Saudi Arabia, Lucid Motors aims to strengthen its financial position and advance its mission of producing high-quality electric vehicles. This funding will enable the company to navigate the challenges associated with manufacturing and selling luxury electric sedans.

By securing additional funding, Lucid can continue to invest in research and development, enhance its production capabilities, and expand its market reach. The financial support from Saudi Arabia reaffirms their belief in the potential of Lucid Motors and their commitment to sustainable transportation.

Despite facing hurdles in the form of a competitive market and the need to establish a strong customer base, Lucid remains optimistic about its future prospects. The investment from Saudi Arabia not only provides financial stability but also serves as an endorsement of Lucid's vision and capabilities.

Lucid's CEO, Peter Rawlinson, has emphasized the importance of not solely relying on a single source of funding, highlighting the need for diversification to ensure long-term success. This approach demonstrates Lucid's commitment to responsible financial management and its determination to build a sustainable business model.

As the company moves forward, Lucid plans to capitalize on the growing demand for electric vehicles and expand its product portfolio. The upcoming production of the Gravity SUV showcases Lucid's commitment to innovation and meeting the evolving needs of consumers.

With the financial backing of Saudi Arabia, Lucid Motors is well-positioned to overcome current challenges and achieve its goals. The company's dedication to producing high-quality electric vehicles, combined with its focus on sustainable practices, sets it apart in the competitive automotive industry.

In conclusion, Lucid Motors' recent $1 billion funding from Saudi Arabia's Public Investment Fund reaffirms the Kingdom's confidence in the company and its commitment to sustainable transportation. This financial support will enable Lucid to overcome challenges, expand its market presence, and continue producing cutting-edge electric vehicles. With its vision, dedication, and strong financial backing, Lucid is poised to make a significant impact on the future of the automotive industry.","https://techcrunch.com/wp-content/uploads/2021/09/IMG_2580.jpg?resize=1200,675",2024-03-25 14:31:52,Innovation,Innovation
https://techxplore.com/news/2024-03-semiconductors-scale-processor-remarkable-speedup.html,Semiconductors at scale: New processor achieves remarkable speedup in problem solving,"Annealing processors are specialized for solving combinatorial optimization problems and have applications in various fields such as logistics, resource allocation, and drug discovery. The scalability of these processors is directly influenced by the complexity of their coupling.

In a recent study led by Professor Takayuki Kawahara from Tokyo University of Science, researchers have successfully developed and tested a scalable annealing processor. This processor divides the calculation into multiple LSI chips, allowing for larger-scale systems. The team presented their innovation at the IEEE 22nd World Symposium on Applied Machine Intelligence and Informatics (SAMI 2024) on January 25, 2024.

Prof. Kawahara explains that their goal is to achieve advanced information processing directly at the edge, without relying on the cloud. In 2020, Tokyo University of Science introduced a unique processing architecture that enabled the creation of a fully coupled LSI on a single chip using 28nm CMOS technology. They also developed a scalable method with parallel-operating chips and demonstrated its feasibility using FPGAs in 2022.

The scalable annealing processor developed by the team consists of 36 22nm CMOS calculation LSI chips and one control FPGA. This technology allows for the construction of large-scale, fully coupled semiconductor systems based on the Ising model with 4096 spins. The processor incorporates two technologies developed at Tokyo University of Science: the ""spin thread method"" that enables 8 parallel solution searches, and a technique that reduces chip requirements by about half compared to conventional methods. It operates at a modest power consumption of 2.9W (1.3W for the core part) and operates at 10MHz.

In terms of power performance ratio, the processor outperforms simulating a fully coupled Ising system on a PC using annealing emulation by 2,306 times. It also surpasses the core CPU and arithmetic chip by 2,186 times. This successful machine verification suggests the potential for enhanced capacity.

Prof. Kawahara envisions the social implementation of this technology, including initiating business ventures, joint research efforts, and technology transfer. The team aims to develop this technology further to achieve an LSI system with the computing power of a 2050-level quantum computer for solving combinatorial optimization problems. They aim to achieve this using current semiconductor processes without requiring additional infrastructure.

In conclusion, the researchers have developed a scalable annealing processor with 4096 spins on a single board using 36 CMOS chips. Key innovations, such as chip reduction and parallel operations for simultaneous solution searches, have played a crucial role in this development. The successful machine verification opens up possibilities for future advancements and the creation of new digital industries.",https://scx2.b-cdn.net/gfx/news/hires/2024/semiconductors-at-scal.jpg,2024-03-25 13:50:03,Innovation,Innovation
https://techcrunch.com/2024/03/25/spotify-throws-its-hat-in-the-edtech-ring/,Spotify throws its hat in the edtech ring,"Welcome back to Equity, the podcast that delves into the numbers and nuances behind startup news. In today's episode, we'll be covering a range of topics, from the global stock market downturn to the recent success of cryptocurrencies. We'll also be discussing the departure of Stability AI's CEO, a move that has significant implications for the company's future.

But first, let's turn our attention to the EU, where several US-based tech companies are under investigation due to the new Digital Markets Act. This raises questions about the relationship between these tech giants and the European bloc, and whether they can find a more harmonious way of working together.

Shifting gears, let's talk about Spotify's latest venture. Surprisingly, it's not related to music. I have some interesting thoughts on this non-musical endeavor and what it means for the company's future direction.

In other news, China is set to launch the Vision Pro, a new product that has garnered a lot of attention. Additionally, the country is making a concerted effort to remove Intel and AMD chips from state computers. These developments highlight China's growing technological prowess and its desire to become a global leader in the industry.

Lastly, we'll discuss a report detailing how beverage startups are challenging the dominance of industry giants like Coke and Pepsi. This battle for market share is an intriguing one, and it will be interesting to see how these startups fare in their quest to disrupt the beverage industry.

For those interested in episode transcripts and more, please visit Equity's Simplecast website.

Don't forget to tune in to Equity, available on Apple Podcasts, Overcast, Spotify, and all major podcast platforms. And if you're interested in cryptocurrency, be sure to check out TechCrunch's fantastic show, which features interviews with founders and industry experts.

We hope you enjoy today's episode. Stay tuned for more insightful discussions on the business of startups.","https://techcrunch.com/wp-content/uploads/2024/02/GettyImages-1783835425-crop.jpg?resize=1200,675",2024-03-25 14:22:20,Innovation,Innovation
https://www.forbes.com/sites/traversmark/2024/03/25/3-motivations-behind-cosplaying-according-to-a-psychologist/,"3 Motivations Behind ‘Cosplaying,’ According To A Psychologist","Cosplay: Embracing Self-Expression, Escaping Reality, and Building Community

Have you ever experienced the thrill of dressing up as a famous character for Halloween? If so, you may have caught a glimpse of the excitement that comes with embodying someone else, even if it's just for one night. But for some individuals, dressing up as fictional characters is more than just a once-a-year event - it's a way of life. Welcome to the world of cosplay, a vibrant subculture where people don elaborate costumes, embrace fictional personas, and transform themselves into their favorite characters.

Cosplay, short for ""costume play,"" involves individuals dressing up as characters from various forms of media, including comic books, anime, manga, video games, movies, and television shows. It's an opportunity for fans to immerse themselves in the worlds of their beloved franchises and express their passion for these fictional universes. From superheroes like Superman, Batman, and Spider-Man, to iconic characters from Disney, Harry Potter, and Star Wars - the possibilities are endless.

But cosplay is more than just putting on a costume. It's about meticulous attention to detail, from recreating the costumes and hairstyles to mastering the makeup and accessories. Cosplayers strive for accuracy and authenticity, aiming to bring their chosen characters to life. It's not just about the physical appearance; it's about embodying the personality, mannerisms, and unique traits of the character being portrayed.

So why do people cosplay? Research has shown that there are three main reasons behind this passionate pursuit.

Firstly, cosplay provides a platform for creative self-expression. Authentic self-expression has been linked to greater life satisfaction, and cosplay allows individuals to celebrate their favorite fandoms and express their love for fictional characters and stories. For many cosplayers, it's a means of exploring different facets of their identity. By embodying different characters, they can experiment with personas and aspects of themselves that they may not feel comfortable expressing in their everyday lives.

A study published in the journal Fashion Theory in 2015 examined the cosplay subculture in Hong Kong and highlighted the role of identity transformation in pursuing cosplay. Cosplay allows enthusiasts to momentarily change their identity, creating an exciting and contented self. It's a chance to be a superhero, a performer, or even recapture the innocence of childhood. Cosplaying empowers individuals by allowing them to choose their identity and take on new roles, boosting their confidence and fulfilling their dreams.

Secondly, cosplay offers an escape from reality. In a world filled with stress and uncertainty, stepping into the shoes of a beloved character provides a temporary reprieve. Cosplayers can transcend the confines of their everyday lives and become anyone or anything they desire. It's a chance to experience adventure, excitement, wonder, and popularity that may be lacking in their mundane routines.

A study conducted in 2018 found that one of the strongest motivations for engaging in cosplay is the desire to escape from everyday life. By immersing themselves in their favorite fantastical worlds, cosplayers can fulfill dreams, pleasures, romances, and fantasies that may not be achievable in reality. For a brief moment, they can feel like stars or celebrities, recognized, photographed, and admired. Cosplay becomes not just a hobby, but a form of performance and exhibition that satisfies the longing for recognition and appreciation.

Lastly, cosplay fosters a sense of community. Apart from escaping reality, a fundamental motivation behind cosplaying is the need for belongingness. Conventions and gatherings serve as communal spaces where cosplayers can come together, share their passion, and forge lasting friendships. These events provide a platform for cosplayers to connect with like-minded individuals who understand their love for cosplay and the worlds they inhabit. It's a chance to bond over shared interests, exchange tips and tricks, and inspire one another's creativity.

In conclusion, cosplay is more than just a hobby or a form of dress-up. It's a way for individuals to express their creativity, escape from the stresses of everyday life, and connect with a community of like-minded enthusiasts. By donning elaborate costumes and embodying their favorite characters, cosplayers can become the best version of themselves. They embrace self-expression, explore new identities, and find solace and camaraderie in a world that celebrates their passion for all things fictional. So next time you see someone in an incredible costume, remember that behind the mask is a person who has found a unique way to celebrate their favorite stories and become a part of something truly extraordinary.","https://imageio.forbes.com/specials-images/imageserve/6601ac3a0b7231e5ced958f7/0x0.jpg?format=jpg&crop=2613,1224,x0,y80,safe&height=900&width=1600&fit=bounds",2024-03-25 19:30:41,Innovation,Innovation
https://techxplore.com/news/2024-03-pairing-crypto-green-hydrogen-energy.html,"Pairing crypto mining with green hydrogen offers clean energy boost, study suggests","Pairing cryptocurrency mining, known for its high carbon emissions, with green hydrogen technology could be a key solution for advancing renewable energy, according to a recent study by Cornell University. The study, titled ""Climate Sustainability Through a Dynamic Duo: Green Hydrogen and Crypto Driving Energy Transition and Decarbonization,"" explores the potential of combining energy-intensive cryptocurrency mining with green hydrogen to boost renewable energy sectors.

Cryptocurrency mining operations currently contribute significantly to global carbon emissions. As we strive towards a sustainable and climate-friendly future, it is crucial to find ways to harness the enthusiasm for cryptocurrency while minimizing its environmental impact. Professor Fengqi You, an expert in energy systems engineering at Cornell, emphasizes the importance of exploring opportunities for a more sustainable energy landscape.

The research conducted by Professor You and doctoral student Apoorv Lal highlights the benefits of linking cryptocurrency mining with green hydrogen technology. They refer to this combination as the ""dynamic duo"" that can accelerate the adoption of renewable energy. By using clean energy sources to power blockchain mining operations and produce green hydrogen, we can increase wind and solar capacity and expand sustainable energy production across the country.

The current structure of cryptocurrency mining in the United States alone consumes as much carbon-based energy as the entire country of Argentina, as reported by the White House Office of Science and Technology. The electricity consumption of cryptocurrency mining is driven by computer-intensive consensus mechanisms, known as ""proof of work,"" used to verify crypto-assets. Preliminary estimates from the U.S. Energy Information Administration suggest that cryptocurrency mining could represent 0.6% to 2.3% of all U.S. electricity consumption in 2023.

Acknowledging the substantial energy demands of cryptocurrency mining, Professor You proposes an innovative technology solution. By utilizing cryptocurrencies as virtual energy carriers alongside green hydrogen, we can transform the environmental challenge posed by cryptocurrency into a driving force for climate mitigation and sustainability.

To assess the potential energy strengths of individual U.S. states, Professor You and Lal examined various regions. Their findings indicate that supporting cryptocurrency can expedite the development of additional energy infrastructure. For example, mining one Bitcoin in New Mexico could potentially generate 78.4 megawatt hours of solar power, while mining one Bitcoin in Wyoming could potentially produce 265.8 megawatt hours of wind power.

Cryptocurrency holds an energy value similar to a gift card concept, according to Professor You. It is a virtual asset that can contribute to the energy system. By advancing sustainable practices for blockchain-based cryptocurrency, we can pave the way for a renewable energy transition. However, this endeavor requires stronger federal policies that align with climate goals and promote renewable energy.

By combining cryptocurrency mining with green hydrogen, we not only mitigate the environmental impact of cryptocurrency but also pioneer a sustainable path for renewable energy. This novel strategy, as proposed by Professor You, has the potential to revolutionize the cryptocurrency industry and contribute to a more sustainable and climate-friendly future.

Professor Fengqi You is a senior faculty fellow at the Cornell Atkinson Center for Sustainability, and his expertise in energy systems engineering makes him a key voice in advancing renewable energy solutions. Together with Apoorv Lal, they present a compelling case for the integration of cryptocurrency and green hydrogen technology to drive the energy transition towards a more sustainable future.",https://scx2.b-cdn.net/gfx/news/hires/2023/cryptocurrencies.jpg,2024-03-25 15:00:02,Innovation,Innovation
