Link,post_title,post_content,featured_image,Date-Publish,post_category,post_tag
https://techcrunch.com/2024/03/25/fisker-trading-suspended-by-nyse/,Fisker trading suspended by NYSE,"The New York Stock Exchange (NYSE) made an announcement on Monday that it will suspend trading shares of electric vehicle (EV) startup Fisker and is taking steps to remove the company from its stock exchange. The NYSE stated that Fisker's stock is no longer suitable for listing due to abnormally low price levels. This decision follows a warning from the NYSE last month that Fisker's stock price had been trading below $1 for 30 consecutive days, which is not in compliance with the exchange's rules.

Fisker has the opportunity to review the NYSE's determination, but in a filing made on Monday afternoon, the company stated that it expects its stock to be moved to an over-the-counter market such as OTC Pink. Additionally, the delisting has triggered repayment clauses in two outstanding loans that Fisker is currently unable to afford, which could have a significant negative impact on the business.

This suspension of trading marks the end of a tumultuous day for Fisker, as its shares fell more than 28% before trading was halted. Earlier in the day, Fisker announced the loss of a potential deal with a major automaker, rumored to be Nissan. This development has also put in jeopardy a recently announced attempt to secure emergency funding.

Fisker did not provide an explanation for why the automaker terminated the negotiations, which was a critical condition for closing a potential $150 million convertible note that was announced last week. In the filing, Fisker stated that it will request the unnamed investor to waive the closing condition.

Fisker has been facing a series of problems for several months, including customer complaints, lawsuits, and federal investigations. The troubled EV startup has struggled to sell its Ocean SUV, falling short of its own sales goals. In January, TechCrunch reported that Fisker had shifted from a direct sales model to utilizing dealerships to boost sales. The company has also grappled with quality issues that it has had difficulty resolving, according to internal documents.

In February, Fisker laid off around 200 employees, which accounted for 15% of its workforce. Last week, the company reported having only $121 million in cash reserves and announced a production pause. Fisker has warned investors that it will not survive another year without a fresh injection of funds.

It is important to note that the information provided in this article has been updated to include details from Fisker's SEC filing on Monday afternoon.","https://techcrunch.com/wp-content/uploads/2024/03/fisker-GettyImages.jpg?resize=1200,800",2024-03-25 21:06:18,Innovation,Innovation
https://techcrunch.com/2024/03/25/maju-kuruvilla-is-out-as-ceo-of-one-click-checkout-company-bolt/,Maju Kuruvilla is out as CEO of one-click checkout company Bolt,"Bolt, the one-click checkout company, has announced a change in leadership. Maju Kuruvilla, the former CEO, has been replaced by Justin Grooms, who previously served as Bolt's global head of sales. Grooms will now take on the role of interim CEO, according to his LinkedIn profile.

Kuruvilla confirmed the change on both LinkedIn and X, simply stating, ""One-Click Checkedout from @bolt! Onwards,"" accompanied by a rocket emoji. Although he did not provide further comments, Arjun Sethi, a co-founder of venture firm Tribe Capital, expressed admiration for Kuruvilla in a comment on his LinkedIn post.

The decision to remove Kuruvilla from his position was made by the Bolt board over the weekend, as reported by The Information. Kuruvilla, a former executive at Amazon, took over as CEO in January 2022 after founder Ryan Breslow stepped down.

Grooms, who has been with Bolt for five years, previously held executive positions at companies such as Ultraleap (formerly Leap Motion), Datron World Communications, and Qualcomm, as stated on his LinkedIn profile. Bolt informed The Information that the CEO role had changed and described Kuruvilla's departure as ""amicable,"" without providing further details.

Bolt has had its fair share of controversies. The company was founded by Breslow, then 27 years old, after dropping out of Stanford. Breslow was known for his outspoken rants. In an interview with TechCrunch, Breslow mentioned that Bolt had signed significant deals in the second half of 2021, surpassing any previous deals in the company's history.

However, Bolt faced challenges, including a federal probe involving Breslow's potential violation of securities laws during the company's fundraising efforts in 2021. Bolt was seeking a $355 million Series E round that valued the company at $11 billion. In total, the company raised approximately $1 billion in venture-backed funding.

Bolt also experienced several rounds of layoffs, including one in May 2022, where about 185 employees, or one-third of the workforce, were let go. Additional layoffs occurred in early 2023 and December 2023, affecting 29% of the staff.

In October, when Kuruvilla was still CEO, he informed TechCrunch that the SEC was no longer investigating Bolt. He also mentioned that the company was working towards profitability and had plans to introduce new features, such as improving merchandise returns and providing personalized experiences for its universal shopper network. Bolt announced partnerships with retailers like Saks OFF 5TH, Shinola, Filson, Lafayette 148, and Toys ""R"" Us in November.

Recently, Bolt signed an exclusive deal with Checkout.com, becoming Checkout.com's preferred payment partner and providing one-click checkout services.

For more fintech news, you can sign up for TechCrunch Fintech. If you have any tips or suggestions, you can reach out to us at maryann@techcrunch.com or chall.techcrunch@gmail.com, or send us a message on Signal at 408.204.3036. You can also contact the entire TechCrunch team at tips@techcrunch.com. For more secure communications, you can click here to contact us, which includes SecureDrop and links to encrypted messaging apps.","https://techcrunch.com/wp-content/uploads/2022/05/Headshot_Maju-Kuruvilla_CEO-of-Bolt-1.jpg?resize=1200,813",2024-03-25 21:15:07,Innovation,Innovation
https://techcrunch.com/2024/03/25/elon-musk-x-ccdh-california-lawsuit-dismissed/,A judge just killed Elon Musk's lawsuit against an anti-hate research org,"Federal Judge Dismisses Lawsuit by Elon Musk and X Against Nonprofit Researching Online Hate

In a recent development, a federal judge has ruled against Elon Musk and X, dismissing their lawsuit against the Center for Countering Digital Hate (CCDH). The lawsuit, filed last year, accused the nonprofit organization of spreading misleading claims through a series of reports on hate and extremism on the platform. Musk and X claimed that they suffered significant financial losses as a result of the CCDH's research.

Additionally, Musk and X alleged that the CCDH engaged in illegal data scraping and violated the platform's rules by aggregating content using a third-party social media monitoring tool called Brandwatch. Musk, who played a personal role in directing the lawsuit, went as far as calling the CCDH ""an evil propaganda machine"" in his replies on X.

Last year, the CCDH filed a motion to strike X's claims under California's law against Strategic Lawsuit Against Public Participation (SLAPP), which aims to prevent baseless lawsuits intended to intimidate. The CCDH also requested the judge to dismiss the lawsuit. Imran Ahmed, CEO of the CCDH, accused Musk of intentionally prolonging the legal process to drive up the organization's legal costs, highlighting Musk's considerable net worth of around $200 billion.

On Monday, United States District Judge Charles R. Breyer granted the CCDH's motion to dismiss the case. Judge Breyer also denied Musk and X the opportunity to reopen the case for further litigation.

In his ruling, Judge Breyer stated, ""Sometimes it is unclear what is driving a litigation, and only by reading between the lines of a complaint can one attempt to surmise a plaintiff's true purpose. Other times, a complaint is so unabashedly and vociferously about one thing that there can be no mistaking that purpose."" He further expressed that X Corp.'s intention was to punish the CCDH for its critical publications about X Corp. and potentially discourage others from engaging in such criticism.

Following Musk's increased activity on Twitter, the CCDH drew attention to the rise of hate speech on the platform. One report explored how Musk's decision to unban several highly followed extremists could potentially boost the company's ad revenue. Notably, the report highlighted the inclusion of Andrew Anglin, an infamous neo-Nazi who created the white supremacist website, the Daily Stormer.

The CCDH, established in 2018, focuses on researching trends in hate speech, extremism, and misinformation on major social networks. Its research regularly exposes disturbing content across various platforms, such as reports on eating disorder content on TikTok, climate denial on YouTube, and violent misogynistic threats on Instagram.

In response to the ruling, CCDH CEO Imran Ahmed said, ""We create costs for lies and hate."" He emphasized the importance of holding social media companies accountable for decisions that impact children, democracy, and fundamental human rights and civil liberties. The CCDH's legal team included Roberta Kaplan, who recently achieved a significant victory against former President Donald Trump in the E. Jean Carroll defamation suit. Kaplan commented on the ruling, stating, ""Today's decision proves that even the world's wealthiest man cannot bend the rule of law to his will.""

While the CCDH celebrates its victory in California, it is worth noting that Musk is pursuing a similar lawsuit against the left-leaning media watchdog Media Matters for America. However, unlike the CCDH case, X is suing Media Matters for America in Texas, which does not offer the same protections against frivolous lawsuits aimed at stifling free speech as California does.","https://techcrunch.com/wp-content/uploads/2023/08/twitter-x-logo-musk-pattern.jpg?resize=1200,675",2024-03-25 20:33:17,Innovation,Innovation
