Link,post_title,post_content,featured_image,Date-Publish,post_category,post_tag
https://techcrunch.com/2024/03/25/london-regtech-gss-raises-47m-to-help-banks-screen-for-global-sanctions/,London regtech GSS raises $47M to help banks screen for global sanctions,"Global Screening Services (GSS), a London-based regulatory compliance platform, has recently secured $47 million in funding. The company specializes in helping financial institutions meet their global sanctions requirements in light of the increasing number of economic sanctions being imposed by countries such as the United States against nations like Russia, China, and Iran.

GSS was founded by Tom Scampion, who previously served as the head of financial crime for Deloitte's EMEA arm. After leaving Deloitte in 2020, Scampion became a general partner at consulting firm AlixPartner, where GSS was initially developed before becoming an independent entity in 2021.

Last year, GSS raised a similar amount of funding from prominent investors, including Japan's Mitsubishi UFJ Financial Group. The latest funding round saw the Commonwealth Bank of Australia (CBA), Cynosure Group, and AlixPartner joining as backers.

Financial institutions, particularly banks, often face challenges in enforcing sanctions due to their role in overseeing global money flows. However, it can be difficult to track and identify the parties involved in financial transactions. For instance, Standard Chartered was fined $1.1 billion in 2019 by U.K. and U.S. regulators for inadequate money-laundering controls and breaching sanctions against countries like Iran. Similarly, BNP Paribas was fined a staggering $8.9 billion several years prior for processing financial transactions for U.S.-sanctioned countries.

The increasing demand for regulatory compliance solutions has led to continued investment in businesses like GSS. For instance, New York-based Droit raised $23 million last year, while London's SteelEye secured $21 million in financing.

GSS offers a sanctions-screening platform to assist financial institutions in meeting regulatory requirements. These institutions input transaction data into GSS's cloud-based platform, which compares the data against a standardized set of sanctions lists from around the world. GSS also enriches these lists with additional data points, including dates of birth, International Maritime Organization (IMO) numbers for ships, and data from the local financial transfer systems of sanctioned countries.

In addition, GSS provides enhanced lists for screening, which include companies with partial ownership by individuals, entities, or governments that have been sanctioned by organizations such as OFAC, the EU, or the U.K.

With the recent funding, GSS is now transitioning from the development phase to full operation, as it prepares to onboard its first customers and go live with its services.

In conclusion, GSS has raised $47 million in funding to further develop its regulatory compliance platform for financial institutions. The company aims to help these institutions meet their global sanctions obligations in an increasingly complex regulatory landscape. With its advanced screening platform and enhanced data lists, GSS is well-positioned to support banks and other financial organizations in ensuring compliance and preventing financial crime.","https://techcrunch.com/wp-content/uploads/2024/03/GettyImages-1770041999-e1711386339681.jpg?resize=1200,677",2024-03-25 18:36:37,Innovation,Innovation
https://www.forbes.com/sites/lesliekatz/2024/03/25/artists-get-early-access-to-openais-sora-video-tool-with-surreal-results/,OpenAI Gave Artists Early Access To Sora. See The Videos They Created,"OpenAI's new generative AI tool, Sora, has sparked the creativity of artists, designers, and filmmakers. With the ability to produce videos up to a minute long from a single text prompt, Sora has opened up new possibilities for surreal and imaginative creations. One such creation is the short film ""Air Head"" by Toronto-based multimedia production company Shy Kids. In this film, a man with a balloon for a head navigates the joys and challenges of his unique situation. Despite the whimsical nature of the film, it highlights a deeper message about the fragility of life.

Sora is still in the testing phase, but early access to the tool has allowed artists like Alexander Reben and Josephine Miller to explore their creativity in new ways. Reben, OpenAI's first artist in residence, praises Sora for its ability to help bring ideas to life, while Miller, the creative director of Oraar Studio, emphasizes how Sora has challenged and evolved her storytelling process.

The short films created with Sora showcase a range of imaginative worlds. Miller's film transports viewers to a dreamy subaquatic realm where humans gracefully float in garments adorned with fish-like scales. The boundary between reality and imagination is blurred, allowing for limitless possibilities. Don Allen Stevenson III, the creator of another Sora film, describes the tool as unlocking a world of instant visualization and rapid prototyping. With Sora, he was able to shift his focus from technical hurdles to pure creativity.

Nik Kleverov, co-founder and creative director of Native Foreign, shares how Sora has already transformed his approach to agency work and personal projects. It has allowed him to explore original concepts that were previously constrained by budget and resources. His Sora film takes viewers on a captivating journey through different time periods and visual styles, seamlessly blending the past, present, and future.

The excitement surrounding Sora is not without its concerns. Some worry about the potential theft of artists' work to train AI datasets, while others fear that AI algorithms will replace human creativity altogether. However, the artists who have had early access to Sora are overwhelmingly positive about its potential. They see it as a tool that enhances their creative process and allows for rapid iteration and exploration.

In conclusion, Sora is a powerful tool that has sparked the imaginations of artists, designers, and filmmakers. Its ability to generate surreal and imaginative videos from a single text prompt has opened up new possibilities for creative expression. While there are still improvements to be made, Sora has already shown its potential in helping creatives bring their ideas to life. With Sora, the only limit is the artist's imagination.","https://imageio.forbes.com/specials-images/imageserve/660206f5826dc2b2a5012a5a/0x0.jpg?format=jpg&crop=1530,918,x225,y165,safe&height=900&width=1600&fit=bounds",2024-03-25 19:50:18,Innovation,Innovation
