Link,Title,Text,Image,Date Publish
https://techcrunch.com/2023/10/17/hoxton-ventures-shoots-for-the-big-time-luring-bryan-gartner-from-khosla-ventures/,"Hoxton Ventures shoots for the big time, luring Bryan Gartner from Khosla Ventures","Everyone more or less agrees that 2023 is going to be effectively written off in VC-land, as the feeding frenzy of the last few years leaves everyone exhausted, valuations flattened or crashed, and exit market remain more or less closed.
VCs appear to be using this period to get their house in order for the next cycle. We’ve already witnessed General Catalyst using this down-time to scoop up a Seed arm in Europe; another Euro VC spend ‘quality time’ with their LPs to raise another fund; and former bystanders, use it to jump on the AI hype cycle.
Why not use it to expand your partnership, right?
To that end, Hoxton Ventures has now managed to lure former Bryan Gartner, Partner at Khosla Ventures, to join as Partner.
Gartner formerly worked on venture growth-stage investments at the VC, but he’ll be refreshing his memory of early-stage investing now he’s at Hoxton.
Over an interviewed, he admitted it’d also a career move based on his personal life: “I have a very international family. My wife is actually British, so [moving] was always on the cards…but we weren’t thinking this quickly. When I was introduced to Hussein through one of the Hoxton portfolio companies, I noticed immediately the transparent nature and the mutual respect among the partnership. A complete lack of ego in the room which you know, frankly, is a breath of fresh air. And it felt to me that there’s an inflection point that Hoxton is about to hit, and I’m thrilled to be to be part of that story.”
About his time at Khosla, he told me: “There’s there’s a dichotomy between the firm’s that truly work deeply with their portfolio companies and those that don’t… It’s not really about the board meeting. It’s about the calls you make, the meetings leading up to the board meeting. And I’ve always really enjoyed that. I’ve got a bunch of stories in my track record that weren’t obvious wins and then became 9, 10, 11x returns, because of really rolling up sleeves and plugging in and that’s what excites me in this industry. And that’s what I saw at Hoxton.”
Hoxton’s early stage credentials in Europe include a 60-strong portfolio which includes a number of successful companies including Darkrace, Deliveroo, Preply, Spacelift, and TourRadar, as well newer investments such as Avantia, Lumi, and XYZ Reality.
Hussein Kanji, partner, Hoxton Ventures said in a statement: “Bryan is an experienced investor, having seen companies go from their early formation to exit and IPO. His late stage skill set will provide us with a new strength around the table.”
He added over a call: “We’ve been intentionally thinking about expanding and building up the partnership. We started alongside Seedcamp, Connect Ventures, and a bunch of others pioneering investing in Europe, and I think we’ve gone into a really good ‘boutique mode’. But I think we’re trying to make another transition now.”
He said Hoxton is growign: “We’ve become much more of a firm and an institution, kind of in the same journey as Index Ventures in the 90s went from a small shop and became the powerhouse that it is today. And if you’re going to do that, you’ve got to hire really great people. So Brian is part of that. And we’re probably going to try and do this one or two more times.”
In March 2022, Hoxton Ventures closed a $215 million new fund, Hoxton III.
Gartner has 16 years of experience in venture capital. He was a Vice President at Insight Venture Partners, where he invested in companies that include AdColony, which was acquired by Opera for $350 million, Alteryx (IPO’d), Fenergo (acquired by Astorg and Bridgepoint for $600M), Pluralsight (acquired by Vista for $3.5B), Smartsheet (IPO’d), and Udemy (IPO’).
After Insight Venture Partners, he joined join Apax, where he invested in Wizeline, which was acquired by CDPQ for ~$450M. He was also a Partner role at Sidewalk Infrastructure Partners. He was previously a Partner at Khosla Ventures for two years.
Hoxton’s investments include Finesse, Giraffe360, Inflow, Really Clever, Peptone, Universal Quantum and XYZ Reality.",https://techcrunch.com/wp-content/uploads/2023/10/Bryan-Gartner-Hoxton-Ventures.jpg?w=762,2023-10-17 12:40:10
https://techcrunch.com/2023/10/17/amazon-passkey-sign-in/,"Amazon quietly rolls out support for passkeys, with a catch","Amazon has quietly rolled out support for passkeys as it becomes the latest tech giant to join the passwordless future. But you still might have to hold onto your Amazon password for a little while longer.
The option to set up a passkey is now available on the e-commerce giant’s website, allowing users to log in using biometric authentication on their device, such as their fingerprint or face scan. Doing so makes it far more difficult for bad actors to remotely access users’ accounts, given that the attacker also needs physical access to the user’s device.
But Amazon’s implementation of passkeys isn’t without issues, as noted by Vincent Delitz, co-founder of German tech startup Corbado, who first documented the arrival of passkey support on Amazon.
Delitz noted that there is currently no support for passkeys in Amazon’s native apps, such as Amazon’s shopping app or Prime Video, which TechCrunch has also checked, meaning you still have to use a password to sign-in (for now). What’s more, if you’ve set up a passkey but previously set up two-factor authentication (2FA), Amazon will still prompt you to enter a one-time verification code when logging in, a move Delitz said was “redundant,” since passkeys remove the need for 2FA as they are stored on your device.
Amazon says on its website: “You will still need to verify a one-time code after signing in with the passkey,” but does not explain why.
It’s unclear if the requirement for 2FA codes is a temporary feature and whether Amazon plans to add passkey support to its mobile apps. It’s also not yet known if passkey support has been made available to all Amazon users, though TechCrunch has confirmed that the feature is available in the U.S., U.K., France, and Germany.
Amazon has not responded to TechCrunch’s questions.
The arrival of passkeys on Amazon lands as WhatsApp announced that it’s rolling out support for passkeys to all Android users, and just days after Google said it planned to make passkeys the default sign-in method for all Google Account holders. GitHub, Windows 11, TikTok and 1Password have all rolled out support for passkeys.","https://techcrunch.com/wp-content/uploads/2019/06/password.jpg?resize=1200,900",2023-10-17 12:05:56
https://techcrunch.com/2023/10/17/procurify-lands-fresh-cash-to-invest-in-ai-powered-tools-for-procurement/,Procurify lands fresh cash to invest in AI-powered tools for procurement,"Roughly eight years ago, a little-known startup called Procurify raised $4 million for its platform that hosts tools to take some of the pain out of enterprise procurement.
The company never became buzzy, exactly. But Procurify grew steadily over the subsequent years, going on to raise $20 million in its Series B and today closing a $50 million Series C funding round led by Ten Coves Capital with participation from Export Development Canada, Canada’s export credit agency.
Procurify, which is based in Vancouver, Canada (hence the investment from the EDA), was co-founded by Aman Mann (the CEO), Eugene Dong (the CTO) and Kenneth Loi (the former CCO). The trio began working on the idea for the company in Dong’s parents’ basement after meeting in British Columbia Institute of Technology’s business management program in 2011.
“We recognized a gap in the procurement market for affordable, easy-to-use procurement software,” Mann told TechCrunch in an email interview. “In virtually every industry, organizations are struggling with a lack of real-time spend visibility and control.”
To Mann’s point, according to a recent Statista survey, hundreds of companies engaging in business-to-business procurement — i.e. finding, agreeing to terms and purchasing goods and services from a third party — admit to struggling with compliance processes, complex approval processes and purchasing systems and reconciling invoices in a timely manner.
So how does Procurify help? By consolidating various procurement steps in one place, mainly.
Procurify offers modules to manage purchasing, accounts payable (i.e. money owed to suppliers) and data analytics. Using the platform, customers can reallocate procurement spend and adjust forecasts, identify bottlenecks in “procure-to-pay” workflows and perform supplier analyses to inform future procurement decisions.
Procurify also leverages AI, detecting anomalies in purchase orders or invoices to flag them for review.
“In today’s post-pandemic economy, industries are grappling with layoffs, disrupted supply chains and rising operational costs,” Mann said. “The need for responsible spend controls and clear financial oversight is more pressing than ever.”
Procurify competes with incumbents (Coupa, SAP Ariba), enterprise resource management software with procurement management features (NetSuite) and upstarts (Precoro, Zip) in the over-$6.1 billion procurement software segment.
The startup appears to be doing well for itself, though, with a customer base of over 700 companies, a 100% year-over-year increase in sales and plans to invest heavily in bringing new AI capabilities to market.
“Procurify helps organizations bring more spend under management, thereby consolidating spend data from our customers’ procure-to-pay workflows to provide a complete picture of expenditures before they’re committed,” Mann said. “By harnessing the power of this comprehensive spend data and integrating it with AI models, enterprises could unearth opportunities for process optimization, manage risks and achieve cost efficiencies.”
Procurify, which has a team of just over 170 employees, has raised a total of $70 million in venture capital to date. In addition to AI R&D, Mann says that the proceeds from the Series C will be put toward general expansion and launching new payment features.","https://techcrunch.com/wp-content/uploads/2022/09/GettyImages-931203582.jpg?resize=1200,800",2023-10-17 12:00:48
https://techcrunch.com/2023/10/17/reality-defender-raises-15m-to-detect-text-video-and-image-deepfakes/,"Reality Defender raises $15M to detect text, video and image deepfakes","Reality Defender, one of several startups developing tools to attempt to detect deepfakes and other AI-generated content, today announced that it raised $15 million in a Series A funding round led by DCVC with participation from Comcast Ventures, Ex/ante, Parameter Ventures and Nat Friedman’s AI Grant.
The proceeds will be put toward doubling Reality Defender’s 23-person team into the next year and improving its AI content detection models, according to co-founder and CEO Ben Colman.
“New methods of deepfaking and content generation will consistently appear, taking the world by surprise both through spectacle and the amount of damage they can cause,” Colman told TechCrunch in an email interview. “By adopting a research-forward mindset, Reality Defender can stay several steps ahead of these new generation methods and models before they appear publicly, being proactive about detection instead of reacting to what just appears today.”
Colman, a former Goldman Sachs VP, launched Reality Defender in 2021 alongside Ali Shahriyari and Gaurav Bharaj. Shahriyari previously worked at Originate, a digital transformation tech consulting firm, and the AI Foundation, a startup building AI-powered animated chatbots. Bharaj was a colleague of Shahriyari’s at the AI Foundation, where he led R&D.
Reality Defender began as a nonprofit. But, according to Colman, the team turned to outside financing once they realized the scope of the deepfakes problem — and the growing commercial demand for deepfake-detecting technologies.
Colman’s not exaggerating about the scope. DeepMedia, a Reality Defender rival working on synthetic media detection tools, estimates that there’s been three times as many video deepfakes and eight times as many voice deepfakes posted online this year compared to the same time period in 2022.
The rise in the volume of deepfakes is attributable in large part to the commoditization of generative AI tools.
Cloning a voice or creating a deepfake image or video — that is, an image or video digitally manipulated to convincingly replace a person’s likeness — used to cost hundreds to thousands of dollars and require data science know-how. But over the last few years, platforms like the voice-synthesizing ElevenLabs and open source models such as Stable Diffusion, which generates images, have enabled malicious actors to mount deepfake campaigns at little to no cost.
Just this month, users on the notorious chat board 4chan leveraged a range of generative AI tools, including Stable Diffusion, to unleash a blitz of racist images online. Meanwhile, trolls have used ElevenLabs to imitate the voices of celebrities, generating audio ranging in content from memes and erotica to virulent hate speech. And state actors aligned with the Chinese Communist Party have generated lifelike AI avatars portraying news anchors, commenting on topics such as gun violence in the U.S.
Some generative AI platforms have implemented filters and other restrictions to combat abuse. But, as in cybersecurity, it’s a cat and mouse game.
“Some of the greatest risk from AI-generated media stems from use and abuse of deepfaked materials on social media,” Colman said. “These platforms have no incentive to scan deepfakes because there’s no legislation requiring them to do so, unlike the legislation forcing them to remove child sexual abuse material and other illegal materials.”
Reality Defender purports to detect a range of deepfakes and AI-generated media, offering an API and web app that analyze videos, audio, text and images for signs of AI-driven modifications. Using “proprietary models” trained on in-house data sets “created to work in the real world and not in the lab,” Colman claims that Reality Defender is able to achieve a higher deepfake accuracy rate than its competitors.
“We train an ensemble of deep learning detection models, each of which focuses on its own methodology,” Colman said. “We learned long ago that not only does the single-model, monomodal approach not work, but neither does testing for accuracy in a lab versus real-world accuracy.”
But can any tool reliably detect deepfakes? That’s an open question.
OpenAI, the AI startup behind the viral AI-powered chatbot ChatGPT, recently pulled its tool to detect AI-generated text, citing its “low rate of accuracy.” And at least one study shows evidence that deepfake video detectors can be fooled if the deepfakes fed into them are edited in a certain way.
There’s also the risk of deepfake detection models amplifying biases.
A 2021 paper from researchers at the University of Southern California found that some of the data sets used to train deepfake detection systems might under-represent people of a certain gender or with specific skin colors. This bias can be amplified in deepfake detectors, the coauthors said, with some detectors showing up to a 10.7% difference in error rate depending on the racial group.
Colman stands behind Reality Defender’s accuracy. And he asserts the company actively works to mitigate biases in its algorithms, incorporating “a wide variety accents, skin colors and other varied data” into its detector training data sets.
“We’re always training, retraining and improving our detector models so they fit new scenarios and use cases, all while accurately representing the real world and not just a small subset of data or individuals,” Colman said.
Call me cynical, but I’m not sure if I buy those claims without a third-party audit to back them up. My skepticism isn’t impacting Reality Defender’s business, though, which Colman tells me is quite robust. Reality Defender’s customer base spans governments “across several continents” as well as “top-tier” financial institutions, media corporations and multinationals.
That’s despite competition from startups like Truepic, Sentinel and Effectiv, as well as deepfake detection tools from incumbents such as Microsoft.
In an effort to maintain its position in the deepfake detection software market, which was valued at $3.86 billion in 2020, according to HSRC, Reality Defender plans to introduce an “explainable AI” tool that’ll let customers scan a document to see color-coded paragraphs of AI-generated text. Also on the horizon is real-time voice deepfake detection for call centers, to be followed b ay real-time video detection tool.
“In short, Reality Defender will protect a company’s bottom line and reputation,” Colman said. “Reality Defender uses AI to fight AI, helping the largest entities, platforms and governments determine whether a piece of media is likely real or likely manipulated. This helps combat against fraud in the finance world, prevent the dissemination of disinformation in media organizations and prevent the spread of irreversible and damaging materials on the governmental level, just to name three out of hundreds of use cases.”","https://techcrunch.com/wp-content/uploads/2023/07/GettyImages-1463459171.jpg?resize=1200,800",2023-10-17 12:00:27
https://techcrunch.com/2023/10/17/nova-credit-lands-45m-in-funding-to-grow-its-cross-border-and-alternative-data-credit-products/,Nova Credit lands $45M to grow its cross-border and alternative data credit products,"Moving from one country to another is difficult in many ways, not the least of which involves starting over financially.
Nova Credit, which started out as a graduate research project out of Stanford University about seven years ago, was founded to help immigrants overcome the obstacles of applying for things like apartments or loans with no credit history in the U.S.
“We realized that half of the graduate student population of any university consists of international students – and if you go and ask them about their experience with financial services, you’ll hear some version of the same story – ‘I can’t get credit or I can’t get a credit card. Or I need to go ask my classmate to co-sign for an apartment or cell phone plan,’ ” said Misha Esipov, CEO and founder of Nova Credit.
With that Credit Passport product, Nova has connectivity into credit bureau data from other parts of the world through its APIs. Nova launched that product with American Express and then added dozens of institution partners over the years, such as HSBC,Scotiabank, Verizon and Earnest. (Nova Credit emerges embedded within those institutions’ applications).
It works in 20 countries outside of the U.S. as well. If a person from the U.S. moves to London or Singapore, for example, they can get approved for banking products internationally in those markets through Nova.
In recent years, the startup also has expanded beyond its flagship Credit Passport product to also offer anyone – not just immigrants – the ability to use alternative data for credit but providing access to their bank account. That product, dubbed Cash Atlas, is cash flow underwriting product that allows anyone with a U.S. bank account to allow the information – such as rent payment history or direct deposit of paychecks – inside those accounts to be used to help them apply for credit. It is aimed at the tens of millions of people that are “effectively locked out of the U.S. financial system,” Esipov said.
“We’ve started to expand from a single product company to a multi-product company and platform…Our strategy is to evolve into a more data analytics company that serves not only people that are new to this country, but frankly any customer segment and plugging the gaps in this antiquated traditional credit reporting industry which doesn’t do well for serving customers who are new to credit,” Esipov told TechCrunch in an interview.
Today, Nova is announcing that it has raised $45 million in Series C funding, additional capital that it plans to use toward expanding its product offering and geographically, Esipov told TechCrunch exclusively. The round came together “in a matter of weeks,” he said.
Canapi Ventures led the round, which included participation from existing backers Kleiner Perkins, General Catalyst, Index Ventures and Y Combinator as well as new investors such as Avid Ventures, Geodesic Capital, Harmonic Capital, Radiate Capital, and Socium Ventures (Cox Enterprises).
The raise marks the company’s first external round of financing since February 2020, which makes it a bit of an outlier in the fintech space, which experienced a major funding boom in 2020 and 2021. At that time, Nova raised $50 million in a financing that reportedly gave it a valuation of $295 million after its first close.
Esipov declined to disclose Nova’s current valuation, saying only that the company was “xxxx happy” He also declined to reveal hard revenue figures, saying only that the company has grown its revenues by 10x since that 2020 funding round and that it more than tripled its data transaction volumes since the start of 2023.
Nova has remained relatively lean, with about 100 employees. It does plan to do some more hiring with its new capital. It also plans to take its Credit Passport business global – having already launched in markets such as Canada, the United Kingdom, the United Arab Emirate and Singapore. The company is also planning to invest in its Cash Atlas product and developing more new products.
For now, Nova’s Passport product provides the majority of the company’s revenue but Atlas “is growing even more quickly on a percentage basis right now.” Esipov said the company has invested “heavily” in information security and compliance since it was a seed-stage company.
The executive projects that the company will reach profitability in the relatively near future, possibly as early as next year. It opted not to raise more capital – in fact less than its last round – to avoid taking on “unnecessary dilution,” he added.
Jeffrey Reitman, general partner at Canapi Ventures, told TechCrunch he was initially attracted to Nova’s mission of enabling newcomers and thin-file consumers the ability to have fair access to financial products. Canapi first invested in the company in the Series B round and is impressed with “the explosive growth” it has displayed since.
“Many of our banking LPs are in active dialogues with Nova Credit to leverage their products to better serve their customers and that also nicely aligns with the mission here at Canapi,” he said.
Nova, Reitman added, “has amassed more collective access to international credit data than any one of the major credit bureaus and that makes for a very valuable proposition for its customers.”
Want more fintech news in your inbox? Sign up for The Interchange here.","https://techcrunch.com/wp-content/uploads/2020/09/GettyImages-a0146-000299-e1646928299148.jpg?resize=1200,799",2023-10-17 12:00:15
