Link,Title,Text,Image,Date Publish
https://www.innovationnewsnetwork.com/oral-peptides-a-new-era-in-drug-development/41404/,Oral peptides: A new era in drug development,"Researchers from the laboratory of Professor Christian Heinis at EPFL have achieved a significant milestone in drug development through oral peptides.
The research opens the door to oral peptides, a new class of orally available drugs, addressing a long-standing challenge in the pharmaceutical industry.
The research, ‘De novo development of small cyclic peptides that are orally bioavailable,’ is published in Nature Chemical Biology.
“There are many diseases for which the targets were identified, but drugs binding and reaching them could not be developed,” explained Professor Heinis.
“Most of them are types of cancer, and many targets in these cancers are protein-protein interactions that are important for the tumour growth but cannot be inhibited.”
Cyclising breakthrough in oral peptides
The study focused on cyclic peptides, which are versatile molecules known for their high affinity and specificity in binding challenging disease targets.
At the same time, developing cyclic oral peptides has proven difficult because they are rapidly digested or poorly absorbed by the gastrointestinal tract.
The research team targeted the enzyme thrombin, which is a critical disease target because of its central role in blood coagulation. Regulating thrombin is key to preventing and treating thrombotic disorders like strokes and heart attacks.
To generate cyclic oral peptides that can target thrombin and are sufficiently stable, the scientists developed a two-step combinatorial synthesis strategy to synthesise a vast library of cyclical peptides with thioether bonds, which enhance their metabolic stability when taken orally.
Heinis said: “We have now succeeded in generating cyclic peptides that bind to a disease target of our choice and can also be administered orally.
“Therefore, we have developed a new method in which thousands of small cyclic oral peptides with random sequences are chemically synthesised on a nanoscale and examined in a high-throughput process.”
The two steps, one pot method
The new method process involves two steps and takes place in the same reactive container, a feature chemists call ‘one pot’.
The first step is to synthesise linear peptides, which then undergo a chemical process of forming a ring-like structure. This is done using bis-electrophilic linkers – chemical compounds used to connect two molecular groups – to form stable thioether bonds.
In the second phase, the cyclised peptides undergo acylation, which attaches carboxylic acids to them, further diversifying their molecular structure.
The technique eliminates the need for intermediate purification steps, allowing for high-throughput screening directly in the synthesis plates, combining the synthesis and screening of thousands of peptides to identify candidates with high affinity for specific disease targets – in this case, thrombin.
When tested on rats, the oral peptides showed up to 18% bioavailability, which means that when the cyclic peptide drug is taken orally, 18% of it successfully enters the bloodstream and has a therapeutic effect.
Since orally administered cyclic peptides generally show a bioavailability below 2%, increasing that number to 18% is a substantial advance for drugs in the biologics category, including peptides.
Future ambitions of this pharmaceutical breakthrough
By enabling the availability of cyclic oral peptides, the team has opened up possibilities for treating various diseases that have been challenging to address with conventional oral drugs.
The method’s versatility means it can be adapted to target a wide array of proteins, potentially leading to breakthroughs in areas where medical needs are currently unmet.
“To apply the method to more challenging disease targets, such as protein-protein interactions, larger libraries will likely need to be synthesised and studied,” explained Manuel Merz, PhD student and leader of the research.
In the next step of this project, the researchers will target several intracellular protein-protein interaction targets for which it has been difficult to develop inhibitors based on classical small molecules.
They are confident that oral peptides can be developed for at least some of them.",https://www.innovationnewsnetwork.com/wp-content/uploads/2024/01/Low-Res_Graphical_abstract_highresolution.jpg,2024-01-02 11:45:10
https://www.innovationnewsnetwork.com/nutrition-insecurity-caused-by-climate-change-to-be-reduced-with-new-policies/41405/,Nutrition insecurity caused by climate change to be reduced with new policies,"According to a new study, nutrition insecurity in sub-Saharan Africa needs to be combated with crops that are resilient to climate change.
Farmers in sub-Saharan Africa need to diversify away from growing maize and switch to crops that are resilient to climate change to increase nutrition security.
Instead of maize, farmers should begin to grow fruits, vegetables, and crops like cassava, millet, and sorghum to provide the micronutrients essential for good health.
The researchers argue that the quantity of food produced must also increase, and more land must be brought into agricultural production.
More than 50 researchers contributed to the investigation, published in the scientific journal Nature Food. The study involved talking to policymakers and other stakeholders in the food and agriculture sectors in four countries in sub-Saharan Africa: Malawi, South Africa, Tanzania, and Zambia.
Sub-Saharan Africa is at risk of food and nutrition insecurity
According to the World Bank, sub-Saharan Africa is home to 1.2 billion people. It is expected that this will rise by 740 million people by 2050.
Farmers will have to increase the amount of food grown at a time when climate change will create extreme conditions – affecting what crops can be grown.
The team believe that the population is at risk of food and nutrition insecurity unless effective ways of adapting to climate change are identified.
Professor Jennie Macdiarmid, from the Rowett Institute at the University of Aberdeen and one of the authors of the paper, said: “The study has highlighted the need to place nutrition at the heart of agricultural policy to avoid the long-term unintended consequence of failing to produce food that can deliver the nutritional needs of the population.
“If policy solutions focus only on increasing production of calories and adapting to be climate smart, it is likely there will be negative consequences for health through nutritionally poor diets.”
Creating a resilient agricultural system
Using the iFEED assessment framework, the researchers investigated policy options to create an agricultural system that is resilient to climate change and combats nutrition insecurity.
“Too often food, agriculture and nutrition policies sit in siloes across different government departments,” said Dr Jennings, a Research Fellow in the School of Earth and Environment at the University of Leeds.
“This study provides holistic evidence that combines information on the environmental impacts of food system changes and the changes needed for population-level nutrition security.
“The research shows that action can be taken to adapt to climate change and improve nutrition security in sub-Saharan Africa.”
A transformative approach is needed to incorporate nutritional needs
Stakeholders in each country found key uncertainties in the future of the food system. iFEED considers these uncertainties and identifies agricultural policies to be contemplated.
To combat nutrition insecurity, scientists argue that there needs to be a fundamental shift in agriculture.
One option is to diversify into soybean production. This is because soybean crops are more likely to withstand the impacts of climate change compared to maize.
Dr Ndashe Kapulu said: “Many countries in sub-Saharan Africa will be better able to handle climate change and other stresses if they have more diverse food systems, such as the transition to soybean production in Zambia.
“As scientists, we need to generate enough evidence in our research to help make changes that support and guide actions to make the agrifood system more resilient.”
Increasing the production of animal-based products
In sub-Saharan Africa, increasing the production and consumption of animal-based products could fight nutrition insecurity. However, the researchers argue that it should not reach the unsustainable production levels seen in higher-income countries.
An increase in animal-based products would cause a rise in greenhouse gas emissions, but this could be tolerable to reduce sub-Saharan Africa’s need to reduce the risk of nutritionally inadequate diets.",https://www.innovationnewsnetwork.com/wp-content/uploads/2024/01/©-shutterstockCreative-Nerd_1379661350-1024x576.jpg,2024-01-02 11:42:55
https://www.innovationnewsnetwork.com/uk-government-fails-to-deploy-motorway-ultra-rapid-ev-chargers/41398/,UK Government fails to deploy motorway ultra-rapid EV chargers,"Research conducted by the RAC indicates that the UK Government has fallen short of its ambitious goal of deploying rapid or ultra-rapid EV chargers across motorway services in 2023.
The target was to have six or more rapid or ultra-rapid EV chargers available at every motorway service point, yet the reality paints a different picture.
Out of the 119 motorway service areas scrutinised by the RAC using Zapmap, merely 46, accounting for 39%, have achieved the intended number of chargers exceeding 50kW – a crucial capacity to cater to the burgeoning fleet of battery-electric vehicles.
Moreover, the number of rapid or ultra-rapid EV chargers has grown from just 27 (23%) from the end of April.
The goal was imperative considering the expectation that the UK’s electric vehicle count would surpass the one million mark by the end of 2023.
UK’s roadmap for EV charging
The government’s ‘Taking Charge: the Electric Vehicle Infrastructure Strategy’ aimed to expedite high-powered charger deployment via the £950m Rapid Charging Fund.
However, delays ensued, with the announcement of a £70m grant for a pilot scheme at ten motorway service stations only in early December 2023.
While the government foresees approximately 300,000 public chargers and over 6,000 high-powered chargers along strategic roads by 2035, forecasts from the Competition and Markets Authority suggest a larger requirement of 280,000-480,000 public charge points by 2030.
Areas for improvement in UK motorway services
Although there has been a notable increase in high-powered chargers, with an additional 178 installed since spring, the progress remains insufficient. Encouragingly, more than half of the services (55%) now offer ultra-rapid EV chargers, accelerating the process for drivers.
However, concerning gaps persist. Shockingly, four service areas—Leicester Forest on both sides of the M1, Tebay South on the M6, and Barton Park on the A1(M)—lack any charging facilities. Furthermore, only 18 service areas lack rapid EV charging above 50kW.
Comparative figures between the RAC research and Zapmap’s charging statistics reveal that a mere 6% of all high-powered chargers are available at motorway services, underlining the pressing need for accelerated infrastructure development.
Simon Williams, an RAC EV spokesperson, commented: “It’s clear from our research that the government has fallen well short of its target of having six high-powered chargers at every motorway service area in England.
“While that’s the case, some very good progress has been made since the end of April when we last carried out our survey, with four-in-ten services (39%) now having met or exceeded the target number of chargers, compared to just under a quarter (23%) eight months ago.
“There is undoubtedly an eagerness among charge point companies and motorway service operators to install these types of units but unfortunately, it’s often the high-power cabling to the grid that’s the major barrier which is out of their hands.
“More clearly needs to be done to make this process simpler than it is currently. Hopefully, once the government’s Rapid Charging Fund kicks fully into action some of these hurdles will be overcome.
“We continue to believe that the wide availability of ultra-rapid charging is crucial in giving both current and future EV drivers confidence to know they can easily make journeys beyond the range of their vehicles in a time-efficient way.”
Increasing charging compatibility
The analysis also sheds light on connector types, showcasing a 48% increase in Combined Charging System (CCS) connectors and a 32% rise in CHAdeMO connectors, addressing compatibility concerns for different electric car models.
The shortfall in meeting charging infrastructure targets signals the necessity for expedited action to support the burgeoning EV landscape and provide drivers with the confidence to undertake longer journeys without concerns about charging accessibility.",https://www.innovationnewsnetwork.com/wp-content/uploads/2024/01/©-shutterstockAmani-A_1488128222.jpg,2024-01-02 10:48:00
https://www.innovationnewsnetwork.com/habitable-planets-to-be-identified-with-atmospheric-co2-levels/41386/,Habitable planets to be identified with atmospheric CO2 levels,"An international team of researchers have found that atmospheric CO2 levels hold the key to discovering habitable planets.
The team aims to find habitable planets and potentially life itself by comparing the amount of carbon dioxide in their atmosphere to neighbouring planets.
Compared to neighbouring planets, if a planet has a reduced amount of CO2 in its atmosphere, it suggests the presence of liquid water on the surface. The researchers can infer that a drop in carbon dioxide levels is a result of being dissolved into an ocean or sequestrated by planetary biomass.
The work is published in the journal Nature Astronomy.
What is the habitable zone?
Habitable planets are capable of hosting and retaining liquid water on their surfaces. If a planet is too close to its star, it is too hot, those too far away are too cold, and those in the habitable zone are just right.
The habitable zone is sometimes referred to as the Goldilocks zone.
No current method for detecting planet habitability
Although researchers have attempted to identify planets in the theoretical habitable zones of their stars, there was previously no way to find out if they had liquid water on their surfaces.
The scientific community have made great progress in defining biosignatures – chemical tracers of biological processes, but there has been no method for detecting habitable planets until now.
Devising a new habitability signature
The team came up with a habitability signature which can be used to identify whether a planet has liquid water.
Before this, scientists attempted to identify the presence of liquid water by looking at how starlight reflects off water.
However, this signature is too weak for current observatories to detect, whereas the new habitability signature can be applied with ease.
Amaury Triaud, Professor of Exoplanetology at the University of Birmingham, who co-led the study, said: “It is fairly easy to measure the amount of carbon dioxide in a planet’s atmosphere. This is because CO2 is a strong absorber in the infrared, the same property causing the current rise in global temperatures here on Earth.
“By comparing the amount of CO2 in different planets’ atmospheres, we can use this new habitability signature to identify those planets with oceans, which make them more likely to be able to support life.
“For example, we know that initially, the Earth’s atmosphere used to be mostly CO2, but then the carbon dissolved into the ocean and made the planet able to support life for the last four billion years or so.”
Dr Julien de Wit, co-leader of the study, added: “Despite early hopes, most of our colleagues had eventually come to the conclusion that major telescopes like the JWST would not be able to detect life on exoplanets. Our work brings new hope.
“By leveraging the signature of carbon dioxide, not only can we infer the presence of liquid water on a faraway planet, but it also provides a path to identify life itself.”
Providing insights into environmental tipping points
As well as being a method to identify habitable planets, the research can also be used to gain insights into environmental tipping points.
Triaud explained: “By examining the levels of CO2 in other planets’ atmospheres, we can empirically measure habitability and compare it to our theoretical expectations. This helps gather context for the climate crisis we face on Earth to find out at which point the levels of carbon make a planet uninhabitable.
“For example, Venus and Earth look incredibly similar, but there is a very high level of carbon in Venus’ atmosphere. There may have been a past climatic tipping point that led to Venus becoming uninhabitable.”
The next steps for the team
The researchers will now detect the atmospheric carbon dioxide compositions of a range of exoplanets and identify which have oceans on their surface.
The team will prioritise further observations of potentially habitable planets.",https://www.innovationnewsnetwork.com/wp-content/uploads/2024/01/©-shutterstockDarryl-Fonseka_1672248802.jpg,2024-01-02 09:45:06
https://www.innovationnewsnetwork.com/navigating-the-next-wave-of-ai-and-iot/41382/,Navigating the next wave of AI and IoT,"Jonathan Boakes, Managing Director, UK at Infinum, details how success in AI and IoT lies with a solid business strategy.
Artificial Intelligence (AI) and the Internet of Things (IoT) have become two of the most powerful digital transformation tools.
With new connected devices being developed daily, Allied Market Research forecasts the global IoT market will reach $4.4 trillion by 2026, up from $740 billion in 2020. The market for AI is also expected to show strong growth in the coming decade. Its nearly $100bn value is set to grow twentyfold by 2030, up to almost $2tr.
AI and IoT present a whole realm of opportunities, challenges and potential downfalls for businesses, so how can companies be confident that digital transformation will succeed?
AI and IoT success in practice
From the micro-sensors found within Bluetooth-connected toothbrushes to the software that powers complex manufacturing machinery on an assembly line, IoT tech is diverse and capable of processing huge amounts of data between devices.
The benefits of AI and IoT are not just about the data quantity but the capacity to collect volumes of quality data close to the source where it’s being produced. This works through IoT components that collect, process, and share data from various sources or endpoints, providing a rounded data narrative rather than one source alone.
For example, NutriU is a central hub for kitchen appliances that helps people control their smart appliances remotely through their phones, discover recipes, and receive personalised cooking recommendations in a single app. The platform’s Machine Learning-based recommendation system suggests recipes tailored to individual tastes. At the same time, its AI and IoT integration allows users to manage their Philips kitchen gadgets from anywhere, enabling convenient and customised cooking experiences. This is being used in 37 countries and 30 languages, transforming how people prepare meals and interact with their devices.
The untapped potential of AI and IoT holds promise for cost savings, personalised experiences, efficiency gains, and improved interactions for both businesses and consumers. While progress is underway in some sectors, there’s further ground to cover and opportunities to explore.
How healthcare is leading the revolution
AI and IoT are teaming up in healthcare to transform patient care, making it one of IoT’s fastest-growing sectors. Being a highly regulated and complex industry, the Internet of Medical Things (IoMT) innovation requires extensive research, testing, and adherence to strict standards for digital solutions.
Examples of IoMT are medical devices and wearables, such as those that monitor real-time health data, such as heart rate, blood pressure, body temperature, and glucose levels. Obtaining this comprehensive health data allows chronic conditions to be monitored as patients go about their daily lives.
Recent research shows 75% of healthcare leaders plan to invest in AI in the next 12 months. Given the innovations healthcare has spearheaded with IoT, this sector has enormous potential to lead the revolution with both elements of this cutting-edge tech.
Being perceptive to the AI hype
However, leaders across sectors must be wary of embracing AI and IoT without a clear strategy. Research shows that while nine out of ten CTOs plan to invest in AI within the next 12 months, nearly 75% admit they are unprepared to do so.
Aside from the obvious challenges associated with implementing a new technology that the business isn’t ready for, companies need to exercise collective caution as everyone looks to jump on the bandwagon.
When every company says they’re using AI to change their industry, it raises the risk of sky-high expectations. It becomes a recipe for customer retention problems, particularly if it fails due to a lack of understanding or poor implementation.
In 2024, businesses must not allow industry peer pressure to lead them to rush into AI for the sake of it. Experience tells us that you can either begin with a clear strategy or begin to fail.
Instead, with the right strategy and implementation, AI has the potential to be game-changing for businesses of all sizes and industries.
Tread with spirited caution
When building AI and IoT solutions, you’re not just handling the user, app, and cloud but also multiple connected devices, all exchanging information in real-time in a culmination of hardware and software. Because of this, it can be difficult for companies with legacy systems to make the transition smoothly.
Start by thinking about your users. Is your IoT solution compelling enough to cause users to switch away from their current approach to the problem? Sometimes, the dumb solution is smarter than the smart one. Does your proposed business model align with the amount and method your customer might pay?
Successful IoT implementation is a piecewise game that requires you to think around the next corner. Staying ahead of the curve in IoT means more than just keeping up with the latest trends.
It involves creating systems that are antifragile and capable of withstanding changes at a minimised change cost.
Additionally, having the means to source volumes of data is just one element. An IoT platform can bring this data to life, allowing businesses to utilise it for specific needs. These can be categorised into cloud-based, edge-based, and hybrid platforms. Each can cater to scalability, latency, reliability, privacy, and security requirements.
Above all else, there must be a careful assessment of the device requirements regarding the scale needed and how this will be deployed within core target markets, with factors like device authentication, identity management, and data security at the top of mind.
Scaling isn’t simply increasing production volume. It requires transforming your entire digital ecosystem to continuously deliver value to a potentially large base over several years. IoT products are still digital, and their development continues beyond production. Continuously improving and maintaining these products is essential for long-term success.
Beyond just installing sensors and models, digital transformation requires a deeper understanding of extracting, analysing, and positioning the data generated by these sensors through software, bridging between the user and the device.
The entire industry is fixated on AI’s potential for revolutionising processes, but the true game-changer lies in coupling it with IoT. However, success demands a solid strategy and an unwavering dedication to consistently provide value to end-users via ongoing research, identification, and adaptation.",https://www.innovationnewsnetwork.com/wp-content/uploads/2024/01/shutterstockgreenbutterfly_2070595583.jpg,2024-01-02 09:32:42
