Link,post_title,post_content,featured_image,Date-Publish,post_category,post_tag
https://www.forbes.com/sites/erikkain/2024/03/23/todays-wordle-1009-hints-clues-and-answer-for-sunday-march-24th/,"Today’s ‘Wordle’ 1009 Hints, Clues And Answer For Sunday, March 24th","How to Master Today's Wordle Puzzle

Lazy Sunday is here, and what better way to spend it than by solving the Wordle puzzle? But before we dive into that, let me share a little confession. I have a secret desire to make rabbit pot pies on Easter. The thought of that savory dish paired with the irony of using rabbit meat is simply delicious. Perhaps one day I'll make it happen. But for now, let's focus on Wordle.

For those who are new to Wordle, it's a captivating word puzzle game that has gained quite a following. And guess what? I've been writing Strands guides for weeks now. It's another word puzzle game that guarantees endless fun. You can check out today's guide on my blog.

Now, let's get down to business and solve today's Wordle puzzle. Are you ready for some hints and clues? Here they are:

The Hint: This is useful when dry but useless when wet.
The Clue: The first letter of today's Wordle phrase is a consonant.

Okay, enough with the suspense. Here's the answer:

[Insert Answer Image]

Wordle Analysis: My Journey to the Answer

Every day, I eagerly check Wordle Bot to see how well I did. If you haven't tried it yet, you can check your Wordles with Wordle Bot too. Now, let me walk you through my thought process.

My initial guess was ""chain,"" which left me with a staggering 681 possibilities. That was definitely not what I had in mind. But then, I had a stroke of luck. The word ""slope"" came to mind, and it significantly reduced the options to a more manageable 19. Feeling confident, I went with ""below."" It just felt right, even though it might have been a Wordle answer in the past. And guess what? It was correct! Was it pure coincidence or a result of my Strands puzzle practice? Who knows?

Competitive Wordle Score: A Total Wash

Unfortunately, luck wasn't on my side this time. I scored a big fat zero points for guessing in four tries and also for tying with the Wordle Bot. It happens to the best of us, right?

Uncovering the Etymology of ""Towel""

Now, let's take a moment to explore the fascinating history behind the word ""towel."" Did you know that its origins can be traced back to Old French? The term ""touaille"" made its way into English usage around the 13th century. But the story doesn't stop there.

The Old French word ""touaille"" is believed to have its roots in Medieval Latin, specifically the term ""tovaglia."" This Latin word likely derived from ""tubicula,"" a diminutive form of ""tuba,"" meaning ""tube"" or ""cloth."" The evolution of language reflects the practical use and significance of towels in daily life. Initially, they were simply pieces of cloth used for drying or wiping.

It's interesting to note that the Norman Conquest of England in 1066 had a significant impact on the English language. The linguistic influences of Norman French led to the Anglicization of many French-origin words, including ""towel."" Over time, the pronunciation and spelling changed, giving us the modern English word we use today. Towels have been a household staple for centuries, evolving in material and purpose, while still serving their fundamental function of drying and wiping.

Stay Connected and Explore More

That's all for today's Wordle puzzle. I hope you enjoyed the journey as much as I did. Don't forget to check out my blog, where you'll find daily Wordle guides, along with my musings on TV shows, streaming recommendations, movie reviews, video game coverage, and much more.

Thank you for joining me on this Wordle adventure. Until next time!","https://imageio.forbes.com/specials-images/imageserve/6209dc2871dc07b5bc2b0ac7/0x0.jpg?format=jpg&crop=3846,2163,x0,y191,safe&height=900&width=1600&fit=bounds",2024-03-23 19:00:25,Innovation,Innovation
https://www.forbes.com/sites/zakdoffman/2024/03/23/google-upgrade-samsung-s24-s23-pixel-towards-apple-iphone-15-pro-max/,Google Suddenly Reveals Surprise Android Update That Beats iPhone,"Android and iPhone are constantly evolving, with Google and Apple competing to offer the best features to users. In a surprising turn of events, Google has recently introduced a groundbreaking update for Android users that seems to outshine Apple's offerings.

Google has been striving to make Android more like iPhone, with recent enhancements to security and added functionalities such as WhatsApp calls and Apple passes integration. The latest update from Google not only matches an existing iPhone feature but takes it a step further, showcasing Google's innovation and advancement in the smartphone ecosystem.

One of the most exciting new features is the inclusion of an emergency satellite service on Android devices. This service, which mirrors Apple's satellite SOS functionality, adds a layer of safety and security for Android users, especially those in remote areas or situations where traditional cellular coverage may be limited.

Unlike Apple's emergency SOS feature, which is primarily for emergencies, Google's satellite connectivity on Android opens up new possibilities for users. With the latest Android 15 developer preview, users can expand their cellular accounts to include a satellite add-on, allowing core messaging apps to utilize the satellite network for communication even in cellular black spots.

The addition of satellite connectivity on Android 15 is a significant step forward, with new APIs that enable apps to detect satellite connections and utilize them for sending and receiving messages. This development hints at a future where direct-to-phone satellite connectivity becomes more accessible and practical, potentially revolutionizing how we stay connected in remote areas.

While Apple also offers satellite connectivity on select iPhone models, Google's approach seems to be more expansive and forward-thinking. The potential for seamless messaging integration and future collaborations with network providers like T-Mobile and SpaceX hints at a more integrated and connected smartphone experience for Android users.

As Android and iPhone continue to converge in terms of features and capabilities, Google's proactive approach in introducing satellite messaging on Android 15 sets a high bar for innovation in the smartphone industry. With Apple possibly following suit with Gemini integration on iPhone, the competition between the two leading ecosystems is heating up, promising exciting developments for users on both platforms.

In conclusion, the latest updates from Google for Android users showcase a commitment to enhancing user experience and pushing boundaries in smartphone technology. The introduction of satellite messaging on Android 15 highlights Google's leadership in innovation and sets a new standard for connectivity and communication on mobile devices. As Android and iPhone draw closer in features and functionalities, users can look forward to a more seamless and integrated smartphone experience in the near future.",https://imageio.forbes.com/specials-images/imageserve/65d79ec3dadcd6b682668331/0x0.jpg?format=jpg&height=900&width=1600&fit=bounds,2024-03-23 19:17:25,Innovation,Innovation
https://techcrunch.com/2024/03/23/apple-sued-microsofts-ai-ambitions-and-nvidia-surprises/,"Apple sued, Microsoft's AI ambitions and Nvidia's surprises","In this Week in Review, we bring you the latest updates on the Apple antitrust lawsuit and Microsoft’s AI advancements. Let’s jump into the details…

The U.S. has joined global regulators in accusing Apple of employing monopolistic tactics to retain iPhone users. Apple defends its position by stating that the DOJ's actions could jeopardize the user experience that its customers cherish.

Drawing a parallel between Apple and Microsoft of the 1990s, the DOJ's lawsuit highlights the efforts of both companies to maintain their customer base. Despite similarities, there are distinct differences between their approaches.

Experts anticipate a lengthy legal process for the Apple antitrust lawsuit, estimating a resolution could take three to five years to materialize.

Moving on to other news, Microsoft has acquired the co-founders of Inflection AI in a significant deal. Mustafa Suleyman will lead Microsoft AI's consumer-facing unit, while Karén Simonyan assumes the role of EVP and CEO within the same group. This acquisition follows Inflection's successful funding round of $1.3 billion, with Microsoft as a major investor.

Nvidia's recent GTC event unveiled surprising announcements, including CEO Jensen Huang's projection that artificial general intelligence is five years away. Additionally, Nvidia introduced a new AI platform for humanoid robots named GR00T.

Rumors suggest a potential collaboration between Google and Apple, with Google's AI model possibly powering upcoming iOS updates. This partnership raises questions about the duration of collaboration and Apple's independent AI development plans.

On the cybersecurity front, the Biden administration is spearheading an international coalition to combat commercial spyware, with investors joining the initiative. Notably, TechCrunch discovered that some investors had previous ties to the spyware industry.

In gaming news, a hack disrupted a $5 million Apex Legends tournament, prompting the hacker to cite a desire to expose vulnerabilities to developers. Meanwhile, Glassdoor users are facing privacy concerns as their real names are being added to profiles without consent, prompting some to delete their accounts.

In the funding and IPO realm, Reddit's IPO had a strong debut, with shares jumping 48% on the first day. Astera Labs, a cloud computing hardware company, saw a 72% increase in stock value on its first day of trading. The Browser Company, developer of the Arc browser, secured $50 million in funding at a $550 million valuation.

In a bonus segment, we explore AI's struggle with spelling, Fisker's production pause due to financial constraints, and the challenges of reviewing AI systems like ChatGPT and Gemini.

Stay tuned for more updates in the next Week in Review newsletter!","https://techcrunch.com/wp-content/uploads/2024/03/apple-antitrust-doj-splash.jpg?resize=1200,675",2024-03-23 20:15:37,Innovation,Innovation
https://www.forbes.com/sites/ewanspence/2024/03/23/apple-iphone-16-pro-ios-18-ai-china-baidu-google-gemini/,Apple’s Latest AI Move To Change Your New iPhone,"As Apple gears up to unveil its AI strategy for the iPhone, a potential collaboration with Google seems to be on the horizon, alongside a new partnership with China's Baidu.

The iPhone 15 series has lagged behind in the AI race compared to flagship Android devices, with generative AI features notably absent. However, iOS 18 is expected to debut at the upcoming Worldwide Developer Conference, bringing generative AI capabilities to the next-generation iPhone 16 lineup.

Apple, like other smartphone manufacturers, will prioritize a combination of on-device and cloud-based AI processing. While Apple is known for its emphasis on local data processing, the cloud will play a crucial role in handling AI tasks that require substantial computational power.

Reports suggest that Apple is in talks with Google to leverage its Gemini generative AI service for cloud-based AI processing. Despite being competitors in the mobile operating system market, Apple and Google have collaborated on various fronts, including Google being the default search engine on Apple devices. Google stands to gain access to a vast user base through iPhone owners utilizing AI services, enhancing its AI ecosystem against competitors like OpenAI.

However, due to regulatory constraints in China and Google's Gemini not being available in the country, Apple is exploring a partnership with Baidu for cloud-based AI services in the Chinese market. This move aligns with Samsung's approach at the recent Galaxy Unpacked event, where it introduced Galaxy AI services powered by Google Gemini and Baidu for the Chinese market.

The convergence of AI technologies across different platforms raises questions about how Apple will differentiate its AI services technically, given their reliance on similar underlying technologies as competitors.

Stay updated on the latest Apple news, including iPhone, Mac, and App Store updates, by checking out Forbes' weekly Apple Loop news digest.","https://imageio.forbes.com/specials-images/imageserve/6470e48fe2490b1a1cb845f0/0x0.jpg?format=jpg&crop=3561,2003,x374,y223,safe&height=900&width=1600&fit=bounds",2024-03-23 19:31:06,Innovation,Innovation
https://www.forbes.com/sites/brianmazique/2024/03/23/ufcs-dana-white-cuts-fighter-immediately-after-he-bit-an-opponent/,UFC’s Dana White Cuts Fighter Immediately After He Bit An Opponent,"Pressure and combat sports can sometimes push athletes to do unthinkable things. The most recent example occurred at UFC Fight Night: Ribas vs. Namajunas, where a shocking incident took place during a preliminary bout.

In his UFC debut, Igor Severino, a 20-year-old fighter from Brazil, bit his opponent Andre Lima in the second round. This act of aggression resulted in Severino's disqualification from the fight. The bite marks on Lima's arm were clearly visible, leaving no room for doubt about what had transpired.

Severino had an opportunity to make a name for himself in the UFC, but his actions on that night have made it difficult for him to continue his career with the promotion. Dana White, the CEO of UFC, wasted no time in making the decision to cut Severino from the organization. In an interview with KevinIole.com, White expressed his disappointment, stating, ""Those were two up-and-coming undefeated fighters. If you're frustrated and want out of the fight, there are plenty of ways to go about it, but biting your opponent is the worst thing you can do. Now, you not only lose the biggest opportunity of your life, but you also face potential consequences from the NSAC.""

This loss marked the first of Severino's career, bringing his record to 9-1. On the other hand, Lima maintained his undefeated streak, with a record of 8-0. Despite being the victim of the bite, Lima remained remarkably composed throughout the incident. He calmly informed the referee about what had happened, initiating a brief investigation into the infraction.

Severino's future in the world of mixed martial arts looks uncertain. He will need to rebuild his reputation by competing in smaller promotions before he can even consider making a comeback in the UFC or any other reputable organization such as the Professional Fighters League.

As the events of Saturday's fights come to a close in Las Vegas, stay tuned for more updates and traditional results from the night's other matchups. The world of combat sports never fails to surprise us, and the actions of Severino serve as a stark reminder of the consequences that come with losing control in the heat of battle.","https://imageio.forbes.com/specials-images/imageserve/65ff92c285143669667fa59c/0x0.jpg?format=jpg&crop=3188,1794,x0,y217,safe&height=900&width=1600&fit=bounds",2024-03-23 22:45:24,Innovation,Innovation
https://techcrunch.com/2024/03/24/non-sexy-industries-can-appeal-to-investors-too/,Non-sexy industries can appeal to investors too,"Welcome to the latest edition of TechCrunch Fintech! This week, we're diving into the exciting world of fintech startups in Africa, exploring how Copilot has thrived following Mint's closure, and delving into the success of a particular expense management startup that has caught the eye of VCs.

Venture funding in Africa may have seen a decline recently, but there have been some standout moments in the region's fintech scene. Uber's investment in African mobility fintech Moove, Zone's funding to scale decentralized payment infrastructure, and Nala's pivot to offer remittance services and build a B2B payment platform are all making waves.

The closure of Intuit's Mint app has paved the way for startups like Copilot to shine. With a $6 million Series A round led by Nico Wittenborn's Adjacent, Copilot has seen impressive growth and is capitalizing on the opportunity presented by Mint's exit.

In the realm of non-sexy industries, expense management startup Coast is making a name for itself, attracting $25 million in equity funding with its focus on real-world field personnel and fleets. Onyx Private, a digital bank, is shifting its focus to B2B operations after raising $4.1 million last year.

Swiss fintech nsave is also making waves with its $4 million seed funding, aiming to make banking in Switzerland accessible to those in unstable banking sectors or facing high inflation.

Despite the rapid growth in fintech, Ramp CEO Eric Glyman believes there is still untapped potential in the industry. With Ramp and Deel both celebrating their fifth anniversaries this week, the future looks bright for these innovative companies.

In other news, the U.S. Justice Department is taking on Apple's financial business in its antitrust complaint, while Bolt and Checkout.com team up for frictionless commerce, Fetch raises $50 million from Morgan Stanley, and Wealthfront delays its IPO plans.

If you have a tip to share, reach out to me at maryann@techcrunch.com or via Signal at 408.204.3036. For more secure communications, visit our contact page for options like SecureDrop and encrypted messaging apps.

Stay tuned for more exciting updates in the world of fintech!","https://techcrunch.com/wp-content/uploads/2019/07/GettyImages-835896464.jpg?resize=1200,800",2024-03-24 14:15:51,Innovation,Innovation
https://www.forbes.com/sites/jamiecartereurope/2024/03/23/explained-the-difference-between-a-solar-eclipse-and-a-lunar-eclipse/,Explained: The Difference Between A Solar Eclipse And A Lunar Eclipse,"Do you understand the distinction between a solar eclipse and a lunar eclipse? Two exciting celestial events are on the horizon—a lunar eclipse on March 25 and a solar eclipse on April 8. While these occurrences may seem worlds apart, they stem from the same cosmic alignment.

When it comes to lunar eclipses, Earth's shadow is cast upon the moon during a full moon phase. Conversely, solar eclipses transpire when the moon obstructs the sun's rays, casting a shadow on Earth. The rarity of both events is attributed to the slight disparity in the orbital planes of Earth and the moon around the sun.

A lunar eclipse exclusively takes place during a full moon, when Earth positions itself between the sun and the moon, projecting a shadow into space. Although full moons recur approximately every 29 days, lunar eclipses are infrequent due to the moon's sporadic passage through Earth's shadow.

On the other hand, a solar eclipse occurs during a new moon phase, with the moon positioned between the sun and Earth, casting a shadow on our planet. Despite new moons also occurring every 29 days, instances where the moon obstructs the sun from Earth's perspective are seldom witnessed.

The occurrence of a total lunar eclipse necessitates a precise alignment of the sun, Earth, and moon. As the moon drifts into Earth's umbra, it is devoid of direct sunlight, causing its surface to reflect sunlight refracted by Earth's atmosphere. This phenomenon results in a captivating display of pinkish-red hues on the lunar surface, colloquially known as a ""Blood Moon.""

Conversely, a total solar eclipse is brought about by the perfect alignment of the sun, moon, and Earth, coupled with a celestial anomaly. The moon's umbra, projected onto Earth during a total solar eclipse, moves across the planet due to the moon's west-to-east orbit. Those within the umbral shadow's path witness the awe-inspiring spectacle of a total solar eclipse.

Eclipses, whether lunar or solar, are relatively rare occurrences due to the moon's orbital tilt and its intersection with the sun's trajectory. This orbital configuration results in two eclipse seasons annually, during which solar and lunar eclipses occur. However, the majority of solar eclipses are partial or annular, while lunar eclipses are predominantly penumbral or partial.

Looking ahead to 2024 and 2025, sky-watchers can anticipate a series of lunar and solar eclipses during designated ""eclipse seasons."" These celestial events promise to captivate audiences across different regions of the globe, offering a glimpse into the mesmerizing dance of celestial bodies.

As we prepare for the upcoming lunar and solar eclipses, let's marvel at the wonders of the universe and embrace the opportunity to witness these celestial phenomena firsthand. Stay tuned for more updates on the upcoming total solar eclipse on April 8, and may your skies be clear and your eyes wide open.",https://imageio.forbes.com/specials-images/imageserve/65f6b43702078076f68d7fcf/0x0.jpg?format=jpg&height=900&width=1600&fit=bounds,2024-03-23 19:00:00,Innovation,Innovation
https://www.forbes.com/sites/jamiecartereurope/2024/03/24/debunked-i-think-ive-seen-a-total-solar-eclipse-before/,Debunked: ‘I Think I’ve Seen A Total Solar Eclipse Before’,"Total Solar Eclipses in North America: A Once-in-a-Lifetime Experience

Have you ever thought you witnessed a total solar eclipse? Chances are, you actually saw a partial eclipse. Total solar eclipses are rare and unforgettable events that leave a lasting impression on those lucky enough to witness them. To truly experience totality, you must be within the path of totality, where the moon completely blocks the sun.

In North America, the continent has been experiencing a surge in total solar eclipses, with the most recent being the ""Great American Eclipse"" in 2017. This event brought totality to 12 U.S. states, captivating millions of people with the awe-inspiring sight of the sun's corona shining around the silhouette of the moon.

If you're unsure whether you've seen a total solar eclipse, there are ways to confirm your experience. By checking the Solar Eclipses Visibility Database or consulting interactive maps, you can determine if you were within the path of totality during a specific eclipse.

Looking ahead, a once-in-a-lifetime opportunity awaits on April 8, 2024. This total solar eclipse will be visible from parts of Mexico, the United States, and Canada, offering a shared experience for an estimated 42 million people. Only those within a narrow path will witness totality, making it a highly anticipated event for eclipse enthusiasts.

As the date approaches, stay updated on the latest eclipse news, travel options, and lodging recommendations. Clear skies and wide eyes await those who are ready to witness the magic of a total solar eclipse.","https://imageio.forbes.com/specials-images/imageserve/65fd4263183a8b781f7df599/0x0.jpg?format=jpg&crop=2000,1125,x0,y223,safe&height=900&width=1600&fit=bounds",2024-03-24 07:00:00,Innovation,Innovation
