Link,post_title,post_content,featured_image,Date-Publish,post_category,post_tag
https://techcrunch.com/2024/03/25/elon-musk-x-ccdh-california-lawsuit-dismissed/,A judge just killed Elon Musk's lawsuit against an anti-hate research org,"A federal judge has ruled against Elon Musk and his company X in a lawsuit targeting the Center for Countering Digital Hate (CCDH), a nonprofit organization that researches online hate. The lawsuit, filed by X last year, accused CCDH of spreading misleading claims through its reports on hate and extremism on the platform. X claimed to have lost millions of dollars as a result of CCDH's research.

Musk and X also alleged that CCDH illegally scraped data and violated the platform's rules by aggregating content using a third-party social media monitoring tool called Brandwatch. Musk, who personally directed the lawsuit, referred to CCDH as ""an evil propaganda machine"" in his replies on X.

CCDH responded by filing a motion to dismiss X's claims under California's Strategic Lawsuit Against Public Participation (SLAPP) law, which is aimed at preventing frivolous lawsuits intended to intimidate others. The organization also accused Musk of deliberately prolonging the legal process to increase its legal costs, pointing out that Musk's net worth is around $200 billion.

United States District Judge Charles R. Breyer, of the Northern District of California, granted CCDH's motion to dismiss the lawsuit and denied Musk and X the opportunity to reopen the case. In his ruling, Judge Breyer stated that it was clear that X had brought the case to punish CCDH for criticizing the company and to discourage others from doing the same.

The CCDH has been actively monitoring hate speech on social media platforms, particularly on Twitter since Musk's increased presence on the platform. The organization published a report highlighting the rise of hate speech after Musk unbanned several highly followed extremists, potentially boosting the company's ad revenue. One of the extremists mentioned in the report is Andrew Anglin, a notorious neo-Nazi who created the white supremacist website the Daily Stormer.

Established in 2018, CCDH conducts research on hate speech, extremism, and misinformation on major social networks. Its reports consistently expose disturbing content on various platforms, including TikTok, YouTube, and Instagram, covering topics such as eating disorder content, climate denial, and violent misogynistic threats.

CCDH CEO Imran Ahmed expressed satisfaction with the court's ruling, emphasizing the organization's commitment to holding social media companies accountable for their decisions that impact society. He stated, ""We create costs for lies and hate."" Ahmed also emphasized the importance of research, advocacy, and the protection of fundamental human rights and civil liberties.

CCDH's legal team included Roberta Kaplan, who recently achieved a significant victory against former President Donald Trump in the E. Jean Carroll defamation suit. Kaplan commented on the ruling, stating that it demonstrates that even the world's wealthiest man cannot manipulate the rule of law to his advantage.

Despite the victory in California, Musk is pursuing a similar lawsuit against the left-leaning media watchdog Media Matters for America. However, unlike the CCDH lawsuit, X is suing Media Matters for America in Texas, where the protections against frivolous lawsuits aimed at stifling free speech are not as strong as in California.","https://techcrunch.com/wp-content/uploads/2023/08/twitter-x-logo-musk-pattern.jpg?resize=1200,675",2024-03-25 20:33:17,Innovation,Innovation
https://techcrunch.com/2024/03/25/spotify-throws-its-hat-in-the-edtech-ring/,Spotify throws its hat in the edtech ring,"Welcome back to Equity, the podcast that delves into the business of startups and explores the numbers and intricacies behind the headlines. Today, we have an exciting lineup of topics to cover, including the global stock market retreat, the promising performance of cryptocurrencies, and the sudden departure of Stability AI's CEO.

Let's begin with the financial landscape. Stocks worldwide are experiencing a decline, while the crypto market is showing signs of growth and potential. This contrasting trend has caught the attention of investors and analysts alike, sparking discussions and debates about the future of these markets.

In Startup Land, the spotlight is on Stability AI, as their CEO has recently stepped down. This development is significant considering the prior discussions surrounding the company's revenue growth and burn rate. The departure of the CEO raises questions about the future direction of Stability AI and how it will navigate these challenges moving forward.

Shifting our focus to the European Union, several U.S.-based tech companies are currently under investigation due to the implementation of the new Digital Markets Act. This regulatory scrutiny raises the question of whether tech giants will be able to establish a more productive and cooperative relationship with the EU. The outcome of these investigations will undoubtedly have a profound impact on the tech industry and its interactions with European markets.

Meanwhile, Spotify, known predominantly for its musical endeavors, is embarking on a new non-musical venture. This strategic move by the company piques curiosity and invites speculation about their future direction. What could this new endeavor entail, and how will it shape Spotify's growth and expansion?

In China, there is news about the country's plans to adopt the Vision Pro technology and its ambition to replace Intel and AMD chips in state computers. This development highlights China's determination to assert its technological independence and reduce reliance on foreign technology providers. The implications of this move extend beyond the borders of China and have far-reaching consequences for the global tech industry.

To conclude, we bring you an interesting report on the fierce competition between beverage startups and industry giants like Coke and Pepsi for market share. These startups are challenging the dominance of established players and carving out their own space in the market. The battle for market share in the beverage industry is heating up, and it will be fascinating to see how these startups continue to disrupt the status quo.

For more information and access to episode transcripts, visit Equity's Simplecast website. Remember to tune in to Equity every Monday, Wednesday, and Friday at 7 a.m. PT on Apple Podcasts, Overcast, Spotify, and all major podcast platforms. Additionally, don't miss TechCrunch's fantastic crypto show, where they interview founders and delve into the world of cryptocurrencies.

Thank you for joining us today, and we look forward to bringing you more intriguing insights and analysis in the weeks to come. Stay tuned!","https://techcrunch.com/wp-content/uploads/2024/02/GettyImages-1783835425-crop.jpg?resize=1200,675",2024-03-25 14:22:20,Innovation,Innovation
https://techcrunch.com/2024/03/25/match-board-directors-after-talks-activist-investor-elliott-management/,Match appoints two board directors after talks with activist investor Elliott Management,"Tinder-owner Match Group has recently made significant changes to its board of directors and entered into an agreement with activist investor Elliott Management. The company announced on Monday that Laura Jones, the chief marketing officer at Instacart, and Spencer Rascoff, co-founder of Zillow, will be joining the board with immediate effect.

According to Match, these appointments have come after a period of ""constructive dialogue"" with Elliott Management, during which the two companies have entered into an ""information-sharing"" agreement. This news follows a report by The Wall Street Journal a few months ago, which revealed that Elliott had acquired a stake of around $1 billion in Match Group. The report suggested that Elliott was interested in discussing strategies to improve Match's performance, as the company has experienced a decline in paying users due to economic uncertainty.

Marc Steinberg, a partner at Elliott, expressed his confidence in Match's potential for value creation as the global leader in online dating. He stated, ""We are one of the largest investors of Match Group today because we believe in its opportunity for significant value creation as the global leader in online dating. We appreciate the collaboration with management and the Board over the past several months, and we are confident that Laura Jones and Spencer Rascoff are strong additions to the Board. We believe their unique skills and perspectives will help support the Company through its next phase of growth.""

Elliott Management is known for acquiring stakes in tech companies and advocating for changes. Their push for change at Match Group follows similar board shakeups at Crown Castle and Etsy.

In the fourth quarter of 2023, Match Group experienced a 5% decrease in total paid users compared to the previous year, with a total of 15.2 million paid users. The company's growth has slowed down since the peak it reached during the COVID-19 pandemic, resulting in a significant decline of 79% in its stock value since 2021.

Match Group is the parent company of various popular dating apps, including Tinder, Hinge, Match.com, Meetic, OkCupid, Plenty of Fish, OurTime, and more. These apps have gained a large user base and have become well-known in the online dating industry.",https://techcrunch.com/wp-content/uploads/2022/07/GettyImages-1241790742.jpeg?w=1024,2024-03-25 14:15:04,Innovation,Innovation
https://techcrunch.com/2024/03/25/dma-first-formal-probes/,"Apple, Google and Meta face first formal investigations under EU's DMA","The European Union has recently announced a series of investigations on Big Tech companies, specifically Alphabet/Google, Apple, and Meta, under the Digital Markets Act (DMA). These investigations mark the first formal non-compliance probes under the EU's revamped competition rulebook. The focus of the investigations includes Alphabet/Google's rules on steering in Google Play and self-preferencing in search results, Apple's rules on steering in the App Store and the design of choice screens, and Meta's ""pay or consent"" model.

These investigations come less than three weeks after the compliance deadline for the companies. The three gatekeepers, which were designated under the pan-EU market power and contestability regulation, face formal investigation to determine if they are breaching the rulebook. Violations of the DMA can result in fines of up to 10% of global annual turnover, or even 20% for repeat offenses. The EU will have up to 12 months to conclude the investigations, with a preliminary report potentially being produced within six months.

This enforcement action by the EU is happening alongside increased antitrust scrutiny on the three U.S. firms in their home country as well. Since the companies unveiled their DMA compliance plans, there has been criticism that their proposals do not comply with the new EU law. Google has faced accusations of attempting to avoid the regulation's ban on self-preferencing, while Apple's use of notifications to warn users of risks outside its ecosystem has been criticized by developers. Meta's ""pay or be tracked"" tactic has also been condemned by privacy and consumer rights groups.

The investigations specifically address concerns related to the DMA's requirements. The Commission is assessing whether Alphabet and Apple's measures in relation to their app stores breach the DMA, particularly in terms of allowing app developers to ""steer"" consumers to offers outside the gatekeepers' app stores free of charge. Google's self-preferencing in its vertical search services will also be scrutinized to evaluate its impact on rival services. The EU is examining whether Apple is complying with user choice obligations on iOS, such as enabling easy uninstallation of apps and changing default settings. The investigation on Meta focuses on its ""pay or consent"" model and whether it complies with the DMA's requirement to obtain user consent for cross-use of personal data.

The EU's internal market commissioner, Thierry Breton, emphasized that the DMA clearly requires gatekeepers to offer a free, non-preferential choice to users. The investigations aim to ensure fair competition, protect consumer rights, and prevent the accumulation of personal data by gatekeepers. The EU's actions reflect its commitment to regulating and overseeing the practices of Big Tech companies to ensure a level playing field in the digital market.

In conclusion, the European Union has launched investigations on Alphabet/Google, Apple, and Meta under the Digital Markets Act. These investigations focus on various aspects of the companies' practices, including self-preferencing, steering in app stores, and data usage. The EU is determined to enforce the DMA and ensure fair competition in the digital market.","https://techcrunch.com/wp-content/uploads/2022/05/GettyImages-1031626648.jpg?resize=1200,799",2024-03-25 12:10:10,Innovation,Innovation
https://techcrunch.com/2024/03/25/gostudent-tutoring-profitability/,"GoStudent, the online learning platform, says it's now profitable","GoStudent, a leading online tutoring marketplace based in Vienna, Austria, has achieved profitability, marking a significant milestone for the company. With a valuation of $3.2 billion, GoStudent has established itself as one of the most successful startups in Austria, boasting a user base of 11 million families and 23,000 tutors. CEO Felix Ohswald proudly announced that the company is not only EBITDA profitable but also has positive operating cash flow.

While GoStudent's journey to profitability hasn't been without challenges, it has managed to overcome them. The online learning market experienced a crash, causing a sharp drop in customer demand. As a result, GoStudent incurred losses of €89 million in 2021, which escalated to €220 million in 2022. This led to several rounds of layoffs and cost-cutting measures. Despite these setbacks, GoStudent managed to turn things around.

Ohswald described the company's previous phase as a period of ""crazy"" hyper-scaling. Within just two years, GoStudent scaled its core business model to generate over €100 million in revenue. However, this rapid growth came at a cost, with a cash burn of over €150 million in 2022 alone. As the market conditions changed, GoStudent realized it needed to adjust its strategy to ensure long-term sustainability.

In 2023, GoStudent took steps to reduce its burn rate by 70%, but it became clear that further measures were necessary. The company implemented three rounds of layoffs and made difficult decisions to cut back on expenses. Parties and acquisitions were put on hold, and expansion into new markets was halted. GoStudent shifted its focus to Europe and adopted a more organic growth strategy. These changes were aimed at achieving bottom-line growth rather than top-line growth.

The COVID-19 pandemic played a significant role in GoStudent's success. The digital transformation prompted by the pandemic led to increased demand for online learning solutions, and GoStudent emerged as a leading provider of online tutoring services. The company went from having to convince parents of the benefits of online tutoring to becoming the go-to solution for students in need of educational support.

Despite its success, GoStudent recognized the need to become more cost-effective. While scaling at lower costs presents challenges, the company remains committed to its mission of building the number one global school and unlocking the potential of every student through personalized tutoring. GoStudent aims to strike a balance between cost-efficiency and maintaining a personalized approach to education.

To further its mission, GoStudent acquired Studienkreis in 2022. Studienkreis, founded in 1974, operates physical learning centers primarily in Germany. GoStudent plans to leverage these centers to enhance its hybrid learning approach. CEO Ohswald believes that the future of education is hybrid, combining technology with physical learning spaces. With a focus on personalized tutoring and leveraging technology, GoStudent aims to connect students with the right tutors regardless of location.

Most of GoStudent's tutors are university students, which facilitates a strong connection with their pupils while delivering quality education. This younger demographic brings a fresh and relatable perspective to the tutoring experience.

In conclusion, GoStudent's journey to profitability showcases its resilience and adaptability in the face of challenges. By implementing cost-cutting measures and refocusing its growth strategy, the company has positioned itself for continued success in the online tutoring market. GoStudent remains committed to its mission of providing personalized education and unlocking the potential of every student. With its hybrid learning approach and a focus on connecting students with the right tutors, GoStudent is poised to make a lasting impact on the education industry.",https://techcrunch.com/wp-content/uploads/2024/03/Founders-of-GoStudent-Gregor-Muller-I-Felix-Ohswald-2.jpg?w=1024,2024-03-25 11:00:36,Innovation,Innovation
https://techcrunch.com/2024/03/25/london-regtech-gss-raises-47m-to-help-banks-screen-for-global-sanctions/,London regtech GSS raises $47M to help banks screen for global sanctions,"Global Screening Services (GSS), a London-based regulatory compliance platform, has successfully raised $47 million in funding. This comes at a time when economic sanctions are on the rise, with the United States imposing trade restrictions and asset blocking against countries like Russia, China, and Iran.

GSS was founded by Tom Scampion, who previously served as the head of financial crime for Deloitte's EMEA arm. In 2020, Scampion left Deloitte to become a general partner at consulting firm AlixPartner. It was during his time at AlixPartner that GSS was incubated before eventually spinning out as an independent entity in 2021.

Last year, GSS secured a similar amount of funding from prominent investors, including Mitsubishi UFJ Financial Group (MUFG), one of the world's largest banks. In their most recent funding round, GSS announced the Commonwealth Bank of Australia (CBA) as a new backer, along with Cynosure Group and AlixPartner.

Financial institutions, particularly banks, often find themselves at the forefront of sanctions enforcement due to their role in global money flow. However, it can be challenging for banks to determine the origin and destination of funds. For instance, in 2019, Standard Chartered faced fines of $1.1 billion from regulators in the UK and the US for inadequate money-laundering controls and breaching sanctions against countries like Iran. Similarly, BNP Paribas was fined a staggering $8.9 billion in 2014 for processing financial transactions for US-sanctioned countries.

Given these challenges, investors have shown increased interest in regulatory compliance businesses. In recent years, companies like Droit and SteelEye have successfully raised millions of dollars to support their efforts in this space.

GSS offers a sanctions-screening platform that helps banks and other financial institutions comply with regulations. By feeding transaction data into GSS's cloud-based platform, these institutions receive alerts if any matches are found against a comprehensive set of sanctions lists from around the world. GSS also enriches these lists by adding additional data points such as dates of birth, International Maritime Organization (IMO) numbers for ships, and data from the financial transfer systems of sanctioned countries.

Furthermore, GSS provides enhanced lists for screening, which include companies that are partially owned by individuals, companies, or governments that have been sanctioned by entities like the Office of Foreign Assets Control (OFAC), the European Union (EU), or the United Kingdom.

With the recent funding round, GSS is now transitioning from the development phase to becoming fully operational. The company is preparing to go live with its first customers and aims to help financial institutions meet their global sanctions obligations effectively.

In conclusion, Global Screening Services is making significant strides in the regulatory compliance space, providing financial institutions with the necessary tools to navigate the complexities of global sanctions. With its latest funding round and a strong lineup of backers, GSS is well-positioned to drive innovation and enhance compliance efforts in the financial industry.","https://techcrunch.com/wp-content/uploads/2024/03/GettyImages-1770041999-e1711386339681.jpg?resize=1200,677",2024-03-25 18:36:37,Innovation,Innovation
https://techxplore.com/news/2024-03-high-efficiency-based-copperiodide-clusters.html,A high efficiency LED based on copper-iodide clusters,"A team of researchers, led by Prof. Yao Hongbin from the University of Science and Technology of China (USTC), has made a significant breakthrough in the development of warm white light-emitting diodes (LEDs). Their work, which focuses on using copper-iodide cluster hybrids, has been published in Nature Photonics.

LED technology has become increasingly popular for its energy efficiency and versatility. Solution-processed LEDs, in particular, are considered to be the future of large-area solid-state lighting due to their simple manufacturing process and high operability. Various materials, such as lead-halide perovskites, organic semiconductor materials, and colloidal core-shell quantum dots (QDs), have been used to achieve high electroluminescence performance in solution-processed LED devices.

However, some of these materials, like lead-halide perovskites and CdSe QDs, contain heavy metals that pose serious environmental concerns. On the other hand, LED devices based on organic light-emitting molecules, InP QDs, and ZnSe QDs have high production costs due to the complexity of their synthesis. Therefore, the development of solution-processed LEDs based on low-cost, low-toxicity, easily scalable, and highly efficient emitters is crucial for the future of solid-state lighting.

To address this challenge, Prof. Yao's team focused on designing and preparing a copper-iodine-based hybrid cluster with a broad photoluminescence spectrum. They introduced nitrogen-phosphine chelating ligands and phosphine-containing solubilizing ligands to obtain copper-iodide hybrid clusters that exhibited both high luminescence efficiency and high solubility. These clusters demonstrated a solubility of over 200 mg/mL and good structural stability in N, N-dimethylformamide (DMF), a cross-solvent commonly used in LED production.

The team then fabricated luminescent thin films using spin-coating in DMF, which resulted in films with a low surface roughness of 0.22 nm and a high photoluminescence quantum yield of over 70%. These films can serve as a luminescent layer for the production of low-cost warm-white LED devices through an orthogonal solvent route.

The LED devices developed by the team achieved impressive results. They achieved a maximum external quantum efficiency of 19.1%, a brightness of over 40,000 cd m-2, and an operational lifetime of more than 232 hours (T 50 @100 cd m-2). Furthermore, thanks to the excellent solubility and processability of the clusters, the team successfully constructed a large-area solution-processed LED device with a working area of 36 cm2 through blade-coating. This device exhibited warm white light emission with a brightness close to 60,000 cd m-2.

In addition to their work on warm white LEDs, the team also developed a series of solution-processed color-tunable LED devices by modifying different electron-donating groups on the nitrogen heterocycles of the nitrogen-phosphine chelating ligands.

Overall, Prof. Yao's team has made significant progress in the development of high-efficiency and high-brightness LED devices based on copper-iodide hybrid clusters. The expandability and tunability of these clusters make them a promising candidate for the fabrication of low-cost, high-performance LED panels and solid-state lighting.

This breakthrough not only provides a more sustainable and cost-effective solution for solid-state lighting but also opens up new possibilities for the future of LED technology. The research conducted by Prof. Yao and his team is a testament to the power of innovation and collaboration in advancing scientific knowledge and driving technological advancements.

Reference:
Jing-Jing Wang et al, High efficiency warm-white light-emitting diodes based on copper–iodide clusters, Nature Photonics (2023). DOI: 10.1038/s41566-023-01340-8",https://scx2.b-cdn.net/gfx/news/2024/ustc-designs-high-effi.jpg,2024-03-25 13:17:52,Innovation,Innovation
