Link,Title,Text,Image,Date Publish
https://techxplore.com/news/2023-10-method-ai-1.html,A method to interpret AI might not be so interpretable after all,"This article has been reviewed according to Science X's editorial process and policies . Editors have highlighted the following attributes while ensuring the content's credibility:
A study finds humans struggle to understand the outputs of formal specifications, a method that some researchers claim can be used to make AI decision-making interpretable to humans. Credit: Bryan Mastergeorge, Massachusetts Institute of Technology
As autonomous systems and artificial intelligence become increasingly common in daily life, new methods are emerging to help humans check that these systems are behaving as expected. One method, called formal specifications, uses mathematical formulas that can be translated into natural-language expressions. Some researchers claim that this method can be used to spell out decisions an AI will make in a way that is interpretable to humans.
MIT Lincoln Laboratory researchers wanted to check such claims of interpretability. Their findings point to the opposite: Formal specifications do not seem to be interpretable by humans. In the team's study, participants were asked to check whether an AI agent's plan would succeed in a virtual game. Presented with the formal specification of the plan, the participants were correct less than half of the time.
""The results are bad news for researchers who have been claiming that formal methods lent interpretability to systems. It might be true in some restricted and abstract sense, but not for anything close to practical system validation,"" says Hosea Siu, a researcher in the laboratory's AI Technology Group. The group's paper, currently available on the arXiv preprint server, was accepted to the 2023 International Conference on Intelligent Robots and Systems held earlier this month.
Interpretability is important because it allows humans to place trust in a machine when used in the real world. If a robot or AI can explain its actions, then humans can decide whether it needs adjustments or can be trusted to make fair decisions. An interpretable system also enables the users of technology—not just the developers—to understand and trust its capabilities. However, interpretability has long been a challenge in the field of AI and autonomy. The machine learning process happens in a ""black box,"" so model developers often can't explain why or how a system came to a certain decision.
""When researchers say 'our machine learning system is accurate,' we ask 'how accurate?"" and 'using what data?' and if that information isn't provided, we reject the claim. We haven't been doing that much when researchers say 'our machine learning system is interpretable,' and we need to start holding those claims up to more scrutiny,"" Siu says.
Lost in translation
For their experiment, the researchers sought to determine whether formal specifications made the behavior of a system more interpretable. They focused on people's ability to use such specifications to validate a system—that is, to understand whether the system always met the user's goals.
Applying formal specifications for this purpose is essentially a by-product of its original use. Formal specifications are part of a broader set of formal methods that use logical expressions as a mathematical framework to describe the behavior of a model. Because the model is built on a logical flow, engineers can use ""model checkers"" to mathematically prove facts about the system, including when it is or isn't possible for the system to complete a task. Now, researchers are trying to use this same framework as a translational tool for humans.
""Researchers confuse the fact that formal specifications have precise semantics with them being interpretable to humans. These are not the same thing,"" Siu says. ""We realized that next-to-nobody was checking to see if people actually understood the outputs.""
In the team's experiment, participants were asked to validate a fairly simple set of behaviors with a robot playing a game of capture the flag, basically answering the question ""If the robot follows these rules exactly, does it always win?""
Participants included both experts and nonexperts in formal methods. They received the formal specifications in three ways—a ""raw"" logical formula, the formula translated into words closer to natural language, and a decision-tree format. Decision trees in particular are often considered in the AI world to be a human-interpretable way to show AI or robot decision-making.
The results: ""Validation performance on the whole was quite terrible, with around 45 percent accuracy, regardless of the presentation type,"" Siu says.
Confidently wrong
Those previously trained in formal specifications only did slightly better than novices. However, the experts reported far more confidence in their answers, regardless of whether they were correct or not. Across the board, people tended to over-trust the correctness of specifications put in front of them, meaning that they ignored rule sets allowing for game losses. This confirmation bias is particularly concerning for system validation, the researchers say, because people are more likely to overlook failure modes.
""We don't think that this result means we should abandon formal specifications as a way to explain system behaviors to people. But we do think that a lot more work needs to go into the design of how they are presented to people and into the workflow in which people use them,"" Siu adds.
When considering why the results were so poor, Siu recognizes that even people who work on formal methods aren't quite trained to check specifications as the experiment asked them to. And, thinking through all the possible outcomes of a set of rules is difficult. Even so, the rule sets shown to participants were short, equivalent to no more than a paragraph of text, ""much shorter than anything you'd encounter in any real system,"" Siu says.
The team isn't attempting to tie their results directly to the performance of humans in real-world robot validation. Instead, they aim to use the results as a starting point to consider what the formal logic community may be missing when claiming interpretability, and how such claims may play out in the real world.
This research was conducted as part of a larger project Siu and teammates are working on to improve the relationship between robots and human operators, especially those in the military. The process of programming robotics can often leave operators out of the loop. With a similar goal of improving interpretability and trust, the project is trying to allow operators to teach tasks to robots directly, in ways that are similar to training humans. Such a process could improve both the operator's confidence in the robot and the robot's adaptability.
Ultimately, they hope the results of this study and their ongoing research can better the application of autonomy, as it becomes more embedded in human life and decision-making.
""Our results push for the need to do human evaluations of certain systems and concepts of autonomy and AI before too many claims are made about their utility with humans,"" Siu adds.
More information: Ho Chit Siu et al, STL: Surprisingly Tricky Logic (for System Validation), arXiv (2023). DOI: 10.48550/arxiv.2305.17258 Journal information: arXiv
This story is republished courtesy of MIT News (web.mit.edu/newsoffice/), a popular site that covers news about MIT research, innovation and teaching.",https://scx2.b-cdn.net/gfx/news/2023/a-method-to-interpret.jpg,2023-10-16 17:27:04
https://techxplore.com/news/2023-10-algorithm-quality-electricity-local-generation.html,New algorithm to help control quality of electricity in local generation systems,"This article has been reviewed according to Science X's editorial process and policies . Editors have highlighted the following attributes while ensuring the content's credibility:
Prototype. Credit: Ildar Idrisov
With the new stage of energy transition in progress, the key tendency of power market development today is distributed power generation, which is characterized by decentralization, smart energy systems, involvement of consumers, and a higher share of renewable energy sources. In distributed generation systems, electricity comes from a number of local power objects, instead of one large station. For example, home owners who use solar panels can sell excess electricity back into the grid.
A fundamental role in these systems belongs to inverters that convert the generated electricity into the alternating current with specific frequency. In Europe and CIS countries, it equals 50 Hz. Researchers from Skoltech presented an algorithm for inverters that aims to control the quality of electricity injected to the main grid. The results are spotlighted by IEEE and have been published as part of 2023 IEEE Belgrade PowerTech.
""Inverters are programmed with mathematical functions and equations with certain coefficients,"" explains the leading author of the research Ilya Veretennikov, an engineer in the Energy Center's Smart Grid Laboratory.
""If grid parameters remain the same, it is enough to adjust the coefficients just once. Energy systems with distributed (local) generation constantly change (for example, if some market participants stopped selling their electricity), coefficients need to be recalculated. It is difficult to evaluate whether the coefficients are calculated correctly or not, but it is necessary to ensure the quality of electricity, which must meet the standard. Otherwise, it cannot be injected into the grid.""
Ilya Veretennikov working on lab experiments. Credit: Ildar Idrisov
The research team developed an algorithm for a controller, which would recalculate coefficients automatically controlling the quality of electricity injected in the main grid. Using data on calculated voltage, the controller generates a control signal, which ensures the alternating current frequency (50 Hz) without any distortions.
""During our research, we came up with a grid model and a more detailed inverter model. With their help, we checked different algorithms of the controller, their stability and efficiency. We proceeded with validating our results through experimental data. We plugged a real inverter in the grid, modeling a case with a local load, when a part of energy is transferred to the grid. In the lab, we work with low-power inverters, which are suitable for home users. We have great equipment for a detailed simulation in real time. It helps simulate any grid with any number of inverters and any parameters,"" adds Veretennikov.
According to the authors, they see the potential of the research and of the local power generation as a whole in those remote regions which, despite many clear days, still exploit unsustainable power energy sources. The research team is planning to fully automate the algorithm following the plug-and-play concept.
""Configuration is a burden for every end user. As of now, not all parameters are automatically configured, but we are working on the algorithm to make it fully automatic as a modern device that can be used right after connecting it to the computer without manual configurations,"" concludes Veretennikov.
More information: Ilya Veretennikov et al, Proportional Multiresonant Controller with Automatic Gains Adjustment for Grid-Connected Inverters, 2023 IEEE Belgrade PowerTech (2023). DOI: 10.1109/PowerTech55446.2023.10202893",https://scx2.b-cdn.net/gfx/news/2023/new-algorithm-to-help-1.jpg,2023-10-16 17:14:03
https://www.reuters.com/innovation/article/tsmc-results/tsmc-third-quarter-profit-to-slide-30-focus-on-how-much-growth-to-come-idUSKBN31H07N,"TSMC third-quarter profit to slide 30%, focus on how much growth to come","TAIPEI (Reuters) - Taiwan Semiconductor Manufacturing Co Ltd is expected to report a 30% slump in third-quarter profit on Thursday but analysts predict robust growth next year as the chip industry emerges from its current downturn.
FILE PHOTO: A logo of Taiwanse chip giant TSMC can be seen in Tainan, Taiwan December 29, 2022. REUTERS/Ann Wang/File Photo
The likely decline in profit also reflects a strong performance last year, when the company was still riding high on pent-up post-pandemic demand.
The world’s largest contract chipmaker is set to report net profit of T$195.9 billion ($6 billion) for July-September - its second straight quarter of profit decline, according to an LSEG SmartEstimate drawn from 19 analysts. SmartEstimates give greater weighting to forecasts from analysts who are more consistently accurate.
Revenue for the quarter came in at around $17 billion, according to TSMC figures, down 20% from a year earlier and roughly the middle of the company’s forecast range.
Global demand for semiconductors began to weaken in the second half of last year, but analysts say inventories at smartphone and computer makers are running down and restocking demand is expected to pick up.
Given that, much of Thursday’s focus will be on TSMC’s outlook for the fourth quarter and beyond.
Morgan Stanley analysts have forecast 10% revenue growth for the fourth quarter but also said in a research note that “guidance may surprise to the upside,” citing strong demand for high-end chips used in artificial intelligence as one factor.
The AI boom has helped drive up the price of shares in Asia’s most valuable company, with TSMC’s Taipei-listed stock having surged 23% so far this year.
An LSEG SmartEstimate puts TSMC’s 2024 revenue growth at around 22%.
Sources have said, however, that TSMC has been nervous about customer demand and told its major suppliers to delay the delivery of high-end chip-making equipment, although they added that suppliers expect the delay to be short-term.
Some analysts are also reining in their optimism somewhat.
Fubon Securities expects a slow start to next year for TSMC, with 10% growth in the first quarter, predicting order cancellations towards the year end and mild restocking demand. In particular, it is concerned that Apple, a major customer, may revise down its orders.
“We think the market consensus is still too bullish,” it said in a research note.
The company is due to report at 0600 GMT on Thursday.
($1 = 32.2290 Taiwan dollars)",https://s2.reutersmedia.net/resources/r/?m=02&d=20231017&t=2&i=1647931385&w=1200&r=LYNXMPEJ9G044,2023-10-17 03:55:49
https://www.reuters.com/innovation/article/canada-batteries/canada-to-give-belgiums-umicore-up-to-c1-billion-for-new-battery-components-plant-idUSKBN31G1PF,Canada to give Belgium's Umicore up to C$1 billion for new battery components plant,"OTTAWA (Reuters) - Canada and the province of Ontario will give up to C$1 billion to a unit of Belgium’s Umicore to help it build a plant that will produce components for electric vehicle batteries, Ottawa said on Monday.
The facility, in the Ontario town of Loyalist Township, will manufacture cathode active materials and precursor cathode active materials, federal Innovation Minister Francois-Philippe Champagne said in a statement.
The plant - the first of its kind in North America - will initially employ 600 people and have a battery materials production capacity of 35 gigawatt hours annually.
Canada, home to a large mining sector for minerals such as lithium, nickel and cobalt, wants to woo firms involved in all levels of the electric vehicle (EV) supply chain via a multibillion-dollar green technology.
The Umicore plant is due to be built in stages and could be worth C$2.7 billion when fully completed. Canada will invest up to C$551.3 billion with Ontario adding up to C$424.6 billion.
The full project has the potential to produce enough battery materials to support the production of over 800,000 EVs per year, Champagne said.",https://s4.reutersmedia.net/resources_v2/images/rcom-default.png,2023-10-16 19:03:02
https://www.reuters.com/innovation/article/overstock-com-jat/hedge-fund-jat-pushes-overstock-com-to-mull-options-filing-idUSKBN31G1KE,Hedge fund JAT pushes Overstock.com to mull options -filing,"NEW YORK (Reuters) - Hedge fund JAT Capital on Monday urged Overstock.com to consider selling certain assets and overhauling its management and compensation, warning it may seek board seats if its suggestions are ignored, a regulatory filing on Monday showed.
The hedge fund, run by John Thaler, owns a 9.1% stake in Overstock.com, and made its demands public in the filing after sending a letter outlining its wishes to the company last week.
Overstock’s stock price climbed nearly 9% after the filing.
Overstock.com, which spent $21.5 million to buy certain intellectual property assets from Bed Bath & Beyond a few months ago, did not immediately respond to a request for comment.
JAT is not traditionally an activist investor but its filing signaled mounting frustration with the company and left open the option of pursuing strategies like running a proxy contest.
JAT also wants the company to emphasize stock option participation and develop a business plan with financial objectives, the filing said.
“The Reporting Persons may consider to seek Board representation to the extent the above recommendations have not been explored, pursued and executed satisfactorily.”",https://s4.reutersmedia.net/resources_v2/images/rcom-default.png,2023-10-16 16:56:50
