Link,Title,Text,Image,Date Publish
https://techcrunch.com/2023/10/05/uber-slow-on-algo-transparency/,"Uber still dragging its feet on algorithmic transparency, Dutch court finds","Uber has been found to have failed to comply with European Union algorithmic transparency requirements in a legal challenge brought by two drivers whose accounts were terminated by the ride-hailing giant, including with the use of automated account flags.
Uber also failed to convince the court to cap daily fines of €4,000 being imposed for ongoing non-compliance — which now exceed over half a million euros (€584,000).
The Amsterdam District Court found in favor of two of the drivers who are litigating over data access over what they couch as ‘robo-firings’. But the appeals court decided Uber had provided sufficient information to a third driver regarding the reasons why its algorithm flagged the account for potential fraud.
The drivers are suing Uber to obtain information they argue they are legally required to regarding significant automated decisions taken about them.
The European Union’s General Data Protection Regulation (GDPR) provides both for a right for individuals not to be subject to solely automated decisions with a legal or significant impact and to receive information about such algorithmic decision-making, including receiving “meaningful information” about the logic involved; its significance; and envisaged consequences of such processing for the data subject.
The nub of the issue relates not to fraud and/or risk reviews purportedly carried out on flagged driver accounts by (human) Uber staff — but to the automated account flags themselves which triggered these reviews.
Back in April an appeals court in the Netherlands also found largely in favor of platform workers litigating against Uber and another ride-hailing platform, Ola, over data access rights related to alleged robo-firing — ruling the platforms cannot rely on trade secrets exemptions to deny drivers access to data about these sorts of AI-powered decisions.
Per the latest ruling, Uber sought to rehash a commercial secrets argument to argue against disclosing more data to drivers about the reasons why its AIs flagged their accounts. It also generally argues that its anti-fraud systems would not function if full details were provided to drivers about how they work.
In the case of two of the drivers who prevailed against Uber’s arguments the company was found not to have provided any information at all about the “exclusively” automated flags that triggered account reviews. Hence the finding of an ongoing breach of EU algorithmic transparency rules.
The judge further speculated Uber may be “deliberately” trying to withhold certain information because it does not want to give an insight into its business and revenue model.
In the case of the other driver, for whom the Court found — conversely — that Uber had provided “clear and, for the time being, sufficient information”, per the ruling, the company explained that the decision-making process which triggered the flag began with an automated rule that looked at (i) the number of cancelled rides for which this driver received a cancellation fee; (ii) the number of rides performed; and (iii) the ratio of the driver’s number of cancelled and performed rides in a given period.
“It was further explained that because [this driver] performed a disproportionate number of rides within a short period of time for which he received a cancellation fee the automated rule signalled potential cancellation fee fraud,” the court also wrote in the ruling [which is translated into English using machine translation].
The driver had sought more information from Uber, arguing the data it provided was still unclear or too brief and was not meaningful because he does not know where the line sits for Uber to label a driver as a fraudster.
However, in this case, the interim relief judge agreed with Uber that the ride-hailing giant did not have to provide this additional information because that would make “fraud with impunity to just below that ratio childishly easy”, as Uber put it.
The wider question of whether Uber was right to classify this driver (or the other two) as a fraudster has not been assessed at this point in the litigation.
The long-running litigation in the Netherlands looks to be working towards establishing where the line might lie in terms of how much information platforms that deploy algorithmic management on workers must provide them with on request under EU data protection rules vs how much ‘blackboxing’ of their AIs they can claim is necessary to fuzz details so that anti-fraud systems can’t be gamed via driver reverse engineering.
Reached for a response to the ruling, an Uber spokesperson sent TechCrunch this statement:
The ruling related to three drivers who lost access to their accounts a number of years ago due to very specific circumstances. At the time when these drivers’ accounts were flagged, they were reviewed by our Trust and Safety Teams, who are specially trained to spot the types of behaviour that could potentially impact rider safety. The Court confirmed that the review process was carried out by our human teams, which is standard practice when our systems spot potentially fraudulent behaviour.
The drivers in the legal challenge are being supposed by the data access rights advocacy organization, Worker Info Exchange (WIE), and by the App Drivers & Couriers union.
In a statement, Anton Ekker of Ekker law which is representing the drivers, said: “Drivers have been fighting for their right to information on automated deactivations for several years now. The Amsterdam Court of Appeal confirmed this right in its principled judgment of 4 April 2023. It is highly objectionable that Uber has so far refused to comply with the Court’s order. However, it is my belief that the principle of transparency will ultimately prevail.”
In a statement commenting on the ruling, James Farrar, director of WIE, added: “Whether it is the UK Supreme Court for worker rights or the Netherlands Court of Appeal for data protection rights, Uber habitually flouts the law and defies the orders of even the most senior courts. Uber drivers and couriers are exhausted by years of merciless algorithmic exploitation at work and grinding litigation to achieve some semblance of justice while government and local regulators sit back and do nothing to enforce the rules. Instead, the UK government is busy dismantling the few protections workers do have against automated decision making in the Data Protection and Digital Information Bill currently before Parliament. Similarly, the proposed EU Platform Work Directive will be a pointless paper tiger unless governments get serious about enforcing the rules.”","https://techcrunch.com/wp-content/uploads/2023/05/GettyImages-1142304853-a.jpg?resize=1200,675",2023-10-05 18:00:06
https://techcrunch.com/2023/10/05/as-its-workers-strike-over-burnout-and-low-wages-kaiser-permanente-strikes-a-deal-to-use-an-ai-copilot-from-nabla/,"As its workers strike over burnout and low wages, Kaiser Permanente strikes a deal to use an AI Copilot from Nabla","Yesterday, 75,000 workers at healthcare giant Kaiser Permanente embarked on a three-day strike to protest understaffing, burnout and low wages — setting a record for the biggest healthcare strike to date in U.S. history. But timing is everything in medicine. While Kaiser Permanente works through terms with union reps, another interesting development has emerged: it has inked a deal with Nabla, the AI healthcare startup from Paris, to provide an AI assistant to doctors and other clinicians in its network to reduce the amount of time they spend on admin: the AI will help with writing up notes and doing other administrative work, based on conversations that it listens to and transcribes.
Nabla’s Copilot product, which was launched in March of this year, will be rolled out to Kaiser Permanente physicians in Northern California initially, covering 10,000 doctors in all. The service will be available to all of them, but using it will be optional. If the service proves to work well, the idea will be potentially to roll it out across the rest of Kaiser Permanente’s footprint in the U.S.
From what we understand, Nabla and Kaiser Permanente first ran a two-week pilot of the service in August of this year. The process of turning that into a commercial deal might have normally taken much longer, so it’s worth wondering if the current labor actions had a role to play in speeding that up.
Still, it’s worth making clear that for now, neither Nabla nor Kaiser Permanente are working on tools to take over the clinical work the doctors and others are doing.
That’s not to say that others are not. Corti, another AI healthcare startup, raised $60 million in funding to continue building out its technology: another assistant for clinicians, but one where the aim is to help them with their patient assessments. Corti has some impressive deals in place already, too, and it says that it’s already working with more than 100 million patients/year.
And there are other industries where AI has become a major point of contention with labor groups. In the world of entertainment, anticipating the growing use of AI to recreate human likeness and voices, the SAG-AFTRA actors union is striking right now over the very issue of AI and how it will impact how they work and how they are compensated.
The pain point that Nabla is addressing is that the admin that doctors and others are required to do after seeing patients — forms that are needed for compliance and other purposes — can take hours to get through each day.
“A doctor might make as many as 4,000 mouse clicks in a 10-hour shift,” Alexandre Lebrun, the CEO and founder of Nabla, said in an interview.
So most of the time, those clinicians will put off getting to it. As a result, that work stretch, and the work that’s done in that stretch, are often referred to as “pajama time,” a reference to how clinicians get to it typically at the end of the day, in their nightclothes. The burnout that results from these extra hours of work on top of work has been a persistent problem in the industry for years.
Nabla’s copilot, as we have described before, essentially works as a virtual assistant. It listens to conversations and other interactions that are taking place with patients and matches up what it hears with other supplementary documents. And then it translates the resulting data into different document-based endpoints — such as prescriptions, follow-up appointment letters, consultation summaries — which typically result from those meetings. Doctors in the pilot cut out 1.5 hours of admin time using Nabla’s Copilot, the company said.
When we first wrote about the service, it had been based around GPT-3, the large language model built by OpenAI, which is used to generate human text and is powering hundreds of applications. Since then, Copilot has upgraded to GPT-4, but it’s also largely running the majority of its services now on its own LLM, although Lebrun said that it does still use GPT-4 in some areas to verify the work of its own LLM.
“GPT-4 is still the gold standard,” he said. “Because it’s very accurate and powerful, we use it to process feedback to correct what we do.”
(Lebrun, who has a long and interesting background in the world of virtual assistants and natural language processing, is very much a founder to watch. His sold his first startup, VirtuOz, a “Siri for enterprise,” in 2013 to Nuance to spearhead its development of digital assistant technology for businesses. He then founded and eventually sold his next startup, Wit.ai, to Facebook, where he and his team then worked on the social network’s foray into chatbots in Messenger. He then helped establish and run FAIR, Facebook’s AI research centre in Paris, which is headed up by Yann LeCun, the Turing Award winner who is Meta’s chief scientist. LeCun is one of his advisers now at Nabla.)
Nabla has raised just under $23 million from investors that include Tony Fadell, Firstminute Capital and Artemis. From what we understand, it’s starting discussions now with investors to raise more.","https://techcrunch.com/wp-content/uploads/2023/03/GettyImages-1347476924.jpg?resize=1200,600",2023-10-05 16:42:43
https://techcrunch.com/2023/10/05/rivian-evs-costly/,Rivian reminds investors that making EVs is incredibly expensive,"In 2023, the EV market is no longer about startups. Instead, the race to shift to electric vehicles has morphed into a competition between the world’s largest automotive companies and a host of smaller rivals that have gone public. The latter are often deeply unprofitable.
The Exchange explores startups, markets and money.
Read it every morning on TechCrunch+ or get The Exchange newsletter every Saturday.
In fact, this set of smaller EV companies is bleeding so much cash that there’s a row going on at the moment between China and other economies over subsidies and fair competition.
Subsidies are just part of the issue, though. There’s lots of talk about how central China is to the global battery supply chain and if new laws could shake up the present dynamic. Much as food security has long been a priority for countries, joined by semiconductors in recent years, nations and economic blocs also want to ensure that their ability to manufacture green (or greener) technologies can meet their needs.
The stakes are more focused for EV companies simply trying to scale production and prove to investors that they are viable, long-term businesses. They need to scale manufacturing to sell more cars, which will in turn increase manufacturing and research cost efficiencies, and all that will hopefully snowball into a bottom line that’s not deep in the red all the time. So it makes sense that we often see high levels of spending, and massive losses, at EV companies that are ramping up production.
The New York Times recently reported that Nio, a Chinese EV company also listed in the U.S., is losing around $35,000 per car. It’s hardly alone in losing so much money. U.S.-based Rivian in August said it delivered 12,640 cars in the second quarter of 2023, which resulted in revenue of $1.12 billion, gross loss of $412 million, operating loss of $1.29 billion and a free cash flow deficit of $1.62 billion. Gross margin came in at –37%.","https://techcrunch.com/wp-content/uploads/2023/05/rivian-Hero_1_R1S_Max_Pack.jpg?resize=1200,675",2023-10-05 16:15:06
https://techcrunch.com/2023/10/05/annie-wu-henry-vivek-ramaswamy-tiktok-strategy-election/,'TikTok whisperer' Annie Wu Henry on social media and 2024,"‘TikTok whisperer’ Annie Wu Henry on social media and 2024 'There’s this level of like, Gen Z does not put up with bullshit.'
Connecting with the youth is a craft that has long eluded the Olds — a demographic that’s less defined by age than it is by social media habits. Politicians, historically, have not prioritized young voter outreach.
But in recent elections, the youth voter turnout cinched major wins for Democrats, and as the 2024 presidential election looms ahead, Republicans are still falling behind in their digital strategy. Age alone isn’t enough to convince 18- to 29-year-old voters, who overwhelmingly backed Democrats in the midterm elections, to show up to the polls.
Candidates are expected to be content creators as much as they are politicians. Pennsylvania Sen. John Fetterman, for example, became a TikTok star over the course of his campaign. Between trolling his opponent Mehmet Oz and jumping on trending TikTok sounds, Fetterman’s apparent meme fluency was wildly popular with young voters.
Others, both on the left and on the right, fumbled their social media strategy with forced pop culture references and desperate attempts at being cool. They were dismissed as cringe, a branding worse than any scarlet letter.
Digital fluency doesn’t always come naturally to those who didn’t grow up online. Bad at posting? Hire a strategist.
Enter Annie Wu Henry, the digital strategist and “TikTok whisperer” behind Fetterman’s campaign. In an interview with TechCrunch, Henry explained what Vivek Ramaswamy did right, where it went downhill and why Gen Z just doesn’t put up with bullshit.
This interview has been condensed and edited for clarity.
TC: So you worked with Fetterman — obviously, this makes you an expert on this. What was your first reaction when you saw Jake Paul endorsing Vivek Ramaswamy?
AWH: I think, at large, we’re going to see much more of that cultural play, if they’re doing it. A lot of the influencers that we look at as likely right-leaning, like Joe Rogan, are political entities. Joe Rogan’s podcast isn’t a “political podcast.” Andrew Tate, even, is not a political being. Obviously, everything’s political.
But these people are very much in the right-wing media, any kind of ecosystem of media that allows these ideologies to be perpetuated in a cultural and widespread way. If they were only to be spouted from politicians and people in politics, it wouldn’t have the same ability for reach.
I, for example, am a young woman of color. I am pretty politically active. I like what I keep up with, what music I listen to, et cetera, and I don’t get a lot of these things. For example, I didn’t know that Andrew Tate had a brother until way after that was out there. I try to avoid his content because I don’t want to get more, but I don’t get fed a lot of it because I think these platforms know that I am not the target demographic that’s likely to continue to be interested in that. However, I talk to my guy friends that are my age, or guys in their 20s, 30s, and people that are younger, even. That is all they’re fed, even if they don’t want to be seeing that type of stuff.
And so people like Jake Paul, I think, easily fall into that category. And because of his start on YouTube and particularly with young people, he’s right in that space that, if utilized by people on the right and politicians, has a potential to be really impactful.
Definitely. I just talked to a professor who researches political influencers and he was like, we’re seeing a whole class of influencers who are distinctly basing their entire platforms around social issues, and you’re seeing a separate class of creators who happen to be giving out endorsements. And the question is, who is the one who has more influence?
That is something I am so, so interested in doing more with in my work, because we have this class of political influencers on the left and on the right. And a lot of times, these people are really great vehicles to get out information, to get people to take action, to keep young people informed and engaged. It’s not necessarily exactly the same thing as watching C-SPAN every day, but it is getting in depth on a lot of these issues. It’s pretty consistent news.
And so that is really good to get the young people on these platforms educated. However, how we understand that these algorithms and For You Pages and things like that work, is that people have to show that they’re interested in receiving that information and interested in receiving that content.
And so if there is someone who, for example, is just really into sports, or just really into comedy, or is just really into whatever it might be, if they’re on these platforms enough and staying engaged and active in a natural way, they’re going to continue to be fed that content that they want and from people that they want. They’re not going to get some of the reports on the news on their For You Page because the algorithm, and these platforms, are going to say, “That’s not what this person is likely to engage with.”
So I think there is a lot of power, especially in the people who are maybe less political or apolitical or unengaged, to be impacted heavier when it’s from someone that is not a “political influencer.”
A lot of the time, it’s easier to get political influencers to be talking about these things. Because it’s what they care about and put their time and energy into. But it’s when these other people get political, and it doesn’t even have to be in large senses — it can be that they talk about an issue or something happening in the news that happens to have political undertones.
I think like, again, with Jake Paul, people aren’t thinking that they’re being fed political content, even though that ends up being the case, right?
So knowing the reach that Jake Paul has to people who, frankly, probably aren’t interested in politics — do you think that the Ramaswamy campaign picking Jake Paul specifically over some right-wing Twitch streamer was a calculated move? Because when I first saw it, I was like, “Well they probably don’t know anything about TikTok. Why would they pick Jake Paul?”
I mean, on the right, I think that some of the stuff they do is not on purpose.
That’s what I was wondering.
It’s not as purposely as smart as it sometimes is, right? I have looked at Vivek’s TikTok rollout and some of the things that he’s doing, whether on purpose or not, there is some good TikTok strategy behind it.
For example, a lot of Jake Paul’s TikTok following is probably non-political. I would assume his demographics are like, 12- to 25-year-old boys.
The endorsement did not really talk about the issues. It just said that he cares about young people, and he is going to be different, and that is what young people want out of politicians. Young people don’t trust systems, they don’t have super heavy loyalties to a political party.
His first TikTok, if you had it written down, and someone read it without it being about someone specific, is what young people want. It is someone who’s different, someone who’s not going to be a corrupt politician or is outside the system, is someone who understands your issues. A lot of his messaging is for how Gen Z wants to be spoken to, especially being on that platform.
However, I will caveat all of this by saying that as a candidate, this makes it tough to actually then be fully effective, because, I forgot what he called it, but he’s criticized TikTok…
He said it’s digital fentanyl or something like that.
Digital fentanyl from China or something like that. He wants to take away voting for people 18 to 25 unless they serve in the army or take a civics test. I am pro civics, but that is unlikely what he is envisioning. I think that it’s a form of voter suppression, as he wants it.
His attacks on young people then negate all of this perhaps accidental strategy that was good, right? That’s then why we see young people who are engaged and going to seek that out, and going to troll him and ratio him in the comments.
If you were to watch this video, and not know who it is and say, “He’s making some good points,” but then see that he’s being relentlessly trolled by young people, hopefully it will draw some questions.
In general, why the right has issues effectively communicating with Gen Z and effectively being up in these spaces, is because a lot of their messaging and stances are things that Gen Z overwhelmingly does not like.
Fetterman’s campaign is what every candidate trying to get that youth vote is trying to emulate. What is missing on the right?
I think it’s really hard for a lot of these people on the right, they’ll act in ways that go against things that they’ve said. Gen Z sees that, and if you know anything about that generation, they just don’t buy it.
That’s so much of what platforms like TikTok and Twitch cater to, and why they thrive on those platforms, because you can just pull out your phone and be talking while you’re getting ready with the worst angle possible…
I think it’s really hard, with Vivek as a key example, to say it’s digital fentanyl, and to be on the platform and be like, “I’m gonna be here because this is where you guys are at.” Like you want to get rid of this, so why are you really here? None of that can actually feel authentic.","https://techcrunch.com/wp-content/uploads/2023/10/Annie-Wu.png?resize=1200,800",2023-10-05 16:14:29
