Link,Title,Text,Image,Date Publish
https://techcrunch.com/2024/01/02/crowdfunding-is-actually-good/,Debunking the myth that crowdfunding is only good for cash,"Equity crowdfunding, or raising funds from both unaccredited and accredited investors, can be a great alternative to venture capital for startups. The strategy has become significantly more popular in recent years now that venture capital is harder to come by, and changes in regulations allow companies to raise more money at one time.
But even though crowdfunding is growing in prominence and offers a whole host of benefits to the startups that choose it, many VCs continue to talk negatively about the strategy. Many traditional investors feel equity crowdfunding is only for startups that can’t raise venture money. And they even deem capital raised this way as just cash that lacks the value an investor brings, be it their network that can help with hiring and connections to customers, or their own mentorship and experience.
Still, startups that have been down the crowdfunding road say that VCs are just talking their own book.
Chris Lustrino, the founder and CEO of crowdfunding data platform KingsCrowd, thinks crowdfunding definitely isn’t just for raising capital. KingsCrowd has been able to get repeat investors, customers and even talent from their crowdfunding campaigns, he told TechCrunch+, adding that he’s seen numerous other startups do the same.
“I would argue that the venture capital value-add is next to none in reality,” Lustrino said. “They want to hold on to their monopoly.”","https://techcrunch.com/wp-content/uploads/2023/03/GettyImages-1191380440.jpg?resize=1200,800",2024-01-02 16:00:13
https://techcrunch.com/2024/01/02/ai-versus-copyright-and-why-you-shouldnt-count-your-nft-chickens-before-they-hatch/,"AI versus copyright, and why you shouldn't count your NFT chickens before they hatch","AI versus copyright, and why you shouldn’t count your NFT chickens before they hatch
Listen here or wherever you get your podcasts.
Hello, and welcome back to Equity, the podcast about the business of startups, where we unpack the numbers and nuance behind the headlines.
Our Monday show, on Tuesday this week, covers the latest in tech news from the weekend and what’s making headlines early in the week. This being the first week of the year, we had to go over a thing or two that broke just as 2023 gave up the ghost. Here’s what we have on deck for you!",https://techcrunch.com/wp-content/uploads/2022/11/equity-podcast-2019-phone.webp?w=680,2024-01-02 15:15:15
https://techcrunch.com/2024/01/02/rivian-deliveries-slip-10-in-q4-raising-demand-questions/,"Rivian deliveries slip 10% in Q4, raising demand questions","Rivian reported Tuesday it produced 17,541 vehicles at its Normal, Illinois factory and delivered 13,972 to customers in the fourth quarter, mixed results that left investors wary and sent shares down in pre-market trading.
Rivian shares sank 9.75% to $21.17 at 1:40 pm ET.
Rivian had shown consistent growth in production and deliveries in the first three quarters of the year. And while production numbers continued on that upward trajectory in the fourth quarter, deliveries dipped by 10.2% from the previous quarter. That drop could signal softening demand for the company’s slate of premium EVs. Rivian produces four vehicles: its two consumer vehicles, the R1T truck and R1S SUV, and two versions of its commercial van.
Slowing demand for high-priced EVs has plagued automakers, forcing many to scale back production or cut prices. Rivian has managed to avoid slashing prices. If deliveries continue to fall into 2024, the automaker may have to take that strategy in an effort to boost its numbers. That would spell trouble for Rivian, which is not yet profitable.
The cost of building one Rivian vehicle continues to be a barrier to the company’s path toward profitability. Rivian’s consumer R1T and R1S vehicles sell for more than $80,000, on average. But the cost of building far exceeds any revenue it brings. In the second quarter, for instance, the company lost $32,495 on every vehicle it built.
Rivian said during its third-quarter earnings that it narrowed that per unit loss by $2,000 compared to the second quarter by simplifying its product portfolio and reducing material and labor costs. Cutting the sticker price would only put more pressure on margins.
On a full-year basis, Rivian produced 57,232 vehicles and delivered 50,122. This exceeded the automaker’s most recent full-year 2023 production guidance of 54,000 vehicles.
The company also announced that it will report fourth-quarter earning after markets close February 21.","https://techcrunch.com/wp-content/uploads/2023/05/rivian-Your_electric_adventure_awaits._Reserve_an_R1T_228.jpg?resize=1200,675",2024-01-02 14:40:40
https://techcrunch.com/2024/01/02/generative-ai-transforming-education-into-a-personalized-addictive-learning-experience/,"Generative AI: Transforming education into a personalized, addictive learning experience","It’s no surprise that educators have an uneasy relationship with generative AI. They fear the impact of plagiarism and machine-generated essays and the “hallucinations” — where the system confidently asserts something is true that isn’t simply because it doesn’t know any better — of tools like ChatGPT and Bard. There’s a palpable concern that generative AI will become a substitute for authentic learning: something that will help a person pass a test without the need to absorb and internalize the material.
While there is no doubt that AI has been used to circumvent the learning process, ChatGPT has already assumed the role of an ad hoc personal tutor for millions, changing learning consumption patterns and enhancing our relationship with education. The possibility of an AI-powered teaching assistant — one that mentors, encourages, and guides learners through the material in a one-to-one relationship — is within grasp. And the scalability of AI means that anyone can benefit from it.
AI can make — and, for many, already has made — learning addictive. The reasons why have little to do with cutting-edge advancements in AI and computer science and more to do with the fundamentals of what makes a learner engaged, motivated, and excited.
Growing up in Armenia, I was enthralled by the fiercely competitive math Olympiads, and my desire to win drove me to spend hours studying and practicing. Yet, as an adult, I couldn’t find that same motivation while studying math at MIT. I’ve spent a great deal of my life researching and understanding the motivations behind learning, some of which I’ve distilled into this piece and much of which led to me founding CodeSignal.
What do we mean by addictive?
Education has always been centered around the human element, and it’s hard to imagine a world where machines can replace that.
When I talk about AI making learning addictive, I’m talking about a sense of excitement and eagerness — instilling a voracious appetite for self-improvement and growth within a learner. But, more importantly, it continues long after they’ve accomplished what started their journey. Essentially, this boils down to sustained, long-term motivation. Creating self-motivated learners is a challenge that most educators face, and a mountain of educational research touches on this topic.
It’s hard to overstate the importance of motivation. Whether you’re learning to speak a new language or taking the first steps to a career in programming, learning is inherently iterative, where the learner gradually builds confidence and fluency over time. The prolific programming educator Zed Shaw once described this as “climbing a mountain of ignorance.” Those first few months — when you aren’t confident and don’t understand the subject — are the hardest, and it’s all too easy to give up. And that’s why you need an external force to encourage the learner to keep going. Confidence, ability, and perhaps even greatness are just around the corner.","https://techcrunch.com/wp-content/uploads/2019/03/GettyImages-482765551.jpg?resize=1200,720",2024-01-02 14:35:55
https://techcrunch.com/2024/01/02/tesla-2023-sales-figures-price-cuts/,Tesla's cheapest cars helped it notch another record year,"Tesla shipped a record number of electric vehicles in the fourth quarter to help it edge out its targets for the year. The company delivered 1.81 million EVs in 2023 and built 1.85 million, according to a Tuesday morning press release.
Those figures were slightly above the 1.8 million goal Tesla announced at the beginning of this year, and were overwhelmingly driven by the company’s most affordable EVs, the Model 3 and Model Y. The two models accounted for more than 96% of the vehicles Tesla built and shipped this year.
Tesla built nearly 500,000 cars in the fourth quarter alone at its factories in California, Texas, Germany and China, and delivered 484,507 worldwide. That includes the first few Cybertrucks, which started shipping late last year at a price tag of around $100,000. But we don’t know exactly how many Cybertrucks the company has sent to customers to date as it is lumping in those figures with Model S and X sales in an “other models” line item.
The strong finish to the year comes after Tesla saw its deliveries decline in the third quarter for the first time in a year, owing to some factory shutdowns — something that impaired CEO Elon Musk’s loftier goal of building 2 million cars this year. The company spent much of the year tinkering with its prices, starting with big price cuts, which has taken a huge bite out of its industry-leading profit margins.
Tesla’s big year is also due in large part to the company’s success in China, where competition for market share is becoming fierce due to waves of price cuts from competitors. That includes BYD, which has recently been on track to outpace Tesla’s EV global sales.","https://techcrunch.com/wp-content/uploads/2023/12/2021-Tesla-Model-Y-Goodbye-085.jpg?resize=1200,800",2024-01-02 14:26:58
https://techcrunch.com/2024/01/02/openai-dublin-data-controller/,OpenAI moves to shrink regulatory risk in EU around data privacy,"While most of Europe was still knuckle deep in the holiday chocolate selection box late last month, ChatGPT maker OpenAI was busy firing out an email with details of an incoming update to its terms that looks intended to shrink its regulatory risk in the European Union.
The AI giant’s technology has come under early scrutiny in the region over ChatGPT’s impact on people’s privacy — with a number of open investigations into data protection concerns linked to how the chatbot processes people’s information and the data it can generate about individuals, including from watchdogs in Italy and Poland. (Italy’s intervention even triggered a temporary suspension of ChatGPT in the country until OpenAI revised the information and controls it provides users.)
“We have changed the OpenAI entity that provides services such as ChatGPT to EEA and Swiss residents to our Irish entity, OpenAI Ireland Limited,” OpenAI wrote in an email to users sent on December 28.
A parallel update to OpenAI’s Privacy Policy for Europe further stipulates:
If you live in the European Economic Area (EEA) or Switzerland, OpenAI Ireland Limited, with its registered office at 1st Floor, The Liffey Trust Centre, 117-126 Sheriff Street Upper, Dublin 1, D01 YC43, Ireland, is the controller and is responsible for the processing of your Personal Data as described in this Privacy Policy.
The new terms of use listing its recently established Dublin-based subsidiary as the data controller for users in the European Economic Area (EEA) and Switzerland, where the bloc’s General Data Protection Regulation (GDPR) is in force, will start to apply on February 15 2024.
Users are told if they disagree with OpenAI’s new terms they may delete their account.
The GDPR’s one-stop-shop (OSS) mechanism allows for companies that process Europeans’ data to streamline privacy oversight under a single lead data supervisory located in an EU Member State — where they are “main established”, as the regulatory jargon puts it.
Gaining this status effectively reduces the ability of privacy watchdogs located elsewhere in the bloc to unilaterally act on concerns. Instead they would typically refer complaints back to the main established company’s lead supervisor for consideration.
Other GDPR regulators still retain powers to intervene locally if they see urgent risks. But such interventions are typically temporary. They are also exceptional by nature, with the bulk of GDPR oversight funnelled via a lead authority. Hence why the status has proved so appealing to Big Tech — enabling the most powerful platforms to streamline privacy oversight of their cross-border personal data processing.
Asked if OpenAI is working with Ireland’s privacy watchdog to obtain main establishment status for its Dublin-based entity, under the GDPR’s OSS, a spokeswomen for the Irish Data Protection Commission (DPC) told TechCrunch: “I can confirm that Open AI has been engaged with the DPC and other EU DPAs [data protection authorities] on this matter.”
OpenAI was also contacted for comment.
The AI giant opened a Dublin office back in September — hiring initially for a handful of policy, legal and privacy staffers in addition to some back office roles.
At the time of writing it has just five open positions based in Dublin out of a total of 100 listed on its careers page, so local hiring still appears to be limited. A Brussels-based EU Member States policy & partnerships lead role it’s also recruiting at the moment asks applicants to specify if they’re available to work from the Dublin office three days per week. But the vast majority of the AI giant’s open positions are listed as San Francisco/U.S. based.
One of the five Dublin-based roles being advertised by OpenAI is for a privacy software engineer. The other four are for: account director, platform; international payroll specialist; media relations, Europe lead; and sales engineer.
Who and how many hires OpenAI is making in Dublin will be relevant to it obtaining main establishment status under the GDPR as it’s not simply a case of filing a bit of legal paperwork and checking a box to gain the status. The company will need to convince the bloc’s privacy regulators that the Member State-based entity it’s named as legally responsible for Europeans’ data is actually able to influence decision-making around it.
That means having the right expertise and legal structures in place to exert influence and put meaningful privacy checks on a U.S. parent.
Put another way, opening up a front office in Dublin that simply signs off on product decisions that are made in San Francisco should not suffice.
That said, OpenAI may be looking with interest at the example of X, the company formerly known as Twitter, which has rocked all sorts of boats after a change of ownership in fall 2022. But has failed to fall out of the OSS since Elon Musk took over — despite the erratic billionaire owner taking a hatchet to X’s regional headcount, driving out relevant expertise and making what appear to be extremely unilateral product decisions. (So, well, go figure.)
If OpenAI gains GDPR main established status in Ireland, obtaining lead oversight by the Irish DPC, it would join the likes of Apple, Google, Meta, TikTok and X, to name a few of the multinationals that have opted to make their EU home in Dublin.
The DPC, meanwhile, continues to attract substantial criticism over the pace and cadence of its GDPR oversight of local tech giants. And while recent years has seen a number of headline-grabbing penalties on Big Tech finally rolling out of Ireland critics point out the regulator often advocates for substantially lower penalties than its peers. Other criticisms include the glacial pace and/or unusual trajectory of the DPC’s investigations. Or instances where it chooses not to investigate a complaint at all, or opts to reframe it in a way that sidesteps the key concern (on the latter, see, for example, this Google adtech complaint).
Any existing GDPR probes of ChatGPT, such as by regulators in Italy and Poland, may still be consequential in terms of shaping the regional regulation of OpenAI’s generative AI chatbot as the probes are likely to run their course given they concern data processing predating any future main establishment status the AI giant may gain. But it’s less clear how much impact they may have.
As a refresher, Italy’s privacy regulator has been looking at a long list of concerns about ChatGPT, including the legal basis OpenAI relies upon for processing people’s data to train its AIs. While Poland’s watchdog opened a probe following a detailed complaint about ChatGPT — including how the AI bot hallucinates (i.e. fabricates) personal data.
Notably, OpenAI’s updated European privacy policy also includes more details on the legal bases it claims for processing people’s data — with some new wording that phrases its claim to be relying on a legitimate interests legal basis to process people’s data for AI model training as being “necessary for our legitimate interests and those of third parties and broader society” [emphasis ours].
Whereas the current OpenAI privacy policy contains the much drier line on this element of its claimed legal basis: “Our legitimate interests in protecting our Services from abuse, fraud, or security risks, or in developing, improving, or promoting our Services, including when we train our models.”
This suggests OpenAI may be intending to seek to defend its vast, consentless harvesting of Internet users’ personal data for generative AI profit to concerned European privacy regulators by making some kind of public interest argument for the activity, in addition to its own (commercial) interests. However the GDPR has a strictly limited set of (six) valid legal basis for processing personal data; data controllers can’t just play pick ‘n’ mix of bits from this list to invent their own bespoke justification.
It’s also worth noting GDPR watchdogs have already been trying to find common ground on how to tackle the tricky intersection of data protection law and big data-fuelled AIs via a taskforce set up within the European Data Protection Board last year. Although it remains to be seen whether any consensus will emerge from the process. And given OpenAI’s move to establish a legal entity in Dublin as the controller of European users data now, down the line, Ireland may well get the defining say in the direction of travel when it comes to generative AI and privacy rights.
If the DPC becomes lead supervisor of OpenAI it would have the ability to, for example, slow the pace of any GDPR enforcement on the rapidly advancing tech.
Already, last April in the wake of the Italian intervention on ChatGPT, the DPC’s current commissioner, Helen Dixon, warned against privacy watchdogs rushing to ban the tech over data concerns — saying regulators should take time to figure out how to enforce the bloc’s data protection law on AIs.
Note: U.K. users are excluded from OpenAI’s legal basis switch to Ireland, with the company specifying they fall under the purview of its U.S., Delware-based corporate entity. (Since Brexit, the EU’s GDPR no longer applies in the U.K. — although it retains its own U.K. GDPR in national law, a data protection regulation which is still historically based on the European framework, that’s set to change as the U.K. diverges from the bloc’s gold standard on data protection via the rights-diluting ‘data reform’ bill currently passing through parliament.)","https://techcrunch.com/wp-content/uploads/2023/02/GettyImages-1173441590.jpg?resize=1200,800",2024-01-02 14:13:57
https://techcrunch.com/2024/01/02/fidelity-marks-down-x-to-almost-a-third-of-the-investment-price/,Fidelity marks down X valuation by 71.5%,"Mutual fund company Fidelity has marked down its investment in X holdings — the parent company of X (formerly Twitter) owned by Elon Musk — by 71.5% from the original valuation of shares, according to a new disclosure.
Fidelity spent $19.2 million to acquire a stake in X back in October 2022. The fund manager made a valuation cut of 65% in October 2023. And now in the November 2023 disclosure, the firm has made a further cut in X’s valuation. Notably, Fidelity’s disclosures are one month behind the current date.
X has gone through quite a lot of changes in the past year, including getting a new CEO in former NBCU exec Linda Yaccarino. During an interview at the Code Conference in September 2023, Yaccarino claimed that the company would turn profitable in 2024.
The biggest challenge for the company is to convince advertisers to spend money on the platform. A lot of prominent advertisers — including Apple, Comcast/NBCUniversal, Disney, Warner Bros. Discovery, IBM, Paramount Global, Lionsgate and the European Commission — pulled out from the platform after Musk called an antisemitic conspiracy theory the “actual truth.”
Later in the month, at the DealBook Conference, he told advertisers to go fuck themselves.
“What this advertising boycott is going to do is kill the company,” Musk continued. “And the whole world will know that those advertisers killed the company, and we will document it in great detail.”
In December, Financial Times reported that X will look to appease small and medium businesses to spend ad money on the platform. X contested The New York Times’ claim that the platform will lose $75 million because of an advertiser boycott and told FT that the estimated drop will be around $10-12 million.
“Small and medium businesses are a very significant engine that we have definitely underplayed for a long time “It [was] always part of the plan — now we will go even further with it,” X told the publication.
Musk has also made controversial decisions to restore accounts of previously banned users such as conspiracy theorist Alex Jones, Kanye West, former U.S. President Donald Trump, far-right influencer Andrew Tate and right-wing academic Jordan Peterson.","https://techcrunch.com/wp-content/uploads/2023/08/twitter-x-logo-musk-pattern-2.jpg?resize=1200,675",2024-01-02 08:32:38
