Link,post_title,post_content,featured_image,Date-Publish,post_category,post_tag
https://techcrunch.com/2024/03/25/ticktock-5-days-left-to-nest-your-early-bird-savings-for-tc-early-stage/,Ticktock: 5 days left to nest your early-bird savings for TC Early Stage,"Startup visionaries, time is running out! You only have 5 days left to take advantage of the early-bird savings for TechCrunch Early Stage 2024. This is an opportunity you don't want to miss, so secure your ticket now and save big before it's too late! The early-bird savings end on Friday, March 29 at 11:59pm PT.

TechCrunch Early Stage offers a wealth of valuable insights and knowledge for early-stage startups. Let's take a sneak peek at what awaits you at this exciting event:

""Selecting the Right Accelerator or Incubator"" with Emily Knight, president of the Engine Accelerator: Join Emily Knight as she shares her expertise on how incubators and accelerators can provide essential support structures for early-stage startups. Learn about tailored programs designed to assist founders transitioning from academia and national labs, ensuring a smooth navigation through post-formation challenges.

""How to Find Product-Market Fit When You Need It Most"" with Jess Lee, partner at Sequoia: Dive deep into the quest for product-market fit with Jess Lee, a seasoned partner at Sequoia. Benefit from her wealth of experience in building and scaling popular products, as well as her expertise in investing in companies like yours that are on the hunt for the perfect fit.

""How to Build an MVP and Navigate the Startup-Industrial Complex"" with James Currier, general partner at NFX: Join James Currier from NFX as he unravels the art of crafting the perfect minimum viable product (MVP). Gain valuable insights into striking the delicate balance between meeting user needs and avoiding the temptation of excessive features and polish in the startup-industrial complex.

These sessions are just a taste of what TechCrunch Early Stage 2024 has to offer. Don't miss out on these enlightening sessions and more! Secure your early-bird ticket today and position yourself for startup success.

If your company is interested in sponsoring or exhibiting at TechCrunch Early Stage 2024, we invite you to reach out to our sponsorship sales team by completing this form. This is a great opportunity to showcase your brand and connect with the startup community.

Time is running out, so don't hesitate! Grab your early-bird ticket now and join us at TechCrunch Early Stage 2024 for a transformative experience that will set you on the path to startup success.",https://techcrunch.com/wp-content/uploads/2024/02/5DaysLeft_EarlyStage24_1200x628.png?w=1200,2024-03-25 13:00:22,Innovation,Innovation
https://techcrunch.com/2024/03/25/lucid-motors-1-billion-saudi-arabia-gravity-suv/,Lucid Motors raises another $1 billion from Saudi Arabia as it searches for luxury EV buyers,"Lucid Motors, the luxury electric vehicle manufacturer, is securing an additional $1 billion in funding from its major investor, Saudi Arabia. The aim of this funding is to alleviate the high costs associated with the production and sale of its high-end electric sedan. The announcement was made in a regulatory filing on Monday, revealing that Ayar Third Investment, an affiliate of Saudi Arabia's Public Investment Fund, will purchase $1 billion worth of Lucid's stock. This investment will increase the Kingdom's ownership stake to approximately 60%.

This new funding comes shortly after Lucid informed investors that it plans to manufacture approximately 9,000 units of its Air electric vehicles this year, a slight increase compared to the previous year's production. In 2023, the company reported a loss of $2.8 billion and ended the year with nearly $1.4 billion in cash and equivalents. Lucid has encountered challenges in finding buyers for its expensive Air sedan and has resorted to reducing prices multiple times in recent months to stimulate sales. Additionally, the company intends to commence production of its electric Gravity SUV by the end of the year.

Interestingly, Lucid's decision to accept further investment from Saudi Arabia comes in light of CEO Peter Rawlinson expressing caution about relying heavily on the Kingdom for funding. In an interview with the Financial Times, Rawlinson emphasized the importance of not assuming unlimited financial support from the Public Investment Fund (PIF) of Saudi Arabia. He stated, ""If I adopt a mindset that there is bottomless wealth from PIF, that is very dangerous, that is something I will never do, I respect them far too much for that.""

By securing this additional funding, Lucid Motors aims to address the financial challenges inherent in the production and sale of its luxury electric vehicles. With the support of its major investor, Saudi Arabia, the company seeks to overcome obstacles in attracting buyers for its high-priced vehicles. Despite the hurdles faced, Lucid Motors remains committed to expanding its product lineup, with plans to introduce the electric Gravity SUV later this year.

The partnership between Lucid Motors and Saudi Arabia's Public Investment Fund highlights the Kingdom's interest in supporting the development and growth of the electric vehicle industry. As a major global player in the energy sector, Saudi Arabia recognizes the potential of electric vehicles in reducing carbon emissions and transitioning to a more sustainable future. Lucid Motors, with its innovative technology and commitment to luxury electric vehicles, aligns with the Kingdom's vision for a greener transportation sector.

In conclusion, Lucid Motors' recent funding success demonstrates the company's determination to overcome financial challenges and continue its growth trajectory. With the backing of Saudi Arabia's Public Investment Fund, Lucid Motors aims to expand its electric vehicle lineup and boost sales. The partnership between the luxury electric vehicle manufacturer and the Kingdom showcases the shared vision for a cleaner and more sustainable transportation sector. As Lucid Motors moves forward, it remains committed to delivering high-quality, cutting-edge electric vehicles to discerning customers worldwide.","https://techcrunch.com/wp-content/uploads/2021/09/IMG_2580.jpg?resize=1200,675",2024-03-25 14:31:52,Innovation,Innovation
https://venturebeat.com/ai/companies-are-about-to-waste-billions-on-ai-heres-how-not-to-become-one-of-them/,Companies are about to waste billions on AI - here's how not to become one of them,"Join us in Boston on March 27 for an exclusive night of networking and insightful conversations about data integrity. Request an invite here.

""It's venture money, not adventure money."" That was the response a friend received from a venture capitalist while pitching an idea. However, during the hype cycle of a new technology, caution tends to be thrown out the window. Venture capitalists need to invest the capital they raised, and the cost of missing out on a big opportunity is higher than the downside of taking a swing and missing, especially when everyone else is doing the same.

This dynamic also plays out within companies, especially when it comes to AI and anything associated with it. Large language models (LLMs) are considered AI, as is machine learning (ML). Suddenly, projects that were previously denied funding can be rebranded as AI projects and given another chance.

Billions of dollars will be wasted on AI in the next decade. This may sound contrary, but it is the reality of every big technology wave. We get excited before fully understanding its true transformative potential. Search, social media, and mobile have had a lasting impact, but virtual reality (VR) and crypto have been more limited in their reach.

Five years ago, the headlines were filled with promises of AI changing everything. Companies are now rushing to show how much they are investing in AI and its potential. This shotgun approach to investing often results in a few successful ventures and many failures. VCs and company leaders are driven by the fear of missing out and the hope of finding the next big thing.

However, this doesn't diminish the fact that LLMs are a game-changing technology. Just look at how quickly ChatGPT reached 100 million users compared to other transformative companies. Almost every enterprise company is leveraging LLMs and AI in some way. The question is, how do you decide where to invest and where you have the potential to succeed?

To make informed decisions and cut out wasted spending, consider these three factors:

1. Understand the total cost over time: Before saying yes to an AI project, evaluate the resources required to sustain it, both in terms of present and future costs. Often, the work of a data science team requires additional engineering, DevOps, QA, product, and SysOps time. Many projects fail because they lack ongoing investment. While saying no to an AI initiative can be difficult, frequently saying yes can come at the expense of fully funding projects that are worth supporting in the long run. Additionally, using AI without generating sufficient downstream value can eat into your margins and negatively impact customer satisfaction.

2. Ask why others can't do it: In the tech industry, there are monopolies and commodities. When considering an AI initiative, question why your company is the right fit for it. Working on something that commoditizes over time can be challenging, especially without the advantage of scale or cost. Instead, focus on areas where you have a defensive moat, such as preferential access to data, proprietary insights, or an application with strong network effects.

3. Make a few strategic bets: Sometimes, the best bets are the ones that improve your existing business. As the BASF commercial says, ""We don't make the things you buy, we make the things you buy better."" If applying AI can enhance your products or services, it is a worthwhile investment. It is important to see these bets through and provide momentum to your business.

In conclusion, AI is a transformative technology, but it also comes with risks and challenges. By understanding the total cost, evaluating your competitive advantage, and making strategic bets, you can navigate the AI landscape with more clarity and avoid wasted spending. Join us in Boston on March 27 to learn more about data integrity and network with industry leaders. Request an invite today.",https://venturebeat.com/wp-content/uploads/2024/03/An_AI_sitting_in_a_corner_curled_up_looking_sa-transformed.jpeg?w=1200&strip=all,2024-03-24 18:00:00,Innovation,Innovation
https://www.forbes.com/sites/paultassi/2024/03/25/suicide-squad-kill-the-justice-league-approaches-its-do-or-die-moment-with-joker-release/,‘Suicide Squad: Kill The Justice League’ Approaches Its Do-Or-Die Moment With Joker Release,"Joker Rocksteady: A Make-or-Break Moment for Suicide Squad

Suicide Squad: Kill the Justice League is gearing up for its first major content update, and it's a crucial moment for the game's future. This update promises a new squad member, the iconic Joker, along with fresh weapons, missions, and a thrilling boss fight. With a year's worth of content planned, this release will set the tone for the game's success.

The game's performance has been closely monitored, especially on PlayStation where it briefly claimed the top spot upon launch. However, on Xbox, it struggled to break into the top 20 and quickly dropped out of the top 50. Steam has been even less forgiving, with a lackluster launch compared to Marvel's Avengers and consistently low player counts. Currently, Suicide Squad sits at the 1,011th spot for best-selling games on the platform. Its viewership on Twitch has also dwindled significantly since launch, from 155,177 to a mere 65.

These numbers paint a grim picture, and the game desperately needs a miraculous surge in popularity. While Suicide Squad boasts positive user scores and commendable combat mechanics, its main storyline suffered due to the focus on building live content. Players are tasked with fighting 13 different Brainiac variants, which can become tiresome. Additionally, despite unique character designs, the combat moveset for all squad members remains largely similar.

Monetization is another concern. Like the ill-fated Avengers game, Suicide Squad offers heroes for free and relies on cosmetic battle passes for revenue. While player-friendly, this model may not generate substantial profits. A small playerbase means fewer players will engage with new live content, and even fewer will be willing to spend on cosmetic upgrades when characters like Joker are already available at no cost.

The future of Suicide Squad hangs in the balance. The game's lackluster post-launch support, including a dearth of helpful balance patches and prolonged player lockouts, has not helped its cause. If the Joker fails to captivate players and turn the tides, it is unlikely that the game will survive the year, let alone complete its planned four seasons of content.

Follow Joker Rocksteady on Twitter, Threads, YouTube, and Instagram for the latest updates. And don't miss out on his thrilling sci-fi novels, the Herokiller series, and The Earthborn Trilogy. The adventure awaits!",https://imageio.forbes.com/specials-images/imageserve/65afd8128aa1647475d47024/0x0.jpg?format=jpg&height=900&width=1600&fit=bounds,2024-03-25 09:23:44,Innovation,Innovation
https://techcrunch.com/2024/03/25/spotify-throws-its-hat-in-the-edtech-ring/,Spotify throws its hat in the edtech ring,"Welcome back to Equity, the podcast that dives deep into the world of startups and breaks down the numbers and stories behind the headlines. In today's episode, we have a lot of ground to cover, so let's jump right in.

First up, let's talk about the global stock market. It's safe to say that stocks are currently in retreat, but on the bright side, the world of cryptocurrency is seeing some recent gains. It's an interesting dynamic to watch, and we'll be keeping a close eye on how it develops.

Moving on to the startup world, the big news of the day is the exit of Stability AI's CEO. This comes as no surprise, considering the company's revenue growth and burn rate have been hot topics of discussion lately. This leadership change is definitely an important milestone for Stability AI, and we'll be watching to see how it impacts the company's future trajectory.

Shifting our focus to Europe, there's been a lot of buzz around the new Digital Markets Act and its impact on U.S.-based tech companies. It's becoming increasingly clear that these tech giants need to find a better working relationship with the EU if they want to avoid further scrutiny and potential penalties. It's a relationship that will be closely watched by both sides of the Atlantic.

Speaking of Europe, Spotify is making another non-musical push, and I have a few thoughts on that. It's always interesting to see companies expand their offerings and venture into new territories. We'll have to wait and see how Spotify's latest endeavor pans out.

On the topic of international news, let's turn our attention to China. There have been reports that the country is set to release the Vision Pro next, and there's also a push to replace Intel and AMD chips in state computers. These developments have the potential to shake up the tech landscape, and we'll be following the story closely.

Lastly, let's discuss the battle between beverage startups and the industry giants, Coke and Pepsi. These startups are fighting tooth and nail for their share of the market, and it's an exciting time to see how they're challenging the status quo. We'll be keeping an eye on this David vs. Goliath fight and see who comes out on top.

That's it for today's episode of Equity. If you want to dive deeper into any of the stories we covered, you can find episode transcripts and more on Equity's Simplecast website. Don't forget to subscribe to us on Apple Podcasts, Overcast, Spotify, and all the casts. And if you're into crypto, be sure to check out TechCrunch's fantastic show that interviews founders and dives into the world of cryptocurrency.

Thanks for tuning in, and we'll catch you next time on Equity.","https://techcrunch.com/wp-content/uploads/2024/02/GettyImages-1783835425-crop.jpg?resize=1200,675",2024-03-25 14:22:20,Innovation,Innovation
https://www.forbes.com/sites/adrianbridgwater/2024/03/25/the-ever-changing-face-of-software-modernization/,The Ever Changing Face Of Software Modernization,"GIZA, EGYPT - In recent years, software has been undergoing a process of modernization. This shift towards cloud-native infrastructures has revolutionized applications for both enterprise and consumer use. However, the challenge with software modernization is that it must constantly adapt to remain up-to-date. What was considered modern last year may no longer be relevant today. The rise of generative Artificial Intelligence (AI) is a perfect example of how rapidly technology can evolve.

To predict future tech trends, the IT industry relies on reports, surveys, and analysis initiatives that provide quantifiers, qualifiers, and identifiers. These insights help us understand the changing landscape of IT. Red Hat's recent ""State of Application Modernization Report,"" conducted in collaboration with research firm Illuminas, reveals some interesting findings. While enterprise application containers were previously seen as the future, this report suggests a shift towards Continuous Integration & Continuous Delivery (CI/CD) pipelines as the top priority for software modernization in the always-on world of connected cloud.

Another company at the forefront of software modernization is Nutanix, a multi-cloud platform provider. Their sixth global Enterprise Cloud Index (ECI) survey predicts a doubling in the adoption of hybrid multi-cloud models over the next few years. In this context, hybrid multi-cloud refers to a combination of private on-premises cloud, public cloud services provided by hyperscalers, and services that span both worlds. This approach allows organizations to leverage the benefits of multiple cloud providers based on factors such as price, data governance, and technical requirements.

The motivation behind software modernization varies, but AI, security, and sustainability are among the key drivers. As businesses increasingly prioritize AI, investment in AI strategy has become the top priority for IT decision-makers. This is closely followed by investment in IT modernization, as organizations face pressure to update their infrastructure quickly.

Moving applications and data across different environments can be complex, which is why the Nutanix report emphasizes the use of hybrid multi-cloud infrastructure. Security and innovation were identified as the main drivers for transitioning applications between environments in the past year. To meet these evolving demands, 80% of survey respondents plan to invest in IT modernization, and 85% plan to increase their investment in AI strategy.

Overall, software modernization is an ongoing process driven by the need to adapt to new technologies, improve security, and enhance sustainability. As organizations navigate the complexities of hybrid multi-cloud environments, they must prioritize investment in AI and IT modernization. By doing so, they can ensure their IT infrastructure remains efficient and up-to-date in an ever-changing digital landscape.",https://imageio.forbes.com/specials-images/imageserve/660181597188fb59284d9023/0x0.jpg?format=jpg&height=900&width=1600&fit=bounds,2024-03-25 10:28:24,Innovation,Innovation
