Link,post_title,post_content,featured_image,Date-Publish,post_category,post_tag
https://www.forbes.com/sites/krisholt/2024/03/24/todays-quordle-hints-and-answers-for-monday-march-25/,"Today’s ‘Quordle’ Hints And Answers For Monday, March 25","Welcome to today's blog post, where we will be discussing the popular word game, Quordle. Whether you're a seasoned player or a newcomer, this article will provide you with hints and answers to help you navigate through the game. So, let's dive right in!

Firstly, let's quickly go over the rules of Quordle for those who are unfamiliar. The objective of the game is simple - you need to guess four five-letter words correctly. However, the twist is that you play all four words simultaneously. You have nine attempts to find the correct words, and each guess will give you a clue about the placement of the letters.

Now, let's move on to today's Quordle hints. Here are some clues to help you out:

Hint for Word 1 (top left): Think of a past tense verb that means to suspend something loosely with straps. It's similar to how you would hang a hammock.

Hint for Word 2 (top right): This word describes the act of quickly cooking food on a barbeque. It's a common activity during summer gatherings.

Hint for Word 3 (bottom left): Consider the word that represents the way in which something is organized, planned, or arranged. Your desk, for example, has a specific...

Hint for Word 4 (bottom right): Sometimes, unexpected and upsetting things happen suddenly. This word captures that idea.

Here's an additional clue for you: One of the words has a pair of repeated letters. Keep this in mind as you make your guesses.

Now, let's reveal the answers for today's Quordle game:

Word 1 (top left): SLUNG
Word 2 (top right): GRILL
Word 3 (bottom left): SETUP
Word 4 (bottom right): SHOCK

Congratulations if you managed to solve all the words correctly! If you need more hints or solutions, be sure to check out my blog for Tuesday's game.

Quordle is a fun and challenging word game that keeps your mind sharp. It's a great way to pass the time and test your vocabulary skills. So, why not give it a try? Challenge yourself and see how many words you can guess correctly. Remember, practice makes perfect, so don't be discouraged if you don't solve all the words right away.

Thank you for joining us today, and we hope you found this article helpful. Stay tuned for more Quordle hints and answers in the future. Good luck and happy gaming!",https://imageio.forbes.com/specials-images/imageserve/6553f0c05fe0ab340db88291/0x0.jpg?format=jpg&height=900&width=1600&fit=bounds,2024-03-24 18:00:35,Innovation,Innovation
