Link,post_title,post_content,featured_image,Date-Publish,post_category,post_tag
https://www.forbes.com/sites/erikkain/2024/03/23/todays-wordle-1009-hints-clues-and-answer-for-sunday-march-24th/,"Today’s ‘Wordle’ 1009 Hints, Clues And Answer For Sunday, March 24th","Today's Wordle Guide: How to Solve the Puzzle and Uncover the Hidden Phrase

Are you ready to tackle today's Wordle challenge? If you're in need of hints, clues, and the answer, you've come to the right place. Let's dive in and unravel the mystery behind the daily Wordle puzzle.

As we embrace this lazy Sunday, let's set our sights on cracking the code of Wordle. But before we delve into the puzzle, I must confess a culinary desire: rabbit pot pies on Easter. The juxtaposition of sweet irony with a savory dish is a tantalizing thought. Perhaps one day, we'll indulge in this delectable treat.

Now, let's shift our focus to the main event - solving today's Wordle. Here are the clues you need to crack the code:

Hint: Useful when dry, useless when wet.
Clue: The hidden phrase starts with a consonant.

And now, the moment of truth - the answer to today's Wordle is revealed:

[Hidden Phrase]

Wordle Strategy Analysis:

Reflecting on my Wordle journey, my initial guess of ""chain"" led me astray with a staggering 681 words. However, a strategic shift to ""slope"" brought me closer with a manageable 19 words. Opting for ""below"" proved fruitful, despite the nagging feeling that it might have been a previous Wordle solution. The serendipitous guess of ""towel"" proved to be the winning move. Coincidence or clever deduction? You be the judge.

Competitive Wordle Score:

A total washout in today's challenge - scoring zero points for guessing in four attempts and failing to match the Wordle Bot. Zeroes all around, but the thrill of the chase remains undiminished.

Etymology of ""Towel"":

Delving into the origins of the word ""towel,"" we trace its roots back to the Old French term ""touaille,"" which made its way into English in the 13th century. This linguistic evolution highlights the influence of Norman French on the English language post the Norman Conquest in 1066. From ""touaille"" to the modern English ""towel,"" the word's journey signifies its essential role in daily life for drying and wiping purposes.

Closing Thoughts:

Thank you for joining me on this Wordle adventure. Be sure to visit my blog for daily Wordle guides, along with a myriad of content ranging from TV shows, streaming recommendations, movie reviews, video game coverage, and more. Your support is truly appreciated. Until next time, happy puzzling!","https://imageio.forbes.com/specials-images/imageserve/6209dc2871dc07b5bc2b0ac7/0x0.jpg?format=jpg&crop=3846,2163,x0,y191,safe&height=900&width=1600&fit=bounds",2024-03-23 19:00:25,Innovation,Innovation
https://www.forbes.com/sites/zakdoffman/2024/03/23/google-upgrade-samsung-s24-s23-pixel-towards-apple-iphone-15-pro-max/,Google Suddenly Reveals Surprise Android Update That Beats iPhone,"d users are already benefiting from the latest updates and features. This could potentially shift the balance of power in the smartphone market, as Google continues to innovate and push boundaries.

The recent Android 15 developer preview has unveiled a groundbreaking feature that is set to revolutionize the way users connect in areas with poor cellular coverage. Google is introducing satellite connectivity to Android devices, allowing users to expand their cellular accounts with a satellite add-on. This feature will enable core messaging apps to utilize the satellite network, ensuring seamless communication even in remote locations.

With this update, Android is not only matching Apple's existing satellite SOS functionality but surpassing it with a more versatile and user-friendly approach. The addition of a new API in Android 15 allows apps to detect when a device is connected to a satellite, opening up endless possibilities for enhanced connectivity. Users can now send and receive messages via SMS, MMS, and RCS using satellite connectivity, eliminating the frustrations of cellular black spots.

Apple, on the other hand, has a more limited satellite connectivity feature restricted to certain iPhone models. While iPhone users can text emergency services, request roadside assistance, and share their location using satellites, the functionality is primarily geared towards emergency situations. Google's approach with Android 15 focuses on expanding satellite connectivity for everyday use, providing a more comprehensive solution for users in various scenarios.

The potential for direct-to-phone satellite connectivity is on the horizon, with companies like SpaceX testing high-speed satellite connections on smartphones. This development hints at a future where smartphones can seamlessly connect to satellites for calls and messages, even in the absence of traditional cellular networks. The integration of messaging services with satellite technology is just the beginning of a new era in communication technology.

As Android and iPhone continue to converge in terms of features and capabilities, Google's proactive approach to innovation sets the stage for a dynamic shift in the smartphone landscape. The introduction of satellite messaging on Android devices signifies a leap forward in connectivity and accessibility, positioning Google as a frontrunner in the evolution of mobile communication.

In conclusion, the competition between Android and iPhone is heating up, with each platform striving to outdo the other in terms of cutting-edge features and user experience. With Google leading the charge with satellite connectivity on Android 15, the future of mobile communication looks promising and full of exciting possibilities. Stay tuned for more updates as the smartphone market continues to evolve and redefine the way we connect with the world.",https://imageio.forbes.com/specials-images/imageserve/65d79ec3dadcd6b682668331/0x0.jpg?format=jpg&height=900&width=1600&fit=bounds,2024-03-23 19:17:25,Innovation,Innovation
https://techcrunch.com/2024/03/23/apple-sued-microsofts-ai-ambitions-and-nvidia-surprises/,"Apple sued, Microsoft's AI ambitions and Nvidia's surprises","Welcome to this edition of Week in Review, where we bring you the latest news and updates on various tech topics. In this week's edition, we have some significant developments in the Apple antitrust lawsuit and Microsoft's AI ambitions. So, let's get right into it.

The U.S. Department of Justice recently accused Apple of using monopolistic tactics to lock in iPhone users. Apple, on the other hand, argues that the DOJ's actions could jeopardize the very features that its users love about its phones and ecosystem. While there are similarities between Apple's situation and Microsoft's antitrust case in the 1990s, there are also notable differences in how the two companies retain customers. However, experts predict that it may take three to five years for this lawsuit to reach a resolution, so immediate outcomes are unlikely.

Moving on to other news, Microsoft made headlines when it acquired the co-founders of Inflection AI. Mustafa Suleyman will now lead the consumer-facing unit Microsoft AI, while Karén Simonyan assumes the role of EVP and CEO of the same group. Inflection AI recently raised $1.3 billion in funding, with Microsoft being its biggest investor.

Nvidia's GTC event also grabbed attention. In addition to their groundbreaking work on ray tracing, CEO Jensen Huang made some surprising announcements. He predicted that artificial general intelligence is just five years away, and the company unveiled a new AI platform called GR00T, designed for humanoid robots.

Google and Apple are reportedly in talks to deploy Google's AI model on upcoming iOS updates. It remains to be seen whether this collaboration is a temporary solution until Apple's AI efforts catch up or the beginning of a long-term partnership.

In terms of hacking and privacy, the Biden administration is forming an international coalition to combat commercial spyware. Interestingly, some of the investors joining this coalition were previously involved in the spyware business, highlighting the changing tides in the industry. Additionally, a recent hack disrupted a $5 million Apex Legends tournament, serving as a reminder of the vulnerabilities in online gaming.

Glassdoor users have reported a concerning issue with their profiles. Some claim that their real names were added without their consent, leaving them with no choice but to delete their accounts entirely. It's crucial to be cautious when leaving reviews on such platforms.

In funding and IPO news, Reddit had a successful IPO, with its stock price surging 48% on the first day of trading. Astera Labs, a company specializing in connectivity hardware for cloud computing data centers, also experienced a strong start, with its stock closing at $62.03 on day one. Additionally, The Browser Company, the startup behind the Arc browser, recently raised $50 million at a valuation of $550 million. While the company has launched several features and AI updates, its path to monetization remains unclear.

In our bonus round, we explore the limitations of AI, including its struggles with spelling. Despite its immense potential, AI-generated images often contain spelling errors, and we delve into the reasons behind this phenomenon. Additionally, Fisker, an electric vehicle manufacturer, has paused production due to financial constraints. The company urgently needs to secure more capital to continue its operations.

AI systems like ChatGPT and Gemini pose a challenge when it comes to reviewability. While it's nearly impossible to fully review these systems, it remains crucial to test and evaluate them to ensure their reliability and effectiveness.

That wraps up this edition of Week in Review. We hope you found these updates informative and engaging. Stay tuned for more exciting news in the tech world.","https://techcrunch.com/wp-content/uploads/2024/03/apple-antitrust-doj-splash.jpg?resize=1200,675",2024-03-23 20:15:37,Innovation,Innovation
https://www.forbes.com/sites/ewanspence/2024/03/23/apple-iphone-16-pro-ios-18-ai-china-baidu-google-gemini/,Apple’s Latest AI Move To Change Your New iPhone,"As Apple gears up to unveil its AI strategy for the iPhone, a potential collaboration with Google is on the horizon, alongside a new partnership with China's Baidu.

The iPhone 15 series has lagged behind in the AI race compared to flagship Android devices, which heavily promote generative AI. While current AI features focus on software functionalities like image processing and predictive text, generative AI will make its debut in the upcoming iOS 18 release, expected to coincide with the launch of the next-gen iPhone 16 lineup.

Apple, like many other smartphone manufacturers, will adopt a dual approach to AI processing—both on-device and in-the-cloud. Leveraging its reputation for prioritizing data privacy, Apple will prioritize local processing whenever possible. However, cloud-based processing will be essential for more complex AI applications.

Rumors suggest that Apple is in talks with Google to utilize its Gemini generative AI service for cloud-based processing. Despite Google's dominance in the Android market, the two tech giants have collaborated on various fronts, including making Google the default search engine on Apple devices. This partnership could potentially bring millions of AI users to Google, boosting its AI ecosystem's competitiveness against rivals like OpenAI.

However, due to regulatory restrictions and limitations on Google's Gemini service in China, Apple is exploring a partnership with Baidu, China's leading AI provider. Negotiations are underway to integrate Baidu's cloud-based AI services into iOS 18 and the iPhone 16 series to cater to the Chinese market.

Apple is not the only player pursuing such collaborations. Samsung recently unveiled the Galaxy S24 lineup and its Galaxy AI services, some of which rely on Google Gemini. Similarly, to cater to the Chinese market, Samsung has partnered with Baidu for AI services.

It will be interesting to see how Apple differentiates its AI offerings, considering they are built on the same underlying technology as its competitors.

For more updates on iPhone, Mac, and App Store news, check out Forbes' weekly Apple Loop news digest.","https://imageio.forbes.com/specials-images/imageserve/6470e48fe2490b1a1cb845f0/0x0.jpg?format=jpg&crop=3561,2003,x374,y223,safe&height=900&width=1600&fit=bounds",2024-03-23 19:31:06,Innovation,Innovation
https://www.forbes.com/sites/brianmazique/2024/03/23/ufcs-dana-white-cuts-fighter-immediately-after-he-bit-an-opponent/,UFC’s Dana White Cuts Fighter Immediately After He Bit An Opponent,"Pressure and combat sports can push athletes to extreme measures, and the recent incident at UFC Fight Night: Ribas vs. Namajunas serves as a stark reminder of this. Igor Severino, making his UFC debut, shocked everyone when he bit his opponent, Andre Lima, during their preliminary bout. This act of unsportsmanlike conduct occurred in the second round while Severino was in a standing grappling position behind Lima.

The bite marks, confirmed by images, left no room for doubt, leading to Severino's disqualification. This unfortunate incident not only tarnished Severino's reputation but also jeopardized his future in the promotion. The 20-year-old had a chance to establish himself in the UFC, but his actions on Saturday made it difficult for him to earn another opportunity.

Severino's loss to Lima marked the first defeat of his career, dropping his record to 9-1 with the disqualification. On the other hand, Lima maintained his undefeated streak, improving to 8-0. The severity of the situation was emphasized by UFC CEO Dana White, who wasted no time in cutting Severino from the roster. White expressed his disappointment, stating, ""Those were two up-and-coming undefeated fighters. If you get frustrated and want to quit, there are plenty of ways to do it, but biting your opponent is the worst thing you can do. Now, you not only lose your chance at the biggest opportunity of your life, but you'll also face repercussions from the NSAC.""

While biting incidents are not unheard of in combat sports, they remain deeply frowned upon. In this particular case, Lima displayed remarkable composure, calmly informing the referee about the bite and initiating a brief investigation into the matter. Severino now faces the daunting task of rebuilding his reputation through smaller promotions before he can even think of competing in the UFC, the Professional Fighters League, or any other respected mixed martial arts organization.

As the events of Saturday's fights in Las Vegas unfold, we await more conventional results from the night. Stay tuned for further updates on this eventful evening in the world of combat sports.","https://imageio.forbes.com/specials-images/imageserve/65ff92c285143669667fa59c/0x0.jpg?format=jpg&crop=3188,1794,x0,y217,safe&height=900&width=1600&fit=bounds",2024-03-23 22:45:24,Innovation,Innovation
https://www.forbes.com/sites/brucelee/2024/03/23/the-invisible-shield-aims-to-makes-public-health-more-visible/,‘The Invisible Shield’ Aims To Makes Public Health More Visible,"Anthony Chen, MD (R), former Director of Health Emeritus for the Tacoma-Pierce County Health Department, featured in Episodes 1 and 3 of “The Invisible Shield,” meets with Gregory Christopher, Senior Pastor of Tacoma’s Shiloh Baptist Church. Their collaboration played a vital role in ensuring Christopher's church community adhered to recommended precautions during the Covid-19 pandemic.

Public health, much like an offensive line in football, often goes unnoticed when it is doing its job effectively. The upcoming PBS series, The Invisible Shield, sheds light on the essential work of public health professionals in safeguarding communities from various health threats. Premiering on March 26 at 10 pm, this four-episode series aims to raise awareness about the critical role of public health in our daily lives.

The title of the series, The Invisible Shield, symbolizes the unobtrusive yet essential nature of public health efforts. While public health professionals work tirelessly to protect the population, their work often goes unnoticed amidst the noise of other news and distractions. As Kelly Henning, MD, Public Health Program Lead for Bloomberg Philanthropies, highlights in the first episode, “The better public health works, the less likely you are to see it.” Unfortunately, the lack of visibility and recognition has led to chronic underfunding and neglect of public health systems.

The Covid-19 pandemic has starkly exposed the vulnerabilities of public health systems worldwide. The inadequate resources and support for public health agencies have resulted in significant challenges in combating the virus and mitigating its impact. Despite a brief moment of acknowledgment during the pandemic, the long-term sustainability of public health systems remains uncertain. It is crucial to address these systemic issues before another crisis unfolds.

RadicalMedia, in collaboration with Bloomberg Philanthropies, produced The Invisible Shield to amplify the importance of public health on a broader scale. While celebrities and influencers dominate the media landscape, public health initiatives often go unnoticed. The series aims to highlight the profound impact of public health achievements, such as vaccination programs and disease prevention efforts, on individual lives.

In the trailer for The Invisible Shield, Josh Sharfstein, MD, emphasizes the role of public health in preserving lives, even when its contributions go unrecognized. The series serves as a platform to showcase the pivotal role of public health in shaping our collective well-being. Each episode delves into different aspects of public health, exploring its historical significance and contemporary challenges.

“The Old Playbook,” the first episode of The Invisible Shield, delves into the evolution of public health practices and their impact on life expectancy. From lessons learned from past epidemics to current threats to the public health infrastructure, the episode provides a comprehensive overview of the field. By highlighting the critical role of public health in societal progress, the series aims to spark conversations and inspire action towards supporting public health initiatives.

As we anticipate the premiere of The Invisible Shield, let us reflect on the invaluable contributions of public health professionals in safeguarding our communities. By raising awareness and advocating for greater support for public health, we can ensure a healthier and more resilient future for all. Tune in to The Invisible Shield to discover the untold stories of public health heroes and the invisible shield that protects us all.",https://imageio.forbes.com/specials-images/imageserve/65ff76b9cc324c33ed5484d7/0x0.jpg?format=jpg&height=900&width=1600&fit=bounds,2024-03-23 21:25:08,Innovation,Innovation
https://www.forbes.com/sites/jamiecartereurope/2024/03/23/explained-the-difference-between-a-solar-eclipse-and-a-lunar-eclipse/,Explained: The Difference Between A Solar Eclipse And A Lunar Eclipse,"Do you know the difference between a solar eclipse and a lunar eclipse? In the next few weeks, we will witness two celestial events—an upcoming lunar eclipse on Monday, March 25, and a solar eclipse on Monday, April 8. While these phenomena are distinct, they both occur due to a similar alignment of celestial bodies.

Let's first understand what causes a lunar eclipse. This type of eclipse can only happen during a full moon when the Earth is positioned between the sun and the moon, casting a shadow into space. Although full moons occur every 29 days, it is rare for the moon to pass through Earth's shadow. When it does, we witness a lunar eclipse.

On the other hand, a solar eclipse can only occur during a new moon when the moon is positioned between the sun and Earth, casting a shadow onto our planet. New moons happen every 29 days, approximately two weeks after a full moon. However, it is uncommon for the moon to block the sun as seen from Earth. When this alignment occurs, a solar eclipse takes place.

Now, let's dive into the specifics of each type of eclipse. During a total lunar eclipse, a perfect alignment of the sun, Earth, and moon occurs. Earth possesses two shadows—the fuzzy outer penumbral shadow and the dark central umbral shadow. When a full moon enters Earth's umbra, it receives no direct sunlight. The only light reaching its surface is sunlight refracted by Earth's atmosphere. This unique phenomenon creates a breathtaking sight—a thousand sunsets on the lunar surface, resulting in a pinkish-red hue known as the ""Blood Moon."" If one were to stand on the moon during a lunar eclipse, they would be bathed in this pinkish-red light, experiencing a partial or total solar eclipse.

On March 25, we will witness a penumbral lunar eclipse, as the full ""Worm Moon"" moves through Earth's penumbra, the outer part of its shadow.

Similarly, a total solar eclipse occurs due to a perfect alignment of the sun, moon, and Earth, combined with a celestial fluke. A new moon possesses two shadows—the fuzzy outer penumbral shadow and the dark central umbral shadow. Only when the new moon completely blocks the sun, which is possible because the moon is 400 times smaller but also 400 times closer to Earth, its umbra is projected onto our planet.

The shadow of the moon moves across Earth's surface as it orbits from west to east, matching the direction of Earth's rotation. This synchronization slows down the movement of the moon's shadow, creating a path of totality called the umbral shadow. Within this path, observers witness an awe-inspiring sight—a total solar eclipse. If one were on the moon during a total solar eclipse, they would witness the moon's shadow traversing Earth.

On April 8, a total solar eclipse will occur as the new ""Pink Moon"" perfectly aligns with the sun, casting an umbral shadow over North America.

Now, you may wonder why lunar and solar eclipses are rare occurrences. This rarity can be attributed to the tilt of the moon's orbit around Earth, which is about 5 degrees in relation to the sun's path through the sky. Due to this tilt, the moon's path intersects with the sun twice during each orbit (approximately every month), but for an eclipse to occur, the moon must be in its new or full phase. These conditions are met twice a year, resulting in two ""eclipse seasons"" during which solar and lunar eclipses are more likely. However, most solar eclipses are either partial or annular (resembling a ""ring of fire""), while most lunar eclipses are penumbral or partial.

Looking ahead to future eclipses, in 2024, we can expect two eclipse seasons starting on March 25 and September 17, featuring a penumbral lunar eclipse, a total solar eclipse, a partial lunar eclipse, and an annular solar eclipse, visible in North America, the Pacific Ocean, South America, and other regions.

In 2025, two more eclipse seasons will occur starting on March 13 and September 7, showcasing a total lunar eclipse, a partial solar eclipse, and another total lunar eclipse. These events will be visible in North America, Canada, northern Europe, Asia, and Antarctica.

For the latest updates on the upcoming total solar eclipse on April 8 in North America, make sure to check my main feed for new articles each day.

Get ready to witness these celestial marvels with clear skies and wide eyes.",https://imageio.forbes.com/specials-images/imageserve/65f6b43702078076f68d7fcf/0x0.jpg?format=jpg&height=900&width=1600&fit=bounds,2024-03-23 19:00:00,Innovation,Innovation
