Link,Title,Text,Image,Date Publish
https://techcrunch.com/2023/10/05/paradigm-matt-huang-testimony-sbf-trial-investor-fraud/,'Marked to zero': Paradigm testimony at SBF trial points to investor fraud,"The testimony of Matt Huang, co-founder and managing partner of crypto investment firm Paradigm, at Sam Bankman-Fried’s trial may help the prosecution convince jurors that the former crypto mogul defrauded investors.
Huang testified Thursday that he and his firm were in the dark about a range of business practices at FTX, red flags that would have affected his decision to invest in the company. Namely, FTX’s use of customer funds to prop up Bankman-Fried‘s hedge fund Alameda Research.
Government cooperation aside, Huang likely has his own motives for testifying against Bankman-Fried and distancing his firm from FTX. Paradigm is part of a class-action lawsuit (which was temporarily stayed in June) that accuses it, alongside Sequoia Capital and Thoma Bravo, of promoting FTX to the detriment of its users.
According to Huang’s testimony, Paradigm was duped, as well.
Over two funding rounds between 2021 and 2022, Paradigm invested $278 million into FTX. When prosecutor Thane Rehn asked what Paradigm estimates the current value of that investment to be, Huang replied, “We have marked it to zero.”
That establishes damage has been done in the form of financial losses, one of the things the prosecution will have to establish in order to prove fraud.
The government will also have to establish misrepresentation, showing that the defendant made false statements or concealed material information in order to convince investors to fork over money. Prosecutors also need to prove that the investors relied on Bankman-Fried’s misrepresentations. Finally, they’ll need to demonstrate that Bankman-Fried intended to defraud investors, which could be more difficult.
Huang’s testimony Thursday at least supports the establishment of three out of four of those elements.
Paradigm began considering investment into FTX in 2019, according to Huang. During that time, Huang testified that he was told FTX exchange wallets served as a custodian for customer deposits and would always be available if customers wished to withdraw. He wasn’t told that FTX could take those deposits out and use them for their own business purposes.
When asked if he would have still invested in FTX knowing that, Huang responded, “Likely not.”
“If it became known that they were doing that, I think the exchange would lose credibility in the brand and people wouldn’t want to use it, so it would be existential to the business,” said Huang.
Not only was Huang uninformed about FTX’s habit of using customer deposits for its own purposes, but he also testified that he didn’t know Alameda was able to access those deposits, and wouldn’t have invested in FTX if he had.
“Customer deposits are sort of sacred,” he said.
As Paradigm was considering investment into FTX, Huang said he raised concerns about the link between Alameda and FTX. Mainly, he was worried that Alameda — one of the largest traders on the platform — would get preferential treatment, which would also be damaging to FTX’s reputation.
Bankman-Fried told Huang Alameda didn’t have preferential treatment on the platform. But the prosecution pointed out that Alameda was exempt from FTX’s liquidation engine, a risk management strategy that’s designed to automatically trigger the sale of assets if certain risk parameters are exceeded.
Huang said FTX’s liquidation engine was a big part of why Paradigm was attracted to the company. He also agreed that Alameda’s exemption is inconsistent with Bankman-Fried’s statement that it didn’t get preferential treatment.
“It would have meant that Alameda could trade with leverage on the platform and, if those trades didn’t work out, could ultimately incur a negative balance that would have to be paid for somehow,” said Huang. “In a typical case, that might come from the money we were investing into the company that would go to fund operations. But in any case, it would leave the business at risk of becoming insolvent.”
Rehn also sought to establish that Bankman-Fried made false statements to lull Paradigm into investing. He pulled up an excel spreadsheet that had been attached to an email Bankman-Fried sent to Huang showing FTX’s financial stats as of April 2021. The balance sheet showed FTX’s annualized approximate revenue, estimating a net profit for Q1 2021 of $85 million. Rehn asserted that FTX had moved certain expenses off those financial statements in order to artificially inflate the reported net profits.
Throughout his testimony, Huang repeated that he had also expressed concerns with Bankman-Fried over FTX’s lack of a board and lack of governance, which he said could lead to unintended value leakage. While this did not ultimately stop Paradigm from investing in FTX, Huang testified that “SBF was very resistant to having investors on the board.”","https://techcrunch.com/wp-content/uploads/2023/10/GettyImages-1708738406.jpg?resize=1200,800",2023-10-06 03:35:40
https://techcrunch.com/2023/10/05/all-eyes-on-vw-after-hyundai-kia-adopt-tesla-charging-standard/,"All eyes on VW after Hyundai, Kia adopt Tesla charging standard","Hyundai and Kia have finally announced their plans to adopt Tesla’s North American Charging Standard (NACS) ports for their electric vehicles in the U.S. and Canada, joining the swells of automakers that have also promised to do so.
The move will give Hyundai and Kia drivers — as well as drivers of Ford, General Motors, Mercedes-Benz, Honda and Rivian vehicles — access to thousands of Tesla Superchargers across the two countries and Mexico.
As NACS seems to outstrip the Combined Charging System (CCS) as the new charging standard, the question on the auto industry’s mind is when will Volkswagen ante up?
In June, VW’s EV charging subsidiary Electrify America said it would add the NACS connector to Electrify America and Electrify Canada’s fast charging networks by 2025. Many thought that day wouldn’t happen, given how much money VW had to shell out to build that CCS-based charging network in the first place. VW poured $2 billion into building out the Electrify America (EA) as part of a settlement of the VW diesel emissions scandal.
Like most other charging companies, EA said it would continue to provide CCS connectors throughout its network, as well. And Tesla will include CCS connectors at some of its U.S. charging stations to reap some of the rewards of the Biden administration’s IRA subsidies. Tesla’s Supercharger network accounts for about 60% of fast chargers in the U.S., according to the Department of Energy.
Volkswagen didn’t respond in time to TechCrunch’s request for comment, but the company has been in talks with Tesla to adopt the NACS charge port on future vehicles since summer 2023. VW is one of the largest automakers in the world, representing brands like Audi, Bentley, Bugatti, Porsche and Lamborghini.
Over the next few years, under the VW brand, the automaker hopes to release a range of new EV models, including the 2024 ID.3, 2024 ID.7 and the 2025 ID.7 Wagon.
Most of the automakers that have signed up to build EVs equipped with NACS ports are aiming for 2025 models. Hyundai is aiming for even earlier.
The automaker said Thursday that new Hyundai EVs in the U.S. — like the Ioniq 5, Ioniq 6 and upcoming Ioniq 7 — will come with the NACS port starting in the fourth quarter of 2024. That will begin in Canada in the first half of 2025. Genesis, Hyundai’s luxury brand, will also jump on the NACS train.
Kia also said it would build the NACS port into new EVs sold in North America in the fourth quarter of 2024.
Both Hyundai and Kia said they expect to have adapters available at dealers in the first quarter of 2025, for customers who own vehicles with CCS ports.
Tesla’s NACS is quickly becoming the industry standard, in part due to Tesla’s already strong footprint of Superchargers at good locations along highways. EV drivers also say Tesla offers a more streamlined and simpler charging process.
In late June, SAE International, formerly the Society of Automotive Engineers, said it would develop an industry standard around NACS, which would assuage other companies wary of letting a competitor control a key part of the EV experience.","https://techcrunch.com/wp-content/uploads/2023/06/GettyImages-1252172149.jpg?resize=1200,736",2023-10-05 23:17:53
https://techcrunch.com/2023/10/05/a16z-backed-castelion-wants-to-mass-produce-defense-hardware-starting-with-hypersonics/,"a16z-backed Castelion wants to mass produce defense hardware, starting with hypersonics","One builds weapons in hopes that they are not used. Thus goes the central premise of deterrence theory, which says it is the credible threat of aggression — not the use of aggression — that will ensure states avoid war.
This theory has dominated much of America’s strategic thinking over the past 50-plus years, but new technologies and new adversaries threaten to upend the status quo. For the first time, China has started to outpace the U.S. in critical weapons programs — the country developed a new type of weapon called a hypersonic glide vehicle as early as 2014, which can strike Taipei and the Taiwan Strait in about 20 minutes from the country’s strategic bases in the South China Sea. America’s comparative sluggishness to develop such tech could result in the U.S. falling catastrophically behind its adversaries.
The founders of Castelion, a startup that emerged from stealth this week, cut straight to the point: “Simply put — this cannot be allowed to happen.”
The 11-month-old defense startup wants to completely rethink defense hardware development for complex systems, starting with long-range strike hypersonic weapons, a capability that Castelion co-founder and CEO Bryon Hargis called “a national, strategic-level non-nuclear deterrent.”
“China is going faster than us in basically every area,” he said. “They pass the U.S. in some areas, but if you give them enough time, they’re going to pass us in all areas if we don’t do something different. It’s, in my opinion, existential. We grew up in an era of fairly good security and I don’t know necessarily that our children are to have that opportunity if somebody doesn’t do something about it.”
Making American deterrence credible again
Castelion was founded by a trio of ex-SpaceXers, Bryon Hargis, Sean Pitt and Andrew Kreitz, in November 2022. The company is part of a wave of new defense tech startups that have little faith in large American primes and their ability to ensure the country retains its dominant position in the global asymmetry of military power.
In a blog post announcing Castelion, the trio say as much, writing that conditions in the defense industrial base, like consolidation, production delays and ballooning program costs, “have left our nation in a worse position to protect democracy and confront our adversaries around the world.”
The startup wants to do things differently: move faster, design hardware to be produced at scale, and vertically integrate to cut costs. Pitt said that long-range strike weapons were a clear opportunity for an agile hardware development approach.
Its thesis has caught investor support, with the company closing a $14.2 million initial funding round co-led by Andreessen Horowitz and Lavrock Ventures, with participation from First In, BlueYard Capital and Champion Hill Ventures.
Castelion’s founding team is notable for their individual success in the aerospace industry. Hargis, a mechanical engineer by training, joined SpaceX in 2017 and eventually became a senior director of government sales, essentially building out an entire government sales team and that enormous line of business for the company; Pitt was the original salesperson for SpaceX’s hugely successful ride-share program and eventually became director of launch and human spaceflight sales for the European continent; and Kreitz was a senior investment banker at Goldman Sachs before joining SpaceX as senior finance manager.
Hargis and Pitt worked alongside each other at SpaceX’s D.C. office, and Hargis and Kreitz worked directly together regarding finance matters. The three would talk on the evenings and weekends, Pitt said, and the thesis for the company started forming. It was clear that they would have to leave SpaceX if they wanted to focus on defense hardware: SpaceX is not a defense company, even if its technologies do much to serve the national interest.
“SpaceX is fundamentally a Mars company,” Kreitz said. “It will do great defense work if it’s along that development path, but [it] isn’t core, and that’s what precipitated us leaving.”
Hargis echoed these comments: “I think we did some amazing work at SpaceX for national security that will continue to pay dividends for the country for probably multiple decades to come. But I really wanted to be more focused on defense than SpaceX wanted to be.”
Castelion is kicking off its focus on hypersonic missile systems. The U.S. wants to procure these capabilities for a handful of reasons, many of which have to do with the particulars of the Western Pacific theater. These systems offer a big boost in range without a commensurate energy cost, which is critical for safely covering the roughly 1,800 miles between the U.S. territory of Guam and the coast of China. As two officials from the U.S. Department of Defense put it in a recent op-ed, all of the missiles in America’s arsenal “appropriate for the Western Pacific theater” will need to fly at Mach speeds.
Hypersonic missiles are also highly maneuverable, which makes it difficult to predict where they will strike. But perhaps most importantly, they offer a non-nuclear deterrence option — a way for both the United States and China to avoid a severely catastrophic outcome that both countries have vowed to avoid via the adoption of no-first use policies.
Of course, Castelion can’t simply turn up on Uncle Sam’s doorstep one day with a fully finished hypersonic weapon and a bill. Instead, the El Segundo, California–based startup is taking time to build its credibility with missile subsystems: solid rocket motors, low-cost avionics and ultra-high temperature ceramic matrix composite (CMC) materials. The idea is to first become a supplier to a prime working on an existing hypersonic missile program, before eventually building complete missile systems all in-house.
Because rapid design-build-test cycles are built into the company’s strategic mission, the company is also focused on building a hypersonic test platform both for customers looking to test and for in-house testing.
Castelion’s primary engineering efforts, which include developing the avionics and manufacturing the high-temperature CMCs, are taking place in El Segundo. Castelion also has a special use permit for outside of Naval Air Station Fallon in Nevada to do rocket motor production and testing. Looking ahead, the company plans on conducting its first full flight test of its solid motors using a single-stage rocket later this year, and the company plans on scaling its materials testing, starting with a subscale hypersonic glide vehicle shell to demonstrate that it can make complex shapes using the CMC material.
Next year, the 15-person company is planning on making a two-stage test vehicle. It also plans on executing out its three government contracts (the details of which the company couldn’t disclose) and to continue building out its team. It’s more than a little ambitious.
“We’re fairly used to being called crazy,” Hargis joked. “I could see it from the outside, being slightly skeptical, but I think that after you’ve done several crazy things successfully, you realize it’s not crazy to dream big.”","https://techcrunch.com/wp-content/uploads/2023/10/image003.jpg?resize=1200,800",2023-10-05 22:30:01
https://techcrunch.com/2023/10/05/sbf-trial-gary-wang/,Alameda had a $65B line of credit and 'unlimited withdrawals',"The Sam Bankman-Fried trial gained steam after a somewhat sleepier first half of the day. That’s when prosecutors and the defense asked a witness and former FTX developer about the technical details of the crypto exchange as well as Alameda Research.
But that changed around 4 p.m. when FTX co-founder and CTO Gary Wang took the stand, wearing a wrinkled suit. Prior to Wang taking the stand, there was a 15-minute break during which Bankman-Fried looked visibly irritated.
Bankman-Fried’s parents were also there. During the break, they went to their son seemingly in an effort to provide support. At one point his father, Joseph Bankman, patted his mother, Barbara Fried, on the back, said something and laughed. She didn’t laugh back but continued to look away toward her son.
On the stand, Wang admitted that he committed wire fraud, securities fraud and commodities fraud. He added that Bankman-Fried, Nishad Singh and Caroline Ellison were the individuals he committed the crimes with.
Wang, Singh and Ellison pleaded guilty in late December 2022 as part of a deal to cooperate with the government and testify during this trial.
Wang said that they were given “special privileges from Alameda Research,” the crypto trading firm that he said he and Bankman-Fried started prior to launching FTX. Those privileges included getting large lines of credit, unlimited withdrawals and being able to have negative balances. Wang said that the “unlimited funds” came from FTX customers; a special code was added to customer transactions that funneled the money to Alameda.
He shared during his testimony that he was in charge of writing and reviewing code. And while Bankman-Fried did not write the code, Wang said Bankman-Fried did tell him and other developers what to implement. “Sometimes we talked [disagreements] out, but in the end, it’s Sam’s decision,” Wang said.
Negative balances, unlimited withdrawals
Because of these special privileges, Alameda had a $65 billion line of credit, Wang said. “Normal large businesses have single to double digits [of credit] in the millions.” By the time the two businesses filed for bankruptcy in mid November 2022, Alameda withdrew $8 billion, Wang said.
These internal financial advantages were not disclosed to the public, he shared.
Alameda and FTX were both started by Bankman-Fried and Wang, with ownership split 90% and 10%, and then 17% equity and 65% equity, respectively. Singh also had 5% equity of FTX, and a number of outside investors held other positions, Wang noted.
The ownership percentages never changed, he added. At the time, both Wang and Bankman-Fried were billionaires.
During his time at the companies, Wang also disclosed that Alameda “loaned” him around $200 million to $300 million. But the money never went to his bank account, and it instead went to investments that FTX made into other companies.
Naming the business
The company also picked its name to outsmart other businesses, which might have negative connotations toward companies with crypto jargon in their titles. “Alameda” derived from Alameda County in California and “Research,” was because it “sounds prestigious” and is not using a crypto-related name, Wang said.
The initial funds for Alameda came from Bankman-Fried personally as well as various lenders. Wang said Bankman-Fried also believed it would be easier to get bank accounts, rental leases, investors and so on, with a more “normal” company name.
The prosecutors aired a clip of Bankman-Fried from April 2021 on a podcast, where he explained Alameda’s name. “If we named our company Shitcoin Day Trader’s Inc., no one would do business [with us],” he said at the time.
Wang’s testimony is expected to continue on Friday morning until midday, according to prosecutors at the trial.","https://techcrunch.com/wp-content/uploads/2022/11/ftx-broken-on-fire.jpg?resize=1200,645",2023-10-05 21:35:03
https://techcrunch.com/2023/10/05/spyhide-oospy-hacked-phone-spyware-shuts-down/,Hacked phone spyware shuts down… again,"A short-lived spyware operation called Oospy, which emerged earlier this year after its predecessor Spyhide was hacked, is no longer operational and has shut down.
Oospy appeared online in late July as a rebrand of a phone monitoring app called Spyhide, which was facilitating the surveillance of tens of thousands of Android device owners around the world. Spyhide shut down after a breach exposed the operation and its administrators who were profiting from it.
Although Spyhide’s website disappeared from the internet after the hack burned the operation, the spyware’s back-end server stayed online and was still communicating with the tens of thousands of phones it was monitoring since the server was hosted on an entirely different domain. That allowed the administrators to rebrand Spyhide to Oospy without affecting the spyware operation itself.
That back-end server, which stored the victim’s stolen phone data from thousands of Android devices around the world, was taken offline Thursday by the web host Hetzner, which said the service violated its terms of service.
“In addition, we have terminated the customer’s server contract in due time,” Christian Fitz, a spokesperson for Hetzner, told TechCrunch.
In their time online, Spyhide and Oospy had at least 60,000 victims across the world, including thousands of victims in the United States. These stalkerware (also known as spouseware) apps are planted on a victim’s phone, often by someone with knowledge of their passcode. Once planted, these apps continually steal a victim’s contacts, messages, photos, call logs and recordings, and granular location history.
Following the Spyhide hack, TechCrunch identified two of the administrators behind Spyhide and Oospy. One of the administrators, Mohammad (also goes by Mojtaba) Arasteh, confirmed to TechCrunch that he worked on the project “several years ago as a programmer,” but denied involvement with Oospy.
But a mistake on Oospy’s checkout page, which used PayPal to process customer payments, exposed the name of the PayPal account holder, who shares the same family name as Arasteh.
It’s not uncommon for spyware operations to rely on payment services like PayPal to handle customer payments, despite PayPal’s policies broadly prohibiting customers from using its service to buy or sell software that facilitate illegal activity, like spyware. PayPal spokesperson Caitlin Girouard did not comment on the accounts when reached by TechCrunch. Oospy stopped accepting PayPal for payments a short time later, though it’s not known if PayPal took action against the account.
Arasteh did not comment on the PayPal account when contacted by TechCrunch. Soon after contacting Arasteh, Oospy’s website went offline altogether.
The shutdown of the spyware’s back-end server marks the end of Spyhide and Oospy’s ability to operate, for now.
Oospy and Spyhide are the latest phone surveillance operations to drop off the internet in recent months. Polish-made stalkerware LetMeSpy shut down after an earlier data breach in June. And last year, one of the largest known Android spyware apps, SpyTrac, disappeared following a TechCrunch investigation linked the spyware operation to Support King, which was banned from the surveillance industry by the FTC following an earlier data breach.","https://techcrunch.com/wp-content/uploads/2021/09/android-spyware-malloc.jpg?resize=1200,751",2023-10-05 21:15:51
