Link,post_title,post_content,featured_image,Date-Publish,post_category,post_tag
https://techxplore.com/news/2024-03-large-language-simple-mechanism-knowledge.html,Large language models use a surprisingly simple mechanism to retrieve some stored knowledge,"Large language models (LLMs), like ChatGPT, are incredibly complex and widely used in various fields. Despite their widespread use, scientists still don't fully understand how these models work. To gain insights into their inner workings, researchers at MIT and other institutions conducted a study to investigate how these machine-learning models retrieve and decode stored knowledge.

Surprisingly, the researchers discovered that LLMs often use simple linear functions to recover and decode facts. Linear functions, which involve two variables and no exponents, capture the straightforward relationship between these variables. They found that the model employs the same decoding function for similar types of facts. By identifying linear functions for different facts, researchers can probe the model to understand its knowledge about new subjects and where that knowledge is stored within the model.

Using a novel technique they developed, the researchers estimated these simple functions. They observed that even when a model provides incorrect answers, it often retains the correct information. In the future, this approach could be used to identify and correct falsehoods within the model, reducing the occurrence of incorrect or nonsensical answers.

Evan Hernandez, an electrical engineering and computer science graduate student at MIT and co-lead author of the study, explains, ""Even though these models are really complicated and trained on lots of data, there are sometimes really simple mechanisms working inside them. This is one instance of that.""

The paper detailing these findings was authored by Evan Hernandez, Arnab Sharma (a computer science graduate student at Northeastern University), Jacob Andreas (associate professor in EECS at MIT), David Bau (assistant professor of computer science at Northeastern), and other researchers from MIT, Harvard University, and the Israeli Institute of Technology. The research will be presented at the International Conference on Learning Representations (ICLR 2024) in Vienna.

LLMs, also known as transformer models, are neural networks composed of interconnected nodes or neurons. These networks encode and process data, resembling the structure of the human brain. Much of the knowledge stored within a transformer model can be represented through relations that connect subjects and objects. For example, the relation ""Miles Davis plays the trumpet"" connects the subject (Miles Davis) to the object (trumpet).

As a transformer model acquires more knowledge, it stores additional facts about a particular subject across multiple layers. When a user poses a question about that subject, the model must decode the most relevant fact to provide an accurate response. For instance, if someone prompts the model with ""Miles Davis plays the..."", the model should respond with ""trumpet"" rather than ""Illinois"" (the state where Miles Davis was born).

The researchers conducted experiments to investigate LLMs and found that, despite their complexity, these models use simple linear functions to decode relational information. Each decoding function is specific to the type of fact being retrieved. For example, the model utilizes one decoding function to output the instrument a person plays and a different function to output the state where a person was born.

To estimate these simple functions, the researchers developed a method and computed functions for 47 different relations, such as ""capital city of a country"" and ""lead singer of a band."" Although there are countless possible relations, the researchers focused on this subset as they are representative of the types of facts that can be expressed using linear functions.

To evaluate the functions, the researchers tested them by altering the subject to see if they could recover the correct object information. The results showed that the linear functions were effective in decoding and retrieving the necessary facts.

This study sheds light on the inner workings of large language models and highlights the presence of simple mechanisms within complex models. By understanding these mechanisms, researchers can explore ways to improve model performance and accuracy, ultimately enhancing the reliability and usefulness of large language models.",https://scx2.b-cdn.net/gfx/news/hires/2024/large-language-models-2.jpg,2024-03-25 09:34:06,Innovation,Innovation
https://www.zdnet.com/home-and-office/networking/grab-a-free-nintendo-switch-and-200-target-gift-card-when-you-sign-up-for-verizon-home-internet/,Get a free Nintendo Switch and $200 Target gift card when you sign up for Verizon Home Internet now,"'ZDNET Recommends': What exactly does it mean?

When you come across the label 'ZDNET Recommends,' you might be wondering what it signifies. Allow us to shed some light on this for you.

At ZDNET, our recommendations are not made lightly. We take great care in evaluating and testing various products and services to provide you with accurate and reliable information. Our process involves extensive research, hours of testing, and thorough comparison shopping. We gather data from reputable sources, including vendor and retailer listings, as well as independent review sites. Additionally, we place high value on the opinions of real people who have already purchased and utilized the products and services we assess. By analyzing customer reviews, we gain valuable insights into what matters most to consumers like you.

Now, you may be wondering how we fund our work. When you click through from our site to a retailer and make a purchase, we may earn affiliate commissions. These commissions help support our team's efforts without affecting the content we cover or how we cover it. Rest assured, our recommendations remain unbiased and unaffected by any financial incentives. We hold ourselves to strict guidelines to ensure that our editorial content is never influenced by advertisers. Your trust is of utmost importance to us, and we strive to maintain the highest standards of integrity and transparency.

At ZDNET, our dedicated editorial team works tirelessly on your behalf. Our primary goal is to provide you with the most accurate information and the most knowledgeable advice possible. We want to empower you to make informed decisions when it comes to purchasing tech gear and a wide range of products and services. To achieve this, our editors meticulously review and fact-check every article before publication. We hold ourselves accountable for any errors or misleading information, and if such instances occur, we promptly correct or clarify the article. We value your feedback, so if you come across any inaccuracies in our content, please let us know through this form.

In summary, when you see 'ZDNET Recommends,' it signifies our commitment to delivering reliable, well-researched, and unbiased recommendations. We strive to be your trusted source of information, helping you make smarter buying decisions. With our extensive testing, careful analysis of data, and consideration of real user experiences, you can rely on our recommendations to guide you towards the best products and services available.",https://www.zdnet.com/a/img/resize/d14c505f8c3172cf99c3baabc760a34861982b25/2022/08/03/c69c9d98-18fd-4a49-89a8-db4716d578ac/nintendo-switch-oled-model.jpg?auto=webp&fit=crop&height=675&width=1200,2024-03-24 08:53:00,Innovation,Innovation
https://techcrunch.com/2024/03/25/fisker-nissan-deal-dead-funding-bankruptcy/,"Fisker loses potential Nissan deal, putting rescue funds at risk","The negotiations between Fisker and a large automaker, rumored to be Nissan, have come to an end, jeopardizing the company's near-term rescue funding efforts. Fisker made this announcement in a regulatory filing on Monday, stating that the automaker terminated the negotiations on March 22. The reason for this termination was not explained. However, Fisker was required to continue the negotiations as part of the closing conditions for a potential $150 million convertible note that was announced last week. In response to this development, Fisker plans to ask the unnamed investor to waive the closing condition. 

Following this news, Fisker's stock plummeted by 28% and trading was halted. This is just the latest setback for the struggling electric vehicle (EV) startup. Fisker has been facing challenges in selling its Ocean SUV, falling short of its own sales goals. The company has also faced difficulties in resolving quality issues with some of the cars that have been delivered. These problems have forced Fisker to shift away from its direct sales model. 

In an effort to cut costs, Fisker laid off 15% of its staff in February, which amounted to around 200 people. Additionally, the company recently reported having only $121 million in the bank and warned investors that it would not survive without a fresh injection of cash within a year. Fisker has been in talks with other automakers, including Mazda, but it seems that only Nissan was still considering a potential partnership. 

Despite the termination of negotiations with Nissan, Fisker remains optimistic and is exploring other options. The company is evaluating various ""strategic alternatives,"" which include potential tie-ups with other companies, in or out of court restructurings, capital market transactions subject to market conditions, repurchases, redemptions, exchanges, or refinancings of existing debt, issuance of equity securities, sale of assets and businesses, and other strategic measures. 

This latest development is undoubtedly a blow to Fisker, but the company is determined to find a way forward. It remains to be seen what the future holds for this EV startup, but one thing is certain - the road ahead will not be easy. Fisker will need to navigate these challenges and make the right decisions to secure its survival and success in the competitive electric vehicle market.","https://techcrunch.com/wp-content/uploads/2024/03/GettyImages-1236611991.jpg?resize=1200,759",2024-03-25 13:52:11,Innovation,Innovation
https://techcrunch.com/2024/03/25/elon-musk-x-ccdh-california-lawsuit-dismissed/,A judge just killed Elon Musk's lawsuit against an anti-hate research org,"A federal judge has dismissed a lawsuit brought by Elon Musk and his company, X, against the Center for Countering Digital Hate (CCDH). The lawsuit was filed last year, with X accusing CCDH of spreading misleading claims through unflattering reports about hate and extremism on the platform. X claimed to have lost ""tens of millions of dollars"" as a result of CCDH's research. Musk and X also accused CCDH of illegally scraping data and breaking platform rules by using a third-party social media monitoring tool called Brandwatch.

However, the United States District Judge of the Northern District of California, Charles R. Breyer, sided with CCDH and dismissed the lawsuit. The judge also denied Musk and X the opportunity to relitigate the case. In his ruling, Judge Breyer stated that the purpose of the lawsuit was to punish CCDH for criticizing X and to dissuade others from engaging in such criticism.

The CCDH is a nonprofit organization that was formed in 2018. It conducts research on hate speech, extremism, and misinformation on major social networks. Its research exposes disturbing content on platforms like TikTok, YouTube, and Instagram, including reports on eating disorder content, climate denial, and violent misogynistic threats. The organization aims to hold social media companies accountable for their decisions that impact democracy, human rights, and civil liberties.

CCDH's victory in California is seen as a significant win for researchers who monitor online extremism. However, Elon Musk is pursuing a similar lawsuit against the left-leaning media watchdog Media Matters for America. Unlike the CCDH lawsuit, Musk's lawsuit against Media Matters is taking place in Texas, which does not have the same protections against frivolous lawsuits that stifle free speech.

The ruling in favor of CCDH is a blow to Musk's attempts to silence critics and demonstrates that even the wealthiest individuals cannot bend the rule of law to their will. CCDH's legal team, which includes Roberta Kaplan, who recently won a defamation suit against former President Donald Trump, celebrated the decision as a reaffirmation of the right to research, speak out, and hold social media companies accountable.

While this victory is significant, the battle against online extremism and misinformation continues. It is crucial to support organizations like CCDH that work tirelessly to expose and combat hate speech and extremism on social media platforms. By holding these platforms accountable, we can protect our democracy, human rights, and civil liberties.","https://techcrunch.com/wp-content/uploads/2023/08/twitter-x-logo-musk-pattern.jpg?resize=1200,675",2024-03-25 20:33:17,Innovation,Innovation
https://www.zdnet.com/article/upgrade-to-windows-11-pro-for-just-25-right-now/,Upgrade to Windows 11 Pro for just $25 right now,"'ZDNET Recommends': What does it mean?

When you come across the tagline 'ZDNET Recommends' on our website, it signifies that our recommendations are the result of extensive testing, research, and comparison shopping. We dedicate many hours to gathering data from the best available sources, including vendor and retailer listings, as well as other relevant and independent review sites. Moreover, we carefully examine customer reviews to understand what matters to real people who already own and use the products and services we assess.

It's important to note that when you click through from our site to a retailer and make a purchase, we may earn affiliate commissions. This helps support our work, but it has no influence on what we cover, how we cover it, or the price you pay. We want to emphasize that neither ZDNET nor the author receive any compensation for these independent reviews. In fact, we adhere to strict guidelines that ensure our editorial content is never influenced by advertisers.

At ZDNET, our editorial team writes on your behalf, the reader. Our primary goal is to provide you with the most accurate information and the most knowledgeable advice possible. We aim to assist you in making smarter buying decisions, whether it's related to tech gear or a wide array of products and services. To ensure the highest quality of content, our editors thoroughly review and fact-check every article. If we make an error or publish misleading information, we are committed to correcting or clarifying the article. We value your feedback and encourage you to report any inaccuracies in our content via the provided form.

In conclusion, when you see the 'ZDNET Recommends' label, you can trust that our recommendations are the result of rigorous research and analysis. We strive to provide you with valuable insights and guidance in order to help you navigate the ever-changing world of technology and make informed purchasing decisions.",https://www.zdnet.com/a/img/resize/210bc66f7f72578d128c268bf78cbcf817209402/2023/10/03/e02665e0-f9de-434f-99f7-45a3cde856fa/windowspro-stack-social.jpg?auto=webp&fit=crop&height=675&width=1200,2024-03-25 10:30:00,Innovation,Innovation
https://techcrunch.com/2024/03/25/london-regtech-gss-raises-47m-to-help-banks-screen-for-global-sanctions/,London regtech GSS raises $47M to help banks screen for global sanctions,"Global Screening Services (GSS), a London-based regulatory compliance platform, has successfully raised $47 million in funding. This comes at a time when economic sanctions are on the rise, with the United States imposing trade restrictions and asset blocking against countries such as Russia, China, and Iran.

GSS was founded by Tom Scampion, who previously served as the head of financial crime for Deloitte's EMEA arm. In 2020, Scampion became a general partner at consulting firm AlixPartner, where GSS was initially incubated before becoming an independent entity in 2021.

Last year, GSS secured a similar amount of funding from prominent investors, including Japan's Mitsubishi UFJ Financial Group (MUFG), one of the world's largest banks. For its latest funding round, GSS has attracted the support of the Commonwealth Bank of Australia (CBA), as well as Cynosure Group and AlixPartner.

Financial institutions, particularly banks, often face challenges in enforcing sanctions due to their crucial role in global money flow. However, identifying the parties involved in financial transactions can be a complex task. In recent years, major banks like Standard Chartered and BNP Paribas have faced hefty fines for breaching sanctions and lacking adequate money-laundering controls.

Given the increasing importance of regulatory compliance in the financial sector, investors have shown continued interest in supporting businesses like GSS. Last year, New York-based Droit raised $23 million, while London's SteelEye secured $21 million in financing.

GSS offers a sanctions-screening platform that helps banks and other financial institutions comply with regulations. Users can input transaction data into GSS's cloud-based platform, which then checks for matches against a comprehensive set of sanctions lists from around the world. GSS also adds additional data points, such as dates of birth and International Maritime Organization (IMO) numbers for ships, as well as data from the financial transfer systems of sanctioned countries.

Furthermore, GSS provides ""enhanced"" lists for screening, which include companies that are partially owned by individuals, companies, or governments that have been sanctioned by authorities such as the Office of Foreign Assets Control (OFAC), the European Union (EU), or the United Kingdom (U.K.).

With the new funding, GSS is now transitioning from the development phase to becoming fully operational. The company is preparing to launch its services for its first customers. This significant milestone marks an important step forward for GSS as it continues to play a vital role in helping financial institutions meet their global sanctions obligations.","https://techcrunch.com/wp-content/uploads/2024/03/GettyImages-1770041999-e1711386339681.jpg?resize=1200,677",2024-03-25 18:36:37,Innovation,Innovation
https://techcrunch.com/2024/03/25/spotify-courses-learning/,Spotify tests video courses to teach everything from music production to Excel,"Spotify, known for its music streaming and podcast services, is now venturing into the world of e-learning. The company is testing an online education offering in the U.K., partnering with organizations like the BBC and Skillshare to provide freemium video courses. While at least two lessons will be free, the full courses will cost between £20 and £80 on average. The pricing structure is the same for both basic and premium users, as Spotify is currently testing demand before considering wider rollout.

The courses will be accessible through Spotify's home and browse tabs, as well as the web and mobile app. The content covers a wide range of subjects, from music production to Excel skills, and even includes lessons on creating online learning content. Unlike many online learning platforms that offer interactive content, Spotify's courses revolve around one-directional, on-demand video.

Spotify has partnered with Skillshare, PLAYvirtuoso, BBC Maestro, and Thinkific to provide courses in various domains. The company plans to curate the courses based on user interests and preferences, leveraging its data on what people are already listening to and searching for on the platform. While third-party publishers own the videos, they will be hosted and purchased on Spotify. Revenue from course sales will be shared among the creators, publishers, and Spotify, with content partners handling payments to creators.

This move by Spotify aligns with its strategy to diversify its business and boost profitability. By expanding into education, Spotify aims to leverage its podcasting business and the data it collects on user preferences. The company has observed a strong correlation between popular podcasts and education content, with around half of Spotify Premium subscribers listening to education or self-help podcasts. Spotify plans to use its recommendation algorithms to cross-promote podcasts and courses, offering users a holistic learning experience.

The decision to launch in the U.K. is strategic, as it is one of Spotify's largest and most engaged markets. While the company has faced financial challenges in recent years, including layoffs and net losses, its foray into education presents an opportunity for consistent profitability and stronger margins. By capitalizing on the growing market for online learning and professional development, Spotify aims to tap into the demand for educational content among its user base.

In conclusion, Spotify's entry into the e-learning space marks a new chapter for the company. With its vast user base and data-driven approach, Spotify has the potential to disrupt the online education market. By curating courses based on user preferences and cross-promoting them with podcasts, Spotify aims to create a seamless learning experience for its users. As the company continues to diversify its offerings, it will be interesting to see how it navigates the competitive landscape of online education and establishes itself as a key player in the industry.","https://techcrunch.com/wp-content/uploads/2024/03/Courses-on-Spotify-PR-Image-6-2.png?resize=1200,683",2024-03-25 08:59:18,Innovation,Innovation
