Link,Title,Text,Image,Date Publish
https://www.forbes.com/sites/mikestubbs/2023/10/17/valorant-708-patch-notes-bring-major-smoke-changes/,‘Valorant’ 7.08 Patch Notes Bring Major Smoke Changes,"Valorant gets some big smoke changes. Credit: Riot Games
Riot Games has released the patch notes for Valorant update 7.08 and there are some massive changes coming to smokes, that will make them easier to play around.
With smokes being such an important part of Valorant the dev team has implemented a pretty big change with the 7.08 patch notes. As big smokes can be used to block areas for a considerable amount of time with little info on how long they will remain there a visual and audio indicator has been added to signal their end.
Now, when a smoke from Astra, Brimstone or Omen has 1.5 seconds before it starts to fade, a visual cue will appear and a sound will be played. This will let everyone know that the smoke is about to disappear and you can plan accordingly. We don’t yet know what the sound is or what it looks like, but with the patch about to launch we don’t have long to wait to find out.
On paper, this sounds like a great change. When you round a corner to find a massive smoke and you have no idea how long it has been there it can be impossible to play around. It could disappear just as you are trying to reposition and leave you totally exposed. But now, with the new audio and video cues, you’ll have a small moment to make sure you are in a good position, and hopefully catch people on the other side. Of course, we will have to wait and see how this has actually been implemented to figure out if it is useful or not.
The patch notes also bring a welcome change to the sounds you hear from your allies. When you equipped certain abilities the audio would play not only for enemies as intended, but also allies close to you. The idea is that all things your team does, such as equipping a weapon or ability, should be silent. So this has now been changed to make that the case. Now the only sounds you’ll hear are from enemies equipping their abilities.
Rounding out the patch are a number of bug fixes and some changes to Premier Playoff Tournament queues. Now you’ll only have 15 minutes to queue up and be ready, then when this time expires all eligible teams will be placed into even distributed brackets that are ranked by Premier score. This means that if you have a better regular season, you’ll get some advantages in the playoffs.",https://imageio.forbes.com/specials-images/imageserve/648b1aa18347bb43c775c365/0x0.png?format=png&height=900&width=1600&fit=bounds,2023-10-17 09:00:41
https://www.forbes.com/sites/antonyleather/2023/10/17/intel-core-i5-14600k-review-better-than-amds-ryzen-7-7800x3d-and-core-i5-13600k/,Has Intel beaten AMD?,"Today Intel has launched its 14th Gen Raptor Lake refresh desktop processors, which promise better gaming and content creation performance and here we'll be taking a look at the Core i5-14600K and comparing it against 12th and 13th Gen Intel CPUs as well as those from AMD's Ryzen 7000 series, including its 3D V-cache models.
Intel's Core i5-14600K Antony Leather
At $319 the Core i5-14600K isn't much more expensive than the Core i5-13600K, which might save you $10-20, while AMD's Ryzen 7 7700X costs $329 and the Ryzen 7 7800X3D with its game-boosting 3D V-Cache costs about $80 more at $400. The key questions are whether any of the 14th Gen CPUs are worthwhile upgrades, especially as Intel's LGA1700 socket and motherboards will not see any more CPUS launches - the 14th Gen models are the final generation before Intel moves to a new CPU socket.
Intel has announced new 14th Gen CPU models Intel
Only the Core i7-14700K has received a core count increase, with its E-core count rising by four. The Core i5-14600K can hit 5.3GHz out of the box, while the Core i5-13600K hits the limit at 5.1GHz and that 200MHz boost is mirrored with other 14th Gen CPUs. The core count remains the same at six Performance cores and eight Efficient cores. Gaming performance is further boosted by the introduction of Application Performance Optimizer, which Intel claims can boost performance by up to 17%. Still, upgrading from a Core i5-13600K to a Core i5-14600K is likely a questionable move.
Intel Core i5-14600K performance
My test system included an Asus ROG Maximus Z790 Hero motherboard, liquid cooling system, 32GB of DDR5 6000MHz memory, a Solidigm P41 Plus PCIe 4.0 SSD and an Nvidia RTX 4090 graphics card. The test system was up to date with the latest Windows 11 updates and drivers as of October 10th.
Intel Core i5-14600K conclusion
The Core i5-14600K doesn't offer much more performance than the Core i5-13600K either in games or content creation, but with the latter only saving you a few bucks, it could be worth opting for over the 13th Gen CPU even just for bragging rights. Owners of the Core i5-12600K and to some extent the core i7-12700K will see big improvements, though, in both games and content creation.
Intel's Core i5-14600K and AMD's Ryzen 7 7800X3Dc Antony Leather
Compared to AMD's offerings, the Ryzen 5 7600X was usually slower - significantly so in most content creation tests, while the Ryzen 7 7700X occasionally put up a fight, but was usually either slower or a match for the Core i5-14600K. For a pure gaming system, the Ryzen 7 7800X3D is definitely worth the extra $80 or so, as long as it's paired with a sufficiently powerful graphics card.
As with all 14th Gen CPUs, their main issue if you own an even older Intel CPU or AMD Socket AM4 CPU, is that there is no upgrade path. Motherboards and memory are cheaper than AMD's Socket AM5 route, but that has another few generations of processors planned for it.
Should you buy the Core i5-14600K?
Intel has a decent allrounder in the Core i5-14600K which is much faster than the Ryzen 7 7700X and 7800X3D in most content creation tasks and a match or better than the former in games. It's a good upgrade from a 12th Gen Core i5 CPU too, but gamers would be wise to check out AMD's Ryzen 7 7800X3D. It enjoys stellar gaming performance and a better upgrade path, but with a requirement for DDR5 memory and pricier motherboards, will likely cost significantly more to own.",https://imageio.forbes.com/specials-images/imageserve/652d3a4d139c788e144820a9/0x0.jpg?format=jpg&height=900&width=1600&fit=bounds,2023-10-17 09:00:05
https://www.forbes.com/sites/antonyleather/2023/10/17/intel-core-i9-14900k-vs-ryzen-7-7800x3d-and-core-i9-13900k-which-should-you-buy/,Intel Core i9-14900K review Vs Ryzen 7 7800X3D And Core i9-13900K,"Today Intel's new 14th Gen Raptor Lake refresh desktop processors are available and we're also allowed to lift the lid on our reviews. Here we'll be checking out the flagship - the Core i9-14900K, but you can see my review of the Core i5-14600K in a separate review.
Intel's Core i9-14900K Antony Leather
Intel has already announced the CPUs along with new features such as Application Performance Optimization (APO) - a new feature that promises to prioritise gaming software threads to boost performance by up to 17%. They also include Wi-Fi 7, Thunderbolt 5 and Bluetooth 5.4 support. Today we're focussing on content creation and gaming performance and working out whether they better options than AMD's Ryzen 7000-series or worthwhile upgrades from Intel 12th and 13th Gen models too.
Intel has announced new 14th Gen CPU models Intel
Only the Core i7-14700K has a core count increase this time, with four additional E-cores to help boost multi-threaded workloads. Aside from features such as APO, the new CPUs rely mostly on higher frequencies to boost performance. We saw the Core i9-14900K can hit 6GHz across two P-cores and 5.7GHz across P-cores in multi-threaded workloads, which are 100-200MHz higher than we've seen with the Core i-9-13900K.
The 14th Gen CPUs are compatible with both 600 and 700-series chipset motherboards that use Intel's LGA1700 processor socket, but may require a BIOS update. They were unexpected too, with Intel due to launch this generation on a new processor socket, but its desktop Meteor Lake models have been canned with a new architecture not arriving till 2024 in the form of Arrow Lake. The 14th Gen CPUs will be the last generation to land on LGA1700 making it a questionable platform to buy into. More on that in the conclusion.
Intel Core i9-14900K Performance
My test system included an Asus ROG Maximus Z790 Hero motherboard, liquid cooling system, 32GB of DDR5 6000MHz memory, a Solidigm P41 Plus PCIe 4.0 SSD and an Nvidia RTX 4090 graphics card. The test system was up to date with the latest Windows 11 updates and drivers as of October 10th.
Intel Core i9-14900K Conclusion
At $589 the Core i9-14900K is around $30 more than the Core i9-13900K, the same price as AMD's Ryzen 9 7950X but $100 less than the Ryzen 9 7950X3D. The latter didn't seem to offer consistent gaming performance with its internal structure hindering it compared to the cheaper Ryzen 7 7800X3D, which definitely gave the new Intel CPU a run for its money in games.
The Core i9-14900K was no slouch, though, keeping and bettering the AMD Ryzen 7 7800X3D in plenty of situations. Intel's advantage, though, is that the Core i9-14900K is also a beast outside of games where neither of its 3D V-Cache models are, with some exceptions such as Photoshop and Lightroom, with photo editing software often preferring AMD's architecture.
Intel's Core i9-14900K Antony Leather
Overall, if there's only $20-30 difference between the Core i9-14900K and 13900K, you may as well go for the former if only for bragging rights, but it is slightly faster in most tests. Spending more than this is questionable given the gains. As mentioned earlier, with no upgrade path, buying a new LGA1700 system is questionable unless you need a new upgrade right now and typically keep your processor four or five years before upgrading.
For a pure gaming system, AMD's Ryzen 7 7800X3D is hard to beat, but does have the added expense of pricier motherboards and memory, perhaps counteracted by a decent lifespan. If neither of these options are suitable then both AMD and Intel will have new processors in 2024, with a new socket for Intel too.
Should you buy the Core i9-14900K?
As an allrounder, though, the Core i9-14900K is a monster and is rarely out of the top three in every single graph. The same can't be said of any of AMD's Ryzen 7000 CPUs, which are great in games or multi-threaded performance, but not really both. It's only drawbacks are a non-existent upgrade path and cheaper 13th Gen CPUs that aren't much slower.","https://imageio.forbes.com/specials-images/imageserve/652e7436699d70b9cc306340/0x0.jpg?format=jpg&crop=2601,1463,x0,y331,safe&height=900&width=1600&fit=bounds",2023-10-17 09:00:04
https://www.forbes.com/sites/forbestechcouncil/2023/10/17/unlocking-the-potential-of-ai-and-data-analytics-for-digital-advertising/,The Potential Of AI And Data Analytics For Digital Advertising,"Inc. 5000 entrepreneur, data privacy and web accessibility advocate, co-founder of Ntooitive Digital and TruAbilities.
getty
In the ever-evolving world of digital marketing, new strategies and tools are constantly being introduced. However, none have yet to have the same impact as artificial intelligence (AI), which has transformed how we approach digital marketing.
Despite some users' hesitancy, AI will revolutionize digital marketing by automating and optimizing marketing efforts. AI personalization allows marketers to expertly tailor content based on user behavior, demographics and preferences.
As AI technology advances, we can expect to see more innovative applications emerge and user adoption increase. But rather than waiting to start using AI, it is important for marketers to begin determining how they can use the technology to improve their operations.
What does AI bring to the table?
AI-powered solutions automate those marketing tasks that were previously impossible, too time-consuming or so mundane humans didn’t want to perform them. These activities include completing (in a matter of seconds) complex calculations that would take humans hours or even days and repetitive tasks such as scheduling, data analysis and responding to inbound customer inquiries.
In 2022, IBM’s Global AI Adoption Index revealed that 35% of organizations reported using AI in one way or another in their business and 42% shared they were looking into AI, its benefits and how it could be incorporated into their processes.
There are a variety of AI platforms available today that can assist with a range of tasks. Some of the most notable that I recommend include the following:
Jasper: An AI copywriting system that uses language processing and machine learning to analyze data about your target audience and make suggestions to improve copy in an original and natural-sounding way.
Pictory: A cloud-based video creation software that uses AI to automatically convert long-form text and video content into shorter videos that can easily be used on social media channels.
Grammarly: A writing assistance tool that offers grammar and spelling checks as well as suggestions for clarity, conciseness, engagement tone and readability.
Reply.io: An all-in-one solution that offers a wide range of features, including email automation, CRM integration and analytics, allowing sales teams to streamline their outreach process and personalize their communication with potential leads.
Ocoya: An AI-powered social media post creator and scheduler that analyzes user behavior and preferences, allowing users to create targeted content personalized to their audience.
How is AI changing the industry?
I believe that it’s not a matter of if businesses will begin using AI but when.
A study conducted by Stanford and MIT showed AI boosted worker productivity by 14% on average. In this way, AI can help get marketers out of the weeds of execution to focus 100% on customer connections, quality storytelling and overall business outcomes. In short, marketers will be able to get back to marketing.
This isn’t to say AI is minimizing the human element; it is instead reducing the stress on the human part, allowing workers to focus on tasks that require human expertise and creativity.
Integrating AI technology in digital marketing is here to stay. However, understanding its application for digital marketing is critical, and that begins with training your AI technologies with the appropriate information it needs to churn out the best possible output. You can’t expect to have the right output without providing the right input and training. Data sets fed into the AI program, for example, can be biased and pose issues with how outputs are interpreted.
That means being upfront with clients or end users about the use of any AI-embedded software. Even if you plan on using a helpful meeting assistant like Fireflies.ai, I would strongly encourage you to seek consent from all attendees so no one is left in the dark. Or, if your client’s next marketing campaign strategy was assisted by AI, it’s incumbent on you to disclose that. The same goes for any AI-generated images, videos or audio that have been used. Why? Transparency promotes trust, and trust builds buy-in—which is exactly what the AI industry desperately needs right now.
Conclusion
The use of AI technology in digital marketing is becoming increasingly prominent and will continue to grow exponentially. Before 2030, the global AI market is expected to be valued at over $1.5 trillion.
Marketers who embrace AI and keep up with the latest tools and strategies can increase their chances of gaining a competitive advantage, but it’s important to understand this technology and how it can best be used within your business. I believe that AI-driven digital marketing, done ethically, is the future, and these tips can provide an effective way to ensure the successful use of emerging technologies and applications.
Forbes Technology Council is an invitation-only community for world-class CIOs, CTOs and technology executives. Do I qualify?",https://imageio.forbes.com/specials-images/imageserve/6453ca7bf8a3c5db599c02ff/0x0.jpg?format=jpg&height=900&width=1600&fit=bounds,2023-10-17 09:00:00
https://www.forbes.com/sites/forbestechcouncil/2023/10/17/how-ceos-can-change-culture-reduce-burnout-and-retain-talent/,"How CEOs Can Change Culture, Reduce Burnout And Retain Talent","Marc is CEO at Devo, a cloud-native logging and security analytics solution.
getty
One of the top challenges facing CISOs and security teams today isn’t just the security risks they are being bombarded with; it’s burnout. This directly ties into security risks in that if you're lacking staff, or if the existing staff you have is burnt out, your assets aren’t being optimally protected. In fact, as we found in our recent research with Wakefield Research, 83% of IT security professionals have seen burnout lead to errors that resulted in a security breach; 39% of them have experienced this situation more than once.
Heightened security concerns can also contribute to an even greater sense of burnout. Because keeping the network and its assets safe is such a huge responsibility, security teams are under constant pressure. According to our research, half of IT security staff point to ongoing staff shortages as a top contributor to stress. Their jobs can seem quite thankless, too, since people typically only think about security when something has gone wrong. No wonder they’re burnt out.
The conviction of Uber’s former CISO embodied many security leaders’ fears that they could be the sacrificial lambs if an attack occurred under their watch. This is an extreme example of an executive’s willful obstruction, but security professionals can’t help but wonder if they’ll somehow be blamed if a security incident gets ugly.
Burnout and mental health in this sector aren’t issues for just the security team to deal with—it needs to come from the top. Leaders in the C-suite need to understand why burnout is happening and its implications, then work to help change the culture to avoid or mitigate these issues. This is no easy feat, but the status quo can’t remain unchallenged if you want a content, retained security workforce. That’s particularly important considering the ongoing cybersecurity skills gap.
Looking At Burnout
In our survey, we aimed to dig deeper into what’s really going on with security professionals who are the lifeblood of almost any organization’s cybersecurity efforts. These are the teams who are grappling day in and day out with cyber threats and round-the-clock monitoring.
What we uncovered provided us with a wealth of insights related to burnout and mental health challenges, including:
• Eighty-five percent of IT security professionals predict they'll need to leave their company or role because of burnout, and 24% say they may leave cybersecurity entirely.
• For 77% of respondents, stress levels at work are having a direct impact on keeping private customer data safe.
In another survey we conducted, we also found that hiring, especially for the security operations center (SOC), continues to be a problem.
• Less than one-quarter of respondents say they can typically fill a vacancy in less than a month, and the average time spent filling a position is seven months.
• Fifteen percent of SOC leaders said it takes over two years to hire for a SOC role. You can imagine the impact this has on everyone else who has to pick up the slack.
On top of this, there’s an ongoing shortage of cybersecurity professionals—to the tune of 3.4 million skilled cyber pros globally. There’s no sugarcoating it: the problem is bad. So, now what?
How Leaders Can Take Action
We are living in a time when conversations about burnout and mental health are happening in a much more open fashion than ever before. That’s great because conversations are key and an important first step.
One thing we’ve seen in the last few years, especially coming out of the pandemic, is more willingness to talk about these challenges and treat them as the socioeconomic matters they are as opposed to being considered an individual’s problems—or shrouding these challenges in shame and secrecy.
Mental health must become a company priority with dedicated resources and time. From a leadership and management perspective, there are a number of ways to do this beyond what’s being done at the HR level.
For instance, enable your CISOs and other security leaders to connect and network with their peers. Make the time for them to participate in CISO dinners and networking events where they can share stories with others and get guidance from peers who are grappling with some of the very same challenges day in and day out.
It’s also important to invest in more training and education. Bad actors are continually changing and evolving their tactics, so education and training need to likewise happen regularly. This should be a key aspect of corporate directives. Training should extend across departments, not just the SOC. Giving everyone more access to cyber hygiene training can go a long way toward reducing risk and thereby limit some of the noise coming into the SOC.
Looking To External Resources For Help
Just as there’s no shame in staff admitting they’re struggling, there’s no shame in asking for outside assistance. You are not alone in this challenge. Burnout is a huge problem across many sectors, not just in security, but there are obviously many factors specific to security that make this issue especially concerning.
There are organizations like Cybermindz, a partner of ours, that are focused on improving the burnout problem and addressing mental health in cybersecurity. Such organizations will work with you to help your staff achieve and retain mental well-being in a way that fits with your unique needs.
Steer The Ship To Well-Being
Burnout isn’t a new phenomenon in the cybersecurity space, but it remains a huge problem, one that’s exacerbated by the ongoing skills gap. Organizations struggle to hire and retain staff, and there is a revolving door when it comes to SOC analysts in particular. A burned-out SOC analyst isn’t effective, and it doesn’t set a good precedent for your company’s culture, either.
Your CEO role gives you both the authority and the mandate to navigate your CISO and your SOC through the treacherous landscape of burnout. Culture change comes from the top down, so use the above suggestions to support your security leaders and their teams in every way you can.
Forbes Technology Council is an invitation-only community for world-class CIOs, CTOs and technology executives. Do I qualify?",https://imageio.forbes.com/specials-images/imageserve/652da8a9e1225ef6f2760e75/0x0.jpg?format=jpg&height=900&width=1600&fit=bounds,2023-10-17 08:45:00
