Link,post_title,post_content,featured_image,Date-Publish,post_category,post_tag
https://techxplore.com/news/2024-03-vulnerability-virtual-reality.html,Vulnerability in virtual reality systems identified,"Virtual reality (VR) systems have become increasingly popular in recent years, offering users the opportunity to explore immersive virtual worlds. However, a team of computer scientists at the University of Chicago has uncovered a potential vulnerability in VR systems that could pose a significant threat to users' security. This vulnerability, known as an ""inception attack,"" allows hackers to insert an ""inception layer"" between a user's VR home screen and their VR user/server.

The concept behind an inception layer is inspired by the movie ""Inception,"" in which a character is able to download an altered layer of reality into his brain. Similarly, the researchers propose that hackers could add a layer between the user and the virtual world they see when using their VR device. This layer would enable them to record sensitive information, intercept and alter data, and even manipulate the user's virtual environment.

One potential scenario involves the hacker tricking the user into revealing their passcode for a virtual ATM. By inserting an inception layer, the hacker could record the passcode and gain unauthorized access to the user's account. Additionally, the hacker could modify the cash amounts designated for a purchase, redirecting the difference to their own bank account. This kind of manipulation could have serious financial implications for unsuspecting users.

Moreover, the inception layer could be used to deceive users by adding virtual representations of their friends or family members. By gaining the user's trust in this way, the hacker could exploit vulnerabilities and extract valuable information. This could include monitoring gestures, voice emanations, browsing activity, and social or business interactions. The potential for invasive surveillance and manipulation is concerning.

To test the feasibility of such an attack, the researchers enlisted the help of 28 volunteers who played a game using a demonstration VR headset. They downloaded a simulated hacking app onto the devices without the volunteers' knowledge and observed their reactions. Surprisingly, only 10 of the volunteers noticed a slight flickering during the download and activation process, and only one questioned the possibility of nefarious activity. This suggests that users may be largely unaware of the risks posed by inception attacks.

The research team promptly notified Meta, the company behind the Meta Quest VR system used in the experiment, of their findings. Meta has responded by pledging to investigate the vulnerability and take appropriate measures to address it. However, the researchers caution that similar vulnerabilities are likely to exist in other VR systems and apps. It is crucial for developers and manufacturers across the industry to prioritize security and protect users from potential threats.

As VR technology continues to advance and become more integrated into everyday life, it is essential to remain vigilant and informed about the potential risks. Users should exercise caution when downloading apps and connecting to WiFi networks, as hackers may exploit vulnerabilities to gain unauthorized access. By raising awareness of inception attacks and promoting robust security measures, we can ensure a safer VR experience for all users.

In conclusion, the discovery of the inception attack vulnerability in VR systems serves as a powerful reminder of the importance of cybersecurity in our increasingly digital world. This research sheds light on the potential for hackers to manipulate users' virtual environments and extract sensitive information. By addressing these vulnerabilities and implementing robust security measures, we can continue to enjoy the benefits of virtual reality while safeguarding our privacy and security.",https://scx2.b-cdn.net/gfx/news/2024/vulnerability-in-virtu.jpg,2024-03-25 10:20:02,Innovation,Innovation
https://techxplore.com/news/2024-03-liquid-iron-battery-grid-energy.html,New all-liquid iron flow battery for grid energy storage,"Flow batteries holds great promise for large-scale energy storage, allowing for the integration of intermittent energy sources like wind and solar power into the electric grid. Researchers at the Pacific Northwest National Laboratory have made a breakthrough in flow battery technology by repurposing a common chemical used in water treatment facilities. The battery design utilizes a liquid electrolyte made with Earth-abundant materials, specifically a chemical called nitrogenous triphosphonate (NTMPA) which is commercially available in industrial quantities.

What sets this battery apart is its ability to store charged iron in a liquid complex at room temperature and neutral pH. This is achieved by combining the charged iron with the NTMPA electrolyte. The researchers found that their iron-based battery exhibited remarkable cycling stability, maintaining 98.7% of its maximum capacity over one thousand consecutive charging cycles. This is a significant improvement compared to previous studies on iron-based batteries, which reported much higher degradation of charge capacity over fewer charging cycles.

Flow batteries operate by storing energy in chemical bonds through an electrochemical reaction. Unlike conventional batteries, flow batteries have two chambers filled with different liquids and require a constant supply of electrolyte to function. The larger the electrolyte supply tank, the more energy the flow battery can store. This makes flow batteries ideal for large-scale energy storage applications and they can be built at any scale, from a lab-bench to the size of a city block.

The use of flow batteries as backup generators for the electric grid is a key strategy in decarbonizing the energy sector. These batteries can be located in urban or suburban areas near energy consumers, providing a reliable and sustainable energy source. The aqueous iron flow battery developed by the researchers at Pacific Northwest National Laboratory operates in water at neutral pH, making it safer and more environmentally friendly compared to other battery technologies.

The initial design of the iron-based flow battery achieved an energy density of up to 9 watt-hours per liter (Wh/L). While this is lower than commercialized vanadium-based systems, which have an energy density of 25 Wh/L, the use of Earth-abundant materials allows for scalability to provide the same energy output. This means that a flow battery made with common and readily available materials can be just as effective as other high-density battery systems.

The development of flow battery technology is crucial for modernizing the electric grid and facilitating the widespread adoption of renewable energy sources. With the ability to store energy from intermittent sources like wind and solar power, flow batteries provide a reliable and sustainable solution for meeting the energy demands of the future. The research conducted by the Pacific Northwest National Laboratory represents a significant step forward in flow battery design, offering a safe, economical, and efficient energy storage solution.",https://scx2.b-cdn.net/gfx/news/hires/2024/new-all-liquid-iron-fl.jpg,2024-03-25 07:22:25,Innovation,Innovation
https://techcrunch.com/2024/03/25/techcrunch-minute-why-the-company-behind-trumps-truth-social-joined-the-growing-ipo-trend/,Watch: Why the company behind Trump's Truth Social joined the growing IPO trend,"Last week, the Reddit and Astera Labs IPOs dominated headlines and captured the attention of the media. These two tech IPOs not only performed well in terms of pricing, but they also generated a significant amount of trading activity. This was a much-needed boost for the private-market tech companies and a cause for celebration among industry insiders.

However, amidst all the excitement surrounding these IPOs, there was another offering that flew under the radar with its own tech angle. We're talking about Trump Media and Technology Group, the company behind Truth Social. While not as widely discussed as the Reddit and Astera Labs IPOs, this offering is still worth mentioning.

After much deliberation and negotiation, Trump Media and Technology Group merged with its chosen SPAC (Special Purpose Acquisition Company) and officially began trading. This development marks a new chapter for the company and its ambitious plans for Truth Social.

Financially, Trump Media and Technology Group faces an uphill battle. However, the fact that we witnessed two major debuts last week, along with this public-market transaction, suggests that the IPO window is reopening.

The resurgence of the IPO market is a positive sign for tech companies looking to go public. It indicates renewed investor interest and confidence in the sector. The successful debuts of Reddit and Astera Labs, coupled with the emergence of Trump Media and Technology Group, demonstrate that there is a growing appetite for tech IPOs.

For private-market tech companies, the reopening of the IPO window brings a sense of relief. It offers an opportunity for them to access public capital and fuel their growth strategies. This is especially crucial for multibillion-dollar tech companies that have been waiting for the right market conditions to make their debut.

The return of the IPO window also signifies a broader trend in the tech industry. It reflects the resilience and adaptability of tech companies in navigating through challenging times. Despite the uncertainties brought about by the pandemic and other external factors, the tech sector continues to thrive and attract investor interest.

As we move forward, it will be interesting to see how the IPO market evolves and whether this resurgence is sustainable. Will we witness a wave of tech IPOs in the coming months? Only time will tell. However, one thing is certain: the reopening of the IPO window is a positive development for private-market tech companies and the overall market sentiment.

In conclusion, the Reddit and Astera Labs IPOs may have stolen the spotlight last week, but there was another tech offering that shouldn't be overlooked. Trump Media and Technology Group's merger with its chosen SPAC and subsequent trading signify the reopening of the IPO window. This is a promising development for tech companies looking to access public capital and accelerate their growth. The resurgence of the IPO market reflects the strength and resilience of the tech sector, and it will be fascinating to see how this trend unfolds in the future.","https://techcrunch.com/wp-content/uploads/2024/03/TechCrunch-Minute-Site-Truth-Social.png?resize=1200,675",2024-03-25 16:00:10,Innovation,Innovation
https://www.zdnet.com/home-and-office/home-entertainment/espn-adding-local-sports-to-its-app-and-website-is-your-team-there-yet/,ESPN adding local sports to its app and website - is your team there yet?,"Over the next few months, ESPN is making an effort to provide a more comprehensive streaming experience for sports fans. In a bid to combat the fragmentation of the streaming industry, ESPN is partnering with regional sports networks (RSNs) to bring their broadcasts directly to the ESPN app and website.

To kick things off, subscribers to NESN, the network that covers Boston-area sports teams such as the Red Sox, Celtics, Patriots, and Bruins, can now access live games from these teams through the ESPN site or app. This is a great development for sports fans in the Boston area, as they no longer need to switch between different platforms to catch their favorite teams in action.

In the following month, Monumental Sports Network, which covers the Washington D.C.-area Capitals, Wizards, and Mystics, will also be added to the ESPN app and website. And that's not all. SportsNet Pittsburgh, the host of Penguins, Pirates, and WVU games, has confirmed its partnership with ESPN, with several other RSNs likely to follow suit.

In recent years, many sports franchises have signed agreements to have their games broadcast on regional sports networks. These networks typically feature multiple teams from a specific city or region and can be accessed through cable packages or as standalone subscriptions. While these networks still require a separate subscription, the partnership between ESPN and the RSNs makes it much easier for fans to find and access their favorite games.

This collaboration benefits both parties involved. For the RSNs, it provides greater discoverability for their content, as fans are more likely to subscribe if the games are easier to find and accessible through an app they already use. On the other hand, teams want their games to be accessible to as many fans as possible, so this partnership is a win-win situation. It's important to note that these game links will only be visible to people living within the coverage areas of the respective networks, ensuring that users won't see options for games they don't have access to.

This move from ESPN comes on the heels of their announcement last month about partnering with Fox and Warner Bros. for a streaming service that covers a wide range of sports leagues. With these three major players in the streaming industry coming together, fans will have access to MLB, NFL, NBA, NHL, NCAA football and basketball, NASCAR, PGA Tour, Grand Slam tennis, soccer, and more, all in one app. This consolidation of content is a game-changer for sports enthusiasts who want to catch up on multiple sports without having to switch between different platforms.

In conclusion, ESPN's partnership with regional sports networks is a step towards a more comprehensive and user-friendly streaming experience for sports fans. By bringing broadcasts from these networks directly to the ESPN app and website, fans can easily access their favorite games without the hassle of switching between different platforms. This collaboration benefits both the RSNs and the teams, providing greater discoverability for the content and making games more accessible to a wider audience. The future of sports streaming is looking brighter and more convenient, thanks to partnerships like this.",https://www.zdnet.com/a/img/resize/83df13de495fcfec3cffb77378df0e2ad3591ce2/2024/03/25/fd31c575-1031-497a-845f-afbf4b97b11c/pxl-20240325-185459546.jpg?auto=webp&fit=crop&height=675&width=1200,2024-03-25 00:00:00,Innovation,Innovation
https://techcrunch.com/2024/03/25/uzbekistan-unicorn-uzum-series-a-funding/,Meet Uzbekistan's first unicorn: e-commerce startup Uzum,"Uzum, an e-commerce startup in Uzbekistan, has recently secured $114 million in funding, making it the country's first unicorn with a valuation of $1.16 billion. With a population of over 35 million, Uzbekistan is an ideal market for startups, as 60% of its population is under the age of 30. Additionally, the country boasts a high literacy rate, internet penetration, and smartphone usage. However, despite these favorable conditions, the e-commerce sector in Uzbekistan remains underdeveloped, accounting for only 2.2% of the total retail market.

Uzum's co-founder and CEO, Djasur Djumaev, recognized this gap in the market and set out to create a comprehensive online marketplace that offers end-to-end logistics and delivery. Since its launch in October 2022, Uzum has gained over 8 million monthly active users and has more than 9,000 merchants selling over 600,000 different products. In its first year, Uzum recorded a gross merchandise value of $150 million, and it expects this number to reach at least $300 million this year.

In addition to its e-commerce platform, Uzum has also ventured into the fintech industry by offering a buy-now-pay-later (BNPL) product. Approximately 45% to 50% of Uzum's e-commerce transactions are conducted through the BNPL solution. The startup has also entered the food delivery business and established a digital bank to support its growth.

The recent funding round, led by FinSight Ventures, raised $52 million in equity and $62 million in debt. Uzum plans to use two-thirds of the funding for its fintech business and one-third for its e-commerce arm. The startup also intends to launch new products for unsecured lending and invest in its IT and logistics infrastructure.

By the end of this year, Uzum plans to consolidate all its businesses into two super apps—one for consumer-focused offerings and another for business-focused products. The startup also aims to launch the country's largest e-commerce logistics complex and expand its gross merchandise value by 150% to 200%.

While Uzum faces some competition from global players like Nubank in Latin America and Kaspi.kz in Kazakhstan, the startup believes it has a unique advantage in Uzbekistan. By combining its e-commerce and fintech services, Uzum can generate higher margins and become a national tech leader in the country.

With its recent funding and ambitious plans for expansion, Uzum is well-positioned to capitalize on the growing demand for e-commerce and fintech services in Uzbekistan. As the country's first unicorn, Uzum is set to make a significant impact on the tech industry and drive innovation in the region.",https://techcrunch.com/wp-content/uploads/2024/03/uzum-logistics.jpg?w=1200,2024-03-26 05:00:18,Innovation,Innovation
https://techcrunch.com/2024/03/25/telegrams-peer-to-peer-sms-login-service-is-a-privacy-nightmare/,Telegram’s peer-to-peer SMS login service is a privacy nightmare,"Telegram, the popular instant messaging app, has recently introduced a new and controversial feature. Users can now obtain a free premium membership by allowing the app to utilize their phone number as a relay for sending one-time SMS passwords to other users attempting to log into the platform. While this may sound like a great deal, there are concerns about potential privacy risks and the exposure of personal information.

This new feature, initially reported by the TGInfoEn Telegram channel, is currently being rolled out in select countries for Telegram for Android users. If you agree to let Telegram use your phone number as an OTP (one-time password) relay, the company will reward you with a transferable code for Telegram Premium.

However, before jumping on board, it's crucial to understand the terms and conditions of this peer-to-peer login program. Telegram states that they will send a maximum of 150 OTP messages per month. While participating users may also be charged for local and international SMS usage, they will need to meet a certain quota in order to qualify for the complimentary subscription. In some cases, the cost of these SMS messages may exceed the value of the Telegram Premium membership, making it less enticing from a financial perspective.

Privacy is another major concern with this feature. By allowing your phone number to be used as a relay, you are essentially granting strangers the ability to look up your number and potentially use it for spam and fraudulent activities. Telegram does offer the option to hide your phone number from strangers, but utilizing it as a relay could compromise the privacy of your Telegram account.

The terms and conditions clearly state that Telegram will not be held liable for any damages or unforeseen consequences that may arise from participating in the peer-to-peer login program. In fact, they are granted absolute indemnity from all claims related to this feature. This means that if any issues or problems arise, the onus falls on the user, not Telegram.

Telegram does advise users not to engage with individuals who receive an OTP code from their number, but there is no way for the company to enforce this recommendation. Ultimately, it is up to the users themselves to exercise caution and make informed decisions.

It's worth noting that Telegram introduced a subscription service two years ago, offering features such as transcription, exclusive stickers, and reactions, among others. Paid users also have access to features like Stories. However, for those considering the peer-to-peer login system, it is important to weigh the benefits against the potential risks of sharing your phone number with strangers.

In conclusion, while Telegram's new feature may seem tempting at first glance, it is essential to carefully consider the potential privacy risks and financial implications before participating. Users should weigh the value of a free premium membership against the potential exposure of their personal information. It's always prudent to prioritize privacy and security when making decisions about sharing personal data.","https://techcrunch.com/wp-content/uploads/2021/01/telegram-flames-draft.jpg?resize=1200,675",2024-03-26 06:22:21,Innovation,Innovation
https://techcrunch.com/2024/03/25/lucid-motors-1-billion-saudi-arabia-gravity-suv/,Lucid Motors raises another $1 billion from Saudi Arabia as it searches for luxury EV buyers,"Lucid Motors, a luxury electric sedan manufacturer, is securing an additional $1 billion in funding from its main investor, Saudi Arabia. The investment will help alleviate the high costs associated with building and selling their vehicles. Ayar Third Investment, an affiliate of Saudi Arabia's Public Investment Fund, has agreed to purchase $1 billion worth of Lucid's stock, increasing the Kingdom's ownership stake to around 60%.

This funding comes shortly after Lucid announced that it plans to produce approximately 9,000 of its Air electric vehicles this year, a slight increase from last year's output. The company faced challenges in finding buyers for its expensive sedan, leading to multiple price cuts in recent months. Additionally, Lucid has plans to start manufacturing its electric Gravity SUV by the end of the year.

Interestingly, Lucid's CEO, Peter Rawlinson, expressed caution regarding heavy reliance on Saudi Arabia for financial support. In an interview with the Financial Times, he emphasized the need to avoid assuming that there is unlimited wealth from the Public Investment Fund. Rawlinson respects the fund too much to put it in a precarious position.

Securing this additional funding from Saudi Arabia demonstrates the confidence that the Kingdom has in Lucid Motors and its potential for success in the electric vehicle market. With the financial support, Lucid can further develop and refine its luxury electric sedan and expand its product lineup to include SUVs. This investment also highlights the growing interest and commitment to sustainable transportation options.

Lucid's decision to increase production and expand its product range reflects the company's determination to establish itself as a key player in the electric vehicle market. While facing challenges in finding buyers for its high-end sedan, Lucid is adapting by adjusting prices and diversifying its offerings. These strategic moves aim to attract a wider customer base and increase sales.

The fresh funding from Saudi Arabia will undoubtedly provide Lucid Motors with the necessary resources to continue their development efforts and navigate the competitive landscape of the electric vehicle industry. As they refine their technology and manufacturing processes, Lucid aims to deliver vehicles that combine luxury, performance, and sustainability.

In conclusion, Lucid Motors' recent $1 billion funding from Saudi Arabia's Public Investment Fund will help the company address the financial challenges associated with producing and selling its luxury electric sedans. This investment showcases the confidence and support that the Kingdom has in Lucid's potential. With plans to increase production and introduce new models, Lucid is determined to establish itself as a prominent player in the electric vehicle market. The additional funding will fuel the company's growth and allow it to continue innovating in the pursuit of sustainable transportation solutions.","https://techcrunch.com/wp-content/uploads/2021/09/IMG_2580.jpg?resize=1200,675",2024-03-25 14:31:52,Innovation,Innovation
