Link,post_title,post_content,featured_image,Date-Publish,post_category,post_tag
https://www.zdnet.com/education/professional-development/want-to-be-a-devops-engineer-heres-the-good-the-bad-and-the-ugly/,"Want to be a DevOps engineer? Here's the good, the bad, and the ugly","DevOps engineering is a highly sought-after profession in today's job market. However, breaking into this role requires a combination of technical expertise and business acumen. Moreover, staying relevant in this field demands a commitment to continuous learning, as popular approaches and technologies can quickly become outdated.

The demand for DevOps engineers, who are responsible for automating and coordinating both cloud and on-premises environments to ensure the seamless development and deployment of software, is on the rise. And it comes with a hefty paycheck. In the United States, for instance, the average annual salary for a DevOps engineer is estimated to be around $134,000, according to Talent.com.

But being a DevOps engineer is not without its challenges, as experienced professionals point out. To begin with, this role requires a solid understanding of foundational technologies. Brad Morgan, a seasoned DevOps engineer, emphasizes the importance of learning Linux. Regardless of the specific tasks involved in a DevOps role, Linux is at the core of it all. Having a strong background in Linux is a must, understanding its basics, working with the terminal, and being familiar with essential commands.

Another crucial skill that DevOps engineers should possess is bash scripting, which automates Linux commands. As Morgan explains, bash scripting is widely used in the DevOps world, especially in building pipelines. Therefore, mastering this skill is essential for success in this field.

Cloud skills are also highly valued in the DevOps profession. Morgan suggests that aspiring DevOps engineers should focus on learning one cloud provider at a time, rather than trying to become proficient in all of them. By specializing in a specific cloud vendor, such as AWS, Google Cloud, or Azure, professionals can enhance their employability and ease the learning process.

However, becoming a DevOps engineer does not necessarily require following a formal course or obtaining a specific certification. Morgan believes that self-learning is the best approach for a successful career in this field. Constantly acquiring new knowledge and challenging oneself is essential in a rapidly evolving industry like DevOps.

Homebrew Henry, another experienced DevOps engineer, echoes this sentiment. In a recent YouTube presentation, he emphasizes the importance of continuous learning for DevOps engineers. The DevOps ecosystem is vast and constantly evolving, with tools and frameworks that were popular yesterday being replaced by new alternatives. Therefore, DevOps engineers must dedicate their free time to studying and staying up to date with the latest developments in the field.

Even with experience, the learning never stops for DevOps engineers. Henry highlights that this aspect is actually one of the things that DevOps professionals love most about their job. With the rapid pace of technological advancements, including the introduction of AI tools like ChatGPT, the role of DevOps engineering will undoubtedly continue to evolve in the coming years.

Infrastructure management is a significant aspect of a DevOps engineer's job and may differentiate passionate professionals from their peers. Those who enjoy managing infrastructure will thrive in this role, as it involves setting up, configuring, and maintaining the cloud infrastructure that supports various applications. This includes dealing with servers, databases, networks, and security on a daily basis. DevOps engineers find excitement in this aspect, as it allows them to witness the magic of their work in action.

However, for individuals who are more inclined towards software engineering, writing Terraforms, CI/CD pipelines, and automation scripts may not satisfy their coding itch. Building customer-facing applications may provide a different kind of fulfillment. The good news is that transitioning between software engineering and DevOps is entirely feasible, and many professionals have successfully made the switch.

Lastly, it's crucial to consider the business side of DevOps. Unrealistic expectations for the role can create challenges. Businesses often believe that hiring a few DevOps engineers will magically solve all their problems. However, DevOps is a complex and multifaceted discipline that requires a comprehensive understanding of the organization's goals and processes. DevOps engineers must bridge the gap between technology and business, ensuring that the DevOps strategy aligns with the company's overall objectives.

In conclusion, becoming a DevOps engineer is an exciting and rewarding career choice. However, it requires a strong foundation in technology, a commitment to continuous learning, and the ability to manage infrastructure effectively. DevOps professionals must constantly adapt to new tools and frameworks, staying up to date with the latest industry trends. By embracing these challenges and continuously expanding their skill set, DevOps engineers can excel in their roles and contribute to the success of their organizations.",https://www.zdnet.com/a/img/resize/e4d3d8d263eb00323161fcf2566ad35a3fe52282/2024/03/25/1b8b924e-2629-43c2-b416-1b990e262786/gettyimages-1319039490.jpg?auto=webp&fit=crop&height=675&width=1200,2024-03-25 00:00:00,Innovation,Innovation
https://www.forbes.com/sites/ericsiegel/2024/03/25/ai-success-depends-on-how-you-choose-this-one-number/,AI Success Depends On How You Choose This One Number,"AI: Making Operational Decisions Smarter

Artificial Intelligence (AI) has the potential to revolutionize operational decision-making. From determining whom to contact or approve, to deciding who to investigate or medicate, AI can play a crucial role. However, there is a critical step in the AI process that is often overlooked: choosing the decision threshold. This single number differentiates the ""yeses"" from the ""nos"" and is essential for AI to function effectively.

Setting the decision threshold is not a technical decision, but a strategic one. It is the part that aims the rocket, rather than the rocket science itself. When making this choice, businesses must consider practical tradeoffs between competing objectives. Let's explore why this is so important.

Understanding AI as a Likelihood Calculator

When we talk about AI, we are primarily referring to machine learning (ML), which is the technology behind AI. ML uses data to predict outcomes and drive operational decisions. It learns from data to make predictions about whether someone will click, buy, lie, or even die. These predictions have a significant impact on various operational processes.

The ML use cases we are discussing here are known as predictive AI or predictive analytics. Unlike generative AI, which has dominated headlines recently, predictive AI focuses on improving large-scale operations. It has the potential to deliver substantial efficiencies and improvements to businesses.

While ML cannot predict perfectly, it offers the next best thing: likelihoods. Each predictive model generated by ML can be seen as a ""likelihood calculator."" It assigns a score to each individual case, indicating the chances of the predicted outcome. These scores, or probabilities, can then be used to determine actions.

Transforming Likelihood Scores into Actions

To turn likelihood scores into actions, businesses often need to set a decision threshold, also known as a confidence threshold. This threshold represents the level of confidence required for an action to be taken. For example, a marketing project might set the threshold at 30%: if a customer is more than 30% likely to buy, they will receive a marketing brochure.

By making this one choice, businesses empower AI to make millions of decisions. However, the decision threshold is where the real difference is made. It determines how the predictive model will drive decisions and significantly influences the bottom-line improvements that can be achieved. In fact, the choice of threshold often has a greater impact on project value than changes to the model development itself.

The Importance of Choosing the Right Threshold

Let's consider the example of payment card fraud detection. A predictive model is used to decide whether to authorize or hold each transaction. The threshold chosen determines which transactions are held for further investigation. However, the choice of threshold involves tradeoffs.

For instance, a medium-sized bank might set a threshold that blocks the 3% most risky transactions, successfully preventing 220,000 cases of fraud per month. However, this approach also inconveniences customers by erroneously blocking legitimate transactions 77,000 times in the same period. On the other hand, if the bank chooses a more lenient threshold and only blocks the top 2% of transactions, there would be fewer inconveniences (around 17,600) but also less fraud prevention (around 180,000 cases). These figures are approximate results based on using XGBoost, a popular ML solution, on a public dataset of credit card transactions.

Each predictive AI project offers a range of trade-offs and options. By setting the decision threshold, businesses can determine the balance they wish to strike. However, making this choice requires strategic thinking. Regardless of how well the predictive model is developed or how well the ML software performs, business leaders must weigh in on the pivotal decision of setting the decision threshold.

One Model, Multiple Options

By tuning the decision threshold, businesses can utilize each predictive model developed by their data scientists in various ways. The threshold determines how actions are prioritized and how resources are allocated. It answers questions like, how many transactions are worth investigating as potential fraud? How many customers are worth contacting with a marketing campaign, considering that a lower threshold means reaching out to prospects who are less likely to buy? How many credit applications should a bank approve?

In conclusion, AI has the power to drive millions of operational decisions, but it requires strategic decision-making to be effective. Choosing the decision threshold is a crucial step that should not be overlooked. By setting the threshold, businesses can empower AI to make smarter decisions and achieve significant improvements in operational efficiency. The choices made in this process can have a profound impact on the success of AI projects.",https://imageio.forbes.com/specials-images/imageserve/6600f86863ceebda28e9989e/0x0.jpg?format=jpg&height=900&width=1600&fit=bounds,2024-03-25 09:40:04,Innovation,Innovation
https://techcrunch.com/2024/03/24/nvidia-could-be-primed-to-be-the-next-aws/,Nvidia could be primed to be the next AWS,"Nvidia and Amazon Web Services (AWS) may seem like unlikely companions, but they share several similarities in their growth trajectories. Both companies stumbled upon their core businesses almost by accident. AWS realized it could sell the services it had developed for internal use, while Nvidia discovered that its gaming GPU was well-suited for AI workloads.

This realization led to explosive revenue growth for both companies. Nvidia's revenue skyrocketed from $7.1 billion in Q1 2024 to $22.1 billion in Q4 2024, with the majority of the growth coming from its data center business. While AWS didn't experience the same level of growth, it has consistently been a major revenue driver for Amazon. However, Microsoft and Google have entered the market, creating the Big Three cloud vendors, and other chip makers are expected to gain market share in the future.

Both Nvidia and AWS were in the right place at the right time. As web apps and mobile technology emerged, the cloud provided on-demand resources, and enterprises saw the value of moving workloads to the cloud. Similarly, the rise of AI and large language models coincided with the increased use of GPUs for processing these workloads.

AWS has become a highly profitable business, with a run rate close to $100 billion. However, its growth has started to slow down, while Nvidia's growth is accelerating. Nvidia's challenge is to sustain this growth and become a long-term revenue powerhouse like AWS. While Nvidia has other businesses, they are smaller and growing more slowly than the GPU data center business.

In the short term, Nvidia's revenue growth has been astronomical. The company expects $24 billion in revenue for the current quarter, a 234% increase compared to the previous year's first quarter. However, growth rates are expected to decline as the company faces tougher comparisons. Analysts predict $110.5 billion in revenue for the current fiscal year, an 81% increase from the previous year, but lower than the 126% gain in the previous fiscal year.

Despite the expected slowdown, Nvidia is still projected to scale its revenue past the $100 billion annual run rate mark for several quarters. The company sees significant growth opportunities ahead, driven by AI and competition from other chipmakers. While competition will intensify, Nvidia's dominant position in the market gives it room to maneuver.

Ultimately, AI could be the driving force behind Nvidia's continued growth in the coming years. Although competition will increase, Nvidia's current market control and momentum should help it maintain its position. While AMD is gaining ground at the board level, Nvidia remains firmly in control at the chip level.

In conclusion, Nvidia and AWS have experienced remarkable growth due to their timely entry into the market and the demand for their respective services. While AWS's growth has slowed down, Nvidia's revenue continues to soar. The future holds both challenges and opportunities for Nvidia, but its strong position in the market and focus on AI should help sustain its growth in the years to come.","https://techcrunch.com/wp-content/uploads/2019/05/GettyImages-902417454.jpg?resize=1200,788",2024-03-24 15:00:17,Innovation,Innovation
https://www.forbes.com/sites/davidphelan/2024/03/25/apple-secretly-engineering-iphone-for-game-changing-update-to-apple-pay-report-claims/,"Apple Secretly Engineering iPhone For Game-Changing Update, Report Claims","The Department of Justice recently filed a lawsuit against Apple, and one of the key elements of the case revolves around the NFC chip in the iPhone. This chip powers Apple Pay, a convenient and secure payment system that Apple has closely guarded. However, it seems that Apple may be preparing to change its stance on this issue.

According to Mark Gurman of Bloomberg, the NFC chip access has already changed in the European Union, and it may soon change in the United States as well. The NFC chip is what enables users to make quick and effortless payments by simply tapping their phone on a card reader. Apple's tight control over access to this chip is motivated by security and privacy concerns. By keeping it locked, Apple ensures that bad actors cannot gain access to users' financial information.

There is another factor at play here as well. By maintaining exclusive control over the NFC chip, Apple can charge royalties on each transaction made through Apple Pay. If third-party finance companies were allowed to use the chip, they could charge their own royalties, cutting Apple out of the equation. This has been a longstanding issue, and Gurman previously reported on it almost two years ago. Apple's policy has prevented companies like PayPal, Square, and major financial institutions from launching tap-to-pay apps with their own features and interfaces. If they want to access the iPhone user base, they must pay a fee for every Apple Pay credit card transaction.

It's clear that Apple has valid reasons for wanting to keep the NFC chip locked. The company wants to ensure the security and safety of its users, protect its own royalties, and maintain its reputation as a trusted and secure payment platform. However, recent developments in the European Union may be forcing Apple's hand.

In early March of this year, the European Union introduced the Digital Markets Act, which included a condition requiring Apple to offer access to the NFC chip. Initially wary due to security concerns, Apple reluctantly agreed to comply. Behind the scenes, Apple is now preparing for a potential shift in its policy. Gurman reports that engineering work to open up NFC access in the United States is already underway.

While there is no specific timetable for when this change may occur, it is clear that Apple is taking steps to prepare for it. It is likely that Apple hopes to avoid implementing this change altogether, but it is proactively getting ready in case it becomes necessary. If the transition goes smoothly in the European Union, it could pave the way for a similar change in the United States in the months or years to come.

In conclusion, Apple's control over access to the NFC chip in its iPhones has been a contentious issue for some time. The company has cited security and financial reasons for keeping the chip locked. However, recent developments in the European Union have prompted Apple to reconsider its stance. Although Apple is preparing for potential changes, there is no definitive timeline for when this may occur in the United States. It remains to be seen how this shift will impact Apple Pay and the broader mobile payment landscape.","https://imageio.forbes.com/specials-images/imageserve/6601869f70d828f8cfe50372/0x0.jpg?format=jpg&crop=3662,2060,x0,y591,safe&height=900&width=1600&fit=bounds",2024-03-25 10:15:49,Innovation,Innovation
https://www.forbes.com/sites/quora/2024/03/25/how-machine-learning-and-ai-contribute-to-effective-it-operations/,How Machine Learning And AI Contribute To Effective IT Operations,"Machine learning and AI are revolutionizing the field of IT operations by enabling more effective and efficient management of complex ecosystems. With the rapid advancement and adoption of technology, IT teams often find themselves overwhelmed with reactive problem-solving, decreased performance, and limited innovation. However, the emergence of AIOps is changing the game by utilizing existing data to unlock improvements in IT operations.

Through machine learning, IT teams can automate, detect, invest, and organize the incident analysis response process. This involves using AI to gather data from various sources and employing machine learning algorithms to analyze the data and identify potential issues. By doing so, AIOps can escalate incidents and provide detailed insights on how to address the problems, ensuring consistent and efficient system management.

One of the key ways machine learning contributes to effective IT operations is by aggregating and normalizing IT data. This process delivers clear and accurate root cause insights, streamlining ticket investigations and enabling teams to resolve incidents quickly. Consequently, IT teams can provide incident descriptions, estimate incident impact, and suggest root-cause solutions faster than ever before. This not only helps companies scale their operations but also streamlines their digital services, delivering cost-effective, prompt, and accurate solutions.

The power of AI and machine learning lies in empowering IT workers with awareness and insight, creating a world where teams can seamlessly run their digital services. By freeing IT teams from the time-consuming and laborious task of incident management, AIOps allows companies to allocate more resources towards the work they are truly passionate about.

In today's fast-paced world, consumers demand real-time and seamless services that cater to their needs. Unfortunately, the traditional and cumbersome processes of legacy IT infrastructure hinder the IT industry's ability to deliver efficient services. However, companies like BigPanda are utilizing AIOps technology to augment human capabilities and manage the influx of IT data. This not only reduces costs but also allows teams to focus on digital transformation. BigPanda's platform, for example, has been instrumental in supporting healthcare company Kaiser Permanente's IT teams and expediting their data management processes. By significantly reducing time, effort, and costs spent on IT processes, BigPanda enables Kaiser to allocate more resources towards fulfilling its mission of supporting the health and well-being of millions of patients. The impact of AIOps extends beyond healthcare, benefiting industries such as financial services, hospitality, entertainment, travel, and more.

The ultimate vision is to create a world where incident tickets become obsolete, and software bugs are fixed automatically. BigPanda, for instance, aims to scale up human capabilities in managing the overwhelming influx of IT alerts and data from data centers. By doing so, they reduce costs and free up time for digital transformation. This shift toward Autonomous IT Operations transforms IT noise into insights and manual tasks into automated actions, allowing IT Operations teams to deliver a superior level of digital service and application performance. Ultimately, this has the potential to dramatically accelerate innovation and drive progress in various industries.

In conclusion, machine learning and AI play a crucial role in enhancing IT operations. By leveraging existing data, AIOps enables automation, detection, investment, and organization of incident analysis responses. Machine learning helps aggregate and normalize IT data, providing clear and accurate insights for efficient incident resolution. This technology empowers IT workers, allowing them to focus on more meaningful work and delivering superior digital services. With companies like BigPanda leading the way, the potential for growth and innovation in various industries is immense.",https://imageio.forbes.com/specials-images/imageserve/65fa943a7d1a9778e9238984/0x0.jpg?format=jpg&height=900&width=1600&fit=bounds,2024-03-25 11:00:00,Innovation,Innovation
https://techcrunch.com/2024/03/25/boeing-ceo-to-leave-company-by-year-end-after-a-wave-of-safety-incidents/,"Boeing CEO to leave company by year-end, after a wave of safety incidents","Boeing CEO Set to Depart Amidst Safety Concerns

Boeing, one of the world's leading plane manufacturers, has announced that its chief executive, Dave Calhoun, will be leaving the company by the end of 2024. This decision comes in the wake of a series of safety incidents that have plagued the company in recent years.

One of the most notable incidents involved a cabin panel blowout on one of Boeing's planes. This incident, along with several others, has raised concerns about the safety of Boeing's aircraft. As a result, the company has faced significant backlash and scrutiny from both the public and regulatory authorities.

Boeing has taken steps to address these safety concerns, including implementing an innovation acceleration program called Aerospace Xelerated. This program, which was previously known as the Aerospace Technology Institute, aims to collaborate with startups in order to drive innovation in the aerospace industry. It remains to be seen how Calhoun's departure will impact this program.

In a statement, Calhoun acknowledged the need to stabilize and position the company for the future. He expressed his commitment to completing the critical work that is currently underway in order to achieve this goal.

The safety incidents that have plagued Boeing in recent years have had a significant impact on the company's reputation. In January of this year, an Alaska Airlines 737 Max 9 jet was forced to make an emergency landing, leading to the grounding of 171 Max 9 jets for several weeks. This incident marked the largest safety crisis for Boeing since the crashes of two Max 8 jets in 2018 and 2019, which resulted in the tragic loss of 346 lives.

In addition to Calhoun, Stan Deal, who is in charge of Boeing's commercial airplanes business, will also be leaving the company. Stephanie Pope has been appointed to lead the business in Deal's absence. Pope has a wealth of experience in the aerospace industry, having previously served as the president and CEO of Boeing Global Services.

As this story continues to develop, more information will be added to provide a comprehensive understanding of the situation. It is clear that Boeing is facing a critical period as it works to address the safety concerns that have arisen in recent years. The departure of its CEO and the appointment of new leadership signal a commitment to change and improvement within the company. Only time will tell if these efforts will be enough to restore faith in Boeing and its aircraft.","https://techcrunch.com/wp-content/uploads/2024/01/GettyImages-1910140688.jpg?resize=1200,800",2024-03-25 12:48:28,Innovation,Innovation
