Link,Title,Text,Image,Date Publish
https://www.forbes.com/sites/krisholt/2024/03/23/todays-quordle-hints-and-answers-for-sunday-march-24/,"Today’s ‘Quordle’ Hints And Answers For Sunday, March 24","

Ready for a brain-teasing challenge? Look no further than Quordle! If you're new to the game, here's a quick rundown: you have to guess four five-letter words with the help of hints and color-coded feedback. Green means a letter is in the right place, yellow means it's in the word but misplaced. Let's dive into today's hints and answers!

Today's Quordle hints:
- Word 1: Think broader, think... WIDER.
- Word 2: Done coldly and without emotion, it's... ICILY.
- Word 3: An unexpected occurrence, like a... FREAK accident.
- Word 4: To make up for a mistake, you might... ATONE.
- Bonus hint: One word has a pair of repeated letters, and all words start with W, I, F, or A.

And the answers are... WIDER, ICILY, FREAK, ATONE! Congratulations if you cracked them all! Stay tuned for more Quordle fun and solutions on my blog. Happy puzzling!

",https://imageio.forbes.com/specials-images/imageserve/65b6c7d6cb80b6d1dba147b6/0x0.jpg?format=jpg&height=900&width=1600&fit=bounds,2024-03-23 18:00:15
https://www.forbes.com/sites/anuradhavaranasi/2024/03/24/which-adhd-medications-could-lower-risk-of-suicide--hospitalization/,Which ADHD Medications Could Lower Risk Of Suicide & Hospitalization?,"

A recent study involving over 200,000 individuals with attention-deficit/hyperactivity disorder (ADHD) revealed a significant finding regarding the use of ADHD stimulant medications. Researchers discovered that those prescribed these medications had a reduced risk of suicide attempts and psychiatric hospitalizations. Specifically, four ADHD medications—amphetamine, lisdexamphetamine, dexamphetamine, and methylphenidate—were associated with a lower likelihood of psychiatric hospitalizations.

The study, led by Heidi Taipale and her team at the Karolinska Institute in Sweden, delved into the impact of ADHD medications on individuals with the disorder. Notably, the use of lisdexamphetamine, dexamphetamine, and methylphenidate was linked to a decreased risk of suicidal behavior. This finding is crucial given the high prevalence of psychiatric comorbidities among individuals with ADHD. Conditions such as major depressive disorder, panic disorder, substance abuse, and anxiety disorders are common in this population.

Previous research has shown that psychiatric comorbidities can exacerbate the mortality risk for individuals with ADHD, especially in cases of substance use disorder. While atomoxetine, another ADHD medication, did not show a direct association with reduced psychiatric hospitalizations or suicidal behavior, it was linked to fewer hospitalizations for non-psychiatric comorbidities.

The study spanned a 15-year follow-up period and included individuals aged 16 to 65 years in Sweden who had been diagnosed with ADHD between 2006 and 2021. By analyzing healthcare data from the Swedish National Patient Register, the researchers were able to track medication use and outcomes among the participants. Methylphenidate emerged as the most commonly prescribed ADHD medication, followed by lisdexamphetamine and atomoxetine.

Interestingly, the study found variations in the effectiveness of different medications based on age and gender. While lisdexamphetamine showed a decreased risk of psychiatric hospitalizations across various age groups, methylphenidate appeared to be less effective in older adults. Additionally, atomoxetine was associated with a reduced risk of hospitalization among women but not men.

The overall impact of ADHD medications on psychiatric outcomes was positive, with a lower risk of both psychiatric and non-psychiatric hospitalizations. Despite concerns about potential adverse effects such as increased blood pressure and heart rate, the study highlighted the beneficial effects of these medications in improving the quality of life for individuals with ADHD.

Published in JAMA Network Open, this study sheds light on the complex relationship between ADHD medications and psychiatric outcomes. By identifying specific medications that can mitigate the risk of suicide attempts and hospitalizations, the research offers valuable insights for healthcare providers and individuals managing ADHD.

",https://imageio.forbes.com/specials-images/imageserve/63c28dbb82c31b7412c92cf2/0x0.jpg?format=jpg&height=900&width=1600&fit=bounds,2024-03-24 04:09:46
https://www.forbes.com/sites/brucelee/2024/03/23/the-invisible-shield-aims-to-makes-public-health-more-visible/,‘The Invisible Shield’ Aims To Makes Public Health More Visible,"

Public health is like the offensive line in football, often overlooked until something goes wrong. The new TV series, ""The Invisible Shield,"" sheds light on the critical work of public health professionals. Premiering on PBS on March 26, this four-episode series aims to highlight the essential role of public health in protecting communities.

The title ""The Invisible Shield"" reflects the unnoticed efforts of the public health system in safeguarding society from various health threats. Despite its vital function, public health often remains invisible amidst the noise of celebrity gossip and commercial interests. The COVID-19 pandemic exposed the vulnerabilities of underfunded and underappreciated public health systems, emphasizing the urgent need for increased support and resources.

Dr. Kelly Henning from Bloomberg Philanthropies, featured in the series, emphasizes how effective public health work often goes unnoticed. The pandemic spotlighted the importance of public health, yet the system continues to face challenges due to misinformation and inadequate funding. The series aims to raise awareness about public health and its significant impact on daily life.

Produced by RadicalMedia with support from Bloomberg Philanthropies, ""The Invisible Shield"" seeks to elevate public health in the public consciousness. While celebrities and businesses dominate the media landscape, public health achievements such as vaccinations and clean water supplies often go unrecognized. The series underscores the life-saving contributions of public health that are often taken for granted.

The first episode, ""The Old Playbook,"" delves into the historical advancements in public health that have doubled life expectancy since 1900. However, it also highlights the current threats facing the public health system. By drawing on past experiences with epidemics, the series explores the challenges of adapting to the COVID-19 pandemic and the lessons learned along the way.

In ""Follow the Data,"" the second episode, the importance of data collection and analysis in public health is underscored. Data-driven decision-making plays a crucial role in managing health crises and guiding public health interventions. The episode delves into the significance of utilizing data to inform public health strategies and initiatives.

As the series unfolds, viewers will gain insight into the critical role of public health in safeguarding communities and promoting well-being. By shedding light on the invisible yet essential work of public health professionals, ""The Invisible Shield"" aims to spark conversations and foster greater support for public health initiatives. Tune in to discover the untold stories behind public health's invisible shield and the impact it has on our lives.

",https://imageio.forbes.com/specials-images/imageserve/65ff76b9cc324c33ed5484d7/0x0.jpg?format=jpg&height=900&width=1600&fit=bounds,2024-03-23 21:25:08
https://www.forbes.com/sites/erikkain/2024/03/23/nyt-strands-21-hints-spangram-and-answers-for-sunday-march-24th/,"NYT ‘Strands’ #21 Hints, Spangram And Answers For Sunday, March 24th","

As the last Sunday before Easter unfolds, a sudden shift in the weather brings snow and winds, replacing the warm spring days we enjoyed. Amidst this wintry surprise, what better way to spend the day than diving into a challenging game? The New York Times presents Strands, a word search puzzle that will put your word-finding skills to the test.

In this beta version of Strands, you are tasked with uncovering words on a six by eight grid that share a common theme. Each day presents a new grid, along with clues to guide you. Discover the theme words that remain highlighted in blue and hunt for the special word known as the spangram, connecting opposite sides of the board and highlighted in yellow.

Today's theme hint for the Strands puzzle is ""Lock steps."" For an extra nudge towards the answers, think about ""Shampoo."" Now, brace yourself for the reveal of today's solutions.

The spangram for today is ""HAIRCARE,"" anchoring the words in the grid. Once you spot the spangram, the other words fall into place. The list includes ""Apply,"" ""Rinse,"" ""Towel,"" ""Conditioner,"" ""Lather,"" and ""Moisturizer.""

Today's challenge proved to be a tough nut to crack, with clues like ""apply"" leading to a haircare routine rather than locks or steps in the traditional sense. It's a playful twist on everyday tasks like washing your hair, adding a fun dimension to the puzzle-solving experience. And who knew shampoo could spark such brain-teasing fun?

Reflecting on the puzzle, it's reminiscent of Adam Sandler's iconic scene in Billy Madison, where conditioner reigns supreme. As you navigate through Strands and other word games, remember to drop by my blog for daily Wordle guides and a diverse range of entertainment content, from TV shows to video games. Thanks for joining in on the wordplay fun!

",https://imageio.forbes.com/specials-images/imageserve/65fdd1b8825b541bfffeffb7/0x0.jpg?format=jpg&height=900&width=1600&fit=bounds,2024-03-23 17:45:00
https://www.forbes.com/sites/marksparrow/2024/03/24/lofrees-misty-mechanical-keyboard-is-a-wonderfully-frosted-confection/,Lofree’s Misty Mechanical Keyboard Is A Wonderfully Frosted Confection,"

The LoFree Misty mechanical keyboard is a unique and visually appealing addition to the world of mechanical keyboards. Boasting a frosted casing and keycaps, this 68-key layout keyboard offers a full row of function keys that can also function as multimedia keys, along with modifier keys for both Windows and macOS users.

One of the standout features of the LoFree Misty is its fully frosted keycaps that allow the white RGB backlighting to shine through beautifully. The large legends on the keycaps make it ideal for individuals with visual impairments, adding to its accessibility. Additionally, the keyboard features hot-swappable mechanical switches and a Poron layer that enhances typing comfort by reducing noise and providing a solid typing experience.

The hot-swappable switches on the LoFree Misty allow for customization based on individual preferences for travel distance, sound, and tactile feedback. The Poron Silencing layer effectively absorbs keystroke energy, resulting in a soft, smooth, and accurate typing experience. The pre-lubed Kailh Jellyfish switches installed by LoFree offer ultra-smooth action and minimal noise, making it suitable for quiet environments.

In terms of durability, the keycaps on the Misty are pad printed and coated with UV protection to resist oil and fading, ensuring long-lasting performance. The keyboard can be connected via Bluetooth or a USB Type-C cable, providing flexibility for different usage scenarios. With support for N-Key Rollover, the Misty guarantees accurate typing results even for fast typists.

Overall, the LoFree Misty 1% is a stylish and functional keyboard that stands out for its transparent design and customizable features. It is compatible with various operating systems and offers a comfortable typing experience, especially for users with visual impairments. With its unique aesthetics and practicality, the Misty is a recommended choice for those looking for a premium mechanical keyboard.

The LoFree Misty 1% is available for purchase on the LoFree website at a price of $239 / £187.65.

For more information, visit lofree.co.

","https://imageio.forbes.com/specials-images/imageserve/65f71772feb922c91162e919/0x0.jpg?format=jpg&crop=1097,723,x103,y177,safe&height=900&width=1600&fit=bounds",2024-03-24 06:00:00
https://www.forbes.com/sites/ewanspence/2024/03/23/apple-iphone-16-pro-ios-18-ai-china-baidu-google-gemini/,Apple’s Latest AI Move Is Vital To Find iPhone Success,"

Apple's AI Plans for the iPhone: A Potential Partnership with Google and Baidu

As Apple gears up to announce its AI plans for the iPhone, it seems that the tech giant is looking to strengthen its ties with both Google and Baidu. With every major Android phone release touting generative AI capabilities, Apple's iPhone 15 family has fallen behind in the market. However, the upcoming iOS 18, set to be launched at this year's Worldwide Developer Conference, promises to introduce generative AI to the next-generation iPhone 16 family.

Like other smartphone manufacturers, Apple will focus on on-device and in-the-cloud AI processing. Apple is known for prioritizing local processing and keeping data on the device whenever possible. However, for AI applications that require extensive processing power, the cloud will be utilized.

To harness the power of the cloud, Apple is reportedly working on a partnership with Google. By using Google's Gemini generative AI service, Apple aims to leverage the massive user base of AI-equipped iPhone owners to enhance its AI capabilities. This collaboration between Apple and Google, despite their rivalry in the smartphone market, is not unprecedented. The two companies have previously worked together, such as ensuring Google is the default search engine on Apple devices.

However, there is a hurdle to overcome in China. Due to various factors, including government regulations and vetting processes, Google's Gemini service is not available in the country. In light of this, Apple has begun negotiations with China's Baidu. Baidu's cloud-based AI services are being considered for integration into the upcoming iOS 18 and iPhone 16 family.

Apple is not the only company pursuing this strategy. Samsung, during its recent Galaxy Unpacked event, unveiled not only the new Galaxy S24 family but also its Galaxy AI services, some of which rely on Google Gemini. Similarly, for the Chinese market, Samsung has partnered with Baidu to offer AI services.

It remains to be seen how Apple will differentiate its AI services from its competitors, considering that they are built on the same underlying technology. Nevertheless, this move by Apple signifies its commitment to catching up with the AI capabilities offered by Android devices.

","https://imageio.forbes.com/specials-images/imageserve/6470e48fe2490b1a1cb845f0/0x0.jpg?format=jpg&crop=3561,2003,x374,y223,safe&height=900&width=1600&fit=bounds",2024-03-23 19:31:06
https://www.forbes.com/sites/brianmazique/2024/03/23/ufcs-dana-white-cuts-fighter-immediately-after-he-bit-an-opponent/,UFC’s Dana White Cuts Fighter Immediately After He Bit An Opponent,"

The world of combat sports is no stranger to intense moments, but sometimes athletes can take things too far. This was evident at UFC Fight Night: Ribas vs. Namajunas when Igor Severino made a shocking move during his debut in the octagon.
In a surprising turn of events, Severino bit his opponent, Andre Lima, during their fight, leading to his disqualification in the second round. Images clearly showed the bite marks on Lima's arm, leaving no room for doubt about what had transpired.
Severino, a 20-year-old fighter with potential, may have ruined his chances of further success in the UFC with this unsportsmanlike behavior. This incident marked the first loss of his career, bringing his record to 9-1, while Lima maintained his undefeated streak at 8-0.
UFC President Dana White wasted no time in addressing the issue, promptly announcing Severino's release from the promotion. White emphasized the severity of the situation, highlighting the missed opportunity for both fighters and potential legal consequences for Severino.
Biting in combat sports is a rare but serious offense that can have lasting repercussions. Lima's composed reaction to the incident showed remarkable restraint, underscoring the gravity of Severino's actions.
Moving forward, Severino will need to rebuild his reputation in smaller organizations before earning a shot at redemption in the UFC or other major MMA promotions.
As the dust settles on this controversial bout, fans can expect more updates on the outcomes of Saturday's fights in Las Vegas. Stay tuned for the latest developments in the world of mixed martial arts.

","https://imageio.forbes.com/specials-images/imageserve/65ff92c285143669667fa59c/0x0.jpg?format=jpg&crop=3188,1794,x0,y217,safe&height=900&width=1600&fit=bounds",2024-03-23 22:45:24
https://www.forbes.com/sites/erikkain/2024/03/23/todays-wordle-1009-hints-clues-and-answer-for-sunday-march-24th/,"Today’s ‘Wordle’ #1009 Hints, Clues And Answer For Sunday, March 24th","

Lazy Sunday is here, and with it comes the excitement of solving today's Wordle puzzle. But before we dive into that, let me share a little confession. One day, I hope to make rabbit pot pies for Easter. The combination of savory goodness and the sweet irony seems too perfect to pass up. But for now, let's focus on Wordle.

Are you ready to solve today's Wordle? Let me give you a hint: it's something that is useful when dry but useless when wet. And here's a clue: the word starts with a consonant. Now, if you want to avoid spoilers, look away!

Now, let's analyze the Wordle. Every day, I eagerly check my results using Wordle Bot. It's a great tool to see how well you did. Today, my first guess was ""chain,"" but that left me with a staggering 681 possibilities. Thankfully, my next guess, ""slope,"" narrowed it down to a more manageable 19 options. Finally, I settled on ""below,"" and to my surprise, it was the correct answer! Maybe it was just a lucky coincidence, or maybe the Wordle puzzle and today's Strands puzzle had some cosmic connection. Who knows?

Unfortunately, my competitive Wordle score for today is a total wash. I didn't score any points for guessing in four tries, and I didn't tie with the Wordle Bot either. Zeroes all around! But hey, that's the fun and challenge of Wordle.

Now, let's take a moment to explore the etymology of the word ""towel."" The term has its roots in Old French, where it was known as ""touaille."" Over time, it made its way into English usage around the 13th century. The Old French word is believed to have derived from the Medieval Latin term ""tovaglia,"" which likely came from the Latin word ""tubicula,"" meaning ""tube"" or ""cloth."" This linguistic evolution reflects the item's original purpose as a piece of cloth used for drying or wiping.

The transformation from ""touaille"" to ""towel"" showcases the influence of Norman French on the English language after the Norman Conquest of England in 1066. Many French words underwent pronunciation and spelling changes as they were Anglicized, resulting in the modern English word ""towel"" that we use today. Throughout history, towels have been a household staple, evolving in materials and usage but always serving the same fundamental purpose: drying or wiping.

Before we wrap up, I invite you to check out my blog, where you'll find daily Wordle guides, as well as my thoughts on TV shows, streaming recommendations, movie reviews, video game coverage, and much more. Thank you for joining me today, and happy Wordle solving!

","https://imageio.forbes.com/specials-images/imageserve/6209dc2871dc07b5bc2b0ac7/0x0.jpg?format=jpg&crop=3846,2163,x0,y191,safe&height=900&width=1600&fit=bounds",2024-03-23 19:00:25
https://www.forbes.com/sites/zakdoffman/2024/03/23/google-upgrade-samsung-s24-s23-pixel-towards-apple-iphone-15-pro-max/,Google Suddenly Reveals Surprise Android Update That Beats iPhone,"

Android and iPhone are constantly competing for users, and now Google has introduced a new feature that surpasses Apple. In its latest update, Google is making Android more like iPhone and even adding features that go beyond what Apple offers.

One notable feature that Google has added is an emergency satellite service, which brings Android on par with the satellite SOS functionality that Apple has had for a few years. However, Google's offering seems to include a Garmin rescue service, making it a significant step forward for user safety and security.

The issue with Apple's emergency SOS feature is that it is only for emergencies. It displays an SOS tag on the screen when users are out of coverage, but it is not something that is commonly used. On the other hand, the latest Android 15 developer preview suggests that Google is bridging the gap by allowing users to expand their cellular accounts to include a satellite add-on. This enables core messaging apps to use the satellite network, eliminating cellular black spots and ensuring connectivity even in remote areas.

According to Mishaal Rahman, Android 15 DP2 introduces UI elements for devices that support satellite connectivity and expands platform support for satellite connectivity through a new API that apps can use to detect satellite connection. Additionally, Android 15 allows SMS/MMS/RCS apps to utilize satellite connectivity for sending and receiving messages.

Apple's satellite connectivity remains limited. Users with iPhone 14, iPhone 14 Pro, iPhone 15, or iPhone 15 Pro can connect their phones to a satellite to text emergency services, request roadside assistance, and share their location with friends and family when they have no mobile or Wi-Fi coverage. Android, on the other hand, has the potential for even more with beta code suggesting a satellite messaging option in partnership with T-Mobile.

The possibility of direct-to-phone satellite connectivity becoming more common is exciting. Elon Musk's announcement that SpaceX achieved download speeds of 17mbps to an unmodified Galaxy S21 Ultra sparked interest in the potential of this technology. It means that smartphones could make and receive calls and messages by connecting directly to a satellite, even in areas without cellular network coverage. While this future is still on the horizon, the integration of satellite connectivity into messaging apps is a great start.

The arrival of satellite messaging in Android 15 confirms that Google is leading the way, with Apple likely to follow suit. This development comes shortly after the news that Gemini might be coming to iPhone and Apple claiming that the DOJ lawsuit could turn iPhone into Android. The competition between Android and iPhone continues to intensify.

",https://imageio.forbes.com/specials-images/imageserve/65d79ec3dadcd6b682668331/0x0.jpg?format=jpg&height=900&width=1600&fit=bounds,2024-03-23 19:17:25
