Link,post_title,post_content,featured_image,Date-Publish,post_category,post_tag
https://www.reuters.com/technology/bitcoin-rises-1163-70900-2024-03-25/,"Bitcoin rises 7.15% to $70,900","Bitcoin Surges 7.15% to $70,900, Correcting Previous Headline

In recent news, the value of Bitcoin experienced a significant surge, rising by 7.15% to reach $70,900. This correction is necessary as the initial headline and story mistakenly reported an 11.63% increase. As the world continues to witness the growing popularity of cryptocurrencies, Bitcoin remains a prominent player in the digital currency market.

While the exact reasons for this surge are not mentioned in the report, it is important to note that Bitcoin's value is influenced by various factors. These factors include market demand, investor sentiment, regulatory developments, and macroeconomic conditions. The cryptocurrency market is highly volatile, and price fluctuations are not uncommon.

Bitcoin, the first and most well-known cryptocurrency, was created in 2009 by an individual or group using the pseudonym Satoshi Nakamoto. It operates on a decentralized network called blockchain, which ensures transparency, security, and immutability of transactions. Bitcoin's decentralized nature means that it is not controlled by any central authority or government, making it an attractive option for those seeking financial independence and privacy.

The widespread adoption of Bitcoin and other cryptocurrencies has led to their integration into various industries, including finance, technology, and e-commerce. Many businesses now accept Bitcoin as a form of payment, and some countries have even started to explore the idea of creating their own digital currencies.

Despite its popularity, Bitcoin has faced criticism and skepticism from regulators, economists, and traditional financial institutions. Concerns over its potential for illegal activities, market manipulation, and lack of regulation have led to debates about its long-term viability and stability. However, proponents argue that Bitcoin has the potential to revolutionize the financial industry by providing an alternative to traditional banking systems and facilitating cross-border transactions.

The recent surge in Bitcoin's value highlights the continued interest and demand for cryptocurrencies. Investors and traders are drawn to the potential for high returns and diversification of investment portfolios. However, it is crucial to approach cryptocurrency investments with caution and conduct thorough research, as the market remains highly speculative and volatile.

As the cryptocurrency industry continues to evolve, it is essential for individuals and businesses to stay informed about the latest developments, trends, and regulatory changes. Subscribing to newsletters like the Technology Roundup can provide valuable insights and analysis to help navigate the complex world of cryptocurrencies.

In conclusion, Bitcoin's recent surge of 7.15% to $70,900 showcases the ongoing interest and demand for cryptocurrencies. As the market evolves, it is important for investors and enthusiasts to stay informed and exercise caution when participating in the cryptocurrency ecosystem. While Bitcoin and other cryptocurrencies offer exciting opportunities, they also come with risks that should be carefully considered.",https://www.reuters.com/resizer/v2/OL2NZQJH3JPJDKUJCCID6SOU3A.jpg?auth=7ca5f81ab683b5c3bf55f84a1931dbe0b2b8bda69d39896510a96a8f4978aa30&width=1920&height=1005&smart=true,2024-03-25 20:19:44,Innovation,Innovation
